name	price	size	url	time	name_	price_	brand	calories	proteins	fats	carbos	composition	get_ok	parse_ok	time_
Напиток Floris My Vibe Чёрная смородина Пало санто среднегазированный безалкогольный, 330мл	129,99 ₽/шт	330 мл	https://www.perekrestok.ru/cat/209/p/napitok-floris-my-vibe-cernaa-smorodina-palo-santo-srednegazirovannyj-bezalkogolnyj-330ml-4344990	Wed Jul  3 15:03:36 2024	Напиток Floris My Vibe Чёрная смородина Пало санто среднегазированный безалкогольный, 330мл	Цена159,99 ₽	Floris	46.0	0.1 г	0.0 г	6.0 г	Вода подготовленная, черная смородина сок, пало санто, яблочная кислота, аскорбиновая кислота, минеральный комплекс, фруктоза, сорбат калия. 	True	True	Fri Jul  5 22:39:55 2024
Напиток Coca Cola Classic со вкусом колы безалкогольный газированный стеклянная бутылка, 330мл	159,99 ₽/шт	330 мл	https://www.perekrestok.ru/cat/209/p/napitok-coca-cola-classic-so-vkusom-koly-bezalkogolnyj-gazirovannyj-steklannaa-butylka-330ml-4309309	Wed Jul  3 15:03:36 2024	Напиток Coca Cola Classic со вкусом колы безалкогольный газированный стеклянная бутылка, 330мл	Цена154,99 ₽	Coca-Cola	41.1	0.0 г	0.0 г	10.6 г	Вода, сахар, регулятор кислотности диоксид углерода, краситель (карамельный колер е150d), регулятор кислотности (ортофосфорная кислота), натуральные ароматизаторы, кофеин. 	True	True	Fri Jul  5 22:39:55 2024
Напиток Sparkling Chupa Chups Манго газированный, 250мл	139,99 ₽/шт	250 мл	https://www.perekrestok.ru/cat/209/p/napitok-sparkling-chupa-chups-mango-gazirovannyj-250ml-4230231	Wed Jul  3 15:03:36 2024	Напиток Sparkling Chupa Chups Манго газированный, 250мл	Цена99,99 ₽	Chupa Chups	217.0	0.0 г	0.0 г	13.0 г	Подготовленная вода, кукурузный сироп с высоким содержанием фруктозы, концентрированный сок манго (1,5%) регулятор кислотности: лимонная (е330) , ароматизатор манго, краситель сафлор. 	True	True	Fri Jul  5 22:39:56 2024
Напиток Swag! со вкусом манго и кокоса сильногазированный, 330мл	87,99 ₽/шт	330 мл	https://www.perekrestok.ru/cat/209/p/napitok-swag-so-vkusom-mango-i-kokosa-silnogazirovannyj-330ml-4194181	Wed Jul  3 15:03:36 2024	Напиток Swag! со вкусом манго и кокоса сильногазированный, 330мл	Цена87,99 ₽	Swag	43.0	0.0 г	0.0 г	10.4 г	Вода питьевая, сахар, сок манго концентрированный, регулятор кислотности - кислота лимонная, ароматизатор пищевой натуральный тип кокос, ароматизатор пищевой натуральный тип манго, антиокислитель - аскорбиновая кислота, консервант - натрия бензоат, комплексная пищевая добавка краситель luxomix бета-каротин. 	True	True	Fri Jul  5 22:39:56 2024
Напиток Drinksome Italian Orange Spritz & Tonic безалкогольный газированный с соком, 330мл	259,99 ₽/шт	330 мл	https://www.perekrestok.ru/cat/209/p/napitok-drinksome-italian-orange-spritz-tonic-bezalkogolnyj-gazirovannyj-s-sokom-330ml-4338115	Wed Jul  3 15:03:36 2024	Напиток Drinksome Italian Orange Spritz & Tonic безалкогольный газированный с соком, 330мл	Цена189,99 ₽	DRINKSOME	44.5	0.0 г	0.0 г	11.4 г	none	True	True	Fri Jul  5 22:39:57 2024
Напиток безалкогольный Magnium базилик газированный, 330мл	119,99 ₽/шт	330 мл	https://www.perekrestok.ru/cat/209/p/napitok-bezalkogolnyj-magnium-bazilik-gazirovannyj-330ml-4237719	Wed Jul  3 15:03:36 2024	Напиток безалкогольный Magnium базилик газированный, 330мл	Цена149,99 ₽	Magnium	3.0	0.0 г	0.0 г	0.8 г	Вода питьевая подготовленная, магния цитрат, фруктоза, регулятор кислотности лимонная кислота, натуральный ароматизатор «базилик», подсластитель стевиолгликозиды (стевия), консерванты: бензоат натрия. 	True	True	Fri Jul  5 22:39:58 2024
Напиток Drinksome Семи-Суит Спарклинг Вайн безалкогольный газированный с соком, 330мл	259,99 ₽/шт	330 мл	https://www.perekrestok.ru/cat/209/p/napitok-drinksome-semi-suit-sparkling-vajn-bezalkogolnyj-gazirovannyj-s-sokom-330ml-4338114	Wed Jul  3 15:03:36 2024	Напиток Drinksome Семи-Суит Спарклинг Вайн безалкогольный газированный с соком, 330мл	Цена189,99 ₽	DRINKSOME	35.2	0.0 г	0.0 г	8.7 г	none	True	True	Fri Jul  5 22:39:59 2024
Напиток газированный Бакунин Ботаникалс Тоник безалкогольныйй, 330мл	139,99 ₽/шт	330 мл	https://www.perekrestok.ru/cat/209/p/napitok-gazirovannyj-bakunin-botanikals-tonik-bezalkogolnyjj-330ml-4314239	Wed Jul  3 15:03:36 2024	Напиток газированный Бакунин Ботаникалс Тоник безалкогольныйй, 330мл	Цена169,99 ₽	Бакунин	15.0	0.0 г	0.0 г	4.0 г	Вода питьевая, сахар белый, цедра лайма, цедра бергамота, лемонграсс, краситель натуральный спирулина синяя, ароматизатор натуральный тоник с хинином, регулятор кислотности (лимонная кислота, яблочная кислота), консервант сорбат калия (е202), антиокислитель аскорбиновая кислота. 	True	True	Fri Jul  5 22:40:00 2024
Напиток безалкогольный Sever Апельсин сильногазированный, 500мл	99,99 ₽/шт	500 мл	https://www.perekrestok.ru/cat/209/p/napitok-bezalkogolnyj-sever-apelsin-silnogazirovannyj-500ml-4268483	Wed Jul  3 15:03:36 2024	Напиток безалкогольный Sever Апельсин сильногазированный, 500мл	Цена99,99 ₽	Север	30.0	0.0 г	0.0 г	8.0 г	Вода питьевая подготовленная, сахар, регулятор кислотности лимонная кислота, ароматизаторы (содержат стабилизаторы: гуммиарабик, эфиры глицерина и смоляных кислот; антиокислители: токоферолы, концентрат смеси, аскорбилпальмитат; красители: бета-апо-8'-каротиновый альдегид (c30), каротины; сок апельсиновый концентрированный), консервант бензоат натрия, антиокислитель аскорбиновая кислота, подсластитель сахаринат натрия. 	True	True	Fri Jul  5 22:40:01 2024
Напиток безалкогольный Зандукели со вкусом саперави газированный, 500мл	99,99 ₽/шт	500 мл	https://www.perekrestok.ru/cat/209/p/napitok-bezalkogolnyj-zandukeli-so-vkusom-saperavi-gazirovannyj-500ml-4273447	Wed Jul  3 15:03:36 2024	Напиток безалкогольный Зандукели со вкусом саперави газированный, 500мл	Цена99,99 ₽	ЗАНДУКЕЛИ	45.0	0.0 г	0.0 г	11.0 г	Вода, сахар, ароматизатор винограда саперави идентичный натуральному, консервант бензоат натрия, регулятор кислотности лимонная кислота, краситель e150d, e122, e131. 	True	True	Fri Jul  5 22:40:02 2024
Напиток безалкогольный Черноголовка Дюшес, 2л	144,99 ₽/шт	2000 мл	https://www.perekrestok.ru/cat/209/p/napitok-bezalkogolnyj-cernogolovka-duses-2l-3141247	Wed Jul  3 15:03:36 2024	Напиток безалкогольный Черноголовка Дюшес, 2л	Цена124,99 ₽	Черноголовка	40.0	0.0 г	0.0 г	9.7 г	Вода, сахар, регулятор кислотности кислота лимонная, ароматизатор натуральный, консервант бензоат натрия, краситель сахарный колер iv. 	True	True	Fri Jul  5 22:40:03 2024
Напиток безалкогольный Черноголовка Лимонад, 2л	149,99 ₽/шт	2000 мл	https://www.perekrestok.ru/cat/209/p/napitok-bezalkogolnyj-cernogolovka-limonad-2l-3403324	Wed Jul  3 15:03:36 2024	Напиток безалкогольный Черноголовка Лимонад, 2л	Цена124,99 ₽	Черноголовка	45.0	0.0 г	0.0 г	11.5 г	Вода, сахар свекловичный, концентрированный сок яблока, регуляторы кислотности: кислота лимонная и цитрат натрия, ароматизаторы натуральные, стабилизаторы: гуммиарабик и е445, красители: сахарный колер iv и бета-каротин, антиокислитель кислота аскорбиновая, консервант бензоат натрия. 	True	True	Fri Jul  5 22:40:04 2024
Напиток безалкогольный Зандукели со вкусом сливок газированный, 500мл	99,99 ₽/шт	500 мл	https://www.perekrestok.ru/cat/209/p/napitok-bezalkogolnyj-zandukeli-so-vkusom-slivok-gazirovannyj-500ml-4271304	Wed Jul  3 15:03:36 2024	Напиток безалкогольный Зандукели со вкусом сливок газированный, 500мл	Цена99,99 ₽	ЗАНДУКЕЛИ	45.0	0.0 г	0.0 г	11.0 г	Вода, сахар, регулятор кислотности лимонная кислота, ароматизатор идентичный натуральному, консервант бензоат натрия, стабилизатор e414, эмульгатор e445, краситель e102. 	True	True	Fri Jul  5 22:40:05 2024
Напиток безалкогольный Черноголовка Байкал, 2л	144,99 ₽/шт	2000 мл	https://www.perekrestok.ru/cat/209/p/napitok-bezalkogolnyj-cernogolovka-bajkal-2l-3141246	Wed Jul  3 15:03:36 2024	Напиток безалкогольный Черноголовка Байкал, 2л	Цена124,99 ₽	Черноголовка	40.0	0.0 г	0.0 г	10.0 г	Вода, сахар, экстракты: чая, элеутерококка; краситель сахарный колер (Е150а, E150d), регулятор кислотности кислота лимонная, стабилизатор гуммиарабик, ароматизаторы (содержат масла: кардамона, эвкалипта, пихты), подсластители: цикламат натрия, сукралоза, сахаринат натрия; консервант бензоат натрия. 	True	True	Fri Jul  5 22:40:06 2024
Напиток безалкогольный Laimon Фреш макс газированный, 1.5л	149,99 ₽/шт	1500 мл	https://www.perekrestok.ru/cat/209/p/napitok-bezalkogolnyj-laimon-fres-maks-gazirovannyj-1-5l-3299546	Wed Jul  3 15:03:36 2024	Напиток безалкогольный Laimon Фреш макс газированный, 1.5л	Цена154,99 ₽	LaimonFresh	50.0	0.0 г	0.0 г	12.0 г	Вода очищенная; сахар; концентрированные соки яблочный и лайма; ароматизаторы (натуральные вкусоароматические вещества и препараты, масла: лимона, лайма, мяты, апельсиновое). 	True	True	Fri Jul  5 22:40:07 2024
Напиток безалкогольный Черноголовка Тархун, 2л	144,99 ₽/шт	2000 мл	https://www.perekrestok.ru/cat/209/p/napitok-bezalkogolnyj-cernogolovka-tarhun-2l-3013417	Wed Jul  3 15:03:36 2024	Напиток безалкогольный Черноголовка Тархун, 2л	Цена124,99 ₽	Черноголовка	40.0	0.0 г	0.0 г	10.0 г	Вода, сахар свекловичный, настой эстрагона, регулятор кислотности кислота лимонная, консервант бензоат натрия, красители: тартразин, синий блестящий; ароматизатор пищевой «ванилин».nсодержит краситель е102 тартразин, который может оказывать отрицательное влияние на активность и внимание детей. 	True	True	Fri Jul  5 22:40:07 2024
Напиток Лимонад безалкогольный газированный Маркет Перекрёсток, 500мл	60,99 ₽/шт	500 мл	https://www.perekrestok.ru/cat/209/p/napitok-limonad-bezalkogolnyj-gazirovannyj-market-perekrestok-500ml-3487439	Wed Jul  3 15:03:36 2024	Напиток Лимонад безалкогольный газированный Маркет Перекрёсток, 500мл	Цена65,99 ₽	Маркет	44.0	0.0 г	0.0 г	11.1 г	Вода питьевая подготовленная, сахар, регулятор кислотности: кислота лимонная, ароматизатор лимонад, консервант: бензоат натрия, краситель: сахарный колер iv. 	True	True	Fri Jul  5 22:40:08 2024
Напиток безалкогольный Дюшес газированный Пр!ст, 2л	45,99 ₽/шт	2000 мл	https://www.perekrestok.ru/cat/209/p/napitok-bezalkogolnyj-duses-gazirovannyj-pr-st-2l-3625699	Wed Jul  3 15:03:36 2024	Напиток безалкогольный Дюшес газированный Пр!ст, 2л	Цена47,99 ₽	Пр!ст	1.0	0.0 г	0.0 г	0.3 г	Подготовленная вода, сахар, регулятор кислотности - лимонная кислота, подсластители: аспартам, ацесульфам калия, цикламат натрия, ароматизатор грушевый, консервант - бензоат натрия, краситель сахарный колер iv. 	True	True	Fri Jul  5 22:40:09 2024
Напиток Дюшес безалкогольный газированный Маркет Перекрёсток, 500мл	60,99 ₽/шт	500 мл	https://www.perekrestok.ru/cat/209/p/napitok-duses-bezalkogolnyj-gazirovannyj-market-perekrestok-500ml-3487440	Wed Jul  3 15:03:36 2024	Напиток Дюшес безалкогольный газированный Маркет Перекрёсток, 500мл	Цена65,99 ₽	Маркет	39.0	0.0 г	0.0 г	9.7 г	Вода питьевая подготовленная, сахар, регулятор кислотности: лимонная кислота, ароматизатор дюшес (идентичные натуральным вкусоароматические вещества, вкусоароматические экстракты, регулятор кислотности: цитрат натрия), консервант: бензоат натрия, краситель: сахарный колер iv. 	True	True	Fri Jul  5 22:40:10 2024
Напиток Lifeline Intellectual Арбуз-Яблоко витаминизированный негазированный, 500мл 	64,99 ₽/шт	500 мл	https://www.perekrestok.ru/cat/208/p/napitok-lifeline-intellectual-arbuz-abloko-vitaminizirovannyj-negazirovannyj-500ml-3901913	Wed Jul  3 15:03:36 2024	Напиток Lifeline Intellectual Арбуз-Яблоко витаминизированный негазированный, 500мл 	Цена79,99 ₽	Lifeline	30.0	0.0 г	0.0 г	8.0 г	Вода питьевая подготовленная , сахар, регулятор кислотности лимонная кислота, ароматизаторы, консервант сорбат калия, антиокислитель аскорбиновая кислота, краситель ликопин, премикс витаминный. пищевая ценность на 100 мл напитка: углеводы - 8,0 г, энергетическая ценность/калорийность -130кдж/30ккал, содержание витаминов, на дату производства, не менее: пантотеновая кислота -0,9 мг (14%*), фолацин -23 мкг (12%*), витамин в6 -0,2 мг (10%*), витамин с -5 мг (8%*), ниацин -1,4 мг (8%*). 	True	True	Fri Jul  5 22:40:11 2024
Напиток газированный Limonati By Borjomi тархун безалкогольный, 330мл	114,99 ₽/шт	330 мл	https://www.perekrestok.ru/cat/209/p/napitok-gazirovannyj-limonati-by-borjomi-tarhun-bezalkogolnyj-330ml-4314196	Wed Jul  3 15:03:36 2024	Напиток газированный Limonati By Borjomi тархун безалкогольный, 330мл	Цена149,99 ₽	Limonati	40.0	0.0 г	0.0 г	10.0 г	Продников боржомского ущелья, вода минеральная природная лечебно-столовая питьевая «боржоми», сахар, концентрированный яблочный сок (7,8%*), яблочный сок (1,39%), концентрированный лимонный сок (0,88%*), регуляторы кислотности лимонная кислота и аскорбиновая кислота, краситель медные комплексы хлорофиллинов, экстракт тархуна. допускается осадок естественного происхождения. 	True	True	Fri Jul  5 22:40:12 2024
Напиток безалкогольный Зандукели со вкусом лимона газированный, 500мл	99,99 ₽/шт	500 мл	https://www.perekrestok.ru/cat/209/p/napitok-bezalkogolnyj-zandukeli-so-vkusom-limona-gazirovannyj-500ml-4271305	Wed Jul  3 15:03:36 2024	Напиток безалкогольный Зандукели со вкусом лимона газированный, 500мл	Цена99,99 ₽	ЗАНДУКЕЛИ	45.0	0.0 г	0.0 г	11.0 г	Вода, сахар, регулятор кислотности лимонная кислота, ароматизатор лимон идентичный натуральному, консервант бензоат натрия. 	True	True	Fri Jul  5 22:40:13 2024
Напиток безалкогольный Волчок с соком персика газированный, 450мл	87,99 ₽/шт	450 мл	https://www.perekrestok.ru/cat/209/p/napitok-bezalkogolnyj-volcok-s-sokom-persika-gazirovannyj-450ml-4095600	Wed Jul  3 15:03:36 2024	Напиток безалкогольный Волчок с соком персика газированный, 450мл	Цена93,99 ₽	Волковская Пивоварня	40.0	0.0 г	0.0 г	10.0 г	Вода питьевая артезианская, концентрированный персиковый сок, сахар, ароматизатор пищевой натуральный тип персиковый. 	True	True	Fri Jul  5 22:40:14 2024
Лимонад со вкусом лимона безалкогольный сильногазированный Маркет, 2л	109,99 ₽/шт	2000 мл	https://www.perekrestok.ru/cat/209/p/limonad-so-vkusom-limona-bezalkogolnyj-silnogazirovannyj-market-2l-4327937	Wed Jul  3 15:03:36 2024	Лимонад со вкусом лимона безалкогольный сильногазированный Маркет, 2л	Цена124,99 ₽	Маркет	44.0	0.0 г	0.0 г	11.1 г	Вода питьевая подготовленная, сахар, регулятор кислотности – кислота лимонная, ароматизатор «Лимонад» (ароматизатор, носители: пропиленгликоль, триацетин), консервант – бензоат натрия, краситель – сахарный колер IV. 	True	True	Fri Jul  5 22:40:15 2024
Напиток безалкогольный Лимонад газированный Пр!ст, 2л	45,99 ₽/шт	2000 мл	https://www.perekrestok.ru/cat/209/p/napitok-bezalkogolnyj-limonad-gazirovannyj-pr-st-2l-3625731	Wed Jul  3 15:03:36 2024	Напиток безалкогольный Лимонад газированный Пр!ст, 2л	Цена47,99 ₽	Пр!ст	2.0	0.0 г	0.0 г	0.5 г	Подготовленная вода, сахар, регулятор кислотности - лимонная кислота, подсластители: цикламат натрия, аспартам, ацесульфам калия, сахаринат натрия, ароматизатор лимонад, консервант - бензоат натрия, краситель сахарный колер iv. Содержит источник фенилаланина. 	True	True	Fri Jul  5 22:40:16 2024
Напиток безалкогольный Черноголовка Тархун газированный, 500мл	83,99 ₽/шт	500 мл	https://www.perekrestok.ru/cat/209/p/napitok-bezalkogolnyj-cernogolovka-tarhun-gazirovannyj-500ml-3342539	Wed Jul  3 15:03:36 2024	Напиток безалкогольный Черноголовка Тархун газированный, 500мл	Цена83,99 ₽	Черноголовка	40.0	0.0 г	0.0 г	10.0 г	Вода, сахар свекловичный, настой эстрагона, регулятор кислотности кислота лимонная, консервант бензоат натрия, красители: тартразин, синий блестящий; ароматизатор пищевой «ванилин».nсодержит краситель е102 тартразин, который может оказывать отрицательное влияние на активность и внимание детей. 	True	True	Fri Jul  5 22:40:17 2024
Напиток безалкогольный Черноголовка Лимонад Буратино газированный, 2л	144,99 ₽/шт	2000 мл	https://www.perekrestok.ru/cat/209/p/napitok-bezalkogolnyj-cernogolovka-limonad-buratino-gazirovannyj-2l-3359208	Wed Jul  3 15:03:36 2024	Напиток безалкогольный Черноголовка Лимонад Буратино газированный, 2л	Цена124,99 ₽	Черноголовка	40.0	0.0 г	0.0 г	11.0 г	Вода, сахар свекловичный, концентрированный сок красного винограда, настой цитрусовый апельсиновый, краситель растительного происхождения, регулятор кислотности кислота лимонная, ароматизаторы натуральные, консервант бензоат натрия. 	True	True	Fri Jul  5 22:40:18 2024
Напиток безалкогольный Laimon Фреш газированный, 1л	114,99 ₽/шт	1000 мл	https://www.perekrestok.ru/cat/209/p/napitok-bezalkogolnyj-laimon-fres-gazirovannyj-1l-3358612	Wed Jul  3 15:03:36 2024	Напиток безалкогольный Laimon Фреш газированный, 1л	Цена114,99 ₽	LaimonFresh	50.0	0.0 г	0.0 г	12.0 г	Вода очищенная; сахар; концентрированные соки яблочный и лайма; ароматизаторы (натуральные вкусоароматические вещества и препараты, масла: лимона, лайма, мяты, апельсиновое). 	True	True	Fri Jul  5 22:40:19 2024
