name	price	size	url	time	name_	price_	brand	calories	proteins	fats	carbos	composition	get_ok	parse_ok	time_
Напиток газированный Фрустайл Апельсин 1л	104,99 ₽/шт	1000 мл	https://www.perekrestok.ru/cat/209/p/napitok-gazirovannyj-frustajl-apelsin-1l-4234988	Wed Jul  3 15:03:36 2024	Напиток газированный Фрустайл Апельсин 1л	Цена99,99 ₽	Фрустайл	52.0	0.0 г	0.0 г	12.7 г	Вода, сахар, регулятор кислотности лимонная кислота, ароматизаторы, красители (e150d, e160a, e160e), консервант е202, антиокислитель аскорбиновая кислота. 	True	True	Fri Jul  5 22:39:06 2024
Напиток Aziano со вкусом Манго безалкогольный слабогазированный, 350мл	64,99 ₽/шт	350 мл	https://www.perekrestok.ru/cat/209/p/napitok-aziano-so-vkusom-mango-bezalkogolnyj-slabogazirovannyj-350ml-4208832	Wed Jul  3 15:03:36 2024	Напиток Aziano со вкусом Манго безалкогольный слабогазированный, 350мл	Цена89,99 ₽	Aziano	0.0	0.0 г	0.0 г	0.0 г	Вода питьевая подготовленная, регуляторы кислотности (лимонная кислота, цитрат натрия), ароматизатор манго, подсластители (цикламат натрия, сукралоза), консервант сорбат калия. 	True	True	Fri Jul  5 22:39:07 2024
Напиток безалкогольный Черноголовка Кола газированный, 330мл	61,99 ₽/шт	330 мл	https://www.perekrestok.ru/cat/209/p/napitok-bezalkogolnyj-cernogolovka-kola-gazirovannyj-330ml-4256501	Wed Jul  3 15:03:36 2024	Напиток безалкогольный Черноголовка Кола газированный, 330мл	Цена61,99 ₽	Черноголовка	45.0	0.0 г	0.0 г	10.5 г	Вода, сахар (s) или сахар и сироп глюкозно-фруктозный (g), регулятор кислотности кислота орто-фосфорная, краситель сахарный колер iv, ароматизаторы, консервант бензоат натрия, кофеин (не более 150 мг/л). 	True	True	Fri Jul  5 22:39:08 2024
Лимонад Лагидзе Экстра Крем-Сода безалкогольный сильногазированный, 330мл	89,99 ₽/шт	330 мл	https://www.perekrestok.ru/cat/209/p/limonad-lagidze-ekstra-krem-soda-bezalkogolnyj-silnogazirovannyj-330ml-4345250	Wed Jul  3 15:03:36 2024	Лимонад Лагидзе Экстра Крем-Сода безалкогольный сильногазированный, 330мл	Цена69,99 ₽	Лагидзе	50.0	0.0 г	0.0 г	13.0 г	none	True	True	Fri Jul  5 22:39:08 2024
Лимонад Лагидзе Экстра Фейхоа безалкогольный сильногазированный, 330мл	89,99 ₽/шт	330 мл	https://www.perekrestok.ru/cat/209/p/limonad-lagidze-ekstra-fejhoa-bezalkogolnyj-silnogazirovannyj-330ml-4345249	Wed Jul  3 15:03:36 2024	Лимонад Лагидзе Экстра Фейхоа безалкогольный сильногазированный, 330мл	Цена69,99 ₽	Лагидзе	50.0	0.0 г	0.0 г	12.0 г	none	True	True	Fri Jul  5 22:39:09 2024
Напиток Chillout Bitter Lemon безалкогольный сильногазированный, 900мл	79,99 ₽/шт	900 мл	https://www.perekrestok.ru/cat/209/p/napitok-chillout-bitter-lemon-bezalkogolnyj-silnogazirovannyj-900ml-4307059	Wed Jul  3 15:03:36 2024	Напиток Chillout Bitter Lemon безалкогольный сильногазированный, 900мл	Цена79,99 ₽	Черноголовка	45.0	0.0 г	0.0 г	11.0 г	Вода, сахар (s) или сахар и сироп глюкозно-фруктозный (g), регулятор кислотности кислота, стабилизаторы (гуммиарабик, эфиры глицерина и смоляных кислот), концентрированный сок лимона, ароматизаторы, антиокислитель аскорбиновая кислота, консервант бензоат натрия, хинин, красители (сахарный колер iv и бета-каротин). 	True	True	Fri Jul  5 22:39:10 2024
Напиток безалкогольный Laimon Fresh Mango среднегазированный, 330мл	59,99 ₽/шт	330 мл	https://www.perekrestok.ru/cat/209/p/napitok-bezalkogolnyj-laimon-fresh-mango-srednegazirovannyj-330ml-4237863	Wed Jul  3 15:03:36 2024	Напиток безалкогольный Laimon Fresh Mango среднегазированный, 330мл	Цена69,99 ₽	Laimon Fresh	45.0	0.0 г	0.0 г	11.0 г	Напиток безалкогольный среднегазированный «лаймон фрэш манго (laimon fresh mango)» 0,33 л пастеризованный. гост 28188-2014 вода очищенная, сахар, концентрированные соки (яблочный, лайма, из манго), натуральные ароматизаторы (натуральные вкусоароматические вещества, вкусоароматические препараты, масла: лимона, лайма, мяты), краситель каротины, антиокислитель аскорбиновая кислота. 	True	True	Fri Jul  5 22:39:11 2024
Лимонад Лагидзе Экстра Вишнёвый безалкогольный сильногазированный, 330мл	89,99 ₽/шт	330 мл	https://www.perekrestok.ru/cat/209/p/limonad-lagidze-ekstra-visnevyj-bezalkogolnyj-silnogazirovannyj-330ml-4345248	Wed Jul  3 15:03:36 2024	Лимонад Лагидзе Экстра Вишнёвый безалкогольный сильногазированный, 330мл	Цена69,99 ₽	Лагидзе	50.0	0.0 г	0.0 г	13.0 г	none	True	True	Fri Jul  5 22:39:12 2024
Лимонад Лагидзе Экстра Тархуновый безалкогольный сильногазированный, 330мл	83,99 ₽/шт	330 мл	https://www.perekrestok.ru/cat/209/p/limonad-lagidze-ekstra-tarhunovyj-bezalkogolnyj-silnogazirovannyj-330ml-4345252	Wed Jul  3 15:03:36 2024	Лимонад Лагидзе Экстра Тархуновый безалкогольный сильногазированный, 330мл	Цена69,99 ₽	Лагидзе	50.0	0.0 г	0.0 г	13.0 г	none	True	True	Fri Jul  5 22:39:13 2024
Напиток безалкогольный Fresh Bar Magic Skills сильногазированный, 480мл	49,99 ₽/шт	480 мл	https://www.perekrestok.ru/cat/209/p/napitok-bezalkogolnyj-fresh-bar-magic-skills-silnogazirovannyj-480ml-4216069	Wed Jul  3 15:03:36 2024	Напиток безалкогольный Fresh Bar Magic Skills сильногазированный, 480мл	Цена53,99 ₽	Fresh Bar	44.0	0.0 г	0.0 г	11.0 г	Подготовленная вода, сахар, регуляторы кислотности кислота лимонная и цитрат натрия, концентрированный лимонный сок, краситель сахарный колер iv, ароматизаторы, кофеин. 	True	True	Fri Jul  5 22:39:14 2024
Напиток газированный Добрый Лесные ягоды безалкогольный, 500мл	77,99 ₽/шт	500 мл	https://www.perekrestok.ru/cat/209/p/napitok-gazirovannyj-dobryj-lesnye-agody-bezalkogolnyj-500ml-4349220	Wed Jul  3 15:03:36 2024	Напиток газированный Добрый Лесные ягоды безалкогольный, 500мл	Цена79,99 ₽	Добрый	20.0	0.0 г	0.0 г	4.7 г	none	True	True	Fri Jul  5 22:39:14 2024
Напиток безалкогольный Dubl Bubl Бабл Гам сильногазированный, 330мл	77,90 ₽/шт	330 мл	https://www.perekrestok.ru/cat/209/p/napitok-bezalkogolnyj-dubl-bubl-babl-gam-silnogazirovannyj-330ml-4235967	Wed Jul  3 15:03:36 2024	Напиток безалкогольный Dubl Bubl Бабл Гам сильногазированный, 330мл	Цена49,99 ₽	Dubl Bubl	40.0	0.0 г	0.0 г	10.0 г	Вода питьевая подготовленная, сахар, регулятор кислотности лимонная кислота, ароматизаторы пищевые. 	True	True	Fri Jul  5 22:39:15 2024
Лимонад Лагидзе Экстра Грушевый безалкогольный сильногазированный, 330мл	89,99 ₽/шт	330 мл	https://www.perekrestok.ru/cat/209/p/limonad-lagidze-ekstra-grusevyj-bezalkogolnyj-silnogazirovannyj-330ml-4345251	Wed Jul  3 15:03:36 2024	Лимонад Лагидзе Экстра Грушевый безалкогольный сильногазированный, 330мл	Цена69,99 ₽	Лагидзе	50.0	0.0 г	0.0 г	13.0 г	none	True	True	Fri Jul  5 22:39:16 2024
Напиток безалкогольный Добрый манго-маракуйя сильногазированный, 500мл	85,99 ₽/шт	500 мл	https://www.perekrestok.ru/cat/209/p/napitok-bezalkogolnyj-dobryj-mango-marakuja-silnogazirovannyj-500ml-4255771	Wed Jul  3 15:03:36 2024	Напиток безалкогольный Добрый манго-маракуйя сильногазированный, 500мл	Цена81,99 ₽	Добрый	32.0	0.0 г	0.0 г	8.0 г	Очищенная вода, сахар, регулятор кислотности лимонная кислота, витамин с (аскорбиновая кислота), стабилизаторы (гуммиарабик, эфиры глицерина и смоляных кислот), антиокислитель альфа-токоферол, подсластитель сахаринат натрия, натуральные ароматизаторы, краситель каротины, консервант сорбат калия. 	True	True	Fri Jul  5 22:39:16 2024
Напиток безалкогольный Dubl Bubl Клубника со сливками сильногазированный, 330мл	69,99 ₽/шт	330 мл	https://www.perekrestok.ru/cat/209/p/napitok-bezalkogolnyj-dubl-bubl-klubnika-so-slivkami-silnogazirovannyj-330ml-4245176	Wed Jul  3 15:03:36 2024	Напиток безалкогольный Dubl Bubl Клубника со сливками сильногазированный, 330мл	Цена49,99 ₽	Dubl Bubl	170.0	0.0 г	0.0 г	10.0 г	Вода питьевая подготовленная, сахар, регулятор кислотности лимонная кислота, ароматизаторы пищевые (стабилизаторы: эфиры глицерина и смоляных кислот, гуммиарабик; антиокислитель альфа-токоферол, краситель красный очаровательный ас). 	True	True	Fri Jul  5 22:39:17 2024
Напиток Добрый кола со вкусом малины газированный ароматизированный безалкогольный, 500мл	81,99 ₽/шт	500 мл	https://www.perekrestok.ru/cat/209/p/napitok-dobryj-kola-so-vkusom-maliny-gazirovannyj-aromatizirovannyj-bezalkogolnyj-500ml-4344356	Wed Jul  3 15:03:36 2024	Напиток Добрый кола со вкусом малины газированный ароматизированный безалкогольный, 500мл	Цена81,99 ₽	Добрый	19.0	0.0 г	0.0 г	4.8 г	none	True	True	Fri Jul  5 22:39:18 2024
Напиток безалкогольный Sever Лайм сильногазированный, 2л	144,99 ₽/шт	2000 мл	https://www.perekrestok.ru/cat/209/p/napitok-bezalkogolnyj-sever-lajm-silnogazirovannyj-2l-4266676	Wed Jul  3 15:03:36 2024	Напиток безалкогольный Sever Лайм сильногазированный, 2л	Цена144,99 ₽	Север	20.0	0.0 г	0.0 г	4.5 г	Вода питьевая подготовленная, сахар, регуляторы кислотности лимонная кислота, цитрат натрия 3-замещенный; ароматизаторы, подсластитель ацесульфам калия, консервант бензоат натрия. 	True	True	Fri Jul  5 22:39:18 2024
Напиток безалкогольный Абрау-ДюрсоЛайт Зеро сильногазированный, 750мл	269,99 ₽/шт	750 мл	https://www.perekrestok.ru/cat/209/p/napitok-bezalkogolnyj-abrau-dursolajt-zero-silnogazirovannyj-750ml-4254269	Wed Jul  3 15:03:36 2024	Напиток безалкогольный Абрау-ДюрсоЛайт Зеро сильногазированный, 750мл	Цена299,99 ₽	Абрау-Дюрсо	25.0	0.0 г	0.0 г	5.0 г	Вода подготовленная, сусло виноградное концентрированное, вино наливом сухое белое, регулятор кислотности - лимонная кислота пищевая, консерванты: сорбат калия, бензоат натрия, ароматизатор пищевой натуральный тип просекко. 	True	True	Fri Jul  5 22:39:19 2024
Напиток газированный Добрый Cola Ваниль, 500мл	95,99 ₽/шт	500 мл	https://www.perekrestok.ru/cat/209/p/napitok-gazirovannyj-dobryj-cola-vanil-500ml-4283427	Wed Jul  3 15:03:36 2024	Напиток газированный Добрый Cola Ваниль, 500мл	Цена95,99 ₽	Добрый	85.0	0.0 г	0.0 г	4.9 г	Очищенная вода, сахар, краситель сахарный колер iv, регулятор кислотности орто-фосфорная кислота, подсластители (цикламат натрия, ацесульфам калия, аспартам), ароматизаторы, кофеин (менее 150 мг/л). содержит источник фенилаланина. 	True	True	Fri Jul  5 22:39:20 2024
Напиток безалкогольный Очаково Street газированный, 500мл	71,99 ₽/шт	500 мл	https://www.perekrestok.ru/cat/209/p/napitok-bezalkogolnyj-ocakovo-street-gazirovannyj-500ml-4232539	Wed Jul  3 15:03:36 2024	Напиток безалкогольный Очаково Street газированный, 500мл	Цена59,99 ₽	Street	40.0	0.0 г	0.0 г	10.0 г	Вода подготовленная, сахар, регулятор кислотности - лимонная кислота, сок лимона и лайма. растительные экстракты, натуральные ароматизаторы. 	True	True	Fri Jul  5 22:39:21 2024
Напиток безалкогольный Laimon Fresh Mango среднегазированный, 500мл	87,99 ₽/шт	500 мл	https://www.perekrestok.ru/cat/209/p/napitok-bezalkogolnyj-laimon-fresh-mango-srednegazirovannyj-500ml-4237864	Wed Jul  3 15:03:36 2024	Напиток безалкогольный Laimon Fresh Mango среднегазированный, 500мл	Цена77,99 ₽	Laimon Fresh	45.0	0.0 г	0.0 г	11.0 г	Напиток безалкогольный среднегазированный «лаймон фрэш манго (laimon fresh mango)» 0,5 л пастеризованный. гост 28188-2014 вода очищенная, сахар, концентрированные соки (яблочный, лайма, из манго), натуральные ароматизаторы (натуральные вкусоароматические вещества, вкусоароматические препараты, масла: лимона, лайма, мяты), краситель каротины, антиокислитель аскорбиновая кислота. 	True	True	Fri Jul  5 22:39:22 2024
Напиток газированный Аква Минерале Цитрусовый микс со вкусом красного апельсина и грейпфрута безалкогольный, 1л	114,99 ₽/шт	1000 мл	https://www.perekrestok.ru/cat/209/p/napitok-gazirovannyj-akva-minerale-citrusovyj-miks-so-vkusom-krasnogo-apelsina-i-grejpfruta-bezalkogolnyj-1l-4302827	Wed Jul  3 15:03:36 2024	Напиток газированный Аква Минерале Цитрусовый микс со вкусом красного апельсина и грейпфрута безалкогольный, 1л	Цена138,99 ₽	Aqua Minerale	18.0	0.0 г	0.0 г	4.4 г	Вода, сахар, регуляторы кислотности (е330, e331(iii)), ароматизатор, минеральные соли (хлорид калия, сульфат магния), консерванты (е202, е211), витамины (ниацин, пантотеновая кислота, в6). 	True	True	Fri Jul  5 22:39:23 2024
Напиток безалкогольный Dubl Bubl Клубника со сливками сильногазированный, 500мл	67,99 ₽/шт	500 мл	https://www.perekrestok.ru/cat/209/p/napitok-bezalkogolnyj-dubl-bubl-klubnika-so-slivkami-silnogazirovannyj-500ml-4245177	Wed Jul  3 15:03:36 2024	Напиток безалкогольный Dubl Bubl Клубника со сливками сильногазированный, 500мл	Цена54,99 ₽	Dubl Bubl	40.0	0.0 г	0.0 г	10.0 г	Вода питьевая подготовленная, сахар, регулятор кислотности лимонная кислота, ароматизаторы пищевые (стабилизаторы: эфиры глицерина и смоляных кислот, гуммиарабик; антиокислитель альфа-токоферол, краситель красный очаровательный ас), консервант сорбат калия. 	True	True	Fri Jul  5 22:39:23 2024
Напиток безалкогольный Sever Indian Tonic сильногазированный, 1л	69,99 ₽/шт	1000 мл	https://www.perekrestok.ru/cat/209/p/napitok-bezalkogolnyj-sever-indian-tonic-silnogazirovannyj-1l-4222291	Wed Jul  3 15:03:36 2024	Напиток безалкогольный Sever Indian Tonic сильногазированный, 1л	Цена89,99 ₽	Север	20.0	0.0 г	0.0 г	4.5 г	Вода питьевая подготовленная, сахар, регулятор кислотности лимонная кислота, ароматизатор (содержит хинин), подсластители ацесульфам калия, сахаринат натрия; консервант бензоат натрия. 	True	True	Fri Jul  5 22:39:24 2024
Напиток Sparkling Chupa Chups Виноград газированный, 250мл	109,99 ₽/шт	250 мл	https://www.perekrestok.ru/cat/209/p/napitok-sparkling-chupa-chups-vinograd-gazirovannyj-250ml-4134081	Wed Jul  3 15:03:36 2024	Напиток Sparkling Chupa Chups Виноград газированный, 250мл	Цена134,99 ₽	Chupa Chups	48.7	0.0 г	0.0 г	12.2 г	Подготовленная вода, кукурузный сироп с высоким содержанием фруктозы, сахар, концентрированный фруктовый сок винограда (1%), краситель: антоцианы краснокочанной капусты (е163), стабилизатор; цитрат натрия (е331), регулятор кислотности, лимонная кислота (е330), цитрат калия (е332), натуральный ароматизатор виноград. 	True	True	Fri Jul  5 22:39:25 2024
Напиток безалкогольный Витамизу Классик йерба-матэ слабогазированный	109,99 ₽/шт	330 мл	https://www.perekrestok.ru/cat/209/p/napitok-bezalkogolnyj-vitamizu-klassik-jerba-mate-slabogazirovannyj-4272655	Wed Jul  3 15:03:36 2024	Напиток безалкогольный Витамизу Классик йерба-матэ слабогазированный	Цена149,99 ₽	Vitamizu	23.0	0.0 г	0.0 г	5.7 г	Вода, сахар, экстракт мате (600 мг/100 мл), диоксид углерода, натуральный ароматизатор мате, регулятор кислотности: лимонная кислота, карамельный сахарный сироп, натуральный кофеин. высокое содержание кофеина; не рекомендуется для детей, беременных или кормящих женщин (20 мг/100 мл). 	True	True	Fri Jul  5 22:39:25 2024
Напиток безалкогольный Dubl Bubl Бабл Гам сильногазированный, 500мл	67,99 ₽/шт	500 мл	https://www.perekrestok.ru/cat/209/p/napitok-bezalkogolnyj-dubl-bubl-babl-gam-silnogazirovannyj-500ml-4245175	Wed Jul  3 15:03:36 2024	Напиток безалкогольный Dubl Bubl Бабл Гам сильногазированный, 500мл	Цена54,99 ₽	Dubl Bubl	40.0	0.0 г	0.0 г	10.0 г	Вода питьевая подготовленная, сахар, стабилизатор гуммиарабик, регулятор кислотности лимонная кислота, ароматизаторы пищевые (регулятор кислотности уксусная кислота (е260),антиокислитель аскорбиновая кислота (е300), стабилизатор эфиры глицерина и смоляных кислот (e445), терпены, консервант сорбат калия (е202), антиокислитель бутилгидроксианизол (е320)), краситель азорубин е122, консервант сорбат калия. 	True	True	Fri Jul  5 22:39:26 2024
Напиток Chupa Chups клубника со сливками безалкогольный cильногазированный жестяная банка, 250мл	109,99 ₽/шт	250 мл	https://www.perekrestok.ru/cat/209/p/napitok-chupa-chups-klubnika-so-slivkami-bezalkogolnyj-cilnogazirovannyj-zestanaa-banka-250ml-4134084	Wed Jul  3 15:03:36 2024	Напиток Chupa Chups клубника со сливками безалкогольный cильногазированный жестяная банка, 250мл	Цена99,99 ₽	Chupa Chups	49.3	0.0 г	0.0 г	12.2 г	Подготовленная вода, кукурузный сироп с высоким содержанием фруктозы, сахар, ферментированное молоко (молоко, обезжиренное сухое молоко, молочные бактерии, лактоза), сухое обезжиренное молоко, клубничный концентрированный фруктовый сок, клюквенный концентрированный фруктовый сок, загуститель е426, регуляторы кислотности: лимонная кислота е330, ортофосфорная кислота е338, краситель антоцианы краснокочанной капусты е163, натуральные ароматизаторы клубники, молока, сгущенного молока. 	True	True	Fri Jul  5 22:39:27 2024
Напиток безалкогольный Очаково CoolCola газированный, 330мл	65,99 ₽/шт	330 мл	https://www.perekrestok.ru/cat/209/p/napitok-bezalkogolnyj-ocakovo-coolcola-gazirovannyj-330ml-4232550	Wed Jul  3 15:03:36 2024	Напиток безалкогольный Очаково CoolCola газированный, 330мл	Цена67,99 ₽	Cool Cola	45.0	0.0 г	0.0 г	11.0 г	Вода, подготовленная, сахар, краситель – сахарный колер iv, регуляторы кислотности – ортофосфорная кислота, лимонная кислота, натуральные ароматизаторы, кофеин (менее150 мг/л), экстракт ванили. 	True	True	Fri Jul  5 22:39:28 2024
Напиток безалкогольный Очаково Fancy газированный, 500мл	73,99 ₽/шт	500 мл	https://www.perekrestok.ru/cat/209/p/napitok-bezalkogolnyj-ocakovo-fancy-gazirovannyj-500ml-4232542	Wed Jul  3 15:03:36 2024	Напиток безалкогольный Очаково Fancy газированный, 500мл	Цена59,99 ₽	Fancy	45.0	0.0 г	0.0 г	11.0 г	Вода подготовленная, сахар, апельсиновый сок (3%), регулятор кислотности - лимонная кислота, стабилизатор- гуммиарабик, эмульгатор - глицерина и смоляных кислот, ароматизаторы, натуральные ароматизаторы, апельсиновые терпены, растительные экстракты (эфирные масла: мандарина, апельсина, лимона, грейпфрута, лайма), красители ( каротина, бета-апо-8-каротиновый альдегид (с30). 	True	True	Fri Jul  5 22:39:29 2024
