name	price	size	url	time	name_	price_	brand	calories	proteins	fats	carbos	composition	get_ok	parse_ok	time_
Напиток газированный Evervess Кола, 1.5л	114,99 ₽/шт	1500 мл	https://www.perekrestok.ru/cat/209/p/napitok-gazirovannyj-evervess-kola-1-5l-4279787	Wed Jul  3 15:03:36 2024	Напиток газированный Evervess Кола, 1.5л	Цена114,99 ₽	Evervess	44.0	0.0 г	0.0 г	11.1 г	Вода, сахар, краситель e150d, регулятор кислотности ез38, ароматизаторы, кофеин (не более 150 мг(л)), стабилизатор е414. 	True	True	Fri Jul  5 22:38:10 2024
Напиток безалкогольный Добрый Кола без сахара сильногазированный, 1.5л	139,99 ₽/шт	1500 мл	https://www.perekrestok.ru/cat/209/p/napitok-bezalkogolnyj-dobryj-kola-bez-sahara-silnogazirovannyj-1-5l-4274867	Wed Jul  3 15:03:36 2024	Напиток безалкогольный Добрый Кола без сахара сильногазированный, 1.5л	Цена124,99 ₽	Добрый	0.3	0.0 г	0.0 г	0.0 г	"Очищенная вода, краситель сахарный колер iv, регуляторы кислотности (ортофосфорная кислота ,цитрат натрия 3-замещенный), подсластители (натриевая соль цикламовой кислоты, ацесульфам калия, аспартам), натуральный ароматизатор, кофеин (менее 150 мг/л).
содержит источник фенилаланина. "	True	True	Fri Jul  5 22:38:11 2024
Напиток сильногазированный Добрый Cola, 1.5л	164,99 ₽/шт	1500 мл	https://www.perekrestok.ru/cat/209/p/napitok-silnogazirovannyj-dobryj-cola-1-5l-4255938	Wed Jul  3 15:03:36 2024	Напиток сильногазированный Добрый Cola, 1.5л	Цена124,99 ₽	Добрый	42.0	0.0 г	0.0 г	10.6 г	Очищенная вода, сахар, краситель  сахарный колер iv, регулятор кислотности  ортофосфорная кислота, натуральный ароматизатор, кофеин (менее 150 мг/л). 	True	True	Fri Jul  5 22:38:12 2024
Напиток газированный Добрый Кола безалкогольный ароматизированный, 250мл	54,99 ₽/шт	250 мл	https://www.perekrestok.ru/cat/209/p/napitok-gazirovannyj-dobryj-kola-bezalkogolnyj-aromatizirovannyj-250ml-4311536	Wed Jul  3 15:03:36 2024	Напиток газированный Добрый Кола безалкогольный ароматизированный, 250мл	Цена54,99 ₽	Добрый	42.0	0.0 г	0.0 г	10.6 г	Очищенная вода, сахар, краситель сахарный колер iv, регулятор кислотности орто-фосфорная кислота, натуральный ароматизатор, кофеин (менее 150 мг/л). 	True	True	Fri Jul  5 22:38:12 2024
Напиток газированный Добрый Кола без сахара безалкогольный ароматизированный, 250мл	54,99 ₽/шт	250 мл	https://www.perekrestok.ru/cat/209/p/napitok-gazirovannyj-dobryj-kola-bez-sahara-bezalkogolnyj-aromatizirovannyj-250ml-4311540	Wed Jul  3 15:03:36 2024	Напиток газированный Добрый Кола без сахара безалкогольный ароматизированный, 250мл	Цена54,99 ₽	Добрый	0.3	0.0 г	0.0 г	0.0 г	"Очищенная вода, краситель сахарный колер iv, регуляторы кислотности (орто-фосфорная кислота ,цитрат натрия 3-замещенный), подсластители (натриевая соль цикламовой кислоты, ацесульфам калия, аспартам), натуральный ароматизатор, кофеин (менее 150 мг/л).
содержит источник фенилаланина. "	True	True	Fri Jul  5 22:38:13 2024
Напиток газированный Pepsi, 1.5л	189,99 ₽/шт	1500 мл	https://www.perekrestok.ru/cat/209/p/napitok-gazirovannyj-pepsi-1-5l-3684633	Wed Jul  3 15:03:36 2024	Напиток газированный Pepsi, 1.5л	Цена189,99 ₽	Pepsi	45.0	0.0 г	0.0 г	11.2 г	Вода, сахар, краситель (е150d), регулятор кислотности (e338), кофеин (не более 150 мг/л), ароматизатор. 	True	True	Fri Jul  5 22:38:14 2024
Напиток газированный Pepsi, 1л	151,99 ₽/шт	1000 мл	https://www.perekrestok.ru/cat/209/p/napitok-gazirovannyj-pepsi-1l-3684639	Wed Jul  3 15:03:36 2024	Напиток газированный Pepsi, 1л	Цена149,99 ₽	Pepsi	45.0	0.0 г	0.0 г	11.2 г	Вода, сахар, краситель (е150d), регулятор кислотности (e338), кофеин (не более 150 мг/л), ароматизатор. 	True	True	Fri Jul  5 22:38:15 2024
Напиток сильногазированный Cool Cola Zero, 1.5л	129,99 ₽/шт	1500 мл	https://www.perekrestok.ru/cat/209/p/napitok-silnogazirovannyj-cool-cola-zero-1-5l-4255568	Wed Jul  3 15:03:36 2024	Напиток сильногазированный Cool Cola Zero, 1.5л	Цена109,99 ₽	Cool Cola	0.2	0.0 г	0.0 г	0.0 г	Вода, краситель сахарный колер iv, регуляторы кислотности (ортофосфорная кислота, лимонная кислота), подсластители (цикламат натрия, ацесульфам калия, сукралоза, сахаринат натрия), натуральные ароматизаторы, кофеин (менее 150 мг/л), экстракт ванили. 	True	True	Fri Jul  5 22:38:16 2024
Напиток Rich Cola, 330мл	74,99 ₽/шт	330 мл	https://www.perekrestok.ru/cat/209/p/napitok-rich-cola-330ml-4283430	Wed Jul  3 15:03:36 2024	Напиток Rich Cola, 330мл	Цена109,99 ₽	Rich	42.0	0.0 г	0.0 г	10.4 г	Очищенная вода, сахар, краситель сахарный колер iv, регулятор кислотности ортофосфорная кислота, натуральный ароматизатор, кофеин (менее 150 мг/л). 	True	True	Fri Jul  5 22:38:17 2024
Напиток газированный Любимая Кола, 1.5л	109,99 ₽/шт	1500 мл	https://www.perekrestok.ru/cat/209/p/napitok-gazirovannyj-lubimaa-kola-1-5l-4279795	Wed Jul  3 15:03:36 2024	Напиток газированный Любимая Кола, 1.5л	Цена144,99 ₽	Любимая	44.0	0.0 г	0.0 г	11.1 г	Вода, сахар, краситель e150d, регулятор кислотности е338, ароматизаторы, кофеин (не более 150 мг/л), подсластители (е950, е951, е952, е954), стабилизатор е414. 	True	True	Fri Jul  5 22:38:18 2024
Напиток безалкогольный  Добрый Кола без сахара сильногазированный, 500мл	97,99 ₽/шт	500 мл	https://www.perekrestok.ru/cat/209/p/napitok-bezalkogolnyj-dobryj-kola-bez-sahara-silnogazirovannyj-500ml-4266830	Wed Jul  3 15:03:36 2024	Напиток безалкогольный  Добрый Кола без сахара сильногазированный, 500мл	Цена97,99 ₽	Добрый	0.3	0.0 г	0.0 г	0.0 г	"Очищенная вода, краситель сахарный колер iv, регуляторы кислотности (ортофосфорная кислота ,цитрат натрия 3-замещенный), подсластители (натриевая соль цикламовой кислоты, ацесульфам калия, аспартам), натуральный ароматизатор, кофеин (менее 150 мг/л). 
содержит источник фенилаланина. "	True	True	Fri Jul  5 22:38:19 2024
Напиток газированный Coca-Cola безалкогольный, 1л	189,99 ₽/шт	1000 мл	https://www.perekrestok.ru/cat/209/p/napitok-gazirovannyj-coca-cola-bezalkogolnyj-1l-4300790	Wed Jul  3 15:03:36 2024	Напиток газированный Coca-Cola безалкогольный, 1л	Цена189,99 ₽	Coca-Cola	42.0	0.0 г	0.0 г	10.6 г	вода, сахар, Диоксид углерода(CARBON DIOXIDE), регулятор кислотности, пропаллент, упаковочный газ Е290), краситель (карамельный колер E150d), регулятор кислотности (Орто-фосфорная кислота Е338), ароматизаторы, кофеин 	True	True	Fri Jul  5 22:38:20 2024
Напиток безалкогольный Кола газированный Пр!ст, 2л	45,99 ₽/шт	2000 мл	https://www.perekrestok.ru/cat/209/p/napitok-bezalkogolnyj-kola-gazirovannyj-pr-st-2l-3625730	Wed Jul  3 15:03:36 2024	Напиток безалкогольный Кола газированный Пр!ст, 2л	Цена47,99 ₽	Пр!ст	2.0	0.0 г	0.0 г	0.5 г	Подготовленная вода, сахар, краситель – сахарный колер iv, ароматизатор, регулятор кислотности - лимонная кислота, подсластители: е952, е951, е950, е954, консервант - бензоат натрия. 	True	True	Fri Jul  5 22:38:21 2024
Напиток сильногазированный Добрый Cola, 500мл	97,99 ₽/шт	500 мл	https://www.perekrestok.ru/cat/209/p/napitok-silnogazirovannyj-dobryj-cola-500ml-4255936	Wed Jul  3 15:03:36 2024	Напиток сильногазированный Добрый Cola, 500мл	Цена97,99 ₽	Добрый	42.0	0.0 г	0.0 г	10.6 г	Очищенная вода, сахар, краситель  сахарный колер iv, регулятор кислотности  ортофосфорная кислота, натуральный ароматизатор, кофеин (менее 150 мг/л). 	True	True	Fri Jul  5 22:38:22 2024
Напиток газированный Pepsi, 500мл	99,99 ₽/шт	500 мл	https://www.perekrestok.ru/cat/209/p/napitok-gazirovannyj-pepsi-500ml-3684630	Wed Jul  3 15:03:36 2024	Напиток газированный Pepsi, 500мл	Цена79,99 ₽	Pepsi	48.4	0.5 г	0.4 г	10.4 г	Вода, сахар, краситель (е150d), регулятор кислотности (e338), кофеин (не более 150 мг/л), ароматизатор. 	True	True	Fri Jul  5 22:38:23 2024
Напиток безалкогольный Cool Cola Zero сильногазированный, 1л	71,99 ₽/шт	1000 мл	https://www.perekrestok.ru/cat/209/p/napitok-bezalkogolnyj-cool-cola-zero-silnogazirovannyj-1l-4256940	Wed Jul  3 15:03:36 2024	Напиток безалкогольный Cool Cola Zero сильногазированный, 1л	Цена74,99 ₽	Cool Cola	0.2	0.0 г	0.0 г	0.0 г	Вода, краситель сахарный колер iv, регуляторы кислотности (ортофосфорная кислота, лимонная кислота), подсластители (цикламат натрия, ацесульфам калия, сукралоза, сахаринат натрия), натуральные ароматизаторы, кофеин (менее 150 мг/л), экстракт ванили. 	True	True	Fri Jul  5 22:38:23 2024
Напиток газированный Добрый Cola Ваниль, 1,5л	139,99 ₽/шт	1500 мл	https://www.perekrestok.ru/cat/209/p/napitok-gazirovannyj-dobryj-cola-vanil-1-5l-4283429	Wed Jul  3 15:03:36 2024	Напиток газированный Добрый Cola Ваниль, 1,5л	Цена124,99 ₽	Добрый	85.0	0.0 г	0.0 г	4.9 г	Очищенная вода, сахар, краситель сахарный колер iv, регулятор кислотности орто-фосфорная кислота, подсластители  (цикламат натрия, ацесульфам калия, аспартам),  ароматизаторы, кофеин (менее 150 мг/л).  содержит источник фенилаланина. 	True	True	Fri Jul  5 22:38:25 2024
Напиток газированный Evervess Кола, 1л	97,99 ₽/шт	1000 мл	https://www.perekrestok.ru/cat/209/p/napitok-gazirovannyj-evervess-kola-1l-4279557	Wed Jul  3 15:03:36 2024	Напиток газированный Evervess Кола, 1л	Цена97,99 ₽	Evervess	44.0	0.0 г	0.0 г	11.1 г	Вода, сахар, краситель e150d, регулятор кислотности ез38, ароматизаторы, кофеин (не более 150 мг(л)), стабилизатор е414. 	True	True	Fri Jul  5 22:38:26 2024
Напиток газированный Coca-Cola, 500мл	129,99 ₽/шт	500 мл	https://www.perekrestok.ru/cat/209/p/napitok-gazirovannyj-coca-cola-500ml-15117	Wed Jul  3 15:03:36 2024	Напиток газированный Coca-Cola, 500мл	Цена124,99 ₽	Coca-Cola	42.0	0.0 г	0.0 г	10.6 г	Очищенная вода, сахар, краситель сахарный колер iv, регулятор кислотности ортофосфорная кислота, натуральные ароматизаторы, кофеин ( менее 150 мг/k). 	True	True	Fri Jul  5 22:38:27 2024
Напиток сильногазированный Добрый Cola Ваниль, 250мл	54,99 ₽/шт	250 мл	https://www.perekrestok.ru/cat/209/p/napitok-silnogazirovannyj-dobryj-cola-vanil-250ml-4311537	Wed Jul  3 15:03:36 2024	Напиток сильногазированный Добрый Cola Ваниль, 250мл	Цена54,99 ₽	Добрый	20.0	0.0 г	0.0 г	4.9 г	Очищенная вода, сахар, краситель сахарный колер iv, регулятор кислотности орто-фосфорная кислота, подсластители  (цикламат натрия, ацесульфам калия, аспартам),  ароматизаторы, кофеин (менее 150 мг/л). содержит источник фенилаланина. 	True	True	Fri Jul  5 22:38:28 2024
Напиток газированный Добрый Кола ароматизированный безалкогольный, 250мл	71,99 ₽/шт	250 мл	https://www.perekrestok.ru/cat/209/p/napitok-gazirovannyj-dobryj-kola-aromatizirovannyj-bezalkogolnyj-250ml-4336084	Wed Jul  3 15:03:36 2024	Напиток газированный Добрый Кола ароматизированный безалкогольный, 250мл	Цена69,99 ₽	Добрый	42.0	0.0 г	0.0 г	10.6 г	Очищенная вода, сахар, краситель сахарный колер IV, регулятор кислотности орто-фосфорная кислота, натуральный ароматизатор, кофеин (менее 150 мг/л) 	True	True	Fri Jul  5 22:38:28 2024
Напиток газированный Evervess Кола, 500мл	77,99 ₽/шт	500 мл	https://www.perekrestok.ru/cat/209/p/napitok-gazirovannyj-evervess-kola-500ml-4279779	Wed Jul  3 15:03:36 2024	Напиток газированный Evervess Кола, 500мл	Цена81,99 ₽	Evervess	44.0	0.0 г	0.0 г	11.1 г	Вода, сахар, краситель e150d, регулятор кислотности ез38, ароматизаторы, кофеин (не более 150 мг(л)), стабилизатор е414. 	True	True	Fri Jul  5 22:38:29 2024
Напиток безалкогольный Fresh Bar Альфа кола газированный, 480мл	47,99 ₽/шт	480 мл	https://www.perekrestok.ru/cat/209/p/napitok-bezalkogolnyj-fresh-bar-alfa-kola-gazirovannyj-480ml-3648425	Wed Jul  3 15:03:36 2024	Напиток безалкогольный Fresh Bar Альфа кола газированный, 480мл	Цена49,99 ₽	Fresh Bar	42.0	0.0 г	0.0 г	10.5 г	Подготовленная вода, сахар, регуляторы кислотности кислота лимонная и цитрат натрия, концентрированный лимонный сок, краситель сахарный колер iv, ароматизаторы, кофеин. 	True	True	Fri Jul  5 22:38:30 2024
Напиток безалкогольный Черноголовка Кола газированный, 330мл	61,99 ₽/шт	330 мл	https://www.perekrestok.ru/cat/209/p/napitok-bezalkogolnyj-cernogolovka-kola-gazirovannyj-330ml-4256501	Wed Jul  3 15:03:36 2024	Напиток безалкогольный Черноголовка Кола газированный, 330мл	Цена61,99 ₽	Черноголовка	45.0	0.0 г	0.0 г	10.5 г	Вода, сахар (s) или сахар и сироп глюкозно-фруктозный (g), регулятор кислотности кислота орто-фосфорная, краситель сахарный колер iv, ароматизаторы, консервант бензоат натрия, кофеин (не более 150 мг/л). 	True	True	Fri Jul  5 22:38:31 2024
Напиток газированный Любимая Кола, 1л	114,99 ₽/шт	1000 мл	https://www.perekrestok.ru/cat/209/p/napitok-gazirovannyj-lubimaa-kola-1l-4279793	Wed Jul  3 15:03:36 2024	Напиток газированный Любимая Кола, 1л	Цена89,99 ₽	Любимая	44.0	0.0 г	0.0 г	11.0 г	Вода, сахар, краситель e150d, регулятор кислотности е338, ароматизаторы, кофеин (не более 150 мг/л), подсластители (е950, е951, е952, е954), стабилизатор е414. 	True	True	Fri Jul  5 22:38:31 2024
Напиток газированный Evervess Кола, 330мл	61,99 ₽/шт	330 мл	https://www.perekrestok.ru/cat/209/p/napitok-gazirovannyj-evervess-kola-330ml-4279583	Wed Jul  3 15:03:36 2024	Напиток газированный Evervess Кола, 330мл	Цена65,99 ₽	Evervess	44.0	0.0 г	0.0 г	11.1 г	Вода, сахар, краситель e150d, регулятор кислотности ез38, ароматизаторы, кофеин (не более 150 мг(л)), стабилизатор е414. 	True	True	Fri Jul  5 22:38:32 2024
Напиток Добрый кола со вкусом малины газированный ароматизированный безалкогольный, 500мл	81,99 ₽/шт	500 мл	https://www.perekrestok.ru/cat/209/p/napitok-dobryj-kola-so-vkusom-maliny-gazirovannyj-aromatizirovannyj-bezalkogolnyj-500ml-4344356	Wed Jul  3 15:03:36 2024	Напиток Добрый кола со вкусом малины газированный ароматизированный безалкогольный, 500мл	Цена81,99 ₽	Добрый	19.0	0.0 г	0.0 г	4.8 г	none	True	True	Fri Jul  5 22:38:33 2024
Напиток газированный Добрый Cola Ваниль, 500мл	95,99 ₽/шт	500 мл	https://www.perekrestok.ru/cat/209/p/napitok-gazirovannyj-dobryj-cola-vanil-500ml-4283427	Wed Jul  3 15:03:36 2024	Напиток газированный Добрый Cola Ваниль, 500мл	Цена95,99 ₽	Добрый	85.0	0.0 г	0.0 г	4.9 г	Очищенная вода, сахар, краситель сахарный колер iv, регулятор кислотности орто-фосфорная кислота, подсластители (цикламат натрия, ацесульфам калия, аспартам), ароматизаторы, кофеин (менее 150 мг/л). содержит источник фенилаланина. 	True	True	Fri Jul  5 22:38:34 2024
Напиток газированный Любимая Кола, 500мл	71,99 ₽/шт	500 мл	https://www.perekrestok.ru/cat/209/p/napitok-gazirovannyj-lubimaa-kola-500ml-4279789	Wed Jul  3 15:03:36 2024	Напиток газированный Любимая Кола, 500мл	Цена69,99 ₽	Любимая	44.0	0.0 г	0.0 г	11.1 г	Вода, сахар, краситель e150d, регулятор кислотности е338, ароматизаторы, кофеин (не более 150 мг/л), подсластители (е950, е951, е952, е954), стабилизатор е414. 	True	True	Fri Jul  5 22:38:35 2024
Напиток газированный Evervess Кола, 250мл	149,99 ₽/шт	250 мл	https://www.perekrestok.ru/cat/209/p/napitok-gazirovannyj-evervess-kola-250ml-4279797	Wed Jul  3 15:03:36 2024	Напиток газированный Evervess Кола, 250мл	Цена144,99 ₽	Evervess	44.0	0.0 г	0.0 г	11.1 г	Вода, сахар, краситель e150d, регулятор кислотности ез38, ароматизаторы, кофеин (не более 150 мг(л)), стабилизатор е414. 	True	True	Fri Jul  5 22:38:35 2024
Газированный напиток Пепсико Любимая Кола безалкогольный, 330мл	63,99 ₽/шт	330 мл	https://www.perekrestok.ru/cat/209/p/gazirovannyj-napitok-pepsiko-lubimaa-kola-bezalkogolnyj-330ml-4279817	Wed Jul  3 15:03:36 2024	Газированный напиток Пепсико Любимая Кола безалкогольный, 330мл	Цена63,99 ₽	PepsiCo	44.0	0.0 г	0.0 г	11.1 г	Вода, сахар, краситель е150d, регулятор кислотности e338, ароматизатор, кофеин, стабилизатор e414. 	True	True	Fri Jul  5 22:38:36 2024
Напиток Coca Cola Classic со вкусом колы безалкогольный газированный стеклянная бутылка, 330мл	159,99 ₽/шт	330 мл	https://www.perekrestok.ru/cat/209/p/napitok-coca-cola-classic-so-vkusom-koly-bezalkogolnyj-gazirovannyj-steklannaa-butylka-330ml-4309309	Wed Jul  3 15:03:36 2024	Напиток Coca Cola Classic со вкусом колы безалкогольный газированный стеклянная бутылка, 330мл	Цена154,99 ₽	Coca-Cola	41.1	0.0 г	0.0 г	10.6 г	Вода, сахар, регулятор кислотности диоксид углерода, краситель (карамельный колер е150d), регулятор кислотности (ортофосфорная кислота), натуральные ароматизаторы, кофеин. 	True	True	Fri Jul  5 22:38:37 2024
Напиток газированный Добрый Лимон-Лайм безалкогольный ароматизированный, 250мл	54,99 ₽/шт	250 мл	https://www.perekrestok.ru/cat/209/p/napitok-gazirovannyj-dobryj-limon-lajm-bezalkogolnyj-aromatizirovannyj-250ml-4311533	Wed Jul  3 15:03:36 2024	Напиток газированный Добрый Лимон-Лайм безалкогольный ароматизированный, 250мл	Цена54,99 ₽	Добрый	18.0	0.0 г	0.0 г	4.6 г	Очищенная вода, сахар, регуляторы кислотности (лимонная кислота, цитрат натрия 3-замещенный), натуральные ароматизаторы, подсластители (ацесульфам калия, аспартам), консервант сорбат калия. содержит источник фенилаланина. 	True	True	Fri Jul  5 22:38:38 2024
Напиток газированный Добрый Кола безалкогольный ароматизированный, 250мл	54,99 ₽/шт	250 мл	https://www.perekrestok.ru/cat/209/p/napitok-gazirovannyj-dobryj-kola-bezalkogolnyj-aromatizirovannyj-250ml-4311536	Wed Jul  3 15:03:36 2024	Напиток газированный Добрый Кола безалкогольный ароматизированный, 250мл	Цена54,99 ₽	Добрый	42.0	0.0 г	0.0 г	10.6 г	Очищенная вода, сахар, краситель сахарный колер iv, регулятор кислотности орто-фосфорная кислота, натуральный ароматизатор, кофеин (менее 150 мг/л). 	True	True	Fri Jul  5 22:38:39 2024
Напиток газированный Добрый Кола без сахара безалкогольный ароматизированный, 250мл	54,99 ₽/шт	250 мл	https://www.perekrestok.ru/cat/209/p/napitok-gazirovannyj-dobryj-kola-bez-sahara-bezalkogolnyj-aromatizirovannyj-250ml-4311540	Wed Jul  3 15:03:36 2024	Напиток газированный Добрый Кола без сахара безалкогольный ароматизированный, 250мл	Цена54,99 ₽	Добрый	0.3	0.0 г	0.0 г	0.0 г	"Очищенная вода, краситель сахарный колер iv, регуляторы кислотности (орто-фосфорная кислота ,цитрат натрия 3-замещенный), подсластители (натриевая соль цикламовой кислоты, ацесульфам калия, аспартам), натуральный ароматизатор, кофеин (менее 150 мг/л).
содержит источник фенилаланина. "	True	True	Fri Jul  5 22:38:40 2024
