name	price	size	url	time	name_	price_	brand	calories	proteins	fats	carbos	composition	get_ok	parse_ok	time_
Бриошь Смак Французские улочки молочная, 120г	69,99 ₽/шт	120 гр	https://www.perekrestok.ru/cat/246/p/brios-smak-francuzskie-ulocki-molocnaa-120g-4078291	Sun Jul  7 17:14:17 2024	Бриошь Смак Французские улочки молочная, 120г	Цена65,99 ₽	Smak	390.0	9.0 г	14.0 г	57.0 г	Мука пшеничная хлебопекарная высшего сорта, вода питьевая, сахар, масла растительные (подсолнечное, рапсовое), яйца куриные пищевые, дрожжи хлебопекарные прессованные, молоко цельное сухое, агент влагоудерживающий – глицерин, соль, эмульгатор – эфиры глицерина и диацетилвинной и жирных кислот, консерванты – диацетат натрия, сорбиновая кислота, пропионат кальция, крахмал пшеничный, антиокислитель – аскорбиновая кислота, ароматизатор – «Ванильно-сливочный». Может содержать следы сои. Не содержит ГМО. 	True	True	Sun Jul  7 18:32:33 2024
Булочка Смак Изюмка, 40г	63,99 ₽/шт	40 гр	https://www.perekrestok.ru/cat/246/p/bulocka-smak-izumka-40g-3337388	Sun Jul  7 17:14:17 2024	Булочка Смак Изюмка, 40г	Цена63,99 ₽	Smak	145.2	3.2 г	3.5 г	25.4 г	Мука пшеничная хлебопекарная высшего сорта, изюм, вода питьевая, сахар, маргарин (масла растительные рафинированные дезодорированные, эмульгаторы - моно- и диглицериды жирных кислот, лецитины, антиокислитель - лимонная кислота, красители -аннато, куркумин), яйца куриные пищевые, молоко цельное сухое, дрожжи хлебопекарные сухие, соль, эмульгаторы E481, E472e, ароматизатор Ванильно-сливочный, антиокислитель аскорбиновая кислота. 	True	True	Sun Jul  7 18:32:33 2024
Бриошь Смак Французские улочки с кусочками шоколада, 240г	119,99 ₽/шт	240 гр	https://www.perekrestok.ru/cat/246/p/brios-smak-francuzskie-ulocki-s-kusockami-sokolada-240g-4060582	Sun Jul  7 17:14:17 2024	Бриошь Смак Французские улочки с кусочками шоколада, 240г	Цена119,99 ₽	Smak	390.0	8.5 г	16.0 г	54.0 г	Мука пшеничная хлебопекарная высшего сорта, вода питьевая, сахар, масло растительное(подсолнечное, рапсовое), какао-масса, какао-масло, дрожжи хлебопекарные прессованные, яйца куриные пищевые, молоко цельное сухое, агент влагоудерживающий-глицерин, соль, эмульгаторы-эфиры глицерина и диацетилвинной и жирных кислот, подсолнечный лецитин, консерванты – диацетат натрия, сорбиновая кислота, пропионат кальция, крахмал пшеничный, антиокислитель – аскорбиновая кислота, ароматизатор – «Ванильно-сливочный», ваниль. Может содержать следы сои. Не содержит ГМО. 	True	True	Sun Jul  7 18:32:34 2024
Сдоба Smak Волшебство, 100г	43,99 ₽/шт	100 гр	https://www.perekrestok.ru/cat/246/p/sdoba-smak-volsebstvo-100g-3169530	Sun Jul  7 17:14:17 2024	Сдоба Smak Волшебство, 100г	Цена43,99 ₽	Smak	400.0	6.0 г	11.0 г	71.0 г	Мука пшеничная хлебопекарная высшего сорта, начинка (сахар, патока, масла растительные, сыворотка молочная сухая, эмульгатор – лецитин; загустители – каррагинан, пектин, гуаровая камедь, ксантановая камедь; консервант – сорбиновая кислота; соль, ароматизатор – «Сливочная ваниль», экстракт ванили; краситель – каротины), вода питьевая, стружка кокосовая, яйца куриные пищевые, сахар, маргарин (масло модифицированное подсолнечное, масло подсолнечное, эмульгаторы – моно- и диглицериды жирных кислот, эфиры полиглицерина и жирных кислот, соевый лецитин; ароматизатор, краситель – каротины, регулятор кислотности – лимонная кислота), дрожжи хлебопекарные сухие, соль, эмульгаторы – эфиры глицерина и диацетилвинной и жирных кислот, Е481; антислеживающий агент – карбонат кальция; антиокислитель – аскорбиновая кислота, краситель - каротины. 	True	True	Sun Jul  7 18:32:35 2024
Булочки Смак Минутка ЗОЖ со льном, 80г	33,99 ₽/шт	80 гр	https://www.perekrestok.ru/cat/246/p/bulocki-smak-minutka-zoz-so-lnom-80g-4190624	Sun Jul  7 17:14:17 2024	Булочки Смак Минутка ЗОЖ со льном, 80г	Цена33,99 ₽	Smak	370.0	10.0 г	12.0 г	55.0 г	Мука пшеничная хлебопекарная высшего сорта, вода питьевая, семена кунжута, цельные семена льна темного, цельные семена льна белого, семена подсолнечника, масло подсолнечное, отруби пшеничные, сахар, дрожжи хлебопекарные прессованные, экстракт солодовый (ячмень), соль, эмульгаторы – моно- и диглицериды жирных кислот, Е481, эфиры глицерина и диацетилвинной и жирных кислот, антиокислитель – аскорбиновая кислота. Может содержать следы молока, яиц, сои, кунжута. 	True	True	Sun Jul  7 18:32:36 2024
Бриошь Смак Французские улочки с шоколадной начинкой, 160г	71,99 ₽/шт	160 гр	https://www.perekrestok.ru/cat/246/p/brios-smak-francuzskie-ulocki-s-sokoladnoj-nacinkoj-160g-4079428	Sun Jul  7 17:14:17 2024	Бриошь Смак Французские улочки с шоколадной начинкой, 160г	Цена71,99 ₽	Smak	360.0	6.5 г	12.0 г	56.0 г	Мука пшеничная хлебопекарная высшего сорта, сахар, вода питьевая, сироп глюкозно-фруктозный, масла растительные (подсолнечное, рапсовое), молоко восстановленное, какао-порошок, какао-масло, яйца куриные пищевые, дрожжи хлебопекарные прессованные, молоко цельное сухое, агент влагоудерживающий – глицерин, соль, масла растительные рафинированные дезодорированные, эмульгаторы – эфиры глицерина и диацетилвинной и жирных кислот, лецитины, крахмал кукурузный, загуститель – альгинат натрия, консерванты – диацетат натрия, сорбиновая кислота, пропионат кальция, крахмал пшеничный, антиокислитель – аскорбиновая кислота, ароматизаторы – «Шоколад», «Ванильно-сливочный», красители – сахарный колер III, диоксид титана. 	True	True	Sun Jul  7 18:32:37 2024
Бриошь Смак Французские улочки с изюмом, 30г	21,99 ₽/шт	30 гр	https://www.perekrestok.ru/cat/246/p/brios-smak-francuzskie-ulocki-s-izumom-30g-4065994	Sun Jul  7 17:14:17 2024	Бриошь Смак Французские улочки с изюмом, 30г	Цена21,99 ₽	Smak	110.0	2.0 г	3.0 г	17.0 г	Мука пшеничная хлебопекарная высшего сорта, виноград сушеный, вода питьевая, масла растительные (подсолнечное, рапсовое), сахар, дрожжи хлебопекарные прессованные, яйца куриные пищевые, молоко цельное сухое, агент влагоудерживающий – глицерин, соль, эмульгатор – эфиры глицерина и диацетилвинной и жирных кислот, консерванты – диацетат натрия, сорбиновая кислота, пропионат кальция, крахмал пшеничный, антиокислитель – аскорбиновая кислота, ароматизатор – «Ванильно-сливочный». Может содержать следы сои. Не содержит ГМО. 	True	True	Sun Jul  7 18:32:38 2024
Булочка Смак Смаковичка с глазурью, 50г	29,99 ₽/шт	50 гр	https://www.perekrestok.ru/cat/246/p/bulocka-smak-smakovicka-s-glazuru-50g-3337385	Sun Jul  7 17:14:17 2024	Булочка Смак Смаковичка с глазурью, 50г	Цена29,99 ₽	Smak	400.0	7.0 г	12.0 г	69.0 г	Мука пшеничная хлебопекарная высшего сорта, вода питьевая, сахар-песок, помадка сухая (глюкозный сироп), глазурь кондитерская (масло растительное, какао-порошок обезжиренный, эмульгатор - соевый лецитин), маргарин, посыпка, сахарная декоративная (заменитель какао-масла, какао-порошок, ароматизатор идентичный натуральному ванилин), яйцо куриные пищевые, дрожжи хлебопекарные сухие, хлопья картофельные, молоко цельное сухое, клейковина пшеничная, сыворотка молочная сухая, соль поваренная пищевая, фруктовый порошок, перец красный молотый, куркума, эмульгатор Е471, энзимы, регулятор кислотности Е341, консервант Е281, ароматизатор натуральный лимон. 	True	True	Sun Jul  7 18:32:39 2024
Мини-бублик Далматово молочный, 350г	91,99 ₽/шт	350 гр	https://www.perekrestok.ru/cat/246/p/mini-bublik-dalmatovo-molocnyj-350g-4211072	Sun Jul  7 17:14:17 2024	Мини-бублик Далматово молочный, 350г	Цена99,99 ₽	Далматово	300.0	7.0 г	5.0 г	57.0 г	Мука пшеничная хлебопекарная, вода, сахар, маргарин (масла растительные, эмульгаторы (моно- и диглицериды жирных кислот, эфиры полиглицерина и жирных кислот), антиокислители (аскорбилпальмитат, концентрат смеси токоферолов), регулятор кислотности лимонная кислота, ароматизатор, краситель куркумин), продукты яичные, дрожжи хлебопекарные, соль, стабилизаторы (карбонат кальция, гуммиарабик), фермент альфа-амилаза, консерванты (сорбиновая кислота, пропионат кальция), ароматизатор, молоко сухое цельное. 	True	True	Sun Jul  7 18:32:39 2024
Бриошь Смак Французские улочки с кусочками шоколада, 30г	25,99 ₽/шт	30 гр	https://www.perekrestok.ru/cat/246/p/brios-smak-francuzskie-ulocki-s-kusockami-sokolada-30g-4065993	Sun Jul  7 17:14:17 2024	Бриошь Смак Французские улочки с кусочками шоколада, 30г	Цена23,99 ₽	Smak	120.0	2.5 г	5.0 г	16.0 г	Мука пшеничная хлебопекарная высшего сорта, вода питьевая, сахар, масла растительные (подсолнечное, рапсовое), какао-масса, какао-масло, дрожжи хлебопекарные прессованные, яйца куриные пищевые, молоко цельное сухое, агент влагоудерживающий – глицерин, соль, эмульгаторы – эфиры глицерина и диацетилвинной и жирных кислот, подсолнечный лецитин, консерванты – диацетат натрия, сорбиновая кислота, пропионат кальция, крахмал пшеничный, антиокислитель – аскорбиновая кислота, ароматизатор – «Ванильно-сливочный», ваниль. Может содержать следы сои. Не содержит ГМО. 	True	True	Sun Jul  7 18:32:40 2024
Слойка Смак с вишней, 90г	41,99 ₽/шт	90 гр	https://www.perekrestok.ru/cat/246/p/slojka-smak-s-visnej-90g-3674480	Sun Jul  7 17:14:17 2024	Слойка Смак с вишней, 90г	Цена41,99 ₽	Smak	365.0	5.0 г	13.0 г	60.0 г	Наполнитель «Вишня» (сахар, яблочное пюре, вода питьевая, ягоды вишни, стабилизаторы – пектин, цитрат кальция, полифосфат натрия; эмульгатор – эфиры полиглицерина и жирных кислот; регуляторы кислотности – лимонная кислота, цитрат натрия; краситель – антоциан; ароматизатор, консервант – сорбат калия), мука пшеничная хлебопекарная высшего сорта, вода питьевая, маргарин (масла растительные, эмульгаторы – эфиры глицерина и лимонной и жирных кислот, моно- и диглицериды жирных кислот, эфиры полиглицерина и жирных кислот, соевый лецитин; консервант – сорбиновая кислота, ароматизатор, краситель – каротины, регулятор кислотности – лимонная кислота), сахар, молоко цельное сухое, дрожжи хлебопекарные прессованные, соль, эмульгатор – эфиры глицерина и диацетилвинной и жирных кислот, антиокислитель – аскорбиновая кислота. 	True	True	Sun Jul  7 18:32:41 2024
Слойка Смак Забава с корицей, 100г	39,99 ₽/шт	100 гр	https://www.perekrestok.ru/cat/246/p/slojka-smak-zabava-s-koricej-100g-3691447	Sun Jul  7 17:14:17 2024	Слойка Смак Забава с корицей, 100г	Цена39,99 ₽	Smak	440.0	6.0 г	20.0 г	60.0 г	Мука пшеничная хлебопекарная высшего сорта, вода питьевая, сахар, маргарин (масла растительные, эмульгаторы – эфиры глицерина и лимонной и жирных кислот, моно- и диглицериды жирных кислот, эфиры полиглицерина и жирных кислот, соевый лецитин; консервант – сорбиновая кислота, ароматизатор, краситель – каротины, регулятор кислотности – лимонная кислота), помадка сухая (глюкозный сироп), яйца куриные пищевые, масло растительное, молоко цельное сухое, корица молотая, дрожжи хлебопекарные прессованные, соль, эмульгатор – эфиры глицерина и диацетилвинной и жирных кислот; стабилизатор – модифицированный крахмал, антиокислитель – аскорбиновая кислота. 	True	True	Sun Jul  7 18:32:42 2024
Слойка Smak с творогом, 100г	49,99 ₽/шт	100 гр	https://www.perekrestok.ru/cat/246/p/slojka-smak-s-tvorogom-100g-3224649	Sun Jul  7 17:14:17 2024	Слойка Smak с творогом, 100г	Цена47,99 ₽	Smak	390.0	15.0 г	17.0 г	44.0 г	Мука пшеничная высшего сорта, творог полужирный, вода, сахар, маргарин, яйцо куриное, дрожжи хлебопекарные прессованные, крахмал картофельный, молоко цельное сухое, соль поваренная пищевая, комплексный хлебопекарный улучшитель, кислота сорбиновая, ванилин. 	True	True	Sun Jul  7 18:32:43 2024
Слойка Смак Лимонная, 70г	35,99 ₽/шт	70 гр	https://www.perekrestok.ru/cat/246/p/slojka-smak-limonnaa-70g-4195592	Sun Jul  7 17:14:17 2024	Слойка Смак Лимонная, 70г	Цена35,99 ₽	Smak	410.0	6.5 г	13.0 г	68.0 г	Мука пшеничная хлебопекарная высшего сорта, вода питьевая, сахар, начинка плодово-ягодная (пюре лимона, пюре яблока, загуститель - пектины, регуляторы кислотности - лимонная кислота, цитрат натрия 1-замещенный, краситель куркумин, ароматизатор, стабилизатор – цитрат кальция, консервант - сорбат калия), маргарин (масла растительные, эмульгаторы – эфиры глицерина и лимонной и жирных кислот, эфиры полиглицерина и жирных кислот, соевый лецитин, консервант – сорбиновая кислота, ароматизатор, краситель – каротины, регулятор кислотности – лимонная кислота), яйца куриные пищевые, дрожжи хлебопекарные прессованные, молоко цельное сухое, соль, эмульгатор – эфиры глицерина и диацетилвинной и жирных кислот, ароматизатор «Ванилин», антиокислитель - аскорбиновая кислота. Может содержать следы кунжута. 	True	True	Sun Jul  7 18:32:44 2024
Слойка Смак Нежная с трюфельной начинкой, 100г	49,99 ₽/шт	100 гр	https://www.perekrestok.ru/cat/246/p/slojka-smak-neznaa-s-trufelnoj-nacinkoj-100g-3337392	Sun Jul  7 17:14:17 2024	Слойка Смак Нежная с трюфельной начинкой, 100г	Цена49,99 ₽	Smak	420.0	7.0 г	18.0 г	58.0 г	Мука хлебопекарная пшеничная высшего сорта, начинка (сахар, сыворотка молочная сухая, молоко сухое обезжиренное, сливки, масла растительные, какао-порошок, загуститель – Е1442, ароматизаторы – «Ванильно-сливочный», «Трюфель»; консервант – сорбат калия, красящий ингредиент – экстракт сафлора), вода питьевая, маргарин (масла растительные, эмульгаторы – эфиры глицерина, лимонной и жирных кислот, моно- и диглицериды жирных кислот, эфиры полиглицерина и жирных кислот, соевый лецитин; консервант – сорбиновая кислота, краситель – каротины, ароматизатор, регулятор кислотности – лимонная кислота), сахар, молоко цельное сухое, дрожжи хлебопекарные прессованные, соль, эмульгаторы – эфиры глицерина и диацетилвинной и жирных кислот, антиокислитель – аскорбиновая кислота. 	True	True	Sun Jul  7 18:32:45 2024
Слойка Реж-Хлеб с абрикосом, 80г	35,99 ₽/шт	80 гр	https://www.perekrestok.ru/cat/246/p/slojka-rez-hleb-s-abrikosom-80g-4316098	Sun Jul  7 17:14:17 2024	Слойка Реж-Хлеб с абрикосом, 80г	Цена35,99 ₽	Реж-Хлеб	330.0	6.0 г	14.0 г	48.0 г	Мука пшеничная хлебопекарная высшего сорта, начинка «Абрикос» (сахар, абрикос, вода питьевая, загуститель: крахмал кукурузный (Е1442), стабилизатор (Е460), (Е415), регулятор кислотности: кислота лиманная (Е330), ароматизатор «Абрикос», консервант: сорбат калия (Е202), краситель бета – каротин (Е160)), маргарин (рафинированные дезодорированные растительные масла, вода, эмульгаторы (моно – и диглицериды жирных кислот, эфиры полиглицерина и жирных кислот), соль, консерванты(сорбиновая кислота, бензоат натрия), краситель бета – каротин, ароматизатор масла, регулятор кислотности: лимонная кислота), вода питьевая, сахар белый, дрожжи хлебопекарные прессованные, молоко сухое обезжиренное, соль пищевая, клейковина пшеничная сухая, эмульгатор (Е472е), антиокислитель аскорбиновая кислота, ферменты (альфа – амилаза и гемицеллюлаза). 	True	True	Sun Jul  7 18:32:46 2024
