name	price	size	url	time	name_	price_	brand	calories	proteins	fats	carbos	composition	get_ok	parse_ok	time_
Конвертик Мастер Пироговъ с вишнёвой начинкой, 70г	59,99 ₽/шт	70 гр	https://www.perekrestok.ru/cat/246/p/konvertik-master-pirogov-s-visnevoj-nacinkoj-70g-3640932	Thu Jul  4 08:48:29 2024	Конвертик Мастер Пироговъ с вишнёвой начинкой, 70г	Цена59,99 ₽	Мастер Пироговъ	390.0	5.0 г	16.0 г	57.0 г	Фруктовая начинка Вишня (вишня, сахар, вода, загустители: кукурузный крахмал, геллановая камедь, пищевые волокна, натуральный ароматизатор «Вишня»), мука пшеничная хлебопекарная высшего сорта, маргарин (масла растительные рафинированные дезодорированные, вода, ароматизатор натуральный), вода, сахар белый, дрожжи хлебопекарные прессованные, меланж, соль. 	True	True	Fri Jul  5 22:53:45 2024
Ромовая баба Аладушкин в ассортименте, 160г	87,99 ₽/шт	160 гр	https://www.perekrestok.ru/cat/246/p/romovaa-baba-aladuskin-v-assortimente-160g-2146052	Sat Jul  6 19:15:12 2024	Ромовая баба Аладушкин в ассортименте, 160г	Цена85,99 ₽	Аладушкин	320.0	4.5 г	10.0 г	53.0 г	"Ромовая-баба с темной глазурью: Выпеченный полуфабрикат (мука пшеничная хлебопекарная высшего сорта, вода, сахар, маргарин (масла растительные, вода, эмульгаторы: моно - и диглицериды жирных кислот, твин 80, соевый лецитин, соль, консерванты: сорбиновая кислота, бензоат натрия, ароматизатор масла, краситель: β-каротин, регулятор кислотности - кислота лимонная), продукты яичные, виноград сушеный, дрожжи хлебопекарные прессованные, ароматизатор «Ром», соль), сироп для промочки (сахар, вода, коньяк, консервант – сорбат калия, ароматизаторы: «Коньячный», «Ром»), глазурь (сахар, заменитель масла какао, молоко сухое цельное, сыворотка молочная сухая, эмульгаторы: лецитин соевый, Е476, ароматизатор). Продукт содержит натуральный белок пшеничной муки глютен. Может содержать следы горчичного масла, кунжута.
Ромовая-баба с белой глазурью: Выпеченный полуфабрикат (мука пшеничная хлебопекарная высшего сорта, вода, сахар, маргарин (масла растительные, вода, эмульгаторы: моно - и диглицериды жирных кислот, твин 80, соевый лецитин, соль, консерванты: сорбиновая кислота, бензоат натрия, ароматизатор масла, краситель: β-каротин, регулятор кислотности - кислота лимонная), продукты яичные, виноград сушеный, дрожжи хлебопекарные прессованные, ароматизатор «Ром», соль), сироп для промочки (сахар, вода, коньяк, консервант – сорбат калия, ароматизаторы: «Коньячный», «Ром»), глазурь (сахар, заменитель масла какао, какао-порошок, эмульгатор – лецитин соевый, ароматизатор). Продукт содержит натуральный белок пшеничной муки глютен. Может содержать следы молочных продуктов, горчичного масла, кунжута. "	True	True	Sat Jul  6 19:15:13 2024
Плюшка Аладушкин Новомосковская, 200г	53,99 ₽/шт	200 гр	https://www.perekrestok.ru/cat/246/p/pluska-aladuskin-novomoskovskaa-200g-3443090	Sun Jul  7 13:46:00 2024	Плюшка Аладушкин Новомосковская, 200г	Цена55,99 ₽	Аладушкин	335.0	7.0 г	8.0 г	56.0 г	Мука пшеничная хлебопекарная высшего сорта, вода, сахар-песок, масло подсолнечное, маргарин (масла растительные, вода, эмульгаторы: моно - и диглицериды жирных кислот, твин 80, лецитин соевый; соль, ароматизатор, краситель пищевой-бета-каротин, регулятор кислотности – кислота лимонная), продукты яичные, улучшители хлебопекарные (эмульгаторы: моно- и диглицериды жирных кислот, эфиры глицерина и диацетилвинной и жирных кислот; стабилизатор – карбонат кальция, антиокислитель - кислота аскорбиновая, мука пшеничная, ферменты –амилазы, гемицеллюлозы), дрожжи хлебопекарные прессованные, соль, молоко сухое обезжиренное. 	True	True	Sun Jul  7 18:32:06 2024
Штрудель 7 Days с яблоком и корицей, 80г	71,99 ₽/шт	80 гр	https://www.perekrestok.ru/cat/246/p/strudel-7-days-s-ablokom-i-koricej-80g-4030309	Sun Jul  7 13:46:00 2024	Штрудель 7 Days с яблоком и корицей, 80г	Цена79,99 ₽	7 Days	408.0	6.0 г	20.0 г	50.0 г	Мука пшеничная хлебопекарная высшего сорта 38%, маргарин [масло растительное (пальмовое масло), вода, соль, эмульгатор (моно- и диглицериды жирных кислот), регулятор кислотности (лимонная кислота), консервант (сорбат калия)], вода, масло растительное (пальмовое масло), сахар, яичный желток пастеризованный, ржаная мука 1.7%, ячменная мука 1.7%, глюкозно-фруктозный сироп (фруктоза, декстроза, мальтоза), дрожжи прессованные хлебопекарные, стабилизатор (моно- и диглицериды жирных кислот), соль, овсяная мука 0.4%, ароматизатор, консервант (пропионат кальция). Начинка «яблоко и корица» 28%: глюкозно-фруктозный сироп (фруктоза, декстроза, мальтоза), яблоки нарезанные 40%, сахар, вода, желирующий агент (пектин), регуляторы кислотности (лимонная кислота, цитраты кальция), ароматизатор, корица 0.5%, консервант (сорбат калия). 	True	True	Sun Jul  7 18:32:07 2024
Плюшка Московская сахарная Маркет Перекрёсток, 100г	39,99 ₽/шт	100 гр	https://www.perekrestok.ru/cat/246/p/pluska-moskovskaa-saharnaa-market-perekrestok-100g-3974717	Sun Jul  7 17:00:11 2024	Плюшка Московская сахарная Маркет Перекрёсток, 100г	Цена39,99 ₽	Маркет	340.0	7.5 г	9.0 г	56.0 г	Мука пшеничная хлебопекарная высшего сорта, вода питьевая, сахар, маргарин (рафинированные дезодорированные масла в натуральном и модифицированном виде (пальмовое масло и его фракции, подсолнечное масло), вода питьевая, эмульгаторы: е471, е475, соль, ароматизатор, краситель каротины, регулятор кислотности лимонная кислота), продукты яичные, дрожжи хлебопекарные прессованные, молоко сухое цельное, масло подсолнечное рафинированное дезодорированное, соль (содержит агент антислеживающий е536), улучшитель хлебопекарный (эмульгаторы: е471, е481, мука пшеничная, глютен пшеничный, антиокислитель аскорбиновая кислота), ванилин. 	True	True	Sun Jul  7 18:32:08 2024
Слойка Свердловка Маркет Перекрёсток, 80г	39,99 ₽/шт	80 гр	https://www.perekrestok.ru/cat/246/p/slojka-sverdlovka-market-perekrestok-80g-3974718	Sun Jul  7 17:00:11 2024	Слойка Свердловка Маркет Перекрёсток, 80г	Цена39,99 ₽	Маркет	350.0	7.5 г	13.0 г	51.0 г	Мука пшеничная хлебопекарная высшего сорта, вода питьевая, сахар, маргарин (рафинированные дезодорированные масла (пальмовое, модифицированное пальмовое), вода питьевая, эмульгаторы: е472с, е475, соль, консервант сорбиновая кислота, регулятор кислотности лимонная кислота), продукты яичные, дрожжи хлебопекарные прессованные, молоко сухое цельное, комплексная пищевая добавка: улучшитель хлебопекарный (пшеничная клейковина, эмульгатор е472е, антиокислитель аскорбиновая кислота), соль (содержит агент антислеживающий е536), маргарин (рафинированные дезодорированные масла в натуральном и модифицированном виде (пальмовое масло и его фракции, подсолнечное масло), вода питьевая, эмульгаторы: е471, е475, соль, ароматизатор, краситель каротины, регулятор кислотности лимонная кислота), ванилин. 	True	True	Sun Jul  7 18:32:10 2024
Булочка с изюмом Маркет Перекрёсток, 80г	37,99 ₽/шт	80 гр	https://www.perekrestok.ru/cat/246/p/bulocka-s-izumom-market-perekrestok-80g-3974715	Sun Jul  7 17:00:11 2024	Булочка с изюмом Маркет Перекрёсток, 80г	Цена37,99 ₽	Маркет	370.0	7.5 г	10.0 г	64.0 г	Мука пшеничная хлебопекарная высшего сорта, вода питьевая, виноград сушеный, сахар, продукты яичные, маргарин (рафинированные дезодорированные масла в натуральном и модифицированном виде (пальмовое масло и его фракции, подсолнечное масло), вода питьевая, эмульгаторы: е471, е475, соль, ароматизатор, краситель каротины, регулятор кислотности лимонная кислота), дрожжи хлебопекарные прессованные, молоко сухое цельное, соль (содержит агент антислеживающий е536), ядра арахиса жареные дробленые, ванилин. 	True	True	Sun Jul  7 18:32:11 2024
Булочки Коломенское с кардамоном, 200г	64,99 ₽/шт	200 гр	https://www.perekrestok.ru/cat/246/p/bulocki-kolomenskoe-s-kardamonom-200g-3682240	Sun Jul  7 17:00:11 2024	Булочки Коломенское с кардамоном, 200г	Цена64,99 ₽	Коломенское	370.0	9.0 г	7.0 г	65.0 г	Мука пшеничная хлебопекарная высшего сорта, вода, сахар белый, масло сливочное (пастеризованные сливки), меланж, дрожжи хлебопекарные прессованные, яичный порошок, молоко сухое обезжиренное, соль, кардамон. 	True	True	Sun Jul  7 18:32:12 2024
Коржик Хлебное Местечко молочный, 100г	45,99 ₽/шт	100 гр	https://www.perekrestok.ru/cat/246/p/korzik-hlebnoe-mestecko-molocnyj-100g-3504623	Sun Jul  7 17:00:11 2024	Коржик Хлебное Местечко молочный, 100г	Цена45,99 ₽	Хлебное местечко	380.0	6.5 г	14.0 г	57.0 г	Мука пшеничная хлебопекарная в/с, сахар белый, маргарин (рафинированные и дезодорированные масла в натуральном и модифицированном виде, вода, эмульгаторы (Е471, Е475, Е322), меланж яичный, сметанный продукт (восстановленное молоко, сливочное масло, заменитель молочного жира (растительные масла, эмульгатор Е471, краситель бета каротин), молоко сухое цельное, разрыхлители: карбонат аммония, сода пищевая. 	True	True	Sun Jul  7 18:32:13 2024
Бриошь Щелковохлеб Парижская в упаковке, 80г	37,99 ₽/шт	80 гр	https://www.perekrestok.ru/cat/246/p/brios-selkovohleb-parizskaa-v-upakovke-80g-4124048	Sun Jul  7 17:00:11 2024	Бриошь Щелковохлеб Парижская в упаковке, 80г	Цена37,99 ₽	Щелковохлеб	236.0	5.0 г	4.2 г	46.6 г	Мука пшеничная хлебопекарная высшего сорта, вода питьевая, сухая смесь молокосодержащая «Кремиголд» (пудра сахарная, молоко сухое цельное, загустители: дикрахмалфосфат ацетилированный и альгинат натрия, сыворотка сухая молочная, стабилизаторы: фосфаты натрия и пирофосфаты, декстроза, консервант – сорбат калия, краситель – бета-каротин синтетический, уплотнитель – сульфаты кальция, ароматизатор), яйца куриные, инвертный сироп, сахар, маргарин (рафинированное дезодорированное растительное масло (подсолнечное) в натуральном и отвержденном виде, вода, эмульгаторы: моно- и диглицериды жирных кислот, полиглицерина и жирных кислот эфиры, антиокислители: бутилгидроксианизол, бутилгидрокситолуол, пропилгаллат, лимонная кислота, ароматизатор, регулятор кислотности - лимонная кислота, пищевой краситель натуральный - аннато экстракты), дрожжи хлебопекарные, смесь сухая «Изи Бриош» (мука пшеничная, соль поваренная, эмульгаторы: моно- и диглицериды жирных кислот и лактилаты натрия, ароматизатор, краситель – рибофлавин, ферменты, вещество для обработки муки – L-цистеин), молоко сухое цельное. Возможно наличие следов кунжута. 	True	True	Sun Jul  7 18:32:14 2024
Булочки Коломенский для хот-дога, 180г	44,99 ₽/шт	180 гр	https://www.perekrestok.ru/cat/246/p/bulocki-kolomenskij-dla-hot-doga-180g-4296435	Sun Jul  7 17:00:11 2024	Булочки Коломенский для хот-дога, 180г	Цена44,99 ₽	Коломенский	300.0	8.5 г	5.0 г	55.0 г	Мука пшеничная хлебопекарная высшего сорта, вода, сахар белый, маргарин (масла растительные рафинированные дезодорированные, вода питьевая, ароматизатор натуральный), дрожжи хлебопекарные прессованные, молоко сухое цельное, сироп глюкозный, соль, глютен пшеничный, пищевые волокна из отрубей.Продукт может содержать следы яичных продуктов, арахиса, горчицы. 	True	True	Sun Jul  7 18:32:15 2024
Булочки Русский Бисквит, 350г	139,99 ₽/шт	350 гр	https://www.perekrestok.ru/cat/246/p/bulocki-russkij-biskvit-350g-4095457	Sun Jul  7 17:00:11 2024	Булочки Русский Бисквит, 350г	Цена139,99 ₽	Русский Бисквит	1380.0	7.0 г	11.0 г	50.0 г	Мука пшеничная хлебопекарная высшего сорта, начинка кондитерская с шоколадным вкусом (сахар, вода, масло растительное, сыворотка молочная сухая деминерализованная, какао-порошок, молоко сухое обезжиренное, комплексная пищевая добавка (загустители: Е407, пектины), соль, консервант сорбиновая кислота, регуляторы кислотности: цитрат натрия 3-замещенный, орто-Фосфат кальция 3-замещенный, ароматизатор шоколадный), вода, масло растительное, сахар, продукты яичные, молоко сухое обезжиренное, сироп глюкозно-фруктозный, улучшитель хлебопекарный (эмульгаторы (моно- и диглицериды жирных кислот, Е481), антиокислитель аскорбиновая кислота), дрожжи хлебопекарные (эмульгатор сорбитан моностеарат, антиокислитель аскорбиновая кислота), клейковина пшеничная, соль, консервант пропионат кальция, ароматизатор, краситель бета-каротин. Продукт может содержать следы клюквы, изюма, кусочков шоколада. 	True	True	Sun Jul  7 18:32:16 2024
Булочки Русский Бисквит молочные с начинкой из варёной сгущенки, 350г	139,99 ₽/шт	350 гр	https://www.perekrestok.ru/cat/246/p/bulocki-russkij-biskvit-molocnye-s-nacinkoj-iz-varenoj-sgusenki-350g-4095458	Sun Jul  7 17:00:11 2024	Булочки Русский Бисквит молочные с начинкой из варёной сгущенки, 350г	Цена139,99 ₽	Русский Бисквит	1380.0	6.5 г	11.0 г	51.0 г	Мука пшеничная хлебопекарная высшего сорта, начинка кондитерская «Варёная сгущёнка» (сахар, вода, масло растительное, мальтодекстрин, крахмал кукурузный, мука пшеничная высшего сорта, молоко сухое обезжиренное, комплексная пищевая добавка (загустители: Е407, пектины), соль, красители: сахарный колер (Е150с), аннато, ароматизатор «варёное сгущённое молоко», консервант сорбиновая кислота, регуляторы кислотности: цитрат натрия 3-замещенный, орто-Фосфат кальция 3-замещенный), вода, масло растительное, сахар, продукты яичные, молоко сухое обезжиренное, сироп глюкозно-фруктозный, улучшитель хлебопекарный (эмульгаторы (моно- и диглицериды жирных кислот, Е481), антиокислитель аскорбиновая кислота), дрожжи хлебопекарные (эмульгатор сорбитан моностеарат, антиокислитель аскорбиновая кислота), клейковина пшеничная, соль, консервант пропионат кальция, ароматизатор, краситель бета-каротин. Продукт может содержать следы клюквы, изюма, кусочков шоколада. 	True	True	Sun Jul  7 18:32:17 2024
Слойка Хлебный Дом Сладкая клубника, 55г	29,99 ₽/шт	55 гр	https://www.perekrestok.ru/cat/246/p/slojka-hlebnyj-dom-sladkaa-klubnika-55g-4311066	Sun Jul  7 17:00:11 2024	Слойка Хлебный Дом Сладкая клубника, 55г	Цена29,99 ₽	Хлебный Дом	370.0	5.0 г	14.0 г	57.0 г	Начинка клубничная (клубника, сахар, крахмал кукурузный, загуститель-геллановая камедь, вода, ароматизатор натуральный «Клубника», натуральный краситель-кармин), мука пшеничная хлебопекарная высшего сорта, вода, маргарин (масла растительные рафинированные дезодорированные, вода, ароматизатор натуральный), сахар белый, дрожжи хлебопекарные прессованные, меланж, соль. 	True	True	Sun Jul  7 18:32:18 2024
Слойка Хлебный Дом Спелое яблоко, 55г	31,99 ₽/шт	55 гр	https://www.perekrestok.ru/cat/246/p/slojka-hlebnyj-dom-speloe-abloko-55g-4311068	Sun Jul  7 17:00:11 2024	Слойка Хлебный Дом Спелое яблоко, 55г	Цена29,99 ₽	Хлебный Дом	370.0	5.0 г	14.0 г	57.0 г	Начинка «Яблоко» (сахар, яблоко, вода питьевая, загуститель крахмал кукурузный, антиокислитель кислота аскорбиновая, ароматизатор «Яблоко», краситель бета-каротин), мука пшеничная хлебопекарная высшего сорта, вода, маргарин (масла растительные рафинированные дезодорированные, вода, ароматизатор натуральный), сахар белый, дрожжи хлебопекарные прессованные, меланж, соль. 	True	True	Sun Jul  7 18:32:19 2024
Пирожок Дом Выпечки слоёный с вишней, 70г	37,99 ₽/шт	70 гр	https://www.perekrestok.ru/cat/246/p/pirozok-dom-vypecki-sloenyj-s-visnej-70g-4263367	Sun Jul  7 17:00:11 2024	Пирожок Дом Выпечки слоёный с вишней, 70г	Цена37,99 ₽	Дом Выпечки	360.0	6.5 г	12.0 г	55.0 г	Мука пшеничная хлебопекарная высший сорт, вода, сахар, масла растительные, в том числе модифицированные, продукты яичные, дрожжи хлебопекарные прессованные, загустители: Е1442, геллановая камедь, вишня быстрозамороженная, сок концентрированный из черной моркови и бузины, инвертный сахарный сироп, соль, глютен пшеничный сухой, эмульгаторы: Е471, Е472с, Е472е, Е475, Е481, регуляторы кислотности: лимонная кислота, цитраты натрия, цитраты кальция, стабилизатор карбонат кальция, антиокислитель аскорбиновая кислота, консерванты: сорбиновая кислота, сорбат калия, ароматизатор. 	True	True	Sun Jul  7 18:32:20 2024
