name	price	size	url	time	name_	price_	brand	calories	proteins	fats	carbos	composition	get_ok	parse_ok	time_
Булочка Ремесленный Хлеб с абрикосовой начинкой, 75г	19,99 ₽/шт	75 гр	https://www.perekrestok.ru/cat/246/p/bulocka-remeslennyj-hleb-s-abrikosovoj-nacinkoj-75g-4095507	Wed Jul  3 15:03:58 2024	Булочка Ремесленный Хлеб с абрикосовой начинкой, 75г	Цена19,99 ₽	Ремесленный Хлеб	378.0	6.0 г	14.1 г	54.3 г	Мука пшеничная хлебопекарная высшего сорта, начинка (сахар, абрикос сушеный, загуститель - крахмал кукурузный модифицированный, эмульгатор-целлюлоза микрокристаллическая, стабилизатор-ксантановая камедь, вода, регулятор кислотности- кислота лимонная, ароматизатор, консерванты - сорбат калия, бензоат натрия, краситель-каротин), вода, сахар, маргарин (масла растительные, в том числе соевое, вода, эмульгаторы: эфиры полиглицерина и жирных кислот, моно - и диглицериды жирных кислот, соль, сахар, консервант- сорбат калия, регулятор кислотности - кислота лимонная, ароматизатор, краситель- бета-каротин, антиокислители: аскорбиновая кислота, альфа-токоферол), продукты яичные, дрожжи хлебопекарные прессованные, влагоудерживающий агент – глицерин, соль, улучшитель хлебопекарный (стабилизатор - карбонат кальция, эмульгатор- эфиры глицерина и диацетилвинной и жирных кислот, антиокислитель – аскорбиновая кислота), влагоудерживающий агент-ксантановая камедь, консерванты-сорбат калия, пропионат кальция. Может содержать следы арахиса, кунжута, соевой муки, молока сухого. 	True	True	Fri Jul  5 22:53:19 2024
Булочка Ремесленный Хлеб с лимонной начинкой, 75г	21,99 ₽/шт	75 гр	https://www.perekrestok.ru/cat/246/p/bulocka-remeslennyj-hleb-s-limonnoj-nacinkoj-75g-4095506	Wed Jul  3 15:03:58 2024	Булочка Ремесленный Хлеб с лимонной начинкой, 75г	Цена19,99 ₽	Ремесленный Хлеб	287.0	7.7 г	5.2 г	52.5 г	Мука пшеничная хлебопекарная высшего сорта, начинка лимонная (сахар, лимон, вода, загустители - крахмал кукурузный модифицированный, эмульгатор –целлюлоза, стабилизатор - ксантановая камедь, регуляторы кислотности: цитрат натрия, кислота лимонная, ароматизатор, консерванты- сорбат калия, бензоат натрия, краситель - куркумин), вода, сахар, маргарин (масла растительные, в том числе соевое, вода, эмульгаторы: эфиры полиглицерина и жирных кислот, моно - и диглицериды жирных кислот, соль, сахар, консервант- сорбат калия, регулятор кислотности - кислота лимонная, ароматизатор, краситель- бета-каротин, антиокислители: аскорбиновая кислота, альфа-токоферол), продукты яичные, дрожжи хлебопекарные прессованные, влагоудерживающий агент – глицерин, соль, улучшитель хлебопекарный (стабилизатор - карбонат кальция, эмульгатор- эфиры глицерина и диацетилвинной и жирных кислот, антиокислитель – аскорбиновая кислота), влагоудерживающий агент-ксантановая камедь, консерванты-сорбат калия, пропионат кальция. Может содержать следы арахиса, кунжута, соевой муки, молока сухого. 	True	True	Fri Jul  5 22:53:20 2024
Булочка Каравай Ассоль, 2х50г	39,99 ₽/шт	100 гр	https://www.perekrestok.ru/cat/246/p/bulocka-karavaj-assol-2h50g-4118655	Wed Jul  3 15:03:58 2024	Булочка Каравай Ассоль, 2х50г	Цена39,99 ₽	Каравай	340.0	8.5 г	9.5 г	65.0 г	Мука пшеничная хлебопекарная высшего сорта, сахар, вода питьевая, продукты яичные, творог, маргарин (масла растительные рафинированные дезодорированные, вода, эмульгаторы (Е471, Е475), соль, антиокислители (Е304i, Е306), регулятор кислотности лимонная кислота, ароматизатор, красители: куркумин, Е160b), дрожжи хлебопекарные, смесь сухая молокосодержащая (сахар, загустители: Е1414, альгинат натрия, молоко сухое цельное, стабилизаторы: Е339, Е450, ароматизатор, краситель каротины, уплотнитель сульфат кальция), соль, антиокислитель аскорбиновая кислота, ароматизатор. Продукт может содержать следы горчицы, сои, кунжута, орехов и продукты их переработки. 	True	True	Fri Jul  5 22:53:21 2024
Бублики Каравай Украинские, 2х100г	53,99 ₽/шт	200 гр	https://www.perekrestok.ru/cat/246/p/bubliki-karavaj-ukrainskie-2h100g-2004208	Wed Jul  3 15:03:58 2024	Бублики Каравай Украинские, 2х100г	Цена53,99 ₽	Каравай	350.0	8.5 г	7.0 г	64.0 г	Мука пшеничная хлебопекарная первого сорта, вода питьевая, сахар, маргарин (рафинированные дезодорированные растительные масла, вода, эмульгаторы (Е471, Е475), соль, ароматизатор, краситель каротины, регулятор кислотности лимонная кислота), дрожжи хлебопекарные, мак пищевой, соль. 	True	True	Fri Jul  5 22:53:22 2024
Корж Аладушкин молочный, 75г	26,99 ₽/шт	75 гр	https://www.perekrestok.ru/cat/246/p/korz-aladuskin-molocnyj-75g-3604687	Wed Jul  3 15:03:58 2024	Корж Аладушкин молочный, 75г	Цена26,99 ₽	Аладушкин	390.0	6.5 г	11.0 г	65.0 г	Мука пшеничная хлебопекарная высшего сорта, сахар,, маргарин (масла растительные, вода, эмульгаторы: моно - и диглицериды жирных кислот, полиглицерина и жирных кислот эфиры, ароматизатор, регулятор кислотности - кислота лимонная, краситель пищевой «Аннато»),, вода, продукты яичные, молоко сухое цельное, разрыхлители: карбонат аммония, гидрокарбонат натрия, ароматизатор –ванилин. Может содержать следы муки соевой, кунжута, арахиса. 	True	True	Fri Jul  5 22:53:24 2024
Булочка Арнаут Босоногое детство, 200г	69,99 ₽/шт	200 гр	https://www.perekrestok.ru/cat/246/p/bulocka-arnaut-bosonogoe-detstvo-200g-3638217	Wed Jul  3 15:03:58 2024	Булочка Арнаут Босоногое детство, 200г	Цена69,99 ₽	Арнаут	360.0	8.5 г	9.5 г	60.0 г	Мука пшеничная хлебопекарная высшего сорта, сахар, вода, меланж жидкий, маргарин, дрожжи, улучшитель хлебопекарный, молоко сухое обезжиренное, соль, ароматизатор. 	True	True	Fri Jul  5 22:53:24 2024
Кольцо Аладушкин песочное, 80г	49,99 ₽/шт	80 гр	https://www.perekrestok.ru/cat/246/p/kolco-aladuskin-pesocnoe-80g-3482783	Wed Jul  3 15:03:58 2024	Кольцо Аладушкин песочное, 80г	Цена47,99 ₽	Аладушкин	490.0	8.5 г	28.0 г	52.0 г	Мука пшеничная хлебопекарная высшего сорта, маргарин (масла растительные, вода, эмульгаторы: моно - и диглицериды жирных кислот, полиглицерина и жирных кислот эфиры, ароматизатор, регулятор кислотности - кислота лимонная, краситель пищевой «Аннато»), сахар, арахис, продукты яичные, ароматизатор, соль, разрыхлители: карбонат аммония, гидрокарбонат натрия. 	True	True	Fri Jul  5 22:53:25 2024
Полоска Каравай песочная со сгущёнкой, 70г	57,99 ₽/шт	70 гр	https://www.perekrestok.ru/cat/246/p/poloska-karavaj-pesocnaa-so-sgusenkoj-70g-3257518	Wed Jul  3 15:03:58 2024	Полоска Каравай песочная со сгущёнкой, 70г	Цена57,99 ₽	Каравай	450.0	6.0 г	23.0 г	57.0 г	Мука пшеничная хлебопекарная высшего сорта, кондитерская глазурь (сахар, заменитель масла какао лауринового типа, молоко сухое обезжиренное, сыворотка сухая молочная, эмульгатор лецитин соевый, ароматизаторы), сахар, продукты яичные, маргарин (масла растительные рафинированные дезодорированные, вода, эмульгаторы: Е471, Е433, антиокислители: Е304i, Е306, регулятор кислотности лимонная кислота, ароматизатор, красители: куркумин, Е160b), повидло яблочное (пюре яблочное, сахар), молоко сгущенное с сахаром вареное (молоко цельное (лактоза), сахар), крем кондитерский (сахар, вода, сухое обезжиренное молоко, жир растительный, стабилизатор Е452, консервант сорбат калия), разрыхлители (пирофосфаты, карбонаты натрия), агент антислеживающий Е170, вещество для обработки муки Е516, ароматизатор. 	True	True	Fri Jul  5 22:53:26 2024
Рожки Арнаут сдобные обсыпные, 200г	43,99 ₽/шт	200 гр	https://www.perekrestok.ru/cat/246/p/rozki-arnaut-sdobnye-obsypnye-200g-3416970	Wed Jul  3 15:03:58 2024	Рожки Арнаут сдобные обсыпные, 200г	Цена45,99 ₽	Арнаут	317.0	7.6 г	5.0 г	59.5 г	Мука пшеничная хлебопекарная высшего сорта, вода, сахар, маргарин (растительные масла, вода, эмульгаторы (Е471, Е475), соль, ароматизатор, регулятор кислотности - лимонная кислота, краситель аннато), продукты яичные, дрожжи хлебопекарные прессованные, соль, комплексная пищевая добавка (мука пшеничная первого сорта, стабилизатор Е170, эмульгатор Е472е, антиокислитель аскорбиновая кислота, вещество для обработки муки Е920, ферменты). 	True	True	Fri Jul  5 22:53:27 2024
Ромовая баба Аладушкин, 160г	99,99 ₽/шт	160 гр	https://www.perekrestok.ru/cat/246/p/romovaa-baba-aladuskin-160g-71813	Wed Jul  3 15:03:58 2024	Ромовая баба Аладушкин, 160г	Цена99,99 ₽	Аладушкин	320.0	4.5 г	10.0 г	53.0 г	Выпеченный полуфабрикат (мука пшеничная хлебопекарная высшего сорта, вода, сахар, маргарин (масла растительные, вода, эмульгаторы: моно - и диглицериды жирных кислот, полиглицерина и жирных кислот эфиры; ароматизатор, регулятор кислотности - кислота лимонная, краситель пищевой «Аннато»), продукты яичные, виноград сушеный, дрожжи хлебопекарные прессованные, ароматизатор «Ром», соль), сироп для промочки (сахар, вода, коньяк, консервант – сорбат калия, ароматизаторы: «Коньячный», «Ром»), глазурь (сахар, заменитель масла какао, молоко сухое цельное, сыворотка молочная сухая, эмульгаторы: лецитин, Е476, ароматизатор). (Может содержать следы муки соевой, арахиса, кунжута). 	True	True	Fri Jul  5 22:53:27 2024
Слойка Хлебный Дом Франтик с яблочной начинкой, 150г	63,99 ₽/шт	150 гр	https://www.perekrestok.ru/cat/246/p/slojka-hlebnyj-dom-frantik-s-ablocnoj-nacinkoj-150g-4072688	Wed Jul  3 15:03:58 2024	Слойка Хлебный Дом Франтик с яблочной начинкой, 150г	Цена63,99 ₽	Хлебный Дом	364.0	5.0 г	14.5 г	53.3 г	Мука пшеничная хлебопекарная высшего сорта, наполнитель плодовый (яблоко сушеное, сахар, вода питьевая, загуститель Е1442, регулятор кислотности - кислота лимонная, консервант - сорбат калия), вода питьевая, маргарин (рафинированные дезодорированные растительные масла, в том числе модифицированные, вода, эмульгаторы: эфиры глицерина и лимонной и жирных кислот, эфиры полиглицерина и жирных кислот, соль, консерванты: сорбиновая кислота, бензоат натрия, краситель - каротины, ароматизатор, регулятор кислотности - кислота лимонная), сахар, дрожжи хлебопекарные, молоко сухое цельное, глютен пшеничный, соль (соль, агент антислеживающий Е536), добавка комплексная пищевая (мука пшеничная, эмульгатор – стеароил -2- лактилат кальция, антиокислитель – кислота аскорбиновая, вещество для обработки муки Е920, фермент микробного происхождения). 	True	True	Fri Jul  5 22:53:29 2024
Слойка Аладушкин Свердловская, 100г	31,99 ₽/шт	100 гр	https://www.perekrestok.ru/cat/246/p/slojka-aladuskin-sverdlovskaa-100g-3136921	Wed Jul  3 15:03:58 2024	Слойка Аладушкин Свердловская, 100г	Цена31,99 ₽	Аладушкин	558.0	7.0 г	39.0 г	46.0 г	Мука пшеничная хлебопекарная высшего сорта, сахар-песок, маргарин (эмульгатор - моно и диглицериды жирных кислот, консервант - кислота сорбиновая, регулятор кислотности - лимонная кислота, краситель - каротин), вода питьевая, продукты яичные (меланж), дрожжи хлебопекарные прессованные, молоко сухое обезжиренное, соль поваренная пищевая, смесь сухая для приготовления хлебобулочных изделий (стабилизаторы: глицерина и диацетилвинной и жирной кислот эфиры, гуаровая камедь, антиокислитель - аскорбиновая кислота), ароматизатор идентичный натуральному - ванилин. 	True	True	Fri Jul  5 22:53:29 2024
Штрудель Аладушкин с начинкой Абрикос-Персик, 100г	57,99 ₽/шт	100 гр	https://www.perekrestok.ru/cat/246/p/strudel-aladuskin-s-nacinkoj-abrikos-persik-100g-4254435	Wed Jul  3 15:03:58 2024	Штрудель Аладушкин с начинкой Абрикос-Персик, 100г	Цена57,99 ₽	Аладушкин	430.0	6.5 г	20.0 г	56.0 г	Мука пшеничная хлебопекарная высшего сорта, начинка «Абрикос-Персик» (сахар, абрикос сушеный, персик, загустители: E1422, E1412, регулятор кислотности - кислота лимонная, загуститель - геллановая камедь, ароматизаторы, консервант – сорбат калия), маргарин (масла растительные, в том числе соевое, вода, эмульгаторы: эфиры полиглицерина и жирных кислот, моно- и диглицериды жирных кислот, лецитин соевый, соль, сахар, консервант – сорбат калия, регулятор кислотности - кислота лимонная, ароматизатор, краситель пищевой – бета-каротин, антиокислители - кислота аскорбиновая, альфа-токоферол), вода, сахар, продукты яичные, дрожжи хлебопе-карные прессованные, молоко сухое цельное, влагоудерживающий агент – глицерин, соль, улучшитель хлебопекарный (эмульгатор - эфиры глицерина и диацетилвинной и жирных кислот, антиокислитель - аскорбиновая кислота). 	True	True	Fri Jul  5 22:53:30 2024
Слойка Дарница с сахаром, 60г	29,99 ₽/шт	60 гр	https://www.perekrestok.ru/cat/246/p/slojka-darnica-s-saharom-60g-4328808	Wed Jul  3 15:03:58 2024	Слойка Дарница с сахаром, 60г	Цена29,99 ₽	Дарница	550.0	8.0 г	27.0 г	68.0 г	Мука пшеничная хлебопекарная высшего сорта, вода, маргарин (масла растительные в натуральном и модифицированном виде: пальмовое, подсолнечное; вода, эмульгаторы: моно- и диглицериды жирных кислот, эфиры полиглицерина и жирных кислот, лецитин соевый; соль, консервант – сорбат калия, краситель – каротины, регулятор кислотности – кислота лимонная, ароматизатор), сахар, соль (агент антислеживающий Е536), антиокислитель - кислота лимонная. (Может содержать следы арахиса, кунжута, муки соевой, молока сухого обезжиренного). 	True	True	Fri Jul  5 22:53:31 2024
Ватрушка Каравай Творожное наслаждение, 220г	99,99 ₽/шт	220 гр	https://www.perekrestok.ru/cat/246/p/vatruska-karavaj-tvoroznoe-naslazdenie-220g-3257514	Wed Jul  3 15:03:58 2024	Ватрушка Каравай Творожное наслаждение, 220г	Цена99,99 ₽	Каравай	357.0	9.1 г	10.3 г	57.9 г	Мука пшеничная хлебопекарная высшего сорта, творог, вода питьевая, сахар, продукты яичные, основа кондитерская (сахар, загуститель Е1422, масла (жиры) растительные рафинированные дезодорированные, загустители: альгинат натрия, гуаровая камедь, соль, стабилизатор ацетат кальция, ароматизатор, краситель каротины), маргарин (рафинированные дезодорированные растительные масла, вода, эмульгаторы (моно- и диглицериды жирных кислот, Е433, лецитин соевый), консерванты (сорбиновая кислота, бензоат натрия), краситель каротины, ароматизатор, регулятор кислотности лимонная кислота), дрожжи хлебопекарные, соль (агент антислеживающий Е536), эмульгатор Е482, антиокислитель аскорбиновая кислота, вещество для обработки муки Е920, ароматизатор. Продукт может содержать следы орехов и продукты их переработки. 	True	True	Fri Jul  5 22:53:31 2024
Ватрушка Арнаут с творогом и изюмом, 200г	89,99 ₽/шт	200 гр	https://www.perekrestok.ru/cat/246/p/vatruska-arnaut-s-tvorogom-i-izumom-200g-3267348	Wed Jul  3 15:03:58 2024	Ватрушка Арнаут с творогом и изюмом, 200г	Цена89,99 ₽	Арнаут	295.0	10.1 г	9.3 г	43.0 г	Мука пшеничная хлебопекарная высший сорт, творог, вода, сахар, меланж яичный, маргарин, молокосодержащая смесь, виноград сушеный, дрожжи хлебопекарные прессованные, соль, комплексная пищевая добавка. 	True	True	Fri Jul  5 22:53:32 2024
Ватрушка Аладушкин с творогом, 100г	59,99 ₽/шт	100 гр	https://www.perekrestok.ru/cat/246/p/vatruska-aladuskin-s-tvorogom-100g-3638212	Wed Jul  3 15:03:58 2024	Ватрушка Аладушкин с творогом, 100г	Цена59,99 ₽	Аладушкин	300.0	10.0 г	8.5 г	47.0 г	Начинка (творог, сахар, продукты яичные, смесь сухая (сахар, загуститель – дикрахмалфосфат ацетилированный, молоко сухое цельное, мальтодекстрин, стабилизаторы – альгинат натрия, пирофосфаты, фосфаты натрия: ароматизаторы, пищевой краситель бета-каротин, носитель – сульфат кальция), ароматизатор), мука пшеничная хлебопекарная высшего сорта, вода питьевая, сахар, маргарин (масла растительные, вода, соль, эмульгаторы: моно – и диглицериды жирных кислот, полиглицерина и жирных кислот эфиры, соль, ароматизатор, краситель пищевой – каротин, регулятор кислотности – кислота лимонная), продукты яичные, дрожжи хлебопекарные прессованные, улучшители хлебопекарные (стабилизатор - карбонат кальция, эмульгаторы: глицерина и диацетилвинной и жирной кислот эфиры, моно- и диглицериды жирных кислот, антиокислитель - аскорбиновая кислота, технологические вспомогательные средства: ферменты – амилазы и гемицеллюлазы), соль. 	True	True	Fri Jul  5 22:53:33 2024
