name	price	size	url	time	name_	price_	brand	calories	proteins	fats	carbos	composition	get_ok	parse_ok	time_
Булочка Золотой Колос Гата, 75г	27,99 ₽/шт	75 гр	https://www.perekrestok.ru/cat/246/p/bulocka-zolotoj-kolos-gata-75g-3329224	Sun Jul  7 17:35:50 2024	Булочка Золотой Колос Гата, 75г	Цена25,99 ₽	Золотой Колос	400.0	7.0 г	14.0 г	61.0 г	Мука пшеничная хлебопекарная в/с, вода питьевая, сахар, маргарин столовый(рафинированные дезодарированные растительные масла, вода, соль, пищевая добавка:эмульгатор лецитин), яйцо куриное пищевое, дрожжи хлебопекарные, соль, пищевая добавка:ароматизатор пищевой-ванилин.Начинка:мука пшеничная хлебопекарная в/с жареная, сахар, масло сливочное, пищевая добавка:ароматизатор пищевой-ванилин. 	True	True	Sun Jul  7 18:33:19 2024
Булочка Золотой Колос пшеничная с кремом, 90г	23,99 ₽/шт	90 гр	https://www.perekrestok.ru/cat/246/p/bulocka-zolotoj-kolos-psenicnaa-s-kremom-90g-3179399	Sun Jul  7 17:35:50 2024	Булочка Золотой Колос пшеничная с кремом, 90г	Цена25,99 ₽	Аютинский Хлеб	390.0	5.5 г	21.0 г	45.0 г	none	True	True	Sun Jul  7 18:33:20 2024
Булочка От Бадалова пшеничная с маком, 90г	24,99 ₽/шт	90 гр	https://www.perekrestok.ru/cat/246/p/bulocka-ot-badalova-psenicnaa-s-makom-90g-3179391	Sun Jul  7 17:35:50 2024	Булочка От Бадалова пшеничная с маком, 90г	Цена26,99 ₽	Аютинский Хлеб	290.0	8.0 г	11.5 г	39.0 г	"Мука пшеничная хлебопекарная в/с, сахар, вода питьевая, маргарин (подсолнечное масло рафинированное и дезодорированное, вода, эмульгаторы (моно- и диглицериды жирных кислот, эфиры полиглицерина и жирных кислот), соль поваренная пищевая, ароматизатор, краситель - каротин, регулятор кислотности - лимонная кислота), дрожжи хлебопекарные, сухая молочная сыворотка, меланж яичный, соль поваренная пищевая, улучшитель хлебопекарный ( стабилизатор - карбонат кальция, мука пшеничная хлебопекарная в/с, эмульгатор - эфиры глицерина, диацетилвинной и жирных кислот, стабилизаторы - ортофосфат кальция 3 - замещенный, карбонат кальция, эмульгатор - стеароил - 2 - лактилат натрия, антиокислитель- аскорбиновая кислота, ферментные препараты), ароматизатор ""Ванилин""; состав начинки: мак пищевой, сахар, вода питьевая, начинка кондитерская ( вода, сахар, патока, загустители - дикрахмалфосфат оксипропилированный, глицерин, пищевые волокна, соль, ароматизаторы, красители - диоксид титана, аннато, куркумин консервант - сорбат калия, бензоат натрия, регулятор кислотности - лимонная кислота). "	True	True	Sun Jul  7 18:33:21 2024
Булочка Золотой Колос Венская с шоколадной начинкой, 75г	27,99 ₽/шт	75 гр	https://www.perekrestok.ru/cat/246/p/bulocka-zolotoj-kolos-venskaa-s-sokoladnoj-nacinkoj-75g-4260403	Sun Jul  7 17:35:50 2024	Булочка Золотой Колос Венская с шоколадной начинкой, 75г	Цена27,99 ₽	Золотой Колос	370.0	6.5 г	14.0 г	55.0 г	Мука пшеничная хлебопекарная высший сорт, вода питьевая, сахар, маргарин столовый (рафинированные дезодорированные растительные масла, вода, соль, эмульгатор: лецитин), масло растительное подсолнечное, яйцо куриное пищевое, дрожжи хлебопекарные, соль, пищевая добавка: ароматизатор пищевой - ванилин. Начинка: молоко цельное сгущенное с сахаром (молоко цельное, сахар (сахароза, лактоза)), маргарин столовый (рафинированные дезодорированные растительные масла, вода, соль, эмульгатор: лецитин), глазурь кондитерская (сахар, кокосовое масло, какао-порошок, пищевая добавка: эмульгатор лецитин), какао-порошок, вода питьевая, пищевая добавка: консервант - сорбиновая кислота. 	True	True	Sun Jul  7 18:33:21 2024
Булочка Золотой Колос с крем-брюле, 65г	31,99 ₽/шт	65 гр	https://www.perekrestok.ru/cat/246/p/bulocka-zolotoj-kolos-s-krem-brule-65g-3605764	Sun Jul  7 17:35:50 2024	Булочка Золотой Колос с крем-брюле, 65г	Цена29,99 ₽	Золотой Колос	380.0	5.5 г	17.0 г	51.0 г	Мука пшеничная хлебопекарная высший сорт, сахар, маргарин молочный столовый (рафинированные дезодорированные растительные масла, вода, соль, пищевая добавка: эмульгатор лецитин), вода питьевая, яйцо куриное пищевое, дрожжи хлебопекарные, соль, пищевая добавка: ароматизатор - ванилин натуральный. Начинка: молоко цельное сгущенное с сахаром, масло сливочное, пищевая добавка: консервант - сорбиновая кислота. 	True	True	Sun Jul  7 18:33:22 2024
Корж Азовский Хлеб молочный, 75г	16,99 ₽/шт	75 гр	https://www.perekrestok.ru/cat/246/p/korz-azovskij-hleb-molocnyj-75g-3178368	Sun Jul  7 17:35:50 2024	Корж Азовский Хлеб молочный, 75г	Цена16,99 ₽	Азовский Хлеб	390.0	6.5 г	11.0 г	65.0 г	Мука пшеничная в-с, маргарин столовый с молочным вкусом (рафинированные дезодорированные масла в натуральном и модифицированном виде), вода питьевая, эмульгаторы Е471, Е475, соль, краситель Е 160а, регулятор кислотности Е330, ароматизатор эмульгатор-Е322, разрыхлители Е903 и Е500), сахар, меланж яичный, соль поваренная пищевая. 	True	True	Sun Jul  7 18:33:23 2024
Сочник Аютинский Хлеб с шоколадной начинкой высший сорт, 120г	59,99 ₽/шт	120 гр	https://www.perekrestok.ru/cat/246/p/socnik-autinskij-hleb-s-sokoladnoj-nacinkoj-vyssij-sort-120g-3678257	Sun Jul  7 17:35:50 2024	Сочник Аютинский Хлеб с шоколадной начинкой высший сорт, 120г	Цена59,99 ₽	Аютинский Хлеб	425.0	5.1 г	25.4 г	44.0 г	Мука пшеничная хлебопекарная высшего сорта, маргарин (рафинированные и дезодорированные масла в натуральном и модифицированном виде (подсолнечное масло, пальмовое масло, пальмоядровое масло), вода, эмульгаторы: моно- и диглицериды жирных кислот, эфиры полиглицерина и жирных кислот, лецитин, соль поваренная пищевая, краситель - каротин, регулятор кислотности - лимонная кислота), сметана ((сливки, молоко обезжиренное, молоко сухое обезжиренное, закваска - бактериальный концентрат молочнокислых стрептококков и лактококков), полуфабрикат кондитерский (сахар, негидрогенизированные растительные масла и жиры (масла (соевые, рапсовые, подсолнечные и кукурузные в различных пропорциях), жиры (пальмовые, пальмоядровые)), обезжиренный какао порошок (15%), лесной орех, эмульгатор-соевый лецитин, ароматизатор), сахар, комплексная пищевая добавка Порошок пекарский (разрыхлитель - дигидропирофосфат натрия, разрыхлитель - гидрокарбонат натрия, крахмал кукурузный, антислеживающий агент - карбонат кальция), соль поваренная пищевая. Начинка: сироп глюкозный, вода питьевая, сахар, шоколад (какао- масса (45, 9%), сахар, какао масло, эмульгатор: соевый лецитин, ароматизатор натуральный - ваниль), влагоудерживающий агент - сорбит жидкий, загустители: (дикрахмалфосфат оксипропилированный, ксантановая камедь), какао- прошок, регуляторы кислотности (кислота винная, глюконо-дельта-лактон), соль поваренная, ароматизаторы, консервант - сорбат калия, краситель - диоксид титана. 	True	True	Sun Jul  7 18:33:25 2024
Сочник Аютинский Хлеб с начинкой варёная сгущёнка, 120г	59,99 ₽/шт	120 гр	https://www.perekrestok.ru/cat/246/p/socnik-autinskij-hleb-s-nacinkoj-varenaa-sgusenka-120g-3678256	Sun Jul  7 17:35:50 2024	Сочник Аютинский Хлеб с начинкой варёная сгущёнка, 120г	Цена59,99 ₽	Аютинский Хлеб	423.0	5.4 г	24.6 г	44.9 г	Мука пшеничная хлебопекарная высший сорт, маргарин (рафинированные дезодорированные масла в натуральном и модифицированном виде (подсолнечное масло, пальмовое масло, пальмоядровое масло), вода, эмульгаторы: моно- и диглицериды жирных кислот, эфиры полиглицерина и жирных кислот, лецитин, соль поваренная пищевая, краситель - каротин, регулятор кислотности - лимонная кислота), сметана (сливки, молоко обезжиренное, молоко сухое обезжиренное, закваска - бактериальный концентрат молочнокислых стрептококков и лактококков), сахар, комплексная пищевая добавка Порошок пекарский (разрыхлитель - дигидропирофосфат натрия, разрыхлитель - гидрокарбонат натрия, крахмал кукурузный, антислеживающий агент - карбонат кальция), соль поваренная пищевая. Состав начинки: сахар, вода, растительный жир, молоко сухое обезжиренное, сухая молочная сыворотка, стабилизаторы (дикрахмалфосфат оксипропилированный, пектин, цитрат натрия), консервант - сорбат калия, соль, ароматизатор, цельное сгущенное молоко (цельное молоко, обезжиренное молоко, сахар (сахароза, лактоза)). 	True	True	Sun Jul  7 18:33:25 2024
Булочка Золотой Колос с шоколадной начинкой, 65г	31,99 ₽/шт	65 гр	https://www.perekrestok.ru/cat/246/p/bulocka-zolotoj-kolos-s-sokoladnoj-nacinkoj-65g-3605763	Sun Jul  7 17:35:50 2024	Булочка Золотой Колос с шоколадной начинкой, 65г	Цена31,99 ₽	Золотой Колос	350.0	6.0 г	13.0 г	51.0 г	Мука пшеничная хлебопекарная высший сорт, сахар, маргарин молочный столовый (рафинированные дезодорированные растительные масла, вода, соль, пищевая добавка: эмульгатор лецитин), вода питьевая, яйцо куриное пищевое, дрожжи хлебопекарные, соль, пищевая добавка: ароматизатор - ванилин натуральный. Начинка: молоко цельное сгущенное с сахаром, масло сливочное, пищевая добавка: консервант - сорбиновая кислота. 	True	True	Sun Jul  7 18:33:26 2024
Слойка Аютинский Хлеб с вишней, 80г	27,99 ₽/шт	80 гр	https://www.perekrestok.ru/cat/246/p/slojka-autinskij-hleb-s-visnej-80g-3291609	Sun Jul  7 17:35:50 2024	Слойка Аютинский Хлеб с вишней, 80г	Цена27,99 ₽	Аютинский Хлеб	264.0	5.4 г	5.5 г	48.4 г	Мука пшеничная хлебопекарная высший сорт, вода питьевая, маргарины (рафинированные дезодорированные масла в натуральном и модифицированном виде (пальмовое масло, подсолнечное масло), вода, эмульгаторы (моно- и диглицериды жирных кислот, лецитин, эфиры полиглицерина и жирных кислот), соль поваренная пищевая, консервант - сорбат калия, краситель каротин, регулятор кислотности - лимонная кислота, ароматизатор), меланж яичный, сахар, дрожжи прессованные хлебопекарные, сыворотка молочная сухая, соль поваренная пищевая, улучшитель хлебопекарный (стабилизатор - карбонат кальция, мука пшеничная хлебопекарная высший сорт, эмульгаторы - эфиры глицерина диацетилвинной и жирных кислот, стабилизаторы - ортофосфат кальция 3-замещенный, карбонат кальция, эмульгатор - стеароил-2-лактилат натрия, антиокислитель - аскорбиновая кислота, ферментные препараты микробного происхождения). Состав начинки: вишня замороженная, сахар, загуститель - картофельный крахмал модифицированный - дикрахмалфосфат ацетилированный, консервант сорбат калия. 	True	True	Sun Jul  7 18:33:27 2024
Слойка Аютинский Хлеб с яблоком, 80г	27,99 ₽/шт	80 гр	https://www.perekrestok.ru/cat/246/p/slojka-autinskij-hleb-s-ablokom-80g-3291592	Sun Jul  7 17:35:50 2024	Слойка Аютинский Хлеб с яблоком, 80г	Цена27,99 ₽	Аютинский Хлеб	282.0	6.0 г	6.3 г	50.4 г	Пшеничная хлебопекарная мука высшего сорта, наполнитель яблоко-брусника (вода питьевая, сахар белый, фруктовая часть, яблоко сублимированное, брусника свежемороженая, пюре яблочное, стабилизаторы: Е418, Е1442, влагоудерживающий агент Е422, регуляторы кислотности: Е330, Е331, пищевые цитрусовые волокна, консервант: Е202, ароматизаторы яблоко , брусника ), маргарин (подсолнечное масло, пальмовое масло, вода питьевая, эмульгаторы: моно- и диглицериды жирных кислот, краситель: каротин , ароматизатор идентичный натуральному сливки , регулятор кислотности: лимонная кислота), меланж, сахар белый, сухое молоко цельное, вода питьевая, улучшитель хлебопекарный (мука пшеничная 1 сорт, эмульгаторы: Е471, Е472е, стабилизатор Е170, антиокислитель Е300), дрожжи хлебопекарные прессованные, соль поваренная пищевая. 	True	True	Sun Jul  7 18:33:27 2024
Слойка Золотой Колос с изюмом, 75г	33,99 ₽/шт	75 гр	https://www.perekrestok.ru/cat/246/p/slojka-zolotoj-kolos-s-izumom-75g-3329220	Sun Jul  7 17:35:50 2024	Слойка Золотой Колос с изюмом, 75г	Цена33,99 ₽	Золотой Колос	400.0	5.0 г	14.0 г	64.0 г	Мука, сливочное масло, сахар, яйца, молоко, вода, изюм, маргарин, дрожжи, патока, соль, ароматизатор ванилин. 	True	True	Sun Jul  7 18:33:28 2024
Слойка Золотой Колос с корицей дрожжевая, 75г	27,99 ₽/шт	75 гр	https://www.perekrestok.ru/cat/246/p/slojka-zolotoj-kolos-s-koricej-drozzevaa-75g-4033726	Sun Jul  7 17:35:50 2024	Слойка Золотой Колос с корицей дрожжевая, 75г	Цена27,99 ₽	Золотой Колос	350.0	4.0 г	13.0 г	54.0 г	Мука пшеничная хлебопекарная высший сорт, сахар, маргарин для слоеного теста(рафинированные дезодорированные растительные масла, вода, соль, сахар, пищевые добавки:эмульгатор лецитин, ароматизатор масла, регулятор кислотности-лимонная кислота, консервант-сорбиновая кислота, краситель-каротин), вода питьевая, маргарин молочный столовый(рафинированные дезодорированные растительные масла, вода, соль, пищевая добавка:эмульгатор-лецитин), яйцо куриное пищевое, дрожжи хлебопекарные, патока, соль, корица молотая, пищевая добавка:ароматизатор-ванилин натуральный. 	True	True	Sun Jul  7 18:33:29 2024
Слойка Золотой Колос с малиновой начинкой, 70г	37,99 ₽/шт	70 гр	https://www.perekrestok.ru/cat/246/p/slojka-zolotoj-kolos-s-malinovoj-nacinkoj-70g-4322459	Sun Jul  7 17:35:50 2024	Слойка Золотой Колос с малиновой начинкой, 70г	Цена37,99 ₽	Золотой Колос	310.0	4.0 г	13.0 г	45.0 г	Мука пшеничная хлебопекарная высший сорт, вода питьевая, сахар, яйцо куриное пищевое, маргарин молочный столовый(рафинированные дезодорированные растительные масла, вода, соль, пищевая добавка: эмульгатор лецитин), дрожжи хлебопекарные, патока, молоко сухое цельное, соль, пищевая добавка: ароматизатор-ванилин натуральный,. Начинка: малина свежемороженая, сахар, повидло яблочное(яблочное пюре, сахар). 	True	True	Sun Jul  7 18:33:29 2024
Слойка Золотой Колос с маком, 75г	29,99 ₽/шт	75 гр	https://www.perekrestok.ru/cat/246/p/slojka-zolotoj-kolos-s-makom-75g-4042506	Sun Jul  7 17:35:50 2024	Слойка Золотой Колос с маком, 75г	Цена29,99 ₽	Золотой Колос	410.0	6.0 г	17.0 г	57.0 г	Мука пшеничная хлебопекарная высший сорт, сахар, маргарин для слоеного теста(рафинированные дезодорированные растительные масла, вода, соль, сахар, пищевые добавки:эмульгатор лецитин, ароматизатор масла, регулятор кислотности-лимонная кислота, консервант-сорбиновая кислота, краситель-каротин), вода питьевая, маргарин молочный столовый(рафинированные дезодорированные растительные масла, вода, соль, пищевая добавка:эмульгатор-лецитин), яйцо куриное пищевое, дрожжи хлебопекарные, патока, соль. Начинка:мак пищевой, сахар, желток куриный пищевой. 	True	True	Sun Jul  7 18:33:30 2024
Слойка Азовский Хлеб с сыром и грибами, 80г	31,99 ₽/шт	80 гр	https://www.perekrestok.ru/cat/246/p/slojka-azovskij-hleb-s-syrom-i-gribami-80g-3698305	Sun Jul  7 17:35:50 2024	Слойка Азовский Хлеб с сыром и грибами, 80г	Цена31,99 ₽	Азовский Хлеб	400.0	8.0 г	25.0 г	35.0 г	Мука пшеничная хлебопекарная высшего сорта, начинка сыр и грибы, вода питьевая, маргарин для слоения маргарин столовый(рафинированные дезодорированные растительные масла), сахар-песок, соль, дрожжи сухие хлебопекарные, улучшитель хлебопекарный, консервант-сорбат калия. 	True	True	Sun Jul  7 18:33:31 2024
