name	price	size	url	time	name_	price_	brand	calories	proteins	fats	carbos	composition	get_ok	parse_ok	time_
Колбаса варёная Велком Докторская высший сорт	999,99 ₽/кг	none	https://www.perekrestok.ru/cat/133/p/kolbasa-varenaa-velkom-doktorskaa-vyssij-sort-3033317	Thu Jul  4 09:46:12 2024	Колбаса варёная Велком Докторская высший сорт	Цена999,99 ₽	Велком	225.0	12.5 г	19.5 г	0.0 г	Свинина, вода, говядина, молоко сухое обезжиренное, соль нитритная (соль, фиксатор окраски нитрит натрия), белок яичный, сахар, регуляторы кислотности: пирофосфат натрия, трифосфат натрия, усилитель вкуса и аромата глутамат натрия, экстракт мускатного ореха, кардамона. 	True	True	Fri Jul  5 23:02:00 2024
Колбаса ливерная Ближние Горки Яичная категория А, 300г	249,99 ₽/шт	300 гр	https://www.perekrestok.ru/cat/133/p/kolbasa-livernaa-bliznie-gorki-aicnaa-kategoria-a-300g-3650519	Thu Jul  4 09:46:12 2024	Колбаса ливерная Ближние Горки Яичная категория А, 300г	Цена229,99 ₽	Ближние горки	366.0	11.0 г	34.0 г	4.0 г	Шековина свиная, печень свиная, свинина, молоко коровье сухое цельное, крахмал картофельный, меланж яичный, соль, лук свежий репчатый, сахар-песок, перец белый, орех мускатный, регулятор кислотности – ацетат натрия, цитрат натрия, антиокислитель – аскорбат натрия, аскорбиновая кислота. На производстве используются горчица, злаки, соевый белок, орехи и продукты переработки. 	True	True	Fri Jul  5 23:02:01 2024
Колбаса варёная Клинский телячья	859,99 ₽/кг	none	https://www.perekrestok.ru/cat/133/p/kolbasa-varenaa-klinskij-telaca-3353674	Thu Jul  4 09:46:12 2024	Колбаса варёная Клинский телячья	Цена859,99 ₽	Клинский МК	252.0	13.0 г	22.0 г	0.0 г	Свинина, говядина, вода, языки свиные, шпик, меланж яичный сухой, соль нитритная (соль, фиксатор окраски-нитрит натрия), комплексная пищевая добавка (стабилизаторы Е450(i), Е452(i), регулятор кислотности Е451(i), Е262, Е331, сахар, специи (мускат, перец белый), усилитель вкуса и аромата глутамат натрия, антиокислитель – аскорбиновая кислота), краситель пищевой - кармин. 	True	True	Fri Jul  5 23:02:02 2024
Колбаса варёная Окраина Докторская	1 149,00 ₽/кг	none	https://www.perekrestok.ru/cat/133/p/kolbasa-varenaa-okraina-doktorskaa-3296424	Thu Jul  4 09:46:12 2024	Колбаса варёная Окраина Докторская	Цена1 149,00 ₽	Окраина	228.0	12.0 г	20.0 г	0.0 г	Свинина, говядина, вода, яичный меланж, молоко коровье сухое цельное, соль, сахар, экстракт мускатного ореха, регулятор кислотности (пирофофсфаты, трифосфаты), усилитель вкуса и аромата (глутамат натрия), антиокислитель (аскорбиновая кислота), фиксатор окраски (нитрит натрия). 	True	True	Fri Jul  5 23:02:03 2024
Колбаса Ремит Докторская вареная категории А нарезка, 150г	164,99 ₽/шт	150 гр	https://www.perekrestok.ru/cat/133/p/kolbasa-remit-doktorskaa-varenaa-kategorii-a-narezka-150g-4255289	Thu Jul  4 09:46:12 2024	Колбаса Ремит Докторская вареная категории А нарезка, 150г	Цена154,99 ₽	Ремит	230.0	12.0 г	20.0 г	0.0 г	Свинина, говядина, вода, меланж яичный, молоко сухое, нитритная соль (соль, фиксатор окраски нитрит натрия), стабилизатор дигидропирофосфат натрия, глюкоза, экстракт ореха мускатного, усилитель вкуса и аромата глутамат натрия, регуляторы кислотности (ацетат натрия, цитрат натрия, трифосфат натрия), антиокислители (аскорбиновая кислота, лимонная кислота, аскорбат натрия). Производится на предприятии, где также используются горчица, молоко, орехи, пшеница, сельдерей, соя и яйца. Продукт готов к употреблению. 	True	True	Fri Jul  5 23:02:04 2024
Колбаса ливерная Рублевский Яичная	699,90 ₽/кг	none	https://www.perekrestok.ru/cat/133/p/kolbasa-livernaa-rublevskij-aicnaa-78004416	Thu Jul  4 09:46:12 2024	Колбаса ливерная Рублевский Яичная	Цена699,90 ₽	Рублевский	366.0	11.0 г	34.0 г	4.0 г	Свинина, печень свиная, вода, мука пшеничная, молоко сухое цельное, соль поваренная пищевая, яичный порошок, лук сушеный, сахар, пряности и экстракты пряностей, мускатный орех, антиокислитель (экстракт розмарина), эмульгаторы (моно и диглицериды жирных кислот), регулятор кислотности (ацетат натрия), влагоудерживающий агент (лактат натрия). Возможно незначительное содержание орехов. 	True	True	Fri Jul  5 23:02:05 2024
Колбаса варёная Сафа говяжья халяль категории Б, 500г	239,99 ₽/шт	500 гр	https://www.perekrestok.ru/cat/133/p/kolbasa-varenaa-safa-govaza-halal-kategorii-b-500g-4229687	Thu Jul  4 09:46:12 2024	Колбаса варёная Сафа говяжья халяль категории Б, 500г	Цена239,99 ₽	Сафа	189.0	9.0 г	17.0 г	0.0 г	Говядина, филе куриное, вода, молоко сухое,яичный меланж крахмал, пищев. волокна,смесь пос-нитр (в составе соль, фиксатор окраски Е250), черный перец, мускатный орех, регуляторы кислотности Е450, Е451, стабилизаторы Е401, Е407, рис ферм., усилитель вкуса и аромата Е621. 	True	True	Fri Jul  5 23:02:05 2024
Колбаса варёная МД Бородина Любительская высший сорт	1 149,00 ₽/кг	none	https://www.perekrestok.ru/cat/133/p/kolbasa-varenaa-md-borodina-lubitelskaa-vyssij-sort-43786	Thu Jul  4 09:46:12 2024	Колбаса варёная МД Бородина Любительская высший сорт	Цена979,99 ₽	Бородина МД	300.0	12.0 г	28.0 г	0.0 г	Свинина, говядина, шпик, вода, соль, регулятор кислотности трифосфат натрия, сахар, экстракты перца черного, кардамона, нитритно-посолочная смесь (соль, фиксатор окраски нитрит натрия). 	True	True	Fri Jul  5 23:02:06 2024
Колбаса Рузком варёная Султан Премиум, 500г	159,99 ₽/шт	500 гр	https://www.perekrestok.ru/cat/133/p/kolbasa-ruzkom-varenaa-sultan-premium-500g-4252660	Thu Jul  4 09:46:12 2024	Колбаса Рузком варёная Султан Премиум, 500г	Цена154,99 ₽	Рузком	220.0	11.0 г	16.0 г	8.0 г	Мясо птицы механической обвалки, кожа птицы, вода, говядина, мука пшеничная, крупа перловая, соевый белок, нитритная соль (соль пищевая, фиксатор окраски - нитрит натрия), молоко сухое, декстроза, мальтодекстрин, стабилизаторы (Е450i, Е452ii), усилитель вкуса и аромата (Е621), молотые пряности (перец черный, лук), ароматизаторы (кориандр, орех мускатный, паприка, говядина), регуляторы кислотности (Е262, Е331), антиокислители (Е300, Е301,Е316), загустители (Е412, Е415), чеснок свежий, краситель пищевой - красный свекольный. Примите к сведению, что на предприятии используются: яичный порошок, горчица, кунжут, сельдерей. 	True	True	Fri Jul  5 23:02:07 2024
Колбаса варёная Велком Языковая кусок, 500г	409,99 ₽/шт	500 гр	https://www.perekrestok.ru/cat/133/p/kolbasa-varenaa-velkom-azykovaa-kusok-500g-3385815	Thu Jul  4 09:46:12 2024	Колбаса варёная Велком Языковая кусок, 500г	Цена479,99 ₽	Велком	210.0	14.0 г	17.0 г	0.0 г	Свинина, вода, язык свиной, стабилизатор E450, сахар, экстракт черного перца, экстракт мускатного ореха, краситель пищевой кармин, соль соль нитритная (соль, фиксатор окраски нитрит натрия). 	True	True	Fri Jul  5 23:02:08 2024
Колбаса Мортаделла Cortador варёная категории А	999,90 ₽/кг	none	https://www.perekrestok.ru/cat/133/p/kolbasa-mortadella-cortador-varenaa-kategorii-a-4345821	Thu Jul  4 09:46:12 2024	Колбаса Мортаделла Cortador варёная категории А	Цена999,90 ₽	Cortador	292.0	10.0 г	28.0 г	0.0 г	none	True	True	Fri Jul  5 23:02:10 2024
Колбаса Окраина С Языком В Шпиге изделие вареное категории В	799,90 ₽/кг	none	https://www.perekrestok.ru/cat/133/p/kolbasa-okraina-s-azykom-v-spige-izdelie-varenoe-kategorii-v-4280947	Thu Jul  4 09:46:12 2024	Колбаса Окраина С Языком В Шпиге изделие вареное категории В	Цена799,90 ₽	Окраина	365.0	8.0 г	37.0 г	0.0 г	СВИНИНА, шпик, вода питьевая, ЯЗЫК СВИНОЙ, яичный меланж, белковый стабилизатор, соль нитритная (соль пищевая, фиксатор окраски - нитрит натрия), молочный белок, сыворотка молочная сухая, молоко сухое обезжиренное, соль пищевая, стабилизатор  (пирофосфаты), специи и экстракты специй (перец, мускат, лимон), сахар, усилитель вкуса и аромата (глутамат натрия),  антиокислитель (аскорбиновая кислота, изоаскорбат натрия), ароматизатор, регулятор кислотности (цитраты натрия), мальтодекстрин, краситель (кармины). Пищевая и энергетическая ценность 100г продукта (среднее значение): белок -8,0г, жир - 37,0г; 365ккал/1505 кДж. Срок годности при t от 0  до +6°С и относительной влажности воздуха 70-80%  - не более *СрокГодности* суток. Срок годности после вскрытия упаковки не более 72 часов при t от 0 до +6°С в пределах срока годности упакованного продукта\&ТУ 10.13.14-001-78096490-17\&На предприятии используются: молоко, яйцо, горчица, соя, сельдерей, злаки, орехи и продукты их переработки. 	True	True	Fri Jul  5 23:02:11 2024
Колбаса Окраина Столичная вареное категории А	1 049,00 ₽/кг	none	https://www.perekrestok.ru/cat/133/p/kolbasa-okraina-stolicnaa-varenoe-kategorii-a-4286635	Thu Jul  4 09:46:12 2024	Колбаса Окраина Столичная вареное категории А	Цена1 199,00 ₽	Окраина	340.0	13.0 г	32.0 г	0.0 г	СВИНИНА, шпик, ГОВЯДИНА, вода питьевая, МОЛОКО КОРОВЬЕ ЦЕЛЬНОЕ, соль, сахар, перец черный, экстракт мускатного ореха, регулятор кислотности (пирофосфаты, трифосфаты), усилитель вкуса и аромата (глутамат натрия), антиокислитель (аскорбиновая кислота), фиксатор окраски (нитрит натрия). Пищевая и энергетическая ценность 100г продукта (среднее значение): белок - 13г, жир - 32г, 340 ккал/1424 кДж. Срок годности при t от 0 до +6°С и относительной  влажности воздуха не выше 75% не более *СрокГодности* суток. Срок годности после вскрытия упаковки не более 72 часов при t от 0 до +6°С в пределах срока годности упакованного продукта\&ГОСТ 23670-2019 \&На предприятии используются: молоко, яйцо, горчица, соя, сельдерей, злаки, орехи и продукты их переработки. 	True	True	Fri Jul  5 23:02:12 2024
Колбаса Идель Султанская из мяса птицы вареная, 400г	154,99 ₽/шт	400 гр	https://www.perekrestok.ru/cat/133/p/kolbasa-idel-sultanskaa-iz-masa-pticy-varenaa-400g-4263570	Thu Jul  4 09:46:12 2024	Колбаса Идель Султанская из мяса птицы вареная, 400г	Цена169,99 ₽	Идель	165.0	9.0 г	15.0 г	6.0 г	Мясо курицы механической обвалки, гидратированный соевый белок, белковый стабилизатор (кожа индейки), вода питьевая, крахмал картофельный, соль нитритная (соль, фиксатор окраскинитрит натрия), комплексные пищевые добавки (, стабилизаторы, пирофосфаты натрия, Е450i, Е450iii, E339i, регулятор кислотности трифосфаты натрия, усилит.вкуса и ароматаглутамат натрия, антиокислитель аскорбинов. кта, пряности и экстракты пряностей:, мускатный орех, кардамон, мальтодекстрин, декстроза, ароматизаторы, загустители, камедь рожкового дерева, гуаровая камедь, ксантановая камедь), краситель красный рисовый, Продукт может содержать следы, используемых на производстве:, мяса баранины, говядины, молочного белка, пшеничной муки. 	True	True	Fri Jul  5 23:02:12 2024
Колбаса Рублевский молочная категории Б вареная, 400г	459,99 ₽/шт	400 гр	https://www.perekrestok.ru/cat/133/p/kolbasa-rublevskij-molocnaa-kategorii-b-varenaa-400g-4338321	Thu Jul  4 09:46:12 2024	Колбаса Рублевский молочная категории Б вареная, 400г	Цена459,99 ₽	Рублевский	240.0	11.0 г	22.0 г	0.0 г	Свинина, говядина, вода, посолочно-нитритная смесь (соль поваренная, фиксатор окраски (нитрит натрия)), молоко сухое цельное, меланж яичный сушеный, стабилизатор (пирофосфат натрия), регуляторы кислотности (трифосфат натрия, ацетат натрия, цитрат натрия), сахар, перец черный, орех мускатный, усилитель вкуса и аромата (глутамат натрия), антиокислитель (аскорбиновая кислота). 	True	True	Fri Jul  5 23:02:13 2024
Колбаса Самирель Докторская халяль вареная, 450г	289,99 ₽/шт	450 гр	https://www.perekrestok.ru/cat/133/p/kolbasa-samirel-doktorskaa-halal-varenaa-450g-4273368	Thu Jul  4 09:46:12 2024	Колбаса Самирель Докторская халяль вареная, 450г	Цена289,99 ₽	САМИРЕЛЬ	170.0	8.0 г	12.0 г	6.0 г	Состав:говядина, филе куриное, вода, молоко сухое, крахмал картофельный, мука пшеничная, посолочно-нитритная смесь (соль, фиксатор окраски - нитрит натрия), стабилизатор - пирофосфаты, орех мускатный, перец черный, усилитель вкуса и аромата - глутамат натрия, краситель красный рисовый. 	True	True	Fri Jul  5 23:02:14 2024
Колбаса Фабричная варёная	1 149,00 ₽/кг	none	https://www.perekrestok.ru/cat/133/p/kolbasa-fabricnaa-varenaa-3655370	Thu Jul  4 09:46:12 2024	Колбаса Фабричная варёная	Цена1 099,90 ₽	Егорьевская КГФ	0.0	0.0 г	0.0 г	0.0 г	none	True	True	Fri Jul  5 23:02:16 2024
Хлеб Окраина Чайный мясной варёный категории Б	849,90 ₽/кг	none	https://www.perekrestok.ru/cat/133/p/hleb-okraina-cajnyj-masnoj-varenyj-kategorii-b-4331014	Thu Jul  4 09:46:12 2024	Хлеб Окраина Чайный мясной варёный категории Б	Цена849,90 ₽	Окраина	233.0	11.0 г	21.0 г	0.0 г	none	True	True	Fri Jul  5 23:02:17 2024
Колбаса варёная Окраина Телячья	1 149,00 ₽/кг	none	https://www.perekrestok.ru/cat/133/p/kolbasa-varenaa-okraina-telaca-3370477	Thu Jul  4 09:46:12 2024	Колбаса варёная Окраина Телячья	Цена1 149,00 ₽	Окраина	273.0	12.0 г	25.0 г	0.0 г	Свинина, телятина, шпик, языки свиные, молоко коровье цельное, вода питьевая, яичный меланж, соль нитритная (соль поваренная пищевая, фиксатор окраски нитрит натрия), соль поваренная, фисташки, пряности (прец, орех мускатный), сахар, стабилизатор (пирофосфаты, полифосфаты), регулятор кислотности (трифосфаты), усилитель вкуса и аромата (глутомат натрия), антиокислитель (аскорбиновая кислота). 	True	True	Fri Jul  5 23:02:17 2024
Колбаса варёная Царицыно Особая с телятиной Халяль, 500г	194,99 ₽/шт	500 гр	https://www.perekrestok.ru/cat/133/p/kolbasa-varenaa-caricyno-osobaa-s-telatinoj-halal-500g-3634950	Thu Jul  4 09:46:12 2024	Колбаса варёная Царицыно Особая с телятиной Халяль, 500г	Цена209,99 ₽	Царицыно	195.0	10.0 г	15.0 г	5.0 г	Мясо птицы механической обвалки, вода питьевая, белковый стабилизатор, соевый белок, телятина, крахмал картофельный, соль нитритная (соль, фиксатор окраски-нитрит натрия), комплексные пищевые добавки (усилит.вкуса и аромата-глутамат натрия, специи и ароматизаторы:аромат мяса, лук, горчичное семя, пажитник, сельдерей, кориандр, глюкоза, краситель-куркумин, регулятор кислотности Е451i, стабилизаторы Е 450i.Е 450 iii.Е339i, специи и экстракты специй:перец черный, тмин, ароматизаторы, декстроза, антиокислитель:изоаскорбат натрия, лимонная кислота), сахар, чеснок, краситель красный рисовый, Возможно наличие пшеничной муки. 	True	True	Fri Jul  5 23:02:18 2024
Колбаса варёная Рузком Байрам, 300г	89,99 ₽/шт	300 гр	https://www.perekrestok.ru/cat/133/p/kolbasa-varenaa-ruzkom-bajram-300g-4252557	Thu Jul  4 09:46:12 2024	Колбаса варёная Рузком Байрам, 300г	Цена89,99 ₽	Рузком	230.0	10.0 г	18.0 г	7.0 г	Мясо индейки механической обвалки, вода, кожа индейки, крупа манная, крупа перловая, соевый белок, нитритная соль (соль пищ., фиксатор окраски – нитрит натрия), стабилизатор (Е450i, Е452ii), молотые пряности (перец черный, лук), загустители (Е407, Е412, Е415), усилитель вкуса и аромата (Е621), ароматизаторы (кориандр, орех мускатный, паприка, говядина), регулятор кислотности (Е262) , антиокислители (Е300, Е301, Е331, Е316), чеснок свежий, краситель пищевой - красный свекольный, сахар. Примите к сведению, что на предприятии используются: молоко, яичный порошок, горчица, кунжут и сельдерей. 	True	True	Fri Jul  5 23:02:19 2024
Колбаса Ремит Мортаделла подпеченная с фисташками варёная	1 399,00 ₽/кг	none	https://www.perekrestok.ru/cat/133/p/kolbasa-remit-mortadella-podpecennaa-s-fistaskami-varenaa-4330909	Thu Jul  4 09:46:12 2024	Колбаса Ремит Мортаделла подпеченная с фисташками варёная	Цена1 049,90 ₽	Ремит	290.0	10.0 г	28.0 г	0.0 г	Свинина, вода, шпик, говядина, соль, крахмал пшеничный, фисташки, регуляторы кислотности (пирофосфат натрия, ацетат натрия, цитраты натрия), декстроза, пряности (мускатный орех, горчица), экстракты (перца черного, лука репчатого), усилитель вкуса и аромата: глутамат натрия, пряности, антиокислители (аскорбиновая кислота, аскорбат натрия), красители (кармин, сахарный колер III). Производится на предприятии, где также используются молоко, орехи, пшеница, сельдерей, соя и яйца. 	True	True	Fri Jul  5 23:02:20 2024
