name	price	size	url	time	name_	price_	brand	calories	proteins	fats	carbos	composition	get_ok	parse_ok	time_
Колбаса Высший Вкус Веганская варено-копчёная, 250г	369,99 ₽/шт	250 гр	https://www.perekrestok.ru/cat/133/p/kolbasa-vyssij-vkus-veganskaa-vareno-kopcenaa-250g-4314699	Thu Jul  4 09:46:12 2024	Колбаса Высший Вкус Веганская варено-копчёная, 250г	Цена369,99 ₽	Высший Вкус	310.0	22.0 г	19.0 г	13.0 г	Клейковина гидратированная охлажденная, вода питьевая очищенная, масло подсолнечное рафинированное дезодорированное, масло кокосовое рафинированное дезодорированное отбеленное,  загустители (ксантановая камедь, гуаровая камедь, камедь рожкового дерева, тары камедь), соль пищевая, дрожжевой экстракт, комплексная пищевая добавка «Аромат бекона» (соль пищевая, мальтодекстрин, пряности (кориандр, паприка), растительный гидролизат, сахар, дрожжевой экстракт, ароматизаторы (мясной идентичный натуральному, аромат дыма)), комплексная пищевая добавка «Аромакс Мозаика» (соль пищевая, ароматизатор Ветчина (содержит злаки)), специи (мускатный орех, кориандр, душистый перец, кардамон), краситель - оксиды железа. 	True	True	Fri Jul  5 23:02:42 2024
Колбаски Высший Вкус Пепперони вялено-копчёные, 120г	289,99 ₽/шт	120 гр	https://www.perekrestok.ru/cat/133/p/kolbaski-vyssij-vkus-pepperoni-valeno-kopcenye-120g-4314698	Thu Jul  4 09:46:12 2024	Колбаски Высший Вкус Пепперони вялено-копчёные, 120г	Цена259,99 ₽	Высший Вкус	300.0	26.0 г	8.0 г	30.0 г	клейковина гидратированная охлажденная, вода питьевая очищенная, масло кокосовое рафинированное дезодорированное отбеленное, загустители (ксантановая камедь, гуаровая камедь, камедь рожкового дерева, тары камедь), соль пищевая, дрожжевой экстракт, комплексная пищевая добавка «Аромат говядины» (декстроза, соль пищевая, перец чёрный, ароматизатор пищевой со вкусом жареной говядины), комплексная пищевая добавка «Аромат дыма» (мальтодекстрин, соль пищевая, ароматизатор дыма), комплексная пищевая добавка «Чили» (декстроза, экстракт чили, агент антислеживающий - диоксид кремния), специи 	True	True	Fri Jul  5 23:02:43 2024
Колбаса варёно-копчёная Окраина Кремлёвская	1 299,00 ₽/кг	none	https://www.perekrestok.ru/cat/133/p/kolbasa-vareno-kopcenaa-okraina-kremlevskaa-4097400	Thu Jul  4 09:46:12 2024	Колбаса варёно-копчёная Окраина Кремлёвская	Цена1 249,00 ₽	Окраина	314.0	11.0 г	30.0 г	0.0 г	Свинина, шпик свиной, белковый стабилизатор, мясо куриное, соль нитритная (соль поваренная пищевая, фиксатор окраски- нитрит натрия), соль пищевая, стабилизатор (пирофосфаты, цитраты натрия), регулятор кислотности (трифосфаты), сахар, усилитель вкуса и аромата (глутамат натрия), антиокислитель (изоаскорбат натрия), специи и экстракты специй (перец, мускат, кориандр, тмин, чеснок, можжевельник), животный белок, краситель (кармин). Пищевая и энергетическая ценность 100г продукта (среднее значение): белок - 11,0г, жир - 30,0г; 314 ккал/1315 кДж.Срок годности при t от 0 до +6°С и относительной влажности воздуха 70-80% - не более *СрокГодности* суток.ТУ 9213-004-78096490-15 Срок годности после вскрытия упаковки не более 3 суток при t от 0 до +6°С в пределах срока годности упакованного продукта. На предприятии используются: молоко, яйцо, горчица, соя, сельдерей, злаки, орехи и продукты их переработки. 	True	True	Fri Jul  5 23:02:45 2024
Сервелат варёно-копчёный Ближние Горки Австрийский	1 149,00 ₽/кг	none	https://www.perekrestok.ru/cat/133/p/servelat-vareno-kopcenyj-bliznie-gorki-avstrijskij-4086401	Thu Jul  4 09:46:12 2024	Сервелат варёно-копчёный Ближние Горки Австрийский	Цена1 299,00 ₽	Ближние горки	331.0	13.0 г	31.0 г	0.0 г	Свинина, шпик, филе грудки куриной, белковый стабилизатор, вода, нитритно-посолочная смесь (соль, фиксатор окраски- нитрит натрия), животный белок (говяжий), декстроза, стабилизатор- дигидропирофосфат натрия, регуляторы кислотности- трифосфат натрия 5-замещённый, глюконо-дельта-лактон; антиокислители- изоаскорбат натрия, аскорбат натрия; растительный гидролизат (рапс, маис), мальтодекстрин, трансглютаминаза, горчица, красители- кармин, сахарный колер III. Возможно наличие следов злаков, молока, яиц, соевого белка, орехов и продуктов их переработки. 	True	True	Fri Jul  5 23:02:46 2024
Колбаса Рахмат Восточная из мяса кур варено-копченая, 350г	159,99 ₽/шт	350 гр	https://www.perekrestok.ru/cat/133/p/kolbasa-rahmat-vostocnaa-iz-masa-kur-vareno-kopcenaa-350g-4310606	Thu Jul  4 09:46:12 2024	Колбаса Рахмат Восточная из мяса кур варено-копченая, 350г	Цена159,99 ₽	РАХМАТ	225.0	9.0 г	17.0 г	9.0 г	мясо куриное механической обвалки, вода питьевая, белковый стабилизатор (кожа куриная), жир-сырец говяжий, крахмал картофельный, мука пшеничная, белок говяжий, соевый белок, соль нитритная(соль, фиксатор окраски - нитрит натрия), комплексные пищевые добавки (натуральные пряности и их экстракты - орех мускатный; регуляторы кислотности – Е450i, Е451i; стабилизаторы – Е339i; Е450iii; усилитель вкуса и аромата – глутамат натрия; антиокислитель – аскорбиновая кислота), краситель «красный рисовый». Возможно наличие следов используемого на производстве молочного белка. 	True	True	Fri Jul  5 23:02:47 2024
Колбаса варёно-копчёная Бахрушинъ Мраморная	1 149,00 ₽/кг	none	https://www.perekrestok.ru/cat/133/p/kolbasa-vareno-kopcenaa-bahrusin-mramornaa-4103554	Thu Jul  4 09:46:12 2024	Колбаса варёно-копчёная Бахрушинъ Мраморная	Цена1 099,90 ₽	Бахрушинъ	386.0	11.0 г	38.0 г	0.0 г	Свинина, вода, молоко сухое, декстроза, ароматизатор (мясо), экстракты пряностей (мускатный орех, имбирь, кориандр), посолочная смесь (соль поваренная пищевая,фиксатор окраски - нитрит натрия), стабилизаторы Е450, Е452, сахар, регуляторы кислотности Е451, Е262, Е331, антиокислитель Е301, гемоглобин (сухой), краситель (Е120). 	True	True	Fri Jul  5 23:02:48 2024
Колбаса Калужучи Домашняя На Дровах варёно-копчёная	1 849,00 ₽/кг	none	https://www.perekrestok.ru/cat/133/p/kolbasa-kaluzuci-domasnaa-na-drovah-vareno-kopcenaa-4323479	Thu Jul  4 09:46:12 2024	Колбаса Калужучи Домашняя На Дровах варёно-копчёная	Цена1 799,00 ₽	none	248.0	17.0 г	43.0 г	0.0 г	Мясо свинины, соль пищевая, перец черный, чеснок. 	True	True	Fri Jul  5 23:02:49 2024
Колбаса Калужучи Гаивская варёно-копчёная	1 499,00 ₽/кг	none	https://www.perekrestok.ru/cat/133/p/kolbasa-kaluzuci-gaivskaa-vareno-kopcenaa-4323480	Thu Jul  4 09:46:12 2024	Колбаса Калужучи Гаивская варёно-копчёная	Цена1 499,00 ₽	none	224.0	16.0 г	44.0 г	0.0 г	Мясо свинины, соль пищевая, сахар, чеснок, зира, черный перец, красный перец. 	True	True	Fri Jul  5 23:02:50 2024
Колбаса Лисецкая свиная варёно-копчёная категории А	1 599,00 ₽/кг	none	https://www.perekrestok.ru/cat/133/p/kolbasa-liseckaa-svinaa-vareno-kopcenaa-kategorii-a-4308110	Thu Jul  4 09:46:12 2024	Колбаса Лисецкая свиная варёно-копчёная категории А	Цена1 599,00 ₽	none	287.0	13.1 г	25.3 г	1.9 г	Свинина окорок,лопатка,соль нитритная,сахар,специи натуральные,вода подготовленная. 	True	True	Fri Jul  5 23:02:51 2024
Колбаса Эколь Сервелат Халяль варено-копченая категории А, 150г	299,99 ₽/шт	150 гр	https://www.perekrestok.ru/cat/133/p/kolbasa-ekol-servelat-halal-vareno-kopcenaa-kategorii-a-150g-4276760	Thu Jul  4 09:46:12 2024	Колбаса Эколь Сервелат Халяль варено-копченая категории А, 150г	Цена299,99 ₽	Эколь	262.0	20.5 г	19.2 г	2.4 г	Говядина, филе грудки цыплят-бройлеров (индеек), жтр говяжий, смесь молочных белков, вода, нитритно-посолочная смесь (соль пищевая поваренная, нитрит натрия-фиксатор окраски Е250, антислеживатель Е536), глюкоза, растительная клейчатка, специи: перец белый, перец черный, тмин; мальтодекстрин, усилитель вкуса и аромата (ароматизатор коптильный Е621), эмульгатор Е508, консервант Е262 (i),Е262(ii), стабилизаторы (Е450, Е452), регуляторы кислотности (Е331 (iii), Е451), антиокислители (Е301, Е316), стабилизаторы (Е415, Е1442), загустители (Е407, Е407а). 	True	True	Fri Jul  5 23:02:53 2024
Колбаса сырокопчёная Останкино Ароматная, 100г	129,99 ₽/шт	100 гр	https://www.perekrestok.ru/cat/133/p/kolbasa-syrokopcenaa-ostankino-aromatnaa-100g-3469277	Thu Jul  4 09:46:12 2024	Колбаса сырокопчёная Останкино Ароматная, 100г	Цена129,99 ₽	Останкино	641.0	14.0 г	65.0 г	0.0 г	Свинина, шпик, говядина, соевый белок, смесь посолочно-нитритная (соль, фиксатор окраски нитрит натрия), соль, молочный белок, регулятор кислотности пирофосфаты, растительная клетчатка (в т.ч. пшеничная), натуральные пряности (перец чёрный, мускатный орех, кардамон), сахар, ароматизатор, антиокислитель аскорбиновая кислота, усилитель вкуса и аромата глутамат натрия, красители: кармины, красный рисовый; стартовая культура. Возможно наличие следовых количеств мяса птицы. 	True	True	Fri Jul  5 23:02:53 2024
Колбасы Черкизово Ассорти Сервелетти И Прошутто сырокопченые полусухие, 85г	109,99 ₽/шт	85 гр	https://www.perekrestok.ru/cat/133/p/kolbasy-cerkizovo-assorti-serveletti-i-prosutto-syrokopcenye-polusuhie-85g-4280852	Thu Jul  4 09:46:12 2024	Колбасы Черкизово Ассорти Сервелетти И Прошутто сырокопченые полусухие, 85г	Цена109,99 ₽	Черкизово	380.0	24.0 г	30.0 г	4.0 г	филе куриное, свинина, шпик, соль, мальтодекстрин, виноградный сахар, усилители вкуса и аромата (глутамат натрия 1-замещенный, 5-рибонуклеотиды натрия 2-замещенные), натуральные специи (перец, имбирь), антиокислитель (изоаскорбат натрия), ароматизаторы, лук, чеснок, мука горчицы, сироп глюкозы, краситель (кармины), стартовая культура, фиксатор окраски-нитрит натрия. Колбаса ПРОШУТТО. Состав: свинина, шпик, соль, мальтодекстрин, специи и их экстракты (перец, горчица, мускатный цвет), сахар, усилитель вкуса и аромата (глутамат натрия 1-замещенный), стабилизатор (пирофосфаты), антиокислитель (аскорбиновая кислота), ароматизатор, виноградный сахар, молоко сухое, стартовая культура, фиксатор окраски-нитрит натрия. 	True	True	Fri Jul  5 23:02:54 2024
Колбаса сырокопчёная Егорьевская КГФ Брауншвейгская в нарезке, 100г	159,99 ₽/шт	100 гр	https://www.perekrestok.ru/cat/133/p/kolbasa-syrokopcenaa-egorevskaa-kgf-braunsvejgskaa-v-narezke-100g-3380222	Thu Jul  4 09:46:12 2024	Колбаса сырокопчёная Егорьевская КГФ Брауншвейгская в нарезке, 100г	Цена159,99 ₽	Егорьевская КГФ	537.0	15.0 г	53.0 г	none	Говядина, шпик, свинина, посолочная смесь (поваренная соль, фиксатор окраски нитрит натрия),сахар, пряности, стартовая культура. 	True	True	Fri Jul  5 23:02:55 2024
Колбаса сырокопчёная Егорьевская КГФ Столичная в нарезке, 100г	159,99 ₽/шт	100 гр	https://www.perekrestok.ru/cat/133/p/kolbasa-syrokopcenaa-egorevskaa-kgf-stolicnaa-v-narezke-100g-3380221	Thu Jul  4 09:46:12 2024	Колбаса сырокопчёная Егорьевская КГФ Столичная в нарезке, 100г	Цена159,99 ₽	Егорьевская КГФ	487.0	24.0 г	13.4 г	0.0 г	Говядина, свинина, шпик, нитртно-псолочная смесь( поваренная соль, фиксатор окраски нитрит натрия), дестрактоза, глюкоза, коньяк, стартовая культура, пряности (перец черный, мускатный орех, кардамон), экстракты пряностей, атиокислитель аскорбиновая кислота, усилитель вкуса и аромата глутомат натрия. 	True	True	Fri Jul  5 23:02:56 2024
Колбаса сырокопчёная Клинский Итальянская полусухая, 300г	319,99 ₽/шт	300 гр	https://www.perekrestok.ru/cat/133/p/kolbasa-syrokopcenaa-klinskij-italanskaa-polusuhaa-300g-4214000	Thu Jul  4 09:46:12 2024	Колбаса сырокопчёная Клинский Итальянская полусухая, 300г	Цена319,99 ₽	Клинский МК	370.0	20.0 г	32.0 г	0.0 г	Свинина, шпик,белок соевый растительный,посолочная смесь(соль,фиксатор окраски нитрит натрия),декстроза,пряности молотые (перец черный, лук, чеснок, кардамон),усилитель вкуса и аромата глутамат натрия,ароматизатор, антиокислители аскорбиновая кислота,аскорбат натрия,лактоза,краситель пищевой кармин,экстракт паприки, стабилизаторы дигидропирофосфат натрия,полифосфат натрия,стартовая культура. 	True	True	Fri Jul  5 23:02:57 2024
Колбаса сырокопчёная МД Бородина Шервудская категория А, 70г	129,99 ₽/шт	70 гр	https://www.perekrestok.ru/cat/133/p/kolbasa-syrokopcenaa-md-borodina-servudskaa-kategoria-a-70g-4138507	Thu Jul  4 09:46:12 2024	Колбаса сырокопчёная МД Бородина Шервудская категория А, 70г	Цена129,99 ₽	Бородина МД	192.0	25.0 г	10.0 г	0.0 г	Свинина, комплексная пищевая добавка (пищевые волокна (цитрусовые, свекольные), регулятор кислотности глюконо-дельта-лактон, мальтодекстрин, декстроза, соль, антиокислитель изоаскорбат натрия), нитритно-посолочная смесь (соль, фиксатор окраски нитрит натрия), комплексная пищевая добавка (декстроза, соль, ароматизатор), комплексная пищевая добавка (пряности (перец черный, перец белый, перец чили, перец душистый), антиокислитель аскорбиновая кислота, регуляторы кислотности трифосфат и пирофосфат натрия. Продукт может содержать следы молока, яичных продуктов, орехов, сельдерея, горчицыttt. 	True	True	Fri Jul  5 23:02:58 2024
Колбаса Solemici Салями С Трюфелем Черный Принц сырокопченая полусухая, 70г	269,99 ₽/шт	70 гр	https://www.perekrestok.ru/cat/133/p/kolbasa-solemici-salami-s-trufelem-cernyj-princ-syrokopcenaa-polusuhaa-70g-4263135	Thu Jul  4 09:46:12 2024	Колбаса Solemici Салями С Трюфелем Черный Принц сырокопченая полусухая, 70г	Цена269,99 ₽	Solemici	470.0	21.0 г	42.0 г	2.0 г	Свинина, шпик, молоко сухое обезжиренное, соль пищевая морская, посолочная смесь (соль пищевая, фиксатор окраски-нитрит натрия, консервант- нитрат калия), трюфель сушеный (порошок), пряности (чеснок, мускатный орех), мальтодекстрин, ароматизатор (аромат трюфеля), антиокислитель ( аскорбат натрия), стартовые культуры. 	True	True	Fri Jul  5 23:02:59 2024
Колбаса сырокопчёная Велком Ассорти Брауншвейгская + Велкомовская + Миланская, 90г	184,99 ₽/шт	90 гр	https://www.perekrestok.ru/cat/133/p/kolbasa-syrokopcenaa-velkom-assorti-braunsvejgskaa-velkomovskaa-milanskaa-90g-4214450	Thu Jul  4 09:46:12 2024	Колбаса сырокопчёная Велком Ассорти Брауншвейгская + Велкомовская + Миланская, 90г	Цена184,99 ₽	Велком	490.0	28.0 г	42.0 г	0.0 г	Брауншвейгская полусухая категории А, ГОСТ 55456-2013.Состав:говядина,шпик,свинина,соль нитритная (соль, фиксатор окраски нитрит натрия),сахар,перец белый,кардамон,антиокислитель аскорбиновая кислота,стартовая культура.Пищевая ценность/100г(средние значения):белки-28г;жиры-42г;энергетическая ценность/калорийность-2040кДж/490ккал;ТУ 10.13.14-002-53134737-2018 Колбаса сырокопченая сухая Велкомовская.Состав:свинина,шпик,соль нитритная (соль, фиксатор окраски нитрит натрия),перец белый,имбирь,кориандр,горчица,сельдерей,чеснок,антиокислитель аскорбиновая кислота,перец черный,краситель кармин,стартовая культура.Пищевая ценность/100г(средние значения):белки-22г;жиры-38г;энергетическая ценность/калорийность-1780кДж/430ккал;Колбаса сырокопченая полусухая Миланская.Состав:шпик,свинина,соль нитритная (соль, фиксатор окраски нитрит натрия),перец зеленый горошек,перец белый,кориандр,имбирь,горчица,сельдерей,чеснок,перец черный, антиокислитель аскорбиновая кислота,краситель кармин,стартовая культура.Пищевая ценность/100г(средние значения):белки-20г;жиры-34г;энергетическая ценность/калорийность-1600кДж/390ккал. 	True	True	Fri Jul  5 23:03:00 2024
Колбаса Ремит Бургундская сырокопченая полусухая, 80г	149,99 ₽/шт	80 гр	https://www.perekrestok.ru/cat/133/p/kolbasa-remit-burgundskaa-syrokopcenaa-polusuhaa-80g-4326321	Thu Jul  4 09:46:12 2024	Колбаса Ремит Бургундская сырокопченая полусухая, 80г	Цена149,99 ₽	Ремит	510.0	24.0 г	46.0 г	0.0 г	none	True	True	Fri Jul  5 23:03:01 2024
Колбаса сырокопчёная МД Бородина Янтарная из индейки категория А, 70г	129,99 ₽/шт	70 гр	https://www.perekrestok.ru/cat/133/p/kolbasa-syrokopcenaa-md-borodina-antarnaa-iz-indejki-kategoria-a-70g-4138508	Thu Jul  4 09:46:12 2024	Колбаса сырокопчёная МД Бородина Янтарная из индейки категория А, 70г	Цена129,99 ₽	Бородина МД	163.0	29.0 г	5.0 г	0.0 г	Филе грудки индейки, комплексная пищевая добавка (пищевые волокна (цитрусовые, свекольные), регулятор кислотности глюконо-дельта-лактон, мальтодекстрин, декстроза, соль, антиокислитель изоаскорбат натрия), нитритно-посолочная смесь (соль, фиксатор окраски нитрит натрия), комплексная пищевая добавка (декстроза, мальтодекстрин, соль, ароматизаторы, экстракты пряностей (перец черный, перец белый, паприка), пряности молотые (чеснок, перец черный)), антиокислитель аскорбат натрия, регуляторы кислотности трифосфат и пирофосфат натрия. Продукт может содержать следы молока, яичных продуктов, орехов, сельдерея, горчицыttt. 	True	True	Fri Jul  5 23:03:01 2024
