name	price	size	url	time	name_	price_	brand	calories	proteins	fats	carbos	composition	get_ok	parse_ok	time_
Колбаса сырокопчёная Черкизово Брауншвейгская полусухая категория А, 85г	199,99 ₽/шт	85 гр	https://www.perekrestok.ru/cat/133/p/kolbasa-syrokopcenaa-cerkizovo-braunsvejgskaa-polusuhaa-kategoria-a-85g-4125242	Wed Jul  3 15:04:10 2024	Колбаса сырокопчёная Черкизово Брауншвейгская полусухая категория А, 85г	Цена190,35 ₽	Черкизово	537.0	15.0 г	53.0 г	0.0 г	Свинина, шпик, филе кур, вода, соевый белок, соль, пищевые волокна, виноградный сахар, натуральные специи и их экстракты (черный перец, чеснок, имбирь, душистый перец, кардамон, мускатный орех), усилитель вкуса и аромата (глутамат натрия 1-замещенный), сахар, антиокислители (аскорбат натрия, изоаскорбат натрия), мальтодекстрин, ароматизатор, сироп глюкозы, красители (красный рисовый, кармины), стартовая культура,  фиксатор окраски-нитрит натрия. 	True	True	Fri Jul  5 23:00:50 2024
Колбаски сырокопчёные Kabanos Chili, 70г	109,99 ₽/шт	70 гр	https://www.perekrestok.ru/cat/133/p/kolbaski-syrokopcenye-kabanos-chili-70g-3942569	Wed Jul  3 15:04:10 2024	Колбаски сырокопчёные Kabanos Chili, 70г	Цена109,99 ₽	Kabanos	540.0	27.0 г	47.0 г	1.0 г	Свинина, филе грудки куриной, филе бедра куриного, вода, соль нитритная (соль, фиксатор окраски нитрит натрия), пшеничная клетчатка, крахмал картофельный, стабилизатор альгинат натрия, пряности (чеснок, перец красный острый), сахар, антиокислитель аскорбат натрия. 	True	True	Fri Jul  5 23:00:51 2024
Колбаса сырокопчёная Ближние Горки Сальчичон полусухая	799,90 ₽/кг	none	https://www.perekrestok.ru/cat/133/p/kolbasa-syrokopcenaa-bliznie-gorki-salcicon-polusuhaa-4222373	Wed Jul  3 15:04:10 2024	Колбаса сырокопчёная Ближние Горки Сальчичон полусухая	Цена799,90 ₽	Ближние горки	358.0	22.0 г	30.0 г	0.0 г	Свинина, нитритно-посолочная смесь (соль, фиксатор окраски- нитрит натрия), пищевые волокна (цитрусовые, свекольные), декстроза, регулятор кислотности – глюконо-дельта-лактон, антиокислители –аскорбиновая кислота, изоаскорбат натрия, аскорбат натрия, лимонная кислота; агент влагоудерживающий – лактат натрия, экстракты пряностей, ароматизаторы, лактоза, усилитель вкуса и аромата – глутамат натрия 1-замещённый, краситель – кармин. Возможно наличие следов горчицы, злаков, молока, яиц, соевого белка, орехов и продуктов их переработки. 	True	True	Fri Jul  5 23:00:52 2024
Колбаса Итальянская Classic сырокопчёная Маркет, 100г	179,99 ₽/шт	100 гр	https://www.perekrestok.ru/cat/133/p/kolbasa-italanskaa-classic-syrokopcenaa-market-100g-4338643	Wed Jul  3 15:04:10 2024	Колбаса Итальянская Classic сырокопчёная Маркет, 100г	Цена199,99 ₽	Маркет	450.0	23.0 г	40.0 г	0.0 г	Свинина, соль нитритная (соль, фиксатор окраски нитрит натрия), сахар, пряности (мацис, перец черный, мускатный орех), усилитель вкуса и аромата глутамат натрия 1-замещенный, антиокислители (аскорбат натрия), ароматизатор вяленое мясо, экстракт перца черного, краситель кармины, стартовые культуры. Производится на предприятии, где также используются горчица, молоко, орехи, пшеница, сельдерей, соя и яйца. Продукт готов к употреблению. 	True	True	Fri Jul  5 23:00:54 2024
Колбаса сырокопчёная Черкизово Брауншвейгская полусухая категория А, 200г	279,99 ₽/шт	200 гр	https://www.perekrestok.ru/cat/133/p/kolbasa-syrokopcenaa-cerkizovo-braunsvejgskaa-polusuhaa-kategoria-a-200g-4109831	Wed Jul  3 15:04:10 2024	Колбаса сырокопчёная Черкизово Брауншвейгская полусухая категория А, 200г	Цена389,99 ₽	Черкизово	537.0	15.0 г	53.0 г	0.0 г	Говядина, шпик, свинина, соль нитритная (соль, фиксатор окраски-нитрит натрия), сахар, мальтодекстрин, стартовая культура, пряности (перец, кардамон). Продукт может содержать следы: горчицы, глютена, кунжута, молока, орехов, сельдерея, сои, яиц. 	True	True	Fri Jul  5 23:00:55 2024
Салями сырокопчёная Черкизово Астория полусухая, 85г	149,99 ₽/шт	85 гр	https://www.perekrestok.ru/cat/133/p/salami-syrokopcenaa-cerkizovo-astoria-polusuhaa-85g-4045568	Wed Jul  3 15:04:10 2024	Салями сырокопчёная Черкизово Астория полусухая, 85г	Цена129,99 ₽	Черкизово	239.0	13.0 г	19.0 г	4.0 г	Свинина, шпик, вода, соевый белок, соль нитритная (соль, фиксатор окраски-нитрит натрия), декстроза, ароматизаторы, усилитель вкуса и аромата (глутамат натрия 1-замещенный), специи и их экстракты, антиокислители (изоаскорбат натрия, экстракт розмарина, аскорбиновая кислота), лук, мальтодекстрин, краситель (кармины), стартовая культура.Продукт может содержать следы: горчицы, глютена, кунжута, молока, орехов, сельдерея, яиц, а также белка птицы и говядины. 	True	True	Fri Jul  5 23:00:55 2024
Колбаски сырокопчёные Kabanos Cheese, 70г	109,99 ₽/шт	70 гр	https://www.perekrestok.ru/cat/133/p/kolbaski-syrokopcenye-kabanos-cheese-70g-3998853	Wed Jul  3 15:04:10 2024	Колбаски сырокопчёные Kabanos Cheese, 70г	Цена109,99 ₽	Kabanos	440.0	26.0 г	35.0 г	2.0 г	Свинина, филе грудки куриной, филе бедра куриного, сыр (молоко, соль, уплотнитель хлорид кальция, ферментный препарат животного происхождения лизоцим, молокосвертывающий ферментный препарат микробного происхождения, мезофильная бактериальная заквасочная культура, краситель аннато), вода, пшеничная клетчатка, соль нитритная (соль, фиксатор окраски нитрит натрия), крахмал пшеничный, ароматизаторы, пряности (чили, мускатный орех), стабилизатор альгинат натрия, сахар, антиокислитель аскорбат натрия. 	True	True	Fri Jul  5 23:00:56 2024
Колбаса Casademont Фуэт Экстра с трюфелем сыровяленая полусухая, 110г	259,99 ₽/шт	110 гр	https://www.perekrestok.ru/cat/133/p/kolbasa-casademont-fuet-ekstra-s-trufelem-syrovalenaa-polusuhaa-110g-4329622	Wed Jul  3 15:04:10 2024	Колбаса Casademont Фуэт Экстра с трюфелем сыровяленая полусухая, 110г	Цена259,99 ₽	Casademont	470.0	27.0 г	36.0 г	10.0 г	Свинина, шпик, лактоза, нитритно-посолочная смесь (соль, консерванты (нитрат калия, нитрит натрия)), декстроза, черный перец, антиокислитель (изоаскорбат натрия), чеснок, краситель (кармины), ароматизаторы (содержат продукты переработки молока (в том числе лактозу)), усилитель вкуса и аромата (глутамат натрия 1-замещенный), черный трюфель, стартовые культуры. 	True	True	Fri Jul  5 23:00:57 2024
Колбаса Сальчичон сырокопчёная полусухая Маркет, 300г	379,99 ₽/шт	300 гр	https://www.perekrestok.ru/cat/133/p/kolbasa-salcicon-syrokopcenaa-polusuhaa-market-300g-4322133	Wed Jul  3 15:04:10 2024	Колбаса Сальчичон сырокопчёная полусухая Маркет, 300г	Цена379,99 ₽	Маркет	370.0	9.0 г	36.0 г	3.0 г	Свинина, соль поваренная, декстроза, пряности (перец белый, перец чёрный, пастернак), усилитель вкуса и аромата е621, растительная клетчатка (овсяная, гороховая), антиокислители е300, е330, экстракты пряностей (чили), белок говяжий, белок пшеничный, стабилизатор е450, регуляторы кислотности е262i, е327, волокна растительные (бобовых), гемоглобин свиной, сироп глюкозы, краситель е120, стартовые культуры. 	True	True	Fri Jul  5 23:00:58 2024
Салями сырокопчёная Черкизово Астория полусухая, 225г	239,99 ₽/шт	225 гр	https://www.perekrestok.ru/cat/133/p/salami-syrokopcenaa-cerkizovo-astoria-polusuhaa-225g-4045569	Wed Jul  3 15:04:10 2024	Салями сырокопчёная Черкизово Астория полусухая, 225г	Цена289,99 ₽	Черкизово	239.0	13.0 г	19.0 г	4.0 г	Свинина, шпик, вода, соевый белок, соль нитритная (соль, фиксатор окраски-нитрит натрия), декстроза, ароматизаторы, усилитель вкуса и аромата (глутамат натрия 1-замещенный), специи и их экстракты, антиокислители (изоаскорбат натрия, экстракт розмарина, аскорбиновая кислота), лук, мальтодекстрин, краситель (кармины), стартовая культура. Продукт может содержать следы: горчицы, глютена, кунжута, молока, орехов, сельдерея, сои, яиц, а также белка птицы. 	True	True	Fri Jul  5 23:01:00 2024
Колбаса Окраина Салями Немецкая сырокопченая полусухая, 80г	179,99 ₽/шт	80 гр	https://www.perekrestok.ru/cat/133/p/kolbasa-okraina-salami-nemeckaa-syrokopcenaa-polusuhaa-80g-4321891	Wed Jul  3 15:04:10 2024	Колбаса Окраина Салями Немецкая сырокопченая полусухая, 80г	Цена179,99 ₽	Окраина	411.0	24.0 г	35.0 г	0.0 г	none	True	True	Fri Jul  5 23:01:00 2024
Колбаса Фелино сырокопчёная полусухая Зелёная Линия, 70г	209,99 ₽/шт	70 гр	https://www.perekrestok.ru/cat/133/p/kolbasa-felino-syrokopcenaa-polusuhaa-zelenaa-linia-70g-4321977	Wed Jul  3 15:04:10 2024	Колбаса Фелино сырокопчёная полусухая Зелёная Линия, 70г	Цена219,99 ₽	Зелёная Линия	400.0	26.0 г	33.0 г	1.0 г	Свинина, соль пищевая, сахара (сахароза, декстроза, лактоза), пряности (перец белый, перец черный, пастернак), растительная клетчатка (овсяная, гороховая), экстракты пряностей (чили, перец черный), экстракты фруктов (помело, лимон), антиокислитель (лимонная кислота), стартовые культуры. 	True	True	Fri Jul  5 23:01:01 2024
Колбаса сырокопчёная Клинский Брауншвейгская категория А	2 399,00 ₽/кг	none	https://www.perekrestok.ru/cat/133/p/kolbasa-syrokopcenaa-klinskij-braunsvejgskaa-kategoria-a-4307	Wed Jul  3 15:04:10 2024	Колбаса сырокопчёная Клинский Брауншвейгская категория А	Цена1 799,90 ₽	Клинский МК	540.0	15.0 г	53.0 г	0.0 г	Говядина,шпик,свинина,соль нитритная(соль поваренная пищевая,фиксатор окраски-нитрит натрия),комплексная пищевая добавка(сахар,специи,антиокислитель-аскорбиновая кислота),стартовая культура. 	True	True	Fri Jul  5 23:01:02 2024
Колбаски сырокопчёные Дымов Пиколини сметана и лук полусухие, 50г	85,99 ₽/шт	50 гр	https://www.perekrestok.ru/cat/133/p/kolbaski-syrokopcenye-dymov-pikolini-smetana-i-luk-polusuhie-50g-4063721	Wed Jul  3 15:04:10 2024	Колбаски сырокопчёные Дымов Пиколини сметана и лук полусухие, 50г	Цена85,99 ₽	Дымов	530.0	22.0 г	50.0 г	0.1 г	Свинина, филе птицы, шпик, животный белок (свиной), нитритно-посолочная смесь (соль, фиксатор окраски нитрит натрия), пряности (лук, петрушка), молоко сухое, лактоза, декстроза, мальтодекстрин, усилители вкуса и аромата (глутамат натрия, 5'-Гуанилат натрия 2-замещенный, 5'-Инозинат натрия 2-замещенный), антиокислители (аскорбиновая и лимонная кислоты), ароматизаторы, стартовые культуры. Продукт может содержать следы орехов, сои, глютена. 	True	True	Fri Jul  5 23:01:03 2024
Колбаса Черный Кабан Сальчичон сырокопченая полусухая	1 999,90 ₽/кг	none	https://www.perekrestok.ru/cat/133/p/kolbasa-cernyj-kaban-salcicon-syrokopcenaa-polusuhaa-4294204	Wed Jul  3 15:04:10 2024	Колбаса Черный Кабан Сальчичон сырокопченая полусухая	Цена1 999,90 ₽	Чёрный Кабан	380.0	22.0 г	32.0 г	0.0 г	свинина,грудинка свиная,посолочная смесь(соль,фиксатор окраски нитрит натрия),регулятор кислотности глюконо-дельта-лактон,мальтодекстрин,стабилизаторы трифосфат натрия,полифосфат натрия,усилитель вкуса и аромата глутамат натрия,антиокислитель изоаскорбат натрия,экстракт дрожжей,волокна пищевые(бамбук),перец чёрный,кориандр,молоко сухое,красители пищевые кармин,ферментированный рис,декстроза,стартовая культура. 	True	True	Fri Jul  5 23:01:04 2024
Колбаса сырокопчёная Останкино Пресижн, 250г	249,99 ₽/шт	250 гр	https://www.perekrestok.ru/cat/133/p/kolbasa-syrokopcenaa-ostankino-presizn-250g-3440967	Wed Jul  3 15:04:10 2024	Колбаса сырокопчёная Останкино Пресижн, 250г	Цена249,99 ₽	Останкино	523.0	14.0 г	50.0 г	0.0 г	Говядина, шпик, соль, растительный белок, регулятор кислотности Е575, пряности, сахар, антиокислитель изоаскорбат натрия, усилитель вкуса и аромата Е621, красители: рис красный ферментированный, Е120, стартовая культура, фиксатор окраски Е250. 	True	True	Fri Jul  5 23:01:05 2024
Салями сырокопчёная Бахрушинъ Монреаль в нарезке, 100г	139,99 ₽/шт	100 гр	https://www.perekrestok.ru/cat/133/p/salami-syrokopcenaa-bahrusin-monreal-v-narezke-100g-3657211	Wed Jul  3 15:04:10 2024	Салями сырокопчёная Бахрушинъ Монреаль в нарезке, 100г	Цена139,99 ₽	Бахрушинъ	552.0	18.0 г	50.0 г	0.0 г	Свинина, шпик, филе куриное, соль поваренная пищевая, комплексная пищевая добавка: декстроза, краситель пищевой (Е-120), антиокислитель (Е-300), усилитель вкуса и аромата ( Е621), фиксатор окраски (Е250), стартовая культура. 	True	True	Fri Jul  5 23:01:06 2024
Колбаски сырокопчёные Дымов Пиколини со вкусом чеснока полусухие, 50г	95,99 ₽/шт	50 гр	https://www.perekrestok.ru/cat/133/p/kolbaski-syrokopcenye-dymov-pikolini-so-vkusom-cesnoka-polusuhie-50g-4035892	Wed Jul  3 15:04:10 2024	Колбаски сырокопчёные Дымов Пиколини со вкусом чеснока полусухие, 50г	Цена95,99 ₽	Дымов	475.0	22.0 г	43.0 г	0.0 г	Свинина, шпик, филе птицы, животный белок, нитритно- посолочная смесь ( соль, фиксатор окраски нитрит натрия), специи (в т.ч. перец черный), чеснок, подсолнечное масло, сахар, усилитель вкуса и аромата (глутамат натрия), антиокислители (изоаксорбат натрия, концентрат смеси токоферолов - витамин Е), ароматизатор, экстракт паприки, красители (красный рисовый, кармин), стартовые культуры. Продукт может содержать следы орехов, сои, глютена, лактозы, молока и продуктов их переработки. 	True	True	Fri Jul  5 23:01:07 2024
Колбаса сырокопчёная Мясная История Флорентийская-пепперони полусухая в нарезке, 100г	109,99 ₽/шт	100 мл	https://www.perekrestok.ru/cat/133/p/kolbasa-syrokopcenaa-masnaa-istoria-florentijskaa-pepperoni-polusuhaa-v-narezke-100g-4032692	Wed Jul  3 15:04:10 2024	Колбаса сырокопчёная Мясная История Флорентийская-пепперони полусухая в нарезке, 100г	Цена189,99 ₽	Мясная история	300.0	21.0 г	4.0 г	0.0 г	Флорентийская: свинина, шпик, животный белок, пищевые волокна, мальтодекстрин, декстроза, усилитель вкуса и аромата (глутамат натрия), антиокислители (изоаскорбат натрия, аскорбиновая кислота), пряности молотые (перец белый, перец черный), ароматизаторы, нитритно-посолочная смесь (соль, фиксатор окраски (нитрит натрия)), краситель (кармин), стартовая культура./Пепперони:свинина, шпик, куриное филе, животный белок, пищевые волокна, мальтодекстрин, декстроза, усилитель вкуса и аромата (глутамат натрия), антиокислители (изоаскорбат натрия, аскорбиновая кислота), пряности (паприка, черный перец, тмин, чеснок), экстракты пряностей (паприка, черный перец, лук, любисток), сахар, нитритно-посолочная смесь (соль, фиксатор окраски (нитрит натрия)), стартовая культура. 	True	True	Fri Jul  5 23:01:08 2024
Колбаса сырокопчёная Чёрный Кабан Сальчичон нарезка, 95г	174,99 ₽/шт	95 гр	https://www.perekrestok.ru/cat/133/p/kolbasa-syrokopcenaa-cernyj-kaban-salcicon-narezka-95g-4254753	Wed Jul  3 15:04:10 2024	Колбаса сырокопчёная Чёрный Кабан Сальчичон нарезка, 95г	Цена194,99 ₽	Клинский	380.0	22.0 г	32.0 г	none	Свинина,грудинка свиная,посолочная смесь(соль,фиксатор окраски нитрит натрия),регулятор кислотности глюконо-дельта-лактон,мальтодекстрин,стабилизаторы трифосфат натрия,полифосфат натрия,усилитель вкуса и аромата глутамат натрия,антиокислитель изоаскорбат натрия,экстракт дрожжей,волокна пищевые(бамбук),перец чёрный,кориандр,молоко сухое,красители пищевые кармин,ферментированный рис,декстроза,стартовая культура. 	True	True	Fri Jul  5 23:01:09 2024
Салями сырокопчёная Ближние Горки Итальянская категория В	1 749,00 ₽/кг	none	https://www.perekrestok.ru/cat/133/p/salami-syrokopcenaa-bliznie-gorki-italanskaa-kategoria-v-3021048	Wed Jul  3 15:04:10 2024	Салями сырокопчёная Ближние Горки Итальянская категория В	Цена1 649,00 ₽	Ближние горки	380.0	12.0 г	37.0 г	0.0 г	Свинина, шпик, нитритно-посолочная смесь (соль, фиксатор окраски- нитрит натрия), пряности (перец белый, имбирь), сахар, декстроза, ароматизаторы (коньяк, гвоздика), пищевой краситель - кармин, стартовая культура. 	True	True	Fri Jul  5 23:01:10 2024
Колбаса сырокопчёная Клинский Зернистая категория А	1 699,90 ₽/кг	none	https://www.perekrestok.ru/cat/133/p/kolbasa-syrokopcenaa-klinskij-zernistaa-kategoria-a-4655	Wed Jul  3 15:04:10 2024	Колбаса сырокопчёная Клинский Зернистая категория А	Цена1 599,90 ₽	Клинский МК	493.0	10.0 г	63.0 г	0.0 г	Шпик, говядина, соль нитритная (соль поваренная пищевая, фиксатор окраски – нитрит натрия), комплексная пищевая добавка (сахар, антиокислитель – аскорбиновая кислота, пряности), чеснок, стартовая культура. 	True	True	Fri Jul  5 23:01:11 2024
Салями сырокопчёная Окраина Богатырская полусухая	1 699,00 ₽/кг	none	https://www.perekrestok.ru/cat/133/p/salami-syrokopcenaa-okraina-bogatyrskaa-polusuhaa-3669528	Wed Jul  3 15:04:10 2024	Салями сырокопчёная Окраина Богатырская полусухая	Цена1 999,00 ₽	Окраина	467.0	27.1 г	39.9 г	0.0 г	Мясо птицы (филе куриной грудки), свинина, шпик, соль нитритная (соль поваренная пищевая, фиксатор окраски нитрит натрия), сахар, специи (горчица, перец белый), усилитель вкуса и аромата (Е621), антиокислитель (Е316, аскорбиновая кислота), краситель кармин. 	True	True	Fri Jul  5 23:01:12 2024
