name	price	size	url	time	name_	price_	brand	calories	proteins	fats	carbos	composition	get_ok	parse_ok	time_
Масло сливочное Гармония с Природой Крестьянское 72.5%, 180г	129,99 ₽/шт	180 гр	https://www.perekrestok.ru/cat/121/p/maslo-slivocnoe-garmonia-s-prirodoj-krestanskoe-72-5-180g-3275805	Sun Jul  7 17:18:25 2024	Масло сливочное Гармония с Природой Крестьянское 72.5%, 180г	Цена159,99 ₽	Гармония с Природой	662.0	1.0 г	72.5 г	1.4 г	Пастеризованные сливки. 	True	True	Sun Jul  7 17:51:07 2024
Масло сливочное Шахунское 74.5%, 180г	179,99 ₽/шт	180 гр	https://www.perekrestok.ru/cat/121/p/maslo-slivocnoe-sahunskoe-74-5-180g-2091668	Sun Jul  7 17:18:25 2024	Масло сливочное Шахунское 74.5%, 180г	Цена179,99 ₽	Шахунское	662.0	1.0 г	74.5 г	1.4 г	Пастеризованные сливки. 	True	True	Sun Jul  7 17:51:07 2024
Масло сладкосливочное Краснобаковские Молочные Продукты Крестьянское 72.5%, 175г	159,99 ₽/шт	175 гр	https://www.perekrestok.ru/cat/121/p/maslo-sladkoslivocnoe-krasnobakovskie-molocnye-produkty-krestanskoe-72-5-175g-3172080	Sun Jul  7 17:18:25 2024	Масло сладкосливочное Краснобаковские Молочные Продукты Крестьянское 72.5%, 175г	Цена159,99 ₽	Крестьянское Приволье	662.0	1.0 г	72.5 г	1.4 г	Сливки пастеризованные. 	True	True	Sun Jul  7 17:51:08 2024
Масло сливочное Городецкий Крестьянское высшего сорта 72.5%, 180г	134,90 ₽/шт	180 гр	https://www.perekrestok.ru/cat/121/p/maslo-slivocnoe-gorodeckij-krestanskoe-vyssego-sorta-72-5-180g-3488296	Sun Jul  7 17:18:25 2024	Масло сливочное Городецкий Крестьянское высшего сорта 72.5%, 180г	Цена134,90 ₽	Городецкий	662.0	1.0 г	72.5 г	1.4 г	Пастеризованные сливки. 	True	True	Sun Jul  7 17:51:09 2024
Масло сливочное Волгодонское, 180г	174,99 ₽/шт	180 гр	https://www.perekrestok.ru/cat/121/p/maslo-slivocnoe-volgodonskoe-180g-2043237	Sun Jul  7 17:25:48 2024	Масло сливочное Волгодонское, 180г	Цена189,99 ₽	Вологодское	748.0	0.6 г	82.5 г	0.8 г	Сливки пастеризованные. 	True	True	Sun Jul  7 17:51:10 2024
Масло Традиционное 82.5% сладко-сливочное несолёное Зелёная Линия, 200г	199,99 ₽/шт	200 гр	https://www.perekrestok.ru/cat/121/p/maslo-tradicionnoe-82-5-sladko-slivocnoe-nesolenoe-zelenaa-linia-200g-4299499	Sun Jul  7 17:25:48 2024	Масло Традиционное 82.5% сладко-сливочное несолёное Зелёная Линия, 200г	Цена199,99 ₽	Зелёная Линия	748.0	0.6 г	82.5 г	0.8 г	Пастеризованные сливки. 	True	True	Sun Jul  7 17:51:11 2024
Масло Белый Медведь Традиционное Волгодонское сладко-сливочное несоленое 82.5%, 120г	83,99 ₽/шт	120 гр	https://www.perekrestok.ru/cat/121/p/maslo-belyj-medved-tradicionnoe-volgodonskoe-sladko-slivocnoe-nesolenoe-82-5-120g-4299418	Sun Jul  7 17:25:48 2024	Масло Белый Медведь Традиционное Волгодонское сладко-сливочное несоленое 82.5%, 120г	Цена139,99 ₽	Белый Медведь	748.0	0.6 г	82.5 г	0.8 г	Сливки пастеризованные. 	True	True	Sun Jul  7 17:51:12 2024
Масло сливочное Молочный Родник Традиционное 82.5%, 180г	189,99 ₽/шт	180 гр	https://www.perekrestok.ru/cat/121/p/maslo-slivocnoe-molocnyj-rodnik-tradicionnoe-82-5-180g-3488984	Sun Jul  7 17:25:48 2024	Масло сливочное Молочный Родник Традиционное 82.5%, 180г	Цена189,99 ₽	Молочный Родник	734.0	0.5 г	82.5 г	0.8 г	none	True	True	Sun Jul  7 17:51:13 2024
Масло сливочное Кубанский Молочник Традиционное 82.5%, 170г	159,99 ₽/шт	170 гр	https://www.perekrestok.ru/cat/121/p/maslo-slivocnoe-kubanskij-molocnik-tradicionnoe-82-5-170g-3902761	Sun Jul  7 17:25:48 2024	Масло сливочное Кубанский Молочник Традиционное 82.5%, 170г	Цена189,99 ₽	Кубанский Молочник	748.0	0.6 г	82.5 г	0.8 г	Масло сливочное. 	True	True	Sun Jul  7 17:51:14 2024
Масло Коровка из Кореновки традиционное сливочное 82.5%, 400г	429,99 ₽/шт	400 мл	https://www.perekrestok.ru/cat/121/p/maslo-korovka-iz-korenovki-tradicionnoe-slivocnoe-82-5-400g-4101201	Sun Jul  7 17:25:48 2024	Масло Коровка из Кореновки традиционное сливочное 82.5%, 400г	Цена479,99 ₽	Коровка из Кореновки	748.0	0.6 г	82.5 г	0.8 г	Сливки пастеризованные. 	True	True	Sun Jul  7 17:51:15 2024
Масло сливочное Коровка Из Кореновки Крестьянское 72.5%, 170г	169,99 ₽/шт	170 гр	https://www.perekrestok.ru/cat/121/p/maslo-slivocnoe-korovka-iz-korenovki-krestanskoe-72-5-170g-4246924	Sun Jul  7 17:25:48 2024	Масло сливочное Коровка Из Кореновки Крестьянское 72.5%, 170г	Цена174,99 ₽	Коровка из Кореновки	662.0	1.0 г	72.5 г	1.4 г	Сливки пастеризованные. 	True	True	Sun Jul  7 17:51:16 2024
Масло сливочное Кубанская буренка 72.5%, 180г	154,99 ₽/шт	180 гр	https://www.perekrestok.ru/cat/121/p/maslo-slivocnoe-kubanskaa-burenka-72-5-180g-2030818	Sun Jul  7 17:25:48 2024	Масло сливочное Кубанская буренка 72.5%, 180г	Цена159,99 ₽	Кубанская Буренка	662.0	1.0 г	72.5 г	1.4 г	Сливки пастеризованные. 	True	True	Sun Jul  7 17:51:17 2024
Масло сладкосливочное Молочная Легенда Крестьянское высшего сорта 72.5%, 180г	119,99 ₽/шт	180 мл	https://www.perekrestok.ru/cat/121/p/maslo-sladkoslivocnoe-molocnaa-legenda-krestanskoe-vyssego-sorta-72-5-180g-3972823	Sun Jul  7 17:25:48 2024	Масло сладкосливочное Молочная Легенда Крестьянское высшего сорта 72.5%, 180г	Цена119,99 ₽	Молочная легенда	662.0	1.0 г	72.5 г	1.4 г	Пастеризованные сливки из коровьего молока. 	True	True	Sun Jul  7 17:51:18 2024
Масло сливочное Ставрополье Крестьянское несолёное высшего сорта 72.5%, 200г	149,99 ₽/шт	200 гр	https://www.perekrestok.ru/cat/121/p/maslo-slivocnoe-stavropole-krestanskoe-nesolenoe-vyssego-sorta-72-5-200g-3608301	Sun Jul  7 17:25:48 2024	Масло сливочное Ставрополье Крестьянское несолёное высшего сорта 72.5%, 200г	Цена149,99 ₽	Ставрополье	662.0	1.0 г	72.5 г	1.4 г	none	True	True	Sun Jul  7 17:51:19 2024
Масло сливочное Молочный Родник Крестьянское 72.5%, 180г	159,99 ₽/шт	180 гр	https://www.perekrestok.ru/cat/121/p/maslo-slivocnoe-molocnyj-rodnik-krestanskoe-72-5-180g-3488983	Sun Jul  7 17:25:48 2024	Масло сливочное Молочный Родник Крестьянское 72.5%, 180г	Цена159,99 ₽	Молочный Родник	650.0	1.0 г	72.5 г	1.4 г	none	True	True	Sun Jul  7 17:51:20 2024
Масло Николаевские Сыроварни Традиционное сливочное 82.5%, 170г	189,99 ₽/шт	170 гр	https://www.perekrestok.ru/cat/121/p/maslo-nikolaevskie-syrovarni-tradicionnoe-slivocnoe-82-5-170g-4300869	Sun Jul  7 17:33:01 2024	Масло Николаевские Сыроварни Традиционное сливочное 82.5%, 170г	Цена189,99 ₽	Николаевские Сыроварни	748.1	0.6 г	82.5 г	0.8 г	Пастеризованные сливки. 	True	True	Sun Jul  7 17:51:21 2024
Масло Белое Золото сладко-сливочное несоленое из козьего молока 82,5%, 100г	269,99 ₽/шт	100 гр	https://www.perekrestok.ru/cat/121/p/maslo-beloe-zoloto-sladko-slivocnoe-nesolenoe-iz-kozego-moloka-82-5-100g-4254553	Sun Jul  7 17:33:01 2024	Масло Белое Золото сладко-сливочное несоленое из козьего молока 82,5%, 100г	Цена239,99 ₽	Белое Золото	748.0	0.6 г	82.5 г	0.9 г	Сливки пастеризованные из козьего молока. 	True	True	Sun Jul  7 17:51:22 2024
Масло сладкосливочное Новая Деревня несолёное 82.5%, 180г	259,99 ₽/шт	180 гр	https://www.perekrestok.ru/cat/121/p/maslo-sladkoslivocnoe-novaa-derevna-nesolenoe-82-5-180g-3358549	Sun Jul  7 17:33:01 2024	Масло сладкосливочное Новая Деревня несолёное 82.5%, 180г	Цена184,99 ₽	Новая Деревня	750.0	0.6 г	82.5 г	0.8 г	Высокожирные пастеризованные сливки. 	True	True	Sun Jul  7 17:51:23 2024
Масло сладкосливочное Белый Медведь Фермерское Премиум несолёное 82.5%, 380г	369,99 ₽/шт	380 гр	https://www.perekrestok.ru/cat/121/p/maslo-sladkoslivocnoe-belyj-medved-fermerskoe-premium-nesolenoe-82-5-380g-4225226	Sun Jul  7 17:33:01 2024	Масло сладкосливочное Белый Медведь Фермерское Премиум несолёное 82.5%, 380г	Цена389,99 ₽	Белый Медведь	748.0	0.6 г	82.5 г	0.8 г	Сливки пастеризованные. 	True	True	Sun Jul  7 17:51:24 2024
Масло сливочное Кубанский Молочник Крестьянское 72.5%, 170г	169,99 ₽/шт	170 гр	https://www.perekrestok.ru/cat/121/p/maslo-slivocnoe-kubanskij-molocnik-krestanskoe-72-5-170g-2029483	Sun Jul  7 17:33:01 2024	Масло сливочное Кубанский Молочник Крестьянское 72.5%, 170г	Цена164,99 ₽	Кубанский Молочник	662.0	1.0 г	72.5 г	1.4 г	Пастеризованные сливки. 	True	True	Sun Jul  7 17:51:25 2024
Масло сливочное Белый Медведь Крестьянское 72.5%, 180г	179,99 ₽/шт	180 гр	https://www.perekrestok.ru/cat/121/p/maslo-slivocnoe-belyj-medved-krestanskoe-72-5-180g-3638580	Sun Jul  7 17:33:01 2024	Масло сливочное Белый Медведь Крестьянское 72.5%, 180г	Цена169,99 ₽	Белый Медведь	662.0	1.0 г	72.5 г	1.4 г	Сливки пастеризованные. 	True	True	Sun Jul  7 17:51:26 2024
