name	price	size	url	time	name_	price_	brand	calories	proteins	fats	carbos	composition	get_ok	parse_ok	time_
Соль морская йодированная поваренная пищевая Маркет Перекрёсток, 500г	69,99 ₽/шт	500 гр	https://www.perekrestok.ru/cat/101/p/sol-morskaa-jodirovannaa-povarennaa-pisevaa-market-perekrestok-500g-3652519	Wed Jul  3 15:03:01 2024	Соль морская йодированная поваренная пищевая Маркет Перекрёсток, 500г	Цена69,99 ₽	Маркет	0.0	0.0 г	0.0 г	0.0 г	Хлорид натрия (nacl не менее 98.40%), йодат калия (kio3, массовая доля йода от 11.25 до 40 мкг/г), агент антислеживающий е535 (массовая доля до 0.001%). 	True	True	Fri Jul  5 21:54:36 2024
Соль гималайская Зелёная Линия, 400г	99,99 ₽/шт	400 гр	https://www.perekrestok.ru/cat/101/p/sol-gimalajskaa-zelenaa-linia-400g-4221321	Wed Jul  3 15:03:01 2024	Соль гималайская Зелёная Линия, 400г	Цена134,99 ₽	Зелёная Линия	0.0	0.0 г	0.0 г	0.0 г	Соль каменная гималайская розовая пищевая. 	True	True	Fri Jul  5 21:54:37 2024
Соль Адыгейская Абадзехская поваренная пищевая Маркет Перекрёсток, 300г	69,99 ₽/шт	300 гр	https://www.perekrestok.ru/cat/101/p/sol-adygejskaa-abadzehskaa-povarennaa-pisevaa-market-perekrestok-300g-4105539	Wed Jul  3 15:03:01 2024	Соль Адыгейская Абадзехская поваренная пищевая Маркет Перекрёсток, 300г	Цена95,99 ₽	Маркет	27.0	4.3 г	0.2 г	1.9 г	Соль пищевая, кориандр, зелень петрушки, чеснок сушеный, зелень укропа, перец чёрный молотый, чабер сушеный. 	True	True	Fri Jul  5 21:54:38 2024
Соль пищевая универсальная с грузинскими травами Маркет Перекрёсток, 200г	129,99 ₽/шт	200 гр	https://www.perekrestok.ru/cat/101/p/sol-pisevaa-universalnaa-s-gruzinskimi-travami-market-perekrestok-200g-4105542	Wed Jul  3 15:03:01 2024	Соль пищевая универсальная с грузинскими травами Маркет Перекрёсток, 200г	Цена164,99 ₽	Маркет	167.0	6.5 г	6.6 г	20.1 г	"Соль пищевая, куркума, кориандр молотый, чеснок, семя укропа,, смесь пряностей ""хмели-сунели"", лук, морковь, базилик, петрушка, укроп, майоран. "	True	True	Fri Jul  5 21:54:39 2024
Соль поваренная пищевая крупная, 1кг	13,90 ₽/шт	1000 гр	https://www.perekrestok.ru/cat/101/p/sol-povarennaa-pisevaa-krupnaa-1kg-3255026	Wed Jul  3 15:03:01 2024	Соль поваренная пищевая крупная, 1кг	Цена11,99 ₽	Славяна	378.0	6.0 г	24.6 г	32.7 г	Соль. 	True	True	Fri Jul  5 21:54:41 2024
Соль поваренная пищевая мелкая, 1кг	25,99 ₽/шт	1000 гр	https://www.perekrestok.ru/cat/101/p/sol-povarennaa-pisevaa-melkaa-1kg-3231335	Wed Jul  3 15:03:01 2024	Соль поваренная пищевая мелкая, 1кг	Цена20,90 ₽	Тендер	0.0	0.0 г	0.0 г	0.0 г	Соль. 	True	True	Fri Jul  5 21:54:44 2024
Соль Salina каменная поваренная пищевая помол №1, 1кг	39,99 ₽/шт	1000 гр	https://www.perekrestok.ru/cat/101/p/sol-salina-kamennaa-povarennaa-pisevaa-pomol-no1-1kg-3450465	Wed Jul  3 15:03:01 2024	Соль Salina каменная поваренная пищевая помол №1, 1кг	Цена37,99 ₽	Salina	none	none	none	none	Хлорид натрия не менее 97.7%. 	True	True	Fri Jul  5 21:54:45 2024
Соль Salina пищевая каменная, 1кг	39,99 ₽/шт	1000 гр	https://www.perekrestok.ru/cat/101/p/sol-salina-pisevaa-kamennaa-1kg-3958082	Wed Jul  3 15:03:01 2024	Соль Salina пищевая каменная, 1кг	Цена39,99 ₽	Salina	0.0	0.0 г	0.0 г	0.0 г	Хлористый натрий (NaCI), массовая доля не менее 98,4%. 	True	True	Fri Jul  5 21:54:47 2024
Соль Илецкая поваренная пищевая высшего сорта помол 1, 500г	83,99 ₽/шт	500 гр	https://www.perekrestok.ru/cat/101/p/sol-ileckaa-povarennaa-pisevaa-vyssego-sorta-pomol-1-500g-3613637	Wed Jul  3 15:03:01 2024	Соль Илецкая поваренная пищевая высшего сорта помол 1, 500г	Цена79,99 ₽	Илецкая	0.0	0.0 г	0.0 г	0.0 г	Хлористый натрий, кальций-ион, магний-ион, сульфат-ион, селен (Se). 	True	True	Fri Jul  5 21:54:48 2024
Соль Валетек пищевая с пониженным содержанием натрия-калий-магний-йод, 350г	83,99 ₽/шт	350 гр	https://www.perekrestok.ru/cat/101/p/sol-valetek-pisevaa-s-ponizennym-soderzaniem-natria-kalij-magnij-jod-350g-3393119	Wed Jul  3 15:03:01 2024	Соль Валетек пищевая с пониженным содержанием натрия-калий-магний-йод, 350г	Цена78,99 ₽	Валетек	0.0	0.0 г	0.0 г	0.0 г	Соль поваренная пищевая, калий хлористый, магний сернокислый, калий йодноватокислый. 	True	True	Fri Jul  5 21:54:48 2024
Соль Илецкая поваренная пищевая высшего сорта помол 1, 180г	63,99 ₽/шт	180 гр	https://www.perekrestok.ru/cat/101/p/sol-ileckaa-povarennaa-pisevaa-vyssego-sorta-pomol-1-180g-3613636	Wed Jul  3 15:03:01 2024	Соль Илецкая поваренная пищевая высшего сорта помол 1, 180г	Цена61,99 ₽	Илецкая	0.0	0.0 г	0.0 г	0.0 г	Хлористый натрий, кальций-ион, магний-ион, сульфат-ион, селен. 	True	True	Fri Jul  5 21:54:49 2024
Соль Четверговая Чёрная поваренная пищевая, 140г	124,99 ₽/шт	140 гр	https://www.perekrestok.ru/cat/101/p/sol-cetvergovaa-cernaa-povarennaa-pisevaa-140g-3632102	Wed Jul  3 15:03:01 2024	Соль Четверговая Чёрная поваренная пищевая, 140г	Цена124,99 ₽	Четверговая	0.0	0.0 г	0.0 г	0.0 г	Соль поваренная пищевая, мука ржано-обдирная. 	True	True	Fri Jul  5 21:54:50 2024
Соль 4life морская атлантическая йодированная пищевая мелкая, 500г	179,99 ₽/шт	500 гр	https://www.perekrestok.ru/cat/101/p/sol-4life-morskaa-atlanticeskaa-jodirovannaa-pisevaa-melkaa-500g-4117216	Wed Jul  3 15:03:01 2024	Соль 4life морская атлантическая йодированная пищевая мелкая, 500г	Цена179,99 ₽	4Life	0.0	0.0 г	0.0 г	0.0 г	Морская соль, йодат калия. 	True	True	Fri Jul  5 21:54:52 2024
Соль 4Life морская йодированная пищевая мелкая, 250г	104,99 ₽/шт	250 мл	https://www.perekrestok.ru/cat/101/p/sol-4life-morskaa-jodirovannaa-pisevaa-melkaa-250g-3507368	Wed Jul  3 15:03:01 2024	Соль 4Life морская йодированная пищевая мелкая, 250г	Цена104,99 ₽	4Life	0.0	0.0 г	0.0 г	0.0 г	Морская соль, йодат калия. 	True	True	Fri Jul  5 21:54:53 2024
Соль 4Life морская йодированная пищевая мелкая, 1кг	119,99 ₽/шт	1000 гр	https://www.perekrestok.ru/cat/101/p/sol-4life-morskaa-jodirovannaa-pisevaa-melkaa-1kg-2157581	Wed Jul  3 15:03:01 2024	Соль 4Life морская йодированная пищевая мелкая, 1кг	Цена114,99 ₽	4Life	0.0	0.0 г	0.0 г	0.0 г	Морская соль, йодат калия. 	True	True	Fri Jul  5 21:54:54 2024
Соль йодированная Экстра Пр!ст, 500г	69,99 ₽/шт	500 гр	https://www.perekrestok.ru/cat/101/p/sol-jodirovannaa-ekstra-pr-st-500g-4335115	Wed Jul  3 15:03:01 2024	Соль йодированная Экстра Пр!ст, 500г	Цена69,99 ₽	Пр!ст	0.0	0.0 г	0.0 г	0.0 г	Хлористый натрий (NACl), массовая доля не менее 99,7%; йодат калия (KIO3), массовая доля йода не более 0,04мг/г, атислеживающий агент Е536, массовая доля до 0,001%. 	True	True	Fri Jul  5 21:54:56 2024
Соль Setra йодированная мелкая, 500г	59,99 ₽/шт	500 гр	https://www.perekrestok.ru/cat/101/p/sol-setra-jodirovannaa-melkaa-500g-3224596	Wed Jul  3 15:03:01 2024	Соль Setra йодированная мелкая, 500г	Цена89,99 ₽	Setra	0.0	0.0 г	0.0 г	0.0 г	Морская соль садочная, йодат калия. 	True	True	Fri Jul  5 21:54:57 2024
Соль йодированная пищевая Маркет, 500г	49,99 ₽/шт	500 гр	https://www.perekrestok.ru/cat/101/p/sol-jodirovannaa-pisevaa-market-500g-4266811	Wed Jul  3 15:03:01 2024	Соль йодированная пищевая Маркет, 500г	Цена49,99 ₽	Маркет	0.0	0.0 г	0.0 г	0.0 г	Хлористый натрий (nacl), массовая доля не менее 99,7%, йодат калия (kio3), массовая доля йода 11,25-40,00 мкг/г, антислеживающий агент е536 (массовая доля до 0,001%). 	True	True	Fri Jul  5 21:54:58 2024
Соль Setra йодированная пищевая крупная, 500г	59,99 ₽/шт	500 гр	https://www.perekrestok.ru/cat/101/p/sol-setra-jodirovannaa-pisevaa-krupnaa-500g-3424885	Wed Jul  3 15:03:01 2024	Соль Setra йодированная пищевая крупная, 500г	Цена99,99 ₽	Setra	0.0	0.0 г	0.0 г	0.0 г	Морская соль садочная, йодат калия. 	True	True	Fri Jul  5 21:54:59 2024
Соль Setra йодированная мелкая, 250г	109,99 ₽/шт	250 гр	https://www.perekrestok.ru/cat/101/p/sol-setra-jodirovannaa-melkaa-250g-3224598	Wed Jul  3 15:03:01 2024	Соль Setra йодированная мелкая, 250г	Цена144,99 ₽	Setra	0.0	0.0 г	0.0 г	0.0 г	Морская соль садочная, йодат калия. 	True	True	Fri Jul  5 21:55:00 2024
Соль пищевая морская йодированная помол №0 Маркет, 250г	79,99 ₽/шт	250 гр	https://www.perekrestok.ru/cat/101/p/sol-pisevaa-morskaa-jodirovannaa-pomol-no0-market-250g-4328849	Wed Jul  3 15:03:01 2024	Соль пищевая морская йодированная помол №0 Маркет, 250г	Цена79,99 ₽	Маркет	0.0	0.0 г	0.0 г	0.0 г	Хлористый натрий (NaCl), массовая доля не менее 98,4%; йодат калия (KiO3), массовая доля йода не более 0,04 мг/г; антислеживающий агент Е535, массовая доля до 0,001%. 	True	True	Fri Jul  5 21:55:01 2024
Соль 4Life Гималайская розовая мелкая, 250г	159,99 ₽/шт	250 гр	https://www.perekrestok.ru/cat/101/p/sol-4life-gimalajskaa-rozovaa-melkaa-250g-4332741	Wed Jul  3 15:03:01 2024	Соль 4Life Гималайская розовая мелкая, 250г	Цена159,99 ₽	4Life	0.0	0.0 г	0.0 г	0.0 г	Соль пищевая розовая гималайская мелкая 	True	True	Fri Jul  5 21:55:05 2024
Соль Вкусная Соль с чесноком-зеленью-пряностями-овощами, 400г	99,99 ₽/шт	400 гр	https://www.perekrestok.ru/cat/101/p/sol-vkusnaa-sol-s-cesnokom-zelenu-pranostami-ovosami-400g-3138271	Wed Jul  3 15:03:01 2024	Соль Вкусная Соль с чесноком-зеленью-пряностями-овощами, 400г	Цена99,99 ₽	Вкусная Соль	0.0	0.0 г	0.0 г	0.0 г	Соль поваренная пищевая, чеснок, зелень сельдерея, кориандр, базилик, куркума, эфирное масло чеснока. 	True	True	Fri Jul  5 21:55:05 2024
Соль Вкусная Соль 7 Блюд с пряностями и овощами, 400г	99,99 ₽/шт	400 гр	https://www.perekrestok.ru/cat/101/p/sol-vkusnaa-sol-7-blud-s-pranostami-i-ovosami-400g-3138162	Wed Jul  3 15:03:01 2024	Соль Вкусная Соль 7 Блюд с пряностями и овощами, 400г	Цена99,99 ₽	Вкусная Соль	0.0	0.0 г	0.0 г	0.0 г	Соль поваренная пищевая, зелень сельдерея, лук репчатый, паприка, чеснок, морковь, мускатный орех, тмин, куркума, кумин. 	True	True	Fri Jul  5 21:55:06 2024
Соль Щепотка Чесночная пищевая, 120г	59,99 ₽/шт	120 гр	https://www.perekrestok.ru/cat/101/p/sol-sepotka-cesnocnaa-pisevaa-120g-4256519	Wed Jul  3 15:03:01 2024	Соль Щепотка Чесночная пищевая, 120г	Цена77,99 ₽	Щепотка	0.0	0.0 г	0.0 г	0.0 г	Соль пищевая, чеснок гранулированный, петрушка сушеная, сельдерей зелень, лук порошок, базилик, укроп сушеный, майоран, лавровый лист молотый, розмарин, орегано, тимьян. 	True	True	Fri Jul  5 21:55:07 2024
Соль Щепотка Душистые травы пищевая, 120г	59,99 ₽/шт	120 гр	https://www.perekrestok.ru/cat/101/p/sol-sepotka-dusistye-travy-pisevaa-120g-4256520	Wed Jul  3 15:03:01 2024	Соль Щепотка Душистые травы пищевая, 120г	Цена81,99 ₽	Щепотка	0.0	0.0 г	0.0 г	0.0 г	Соль пищевая, петрушка сушеная, базилик, укроп сушеный, лавровый лист молотый, розмарин, майоран, орегано, тимьян, сельдерей зелень. 	True	True	Fri Jul  5 21:55:09 2024
Соль Маркет пищевая вываренная, 500г	45,99 ₽/шт	500 гр	https://www.perekrestok.ru/cat/101/p/sol-market-pisevaa-vyvarennaa-500g-4266810	Wed Jul  3 15:03:01 2024	Соль Маркет пищевая вываренная, 500г	Цена45,99 ₽	Маркет	0.0	0.0 г	0.0 г	0.0 г	Хлористый натрий (nacl) массовая доля не менее 99,7%, антислеживающий агент е536 (массовая доля до 0,001%). 	True	True	Fri Jul  5 21:55:10 2024
