name	price	size	url	time	name_	price_	brand	calories	proteins	fats	carbos	composition	get_ok	parse_ok	time_
Виски Fox & Dogs Эпл Пай со вкусом яблочного пирога 35%, 700мл	999,99 ₽/шт	700 мл	https://www.perekrestok.ru/cat/5/p/viski-fox-dogs-epl-paj-so-vkusom-ablocnogo-piroga-35-700ml-4227693	Wed Jul  3 15:05:23 2024	Виски Fox & Dogs Эпл Пай со вкусом яблочного пирога 35%, 700мл	Цена799,99 ₽	Фокс Энд Догс	215.0	0.0 г	0.0 г	5.0 г	"Выдержанные зерновые дистилляты из Шотландии (висковые выдержанные дистилляты) из зерна злаковых культур (ячмень, пшеница, кукуруза), вода питьевая исправленная, сахарный сироп инвертный, ароматизаторы пищевые натуральные: ""яблочный пирог"", ""яблоко"", пищевая добавка: краситель Е150а. "	True	True	Sat Jul  6 00:04:08 2024
Виски Seven Yards 7-летний 40%, 500мл	1 399,00 ₽/шт	500 мл	https://www.perekrestok.ru/cat/5/p/viski-seven-yards-7-letnij-40-500ml-4237813	Wed Jul  3 15:05:23 2024	Виски Seven Yards 7-летний 40%, 500мл	Цена819,99 ₽	none	220.0	0.0 г	0.0 г	0.0 г	Купаж солодовых и зерновых шотландских висковых дистеллятов 7-летней выдержки, вода питьевая исправленная, краситель - сахарный колер | простой (E150a). 	True	True	Sat Jul  6 00:04:09 2024
Виски Yacht Club 3-летний 40%, 700мл	1 399,00 ₽/шт	700 мл	https://www.perekrestok.ru/cat/5/p/viski-yacht-club-3-letnij-40-700ml-3419129	Wed Jul  3 15:05:23 2024	Виски Yacht Club 3-летний 40%, 700мл	Цена1 199,00 ₽	Yacht Club	221.0	0.1 г	0.1 г	1.0 г	Краситель, сахарный колер E150a купаж зерновых и солодовых спиртов, вода деминерализованная. 	True	True	Sat Jul  6 00:04:10 2024
Напиток спиртной Ole Smoky Манго Хабанеро на основе виски со вкусом манго и хабанеро 35%, 750мл	1 799,00 ₽/шт	750 мл	https://www.perekrestok.ru/cat/5/p/napitok-spirtnoj-ole-smoky-mango-habanero-na-osnove-viski-so-vkusom-mango-i-habanero-35-750ml-4212851	Wed Jul  3 15:05:23 2024	Напиток спиртной Ole Smoky Манго Хабанеро на основе виски со вкусом манго и хабанеро 35%, 750мл	Цена2 199,00 ₽	Ole Smoky	267.0	0.0 г	0.0 г	19.1 г	Сок манго-клюква, виски, кукурузный сироп, ароматизатор манго, натуральный ароматизатор манго. 	True	True	Sat Jul  6 00:04:11 2024
Напиток спиртной Ole Smoky Пич Виски на основе виски с ароматом персика 30%, 750мл	1 799,00 ₽/шт	750 мл	https://www.perekrestok.ru/cat/5/p/napitok-spirtnoj-ole-smoky-pic-viski-na-osnove-viski-s-aromatom-persika-30-750ml-4212849	Wed Jul  3 15:05:23 2024	Напиток спиртной Ole Smoky Пич Виски на основе виски с ароматом персика 30%, 750мл	Цена2 199,00 ₽	Ole Smoky	214.0	0.0 г	0.0 г	12.6 г	Вода, виски, тростниковый сахар, натуральный ароматизатор персика, карамельный колер. 	True	True	Sat Jul  6 00:04:11 2024
Напиток спиртной Ole Smoky Синомон на основе виски с ароматом корицы 35%, 750мл	1 799,00 ₽/шт	750 мл	https://www.perekrestok.ru/cat/5/p/napitok-spirtnoj-ole-smoky-sinomon-na-osnove-viski-s-aromatom-koricy-35-750ml-4212852	Wed Jul  3 15:05:23 2024	Напиток спиртной Ole Smoky Синомон на основе виски с ароматом корицы 35%, 750мл	Цена2 199,00 ₽	Ole Smoky	267.0	0.0 г	0.0 г	19.1 г	Вода, виски, кукурузный сироп с высоким содержанием фруктозы, натуральный ароматизатор корицы, карамельный колер. 	True	True	Sat Jul  6 00:04:12 2024
Напиток спиртной Ole Smoky Куки Ду на основе виски с ароматом молочного шоколада 30%, 750мл	1 799,00 ₽/шт	750 мл	https://www.perekrestok.ru/cat/5/p/napitok-spirtnoj-ole-smoky-kuki-du-na-osnove-viski-s-aromatom-molocnogo-sokolada-30-750ml-4212850	Wed Jul  3 15:05:23 2024	Напиток спиртной Ole Smoky Куки Ду на основе виски с ароматом молочного шоколада 30%, 750мл	Цена2 199,00 ₽	Ole Smoky	244.0	0.0 г	0.0 г	19.8 г	Вода, виски, тростниковый сахар, ароматизатор молочного шоколада, ароматизатор тесто для печенья, колер. 	True	True	Sat Jul  6 00:04:13 2024
Напиток спиртной Fireball на основе виски 33%, 750мл	1 359,00 ₽/шт	750 мл	https://www.perekrestok.ru/cat/5/p/napitok-spirtnoj-fireball-na-osnove-viski-33-750ml-4162473	Wed Jul  3 15:05:23 2024	Напиток спиртной Fireball на основе виски 33%, 750мл	Цена1 449,00 ₽	Fireball	272.0	0.0 г	0.0 г	23.0 г	Вода питьевая, висковый зерновой дистиллят, выдержанный не менее 3 лет, сахар белый, натуральный ароматизатор (корица). 	True	True	Sat Jul  6 00:04:13 2024
Виски Aberlour 12-летний 40%, 700мл	6 699,00 ₽/шт	700 мл	https://www.perekrestok.ru/cat/5/p/viski-aberlour-12-letnij-40-700ml-3606992	Wed Jul  3 15:05:23 2024	Виски Aberlour 12-летний 40%, 700мл	Цена6 699,00 ₽	Aberlour	0.0	0.0 г	0.0 г	0.0 г	Ячменный солодовый выдержанный висковый дистиллят, вода исправленная, краситель - сахарный колер (Е150а). 	True	True	Sat Jul  6 00:04:14 2024
Виски Yacht Club 3-летний 40%, 500мл	1 749,00 ₽/шт	500 мл	https://www.perekrestok.ru/cat/5/p/viski-yacht-club-3-letnij-40-500ml-4038518	Thu Jul  4 10:33:25 2024	Виски Yacht Club 3-летний 40%, 500мл	Цена759,99 ₽	Yacht Club	221.0	0.1 г	0.1 г	1.0 г	Краситель, сахарный колер E150a купаж зерновых и солодовых спиртов, вода деминерализованная. 	True	True	Sat Jul  6 00:04:15 2024
Виски Seven Yards шотландский купажированный 40%, 500мл	719,99 ₽/шт	500 мл	https://www.perekrestok.ru/cat/5/p/viski-seven-yards-sotlandskij-kupazirovannyj-40-500ml-4216297	Thu Jul  4 10:33:25 2024	Виски Seven Yards шотландский купажированный 40%, 500мл	Цена519,99 ₽	Seven Yards	220.0	0.0 г	0.0 г	0.0 г	Купаж солодовых и зерновых шотландских висковых дистиллятов, не менее 3-летней выдержки, вода питьевая исправленная, краситель сахарный колер простой (caramel l-plain) (e150a). 	True	True	Sat Jul  6 00:04:16 2024
Виски Black Mustang армянский купажированный 40% в подарочной упаковке, 500мл + стакан	539,99 ₽/шт	500 мл	https://www.perekrestok.ru/cat/5/p/viski-black-mustang-armanskij-kupazirovannyj-40-v-podarocnoj-upakovke-500ml-stakan-4262424	Thu Jul  4 10:33:25 2024	Виски Black Mustang армянский купажированный 40% в подарочной упаковке, 500мл + стакан	Цена839,99 ₽	Black Mustang	224.0	0.0 г	0.0 г	0.1 г	Дистиллят висковый солодовый выдержанный, дистиллят висковый зерновой выдержанный, вода подготовленная (исправленная), сахарный колер I простой (Е150а). 	True	True	Sat Jul  6 00:04:17 2024
Напиток спиртной Bells Апельсин зерновой дистиллированный купажированный креплёный 35%, 700мл	1 499,00 ₽/шт	700 мл	https://www.perekrestok.ru/cat/5/p/napitok-spirtnoj-bells-apelsin-zernovoj-distillirovannyj-kupazirovannyj-kreplenyj-35-700ml-4199605	Thu Jul  4 10:33:25 2024	Напиток спиртной Bells Апельсин зерновой дистиллированный купажированный креплёный 35%, 700мл	Цена1 499,00 ₽	Bells	200.0	0.0 г	0.0 г	1.0 г	Дистиллят зерновой выдержанный (смесь зерновых дистиллятов из зерна злаковых культур: пшеница, кукуруза, ячмень), вода питьевая исправленная, сахарный сироп, ароматизатор пищевой натуральный, краситель: Е150а. 	True	True	Sat Jul  6 00:04:17 2024
Виски Johnnie Walker Black Label 12-летний шотландский купажированный 43%, 750мл + 2 бокала	3 999,00 ₽/шт	700 мл	https://www.perekrestok.ru/cat/5/p/viski-johnnie-walker-black-label-12-letnij-sotlandskij-kupazirovannyj-43-750ml-2-bokala-4175756	Thu Jul  4 10:33:25 2024	Виски Johnnie Walker Black Label 12-летний шотландский купажированный 43%, 750мл + 2 бокала	Цена3 999,00 ₽	Johnnie Walker	222.0	0.0 г	0.0 г	0.0 г	Вода исправленная, висковые зерновые выдержанные дистилляты, висковые солодовые выдержанные дистилляты, краситель: Е150а. 	True	True	Sat Jul  6 00:04:18 2024
Напиток спиртной William Lawsons Супер Чили купажированный 35%, 700мл	1 049,00 ₽/шт	700 мл	https://www.perekrestok.ru/cat/5/p/napitok-spirtnoj-william-lawsons-super-cili-kupazirovannyj-35-700ml-4073519	Thu Jul  4 10:33:25 2024	Напиток спиртной William Lawsons Супер Чили купажированный 35%, 700мл	Цена1 299,00 ₽	William Lawsons	225.0	0.0 г	0.0 г	7.0 г	Вода питьевая исправленная, Висковые зерновые выдержанные дистилляты злаковых культур, Сахарный сироп инвертный, Ароматизатор пищевой: «Ванильный со специями», Пищевая добавка: краситель E150a. 	True	True	Sat Jul  6 00:04:19 2024
Виски Tullamore DEW 40%, 700мл	1 699,00 ₽/шт	700 мл	https://www.perekrestok.ru/cat/5/p/viski-tullamore-dew-40-700ml-18002	Thu Jul  4 10:33:25 2024	Виски Tullamore DEW 40%, 700мл	Цена1 699,00 ₽	Tullamore Dew	220.0	none	none	none	Вода питьевая подготовленная, зерновые и солодовые дистилляры, выдержанные не менее 3 лет, пищевая добавка-пищевой Краситель Е150а. 	True	True	Sat Jul  6 00:04:20 2024
Виски Bell's Spiced купажированный, 0.7л	999,99 ₽/шт	700 мл	https://www.perekrestok.ru/cat/5/p/viski-bells-spiced-kupazirovannyj-0-7l-3501783	Thu Jul  4 10:33:25 2024	Виски Bell's Spiced купажированный, 0.7л	Цена999,99 ₽	Bells	210.0	0.0 г	0.0 г	4.0 г	Вода исправленная, выдержанные зерновые дистилляты на основе ячменного солода и пшеницы, сахарный сироп, натуральные ароматизаторы (корица, ваниль, абрикос, инжир), краситель: Е150а. 	True	True	Sat Jul  6 00:04:21 2024
Виски Aberfeldy 12-летний шотландский солодовый 40%, 700мл	7 199,00 ₽/шт	700 мл	https://www.perekrestok.ru/cat/5/p/viski-aberfeldy-12-letnij-sotlandskij-solodovyj-40-700ml-3500211	Thu Jul  4 10:33:25 2024	Виски Aberfeldy 12-летний шотландский солодовый 40%, 700мл	Цена7 199,00 ₽	Aberfeldy	0.0	0.0 г	0.0 г	0.0 г	Вода питьевая исправленная, Висковый солодовый выдержанный дистиллят, Пищевая добавка. 	True	True	Sat Jul  6 00:04:21 2024
Виски Caisteal Chamuis 12 Y.O. шотландский солодовый 46%, 700мл	6 599,00 ₽/шт	700 мл	https://www.perekrestok.ru/cat/5/p/viski-caisteal-chamuis-12-y-o-sotlandskij-solodovyj-46-700ml-4339876	Thu Jul  4 10:33:25 2024	Виски Caisteal Chamuis 12 Y.O. шотландский солодовый 46%, 700мл	Цена6 599,00 ₽	none	260.0	0.0 г	0.0 г	0.0 г	none	True	True	Sat Jul  6 00:04:22 2024
Виски Hatozaki Пью Молт солодовый 46%, 700мл	4 429,00 ₽/шт	700 мл	https://www.perekrestok.ru/cat/5/p/viski-hatozaki-pu-molt-solodovyj-46-700ml-4177170	Thu Jul  4 10:33:25 2024	Виски Hatozaki Пью Молт солодовый 46%, 700мл	Цена4 429,00 ₽	Hatozaki	260.0	0.0 г	0.0 г	0.0 г	Купаж солодовых висковых дистиллятов, вода исправленная. 	True	True	Sat Jul  6 00:04:23 2024
Висковый напиток Steersman Orange, 700мл	799,99 ₽/шт	700 мл	https://www.perekrestok.ru/cat/5/p/viskovyj-napitok-steersman-orange-700ml-4284250	Thu Jul  4 10:33:25 2024	Висковый напиток Steersman Orange, 700мл	Цена799,99 ₽	Steersman	220.0	0.0 г	0.0 г	5.0 г	"Вода питьевая исправленная, спирт этиловый ректификованный из пищевого сырья ""Альфа"", дистиллят висковый зерновой ,выдержанный в контакте с древесиной дуба не менее трех лет ""Бурбон"",сахарный сироп,спиртованный настой свежей корки плодов апельсина,пищевые добавки: краситель- сахарный колер I простой (Е150а), регулятор кислотности - лимонная кислота, ароматизаторы пищевые. "	True	True	Sat Jul  6 00:04:24 2024
Виски The Macallan Double Cask 12 Years Old 40% в подарочной упаковке, 700мл	9 999,00 ₽/шт	700 мл	https://www.perekrestok.ru/cat/5/p/viski-the-macallan-double-cask-12-years-old-40-v-podarocnoj-upakovke-700ml-4090527	Thu Jul  4 10:33:25 2024	Виски The Macallan Double Cask 12 Years Old 40% в подарочной упаковке, 700мл	Цена9 999,00 ₽	Macallan	220.0	0.0 г	0.0 г	0.0 г	Вода подготовленная, висковые солодовые выдержанные дистилляты. 	True	True	Sat Jul  6 00:04:25 2024
Виски Kinahans LL ирландский купажированный в наборе со стаканом, 700мл	3 399,00 ₽/шт	700 мл	https://www.perekrestok.ru/cat/5/p/viski-kinahans-ll-irlandskij-kupazirovannyj-v-nabore-so-stakanom-700ml-4311006	Thu Jul  4 10:33:25 2024	Виски Kinahans LL ирландский купажированный в наборе со стаканом, 700мл	Цена3 399,00 ₽	none	240.0	0.0 г	0.0 г	0.0 г	Вода исправленная, дистилляты висковые выдержанные (срок выдержки не менее 3 лет) зерновой и солодовый. 	True	True	Sat Jul  6 00:04:25 2024
Виски Bushmills Original подарочная упаковка со стаканом, 700мл	2 699,00 ₽/шт	700 мл	https://www.perekrestok.ru/cat/5/p/viski-bushmills-original-podarocnaa-upakovka-so-stakanom-700ml-4312734	Thu Jul  4 10:33:25 2024	Виски Bushmills Original подарочная упаковка со стаканом, 700мл	Цена2 699,00 ₽	Bushmills	220.0	0.0 г	0.0 г	0.1 г	Дистилят висковый солодовый выдержанный, исправленная вода, краситель: сахар, колер I простой (Е150а). 	True	True	Sat Jul  6 00:04:26 2024
Виски Black Ram Bourbon finish 3y cтакан, 700мл	1 749,00 ₽/шт	700 мл	https://www.perekrestok.ru/cat/5/p/viski-black-ram-bourbon-finish-3y-ctakan-700ml-4311005	Thu Jul  4 10:33:25 2024	Виски Black Ram Bourbon finish 3y cтакан, 700мл	Цена1 749,00 ₽	Black Ram	220.0	0.0 г	0.0 г	0.0 г	Вода исправленная, купаж висковых выдержанных дистиллятов (зерновых и солодовых), краситель e150a (карамель). 	True	True	Sat Jul  6 00:04:27 2024
Настойка Nucky Thompson Apple Pie на основе виски в наборе с тоником Major's 500мл, 700мл	999,00 ₽/шт	700 мл	https://www.perekrestok.ru/cat/5/p/nastojka-nucky-thompson-apple-pie-na-osnove-viski-v-nabore-s-tonikom-majors-500ml-700ml-4311342	Thu Jul  4 10:33:25 2024	Настойка Nucky Thompson Apple Pie на основе виски в наборе с тоником Major's 500мл, 700мл	Цена999,00 ₽	Nucky Thompson	220.0	0.0 г	0.0 г	5.0 г	Воды питьевая исправленная, дистиллят висковый шотландский купажированный, выдержанный не менее трех лет, спирт этиловый ректификованный из пищевого сырья «Люкс», сахар, натуральные ароматизаторы (яблоко, корица, ваниль, кардамон, мускатный орех), краситель – сахарный колер | простой. 	True	True	Sat Jul  6 00:04:27 2024
Виски Mossburn Island 46%, 700мл	3 799,00 ₽/шт	700 мл	https://www.perekrestok.ru/cat/5/p/viski-mossburn-island-46-700ml-4245413	Thu Jul  4 10:33:25 2024	Виски Mossburn Island 46%, 700мл	Цена3 799,00 ₽	none	263.0	0.0 г	0.0 г	0.0 г	Вода исправленная, купаж висковых солодовых выдержанных дистиллятов. 	True	True	Sat Jul  6 00:04:28 2024
Виски Torabhaig Альт Глен Легаси 46%, 700мл	5 799,00 ₽/шт	700 мл	https://www.perekrestok.ru/cat/5/p/viski-torabhaig-alt-glen-legasi-46-700ml-4245411	Thu Jul  4 10:33:25 2024	Виски Torabhaig Альт Глен Легаси 46%, 700мл	Цена5 799,00 ₽	none	260.0	0.0 г	0.0 г	0.0 г	Вода подготовленная (исправленная), дистилляты висковые солодовые выдержанные. 	True	True	Sat Jul  6 00:04:29 2024
Напиток спиртной Ole Smoky Блендед Виски с добавлением виски 40%, 750мл	2 499,00 ₽/шт	750 мл	https://www.perekrestok.ru/cat/5/p/napitok-spirtnoj-ole-smoky-blended-viski-s-dobavleniem-viski-40-750ml-4212854	Thu Jul  4 10:33:25 2024	Напиток спиртной Ole Smoky Блендед Виски с добавлением виски 40%, 750мл	Цена2 499,00 ₽	Ole Smoky	233.0	0.0 г	0.0 г	21.9 г	Вода, зерновые спирты, виски Теннесси, карамельный колер. 	True	True	Sat Jul  6 00:04:30 2024
Виски Glenfiddich 15-летний 40% в подарочной упаковке, 700мл	7 699,00 ₽/шт	700 мл	https://www.perekrestok.ru/cat/5/p/viski-glenfiddich-15-letnij-40-v-podarocnoj-upakovke-700ml-4061119	Thu Jul  4 10:33:25 2024	Виски Glenfiddich 15-летний 40% в подарочной упаковке, 700мл	Цена7 699,00 ₽	Glenfiddich	220.0	0.0 г	0.0 г	0.0 г	Вода питьевая подготовленная, солодовый дистиллят, выдержанный 15 лет, пищевая добавка: пищевой краситель E150a. 	True	True	Sat Jul  6 00:04:31 2024
Виски Aiffat купажированный в подарочной упаковке 40%, 700мл	1 299,00 ₽/шт	700 мл	https://www.perekrestok.ru/cat/5/p/viski-aiffat-kupazirovannyj-v-podarocnoj-upakovke-40-700ml-4291573	Sat Jul  6 19:18:30 2024	Виски Aiffat купажированный в подарочной упаковке 40%, 700мл	Цена1 299,00 ₽	none	250.0	0.0 г	0.0 г	0.0 г	Висковые выдержанные дистилляты (зерновые и солодовые), вода подготовленная (исправленная) , краситель сахарный колер l простой (Caramel l - Plain). 	True	True	Sat Jul  6 19:18:30 2024
Виски Нествил купажированный 40%, 500мл	1 799,00 ₽/шт	500 мл	https://www.perekrestok.ru/cat/5/p/viski-nestvil-kupazirovannyj-40-500ml-4257228	Sat Jul  6 19:32:59 2024	Виски Нествил купажированный 40%, 500мл	Цена1 099,00 ₽	none	220.0	0.0 г	0.0 г	0.1 г	Состав: вода исправленная, солодовый и зерновой висковый выдержанный дистиллят, краситель - сахарный колер. 	True	True	Sat Jul  6 20:04:32 2024
Виски Wilson & Ford купажированный 40%, 700мл	1 549,00 ₽/шт	700 мл	https://www.perekrestok.ru/cat/5/p/viski-wilson-ford-kupazirovannyj-40-700ml-4293163	Sat Jul  6 19:32:59 2024	Виски Wilson & Ford купажированный 40%, 700мл	Цена1 549,00 ₽	Wilson & Ford	224.0	0.0 г	0.0 г	0.0 г	Купаж висковых солодовых выдержанных и висковых зерновых (бурбон) выдержанных дистиллятов, выдержанных не менее трех лет в дубовых бочках, вода подготовленная, натуральный краситель сахарный колер I простой(Е150а) 	True	True	Sat Jul  6 20:04:32 2024
Виски Hunting Lodge купажированный 40%, 700мл	1 399,00 ₽/шт	700 мл	https://www.perekrestok.ru/cat/5/p/viski-hunting-lodge-kupazirovannyj-40-700ml-4293162	Sat Jul  6 19:32:59 2024	Виски Hunting Lodge купажированный 40%, 700мл	Цена1 399,00 ₽	Hunting Lodge	224.0	0.0 г	0.0 г	0.0 г	Состав: Висковый зерновой(пшеница) выдержанный дистиллят, висковый солодовый(ячмень) выдержанный дистиллят, вода исправленная, краситель – сахарный колер I простой (Е150а) 	True	True	Sat Jul  6 20:04:33 2024
Виски Hunting Lodge шотландский купажированный 40%, 500мл	1 149,00 ₽/шт	500 мл	https://www.perekrestok.ru/cat/5/p/viski-hunting-lodge-sotlandskij-kupazirovannyj-40-500ml-4292852	Sat Jul  6 19:32:59 2024	Виски Hunting Lodge шотландский купажированный 40%, 500мл	Цена1 149,00 ₽	Hunting Lodge	224.0	0.0 г	0.0 г	0.0 г	Состав: Висковый зерновой(пшеница) выдержанный дистиллят, висковый солодовый(ячмень) выдержанный дистиллят, вода исправленная, краситель – сахарный колер I простой (Е150а) 	True	True	Sat Jul  6 20:04:34 2024
Виски Glen Forest шотландский купажированный 40%, 500мл	999,99 ₽/шт	500 мл	https://www.perekrestok.ru/cat/5/p/viski-glen-forest-sotlandskij-kupazirovannyj-40-500ml-4292260	Sat Jul  6 19:32:59 2024	Виски Glen Forest шотландский купажированный 40%, 500мл	Цена999,99 ₽	Glen Forest	221.0	0.0 г	0.0 г	0.0 г	Вода исправленная, дистилляты висковые зерновые и солодовые, пищевая добавка краситель-сахарный колер I простой (Е150а). Срок выдержки висковых дистиллятов не менее 3 лет. 	True	True	Sat Jul  6 20:04:35 2024
Виски Элдермен шотландский купажированный, 500мл	999,99 ₽/шт	500 мл	https://www.perekrestok.ru/cat/5/p/viski-eldermen-sotlandskij-kupazirovannyj-500ml-4287557	Sat Jul  6 19:32:59 2024	Виски Элдермен шотландский купажированный, 500мл	Цена699,99 ₽	none	220.0	0.0 г	0.0 г	0.0 г	висковый выдержанный дистиллят, вода питьевая исправленная, краситель сахарный колер I простой (CARAMEL I-Plain) 	True	True	Sat Jul  6 20:04:36 2024
Виски Golden Chest Premium купажированный 40%, 500мл	839,99 ₽/шт	500 мл	https://www.perekrestok.ru/cat/5/p/viski-golden-chest-premium-kupazirovannyj-40-500ml-4264937	Sat Jul  6 19:32:59 2024	Виски Golden Chest Premium купажированный 40%, 500мл	Цена739,99 ₽	Golden Chest Premium	225.0	0.0 г	0.0 г	0.0 г	висковый солодовый, висковые зерновые дистилляты, выдержанные не менее 3-х лет, вода питьевая умягченная, краситель сахарный колер I простой (Е150а) 	True	True	Sat Jul  6 20:04:37 2024
