name	price	size	url	time	name_	price_	brand	calories	proteins	fats	carbos	composition	get_ok	parse_ok	time_
Виски Two Stacks The First Cut купажированный 43%, 700мл	1 999,00 ₽/шт	700 мл	https://www.perekrestok.ru/cat/5/p/viski-two-stacks-the-first-cut-kupazirovannyj-43-700ml-4274220	Wed Jul  3 15:05:23 2024	Виски Two Stacks The First Cut купажированный 43%, 700мл	Цена2 699,00 ₽	Two Stacks	220.0	0.0 г	0.0 г	0.0 г	Висковые зерновые выдержанные дистилляты Висковые солодовые выдержанные дистилляты, вода исправленная 	True	True	Sat Jul  6 00:01:35 2024
Виски Label 5 40%, 200мл	184,99 ₽/шт	200 мл	https://www.perekrestok.ru/cat/5/p/viski-label-5-40-200ml-3651850	Wed Jul  3 15:05:23 2024	Виски Label 5 40%, 200мл	Цена389,99 ₽	Label 5	0.0	0.0 г	0.0 г	0.0 г	none	True	True	Sat Jul  6 00:01:36 2024
Виски Johnnie Walker Рэд Лейбл 40%, 700мл	1 299,00 ₽/шт	700 мл	https://www.perekrestok.ru/cat/5/p/viski-johnnie-walker-red-lejbl-40-700ml-3298929	Wed Jul  3 15:05:23 2024	Виски Johnnie Walker Рэд Лейбл 40%, 700мл	Цена1 699,00 ₽	Johnnie Walker	0.0	0.0 г	0.0 г	0.0 г	ООО Диаджео Брендз Дистрибьюторз. 	True	True	Sat Jul  6 00:01:37 2024
Виски Ballantines Файнест 40%, 700мл	1 599,00 ₽/шт	700 мл	https://www.perekrestok.ru/cat/5/p/viski-ballantines-fajnest-40-700ml-3247206	Wed Jul  3 15:05:23 2024	Виски Ballantines Файнест 40%, 700мл	Цена1 599,00 ₽	Ballantines	0.0	0.0 г	0.0 г	0.0 г	Дистиллят выдержанный зерновой и солодовый висковый, вода исправленная, краситель - сахарный колер (Е150а). 	True	True	Sat Jul  6 00:01:38 2024
Виски Jack Daniels Тенесси Old No.7 40%, 700мл	1 959,00 ₽/шт	700 мл	https://www.perekrestok.ru/cat/5/p/viski-jack-daniels-tenessi-old-no-7-40-700ml-3359549	Wed Jul  3 15:05:23 2024	Виски Jack Daniels Тенесси Old No.7 40%, 700мл	Цена1 999,00 ₽	Jack Daniels	219.0	0.0 г	0.0 г	0.0 г	Вода родниковая подготовленная, дистиллят на основе кукурузы, ржи и ячменного солода. 	True	True	Sat Jul  6 00:01:38 2024
Виски The Whistler Oloroso Sherry Cask Finish ирландский купажированный 43% в п/у, 700мл	3 090,00 ₽/шт	700 мл	https://www.perekrestok.ru/cat/5/p/viski-the-whistler-oloroso-sherry-cask-finish-irlandskij-kupazirovannyj-43-v-p-u-700ml-4269845	Wed Jul  3 15:05:23 2024	Виски The Whistler Oloroso Sherry Cask Finish ирландский купажированный 43% в п/у, 700мл	Цена3 090,00 ₽	The Whistler	240.0	0.0 г	0.0 г	0.0 г	. 	True	True	Sat Jul  6 00:01:40 2024
Виски ирландский купажированный Kinahan's LL 40% в подарочной упаковке, 700мл	3 599,00 ₽/шт	700 мл	https://www.perekrestok.ru/cat/5/p/viski-irlandskij-kupazirovannyj-kinahans-ll-40-v-podarocnoj-upakovke-700ml-4243193	Wed Jul  3 15:05:23 2024	Виски ирландский купажированный Kinahan's LL 40% в подарочной упаковке, 700мл	Цена3 299,00 ₽	none	240.0	0.0 г	0.0 г	0.0 г	Вода исправленная, дистилляты висковые выдержанные (срок выдержки не менее 3 лет) зерновой и солодовый. 	True	True	Sat Jul  6 00:01:41 2024
Виски купажированный Nucky Thompson Выдержка три года 40%, 1 л	1 299,00 ₽/шт	1000 мл	https://www.perekrestok.ru/cat/5/p/viski-kupazirovannyj-nucky-thompson-vyderzka-tri-goda-40-1-l-4034691	Wed Jul  3 15:05:23 2024	Виски купажированный Nucky Thompson Выдержка три года 40%, 1 л	Цена1 599,00 ₽	Nucky Thompson	220.0	0.0 г	0.0 г	0.0 г	Дистиллят висковый шотландский зерновой выдержанный не менее трёх лет, дистиллят висковый шотландский солодовый выдержанный не менее трёх лет, вода питьевая исправленная, натуральный пищевой краситель - сахарный колер I простой. 	True	True	Sat Jul  6 00:01:42 2024
Виски Glen Moon купажированный 40%, 700мл	1 099,00 ₽/шт	700 мл	https://www.perekrestok.ru/cat/5/p/viski-glen-moon-kupazirovannyj-40-700ml-4269350	Wed Jul  3 15:05:23 2024	Виски Glen Moon купажированный 40%, 700мл	Цена1 099,00 ₽	Glen Moon	227.0	0.0 г	0.0 г	0.0 г	Висковые выдержанные дистилляты(зерновые и солодовые), вода подготовленная),краситель сахарный колер I простой (CARAMEL I - Plain). 	True	True	Sat Jul  6 00:01:43 2024
Виски William Lawsons купажированный 40%, 700мл	1 299,00 ₽/шт	700 мл	https://www.perekrestok.ru/cat/5/p/viski-william-lawsons-kupazirovannyj-40-700ml-3610645	Wed Jul  3 15:05:23 2024	Виски William Lawsons купажированный 40%, 700мл	Цена1 299,00 ₽	William Lawsons	0.0	0.0 г	0.0 г	0.0 г	Вода питьевая исправленная, Висковые зерновые выдержанные дистилляты, Висковые солодовые выдержанные дистилляты, Пищевая добавка: краситель Е150а. 	True	True	Sat Jul  6 00:01:44 2024
Виски Sterling Reserve B10 Премиум купажированный 40%, 750мл	1 499,00 ₽/шт	750 мл	https://www.perekrestok.ru/cat/5/p/viski-sterling-reserve-b10-premium-kupazirovannyj-40-750ml-4288132	Wed Jul  3 15:05:23 2024	Виски Sterling Reserve B10 Премиум купажированный 40%, 750мл	Цена1 599,00 ₽	Sterling	229.0	0.0 г	0.0 г	0.0 г	Выдержанные висковые дистилляты: зерновые и солодовые, вода питьевая подготовленная (исправленная), краситель - сахарный колер I простой. 	True	True	Sat Jul  6 00:01:45 2024
Виски Johnnie Walker Black Label 12 лет купажированный, 0.7л	2 249,00 ₽/шт	700 мл	https://www.perekrestok.ru/cat/5/p/viski-johnnie-walker-black-label-12-let-kupazirovannyj-0-7l-4009189	Wed Jul  3 15:05:23 2024	Виски Johnnie Walker Black Label 12 лет купажированный, 0.7л	Цена2 249,00 ₽	Johnnie Walker	222.0	0.0 г	0.0 г	0.0 г	Вода исправленная, висковые зерновые выдержанные дистилляты, висковые солодовые выдержанные дистилляты, краситель: Е150а. 	True	True	Sat Jul  6 00:01:46 2024
Виски О'neill's ирландский купажированный 40%, 700мл	1 149,00 ₽/шт	700 мл	https://www.perekrestok.ru/cat/5/p/viski-oneills-irlandskij-kupazirovannyj-40-700ml-4180473	Wed Jul  3 15:05:23 2024	Виски О'neill's ирландский купажированный 40%, 700мл	Цена1 399,00 ₽	O'Neill'S	224.0	0.0 г	0.0 г	0.0 г	Висковые зерновые выдержанные дистилляты и висковые солодовые выдержанные дистилляты, вода исправленная, краситель сахарный колер I простой. 	True	True	Sat Jul  6 00:01:47 2024
Виски William Lawsons купажированный 40%, 250мл	579,99 ₽/шт	250 мл	https://www.perekrestok.ru/cat/5/p/viski-william-lawsons-kupazirovannyj-40-250ml-4091660	Wed Jul  3 15:05:23 2024	Виски William Lawsons купажированный 40%, 250мл	Цена579,99 ₽	William Lawsons	220.0	0.0 г	0.0 г	0.0 г	Вода питьевая исправленная, Висковые зерновые выдержанные дистилляты, Висковые солодовые выдержанные дистилляты, Пищевая добавка: краситель Е150а. 	True	True	Sat Jul  6 00:01:48 2024
Виски купажированный Наки Томпсон Выдержка шесть лет,  0,5 л	1 199,00 ₽/шт	500 мл	https://www.perekrestok.ru/cat/5/p/viski-kupazirovannyj-naki-tompson-vyderzka-sest-let-0-5-l-4229138	Wed Jul  3 15:05:23 2024	Виски купажированный Наки Томпсон Выдержка шесть лет,  0,5 л	Цена899,99 ₽	Nucky Thompson	220.0	0.0 г	0.0 г	0.0 г	Дистиллят висковый шотландский зерновой выдержанный не менее шести лет вода питьевая исправленная, натуральный пищевой краситель - сахарный колер I простой. 	True	True	Sat Jul  6 00:01:49 2024
Виски Darrow шотландский купажированный 40%, 500мл	739,99 ₽/шт	500 мл	https://www.perekrestok.ru/cat/5/p/viski-darrow-sotlandskij-kupazirovannyj-40-500ml-4261325	Wed Jul  3 15:05:23 2024	Виски Darrow шотландский купажированный 40%, 500мл	Цена879,99 ₽	Darrow	220.0	0.0 г	0.0 г	0.0 г	Дистиллят висковый выдержанный шотландский (купаж висковых зерновых выдержанных дистиллятов и висковых солодовых выдержанных дистиллятов), вода питьевая подготовленная (исправленная), краситель:Е150А. 	True	True	Sat Jul  6 00:01:50 2024
Виски Стронголд купажированный 50%, 700мл	649,99 ₽/шт	700 мл	https://www.perekrestok.ru/cat/5/p/viski-strongold-kupazirovannyj-50-700ml-4231118	Wed Jul  3 15:05:23 2024	Виски Стронголд купажированный 50%, 700мл	Цена799,99 ₽	Strongold	226.0	0.0 г	0.0 г	0.5 г	Дистиллят висковый зерновой выдержанный, дистиллят солодовый выдержанный, вода подготовленная (исправленная), пищевая добавка: краситель - колер сахарный I простой (Plain caramel). 	True	True	Sat Jul  6 00:01:50 2024
Виски Sir Pitterson купажированный 40%, 700мл	949,99 ₽/шт	700 мл	https://www.perekrestok.ru/cat/5/p/viski-sir-pitterson-kupazirovannyj-40-700ml-4255319	Wed Jul  3 15:05:23 2024	Виски Sir Pitterson купажированный 40%, 700мл	Цена1 249,00 ₽	Sir Pitterson	221.0	0.0 г	0.0 г	0.0 г	Смесь выдержанных висковых зерновых и солодового дистиллятов, вода исправленная, сахарный колер I простой (CARAMEL I - Plain). 	True	True	Sat Jul  6 00:01:52 2024
Виски Label 5 шотландский купажированный 40%, 500мл	799,99 ₽/шт	500 мл	https://www.perekrestok.ru/cat/5/p/viski-label-5-sotlandskij-kupazirovannyj-40-500ml-3999523	Wed Jul  3 15:05:23 2024	Виски Label 5 шотландский купажированный 40%, 500мл	Цена799,99 ₽	Label 5	227.0	0.0 г	0.0 г	0.0 г	Выдержанный висковый дистиллят из ферментативного сусла пшеницы и ячменя, вода, выдержанный висковый дистиллят из соложеного ячменя, краситель сахарный колер I простой Е 150а. 	True	True	Sat Jul  6 00:01:53 2024
Виски Scotch Terrier купажированный 40%, 700мл	1 049,00 ₽/шт	700 мл	https://www.perekrestok.ru/cat/5/p/viski-scotch-terrier-kupazirovannyj-40-700ml-3981115	Wed Jul  3 15:05:23 2024	Виски Scotch Terrier купажированный 40%, 700мл	Цена1 049,00 ₽	Scotch Terrier	220.0	0.0 г	0.0 г	0.0 г	Купаж зерновых и солодовых шотландскихвисковых дистилятов, не менее 3-летней выдержки, вода питьевая исправленная, краситель-сахарный колер I простой (caramel I-plain) (E150A). 	True	True	Sat Jul  6 00:01:54 2024
Виски William Lawsons купажированный 40%, 1л	1 849,00 ₽/шт	1000 мл	https://www.perekrestok.ru/cat/5/p/viski-william-lawsons-kupazirovannyj-40-1l-3610644	Wed Jul  3 15:05:23 2024	Виски William Lawsons купажированный 40%, 1л	Цена1 799,00 ₽	William Lawsons	0.0	0.0 г	0.0 г	0.0 г	Вода питьевая исправленная, Висковые зерновые выдержанные дистилляты, Висковые солодовые выдержанные дистилляты, Пищевая добавка: краситель Е150а. 	True	True	Sat Jul  6 00:01:56 2024
Виски The Famous Grouse Файнест 40%, 700мл	2 199,00 ₽/шт	700 мл	https://www.perekrestok.ru/cat/5/p/viski-the-famous-grouse-fajnest-40-700ml-99234	Wed Jul  3 15:05:23 2024	Виски The Famous Grouse Файнест 40%, 700мл	Цена1 899,00 ₽	The Famous Grouse	220.0	0.0 г	0.0 г	0.0 г	Вода исправленная, купаж висковых выдержанных дистиллятов (солодовых и зерновых), краситель e150a (карамель) 	True	True	Sat Jul  6 00:01:58 2024
Виски Kilbeggan 40%, 700мл	2 099,00 ₽/шт	700 мл	https://www.perekrestok.ru/cat/5/p/viski-kilbeggan-40-700ml-3660110	Wed Jul  3 15:05:23 2024	Виски Kilbeggan 40%, 700мл	Цена2 199,00 ₽	Kilbeggan	0.0	0.0 г	0.0 г	0.0 г	Вода исправленная, купаж висковых выдержанных дистиллятов (солодовых и зерновых), краситель e150a (карамель) 	True	True	Sat Jul  6 00:02:01 2024
Виски Scots Gold Black шотландский купажированный 40%, 700мл	1 199,00 ₽/шт	700 мл	https://www.perekrestok.ru/cat/5/p/viski-scots-gold-black-sotlandskij-kupazirovannyj-40-700ml-4349677	Wed Jul  3 15:05:23 2024	Виски Scots Gold Black шотландский купажированный 40%, 700мл	Цена1 499,00 ₽	none	224.0	0.0 г	0.0 г	0.0 г	none	True	True	Sat Jul  6 00:02:02 2024
Виски Scots Gold Red шотландский купажированный 40%, 700мл	1 199,00 ₽/шт	700 мл	https://www.perekrestok.ru/cat/5/p/viski-scots-gold-red-sotlandskij-kupazirovannyj-40-700ml-4349676	Wed Jul  3 15:05:23 2024	Виски Scots Gold Red шотландский купажированный 40%, 700мл	Цена1 499,00 ₽	none	224.0	0.0 г	0.0 г	0.0 г	none	True	True	Sat Jul  6 00:02:03 2024
Виски Woodnote Premium Blended Select Cask 42.8%, 750мл	1 899,00 ₽/шт	750 мл	https://www.perekrestok.ru/cat/5/p/viski-woodnote-premium-blended-select-cask-42-8-750ml-4335095	Wed Jul  3 15:05:23 2024	Виски Woodnote Premium Blended Select Cask 42.8%, 750мл	Цена1 499,00 ₽	none	228.0	0.0 г	0.0 г	0.0 г	none	True	True	Sat Jul  6 00:02:04 2024
Виски Dewar's 15 Y.O. шотландский купажированный 40%, 750мл	7 299,00 ₽/шт	750 мл	https://www.perekrestok.ru/cat/5/p/viski-dewars-15-y-o-sotlandskij-kupazirovannyj-40-750ml-4320914	Wed Jul  3 15:05:23 2024	Виски Dewar's 15 Y.O. шотландский купажированный 40%, 750мл	Цена5 599,00 ₽	Dewars	220.0	0.0 г	0.0 г	0.0 г	none	True	True	Sat Jul  6 00:02:06 2024
Виски Grant's Triple Wood шотландский купажированный 40% с игральными картами, 750мл	1 799,00 ₽/шт	750 мл	https://www.perekrestok.ru/cat/5/p/viski-grants-triple-wood-sotlandskij-kupazirovannyj-40-s-igralnymi-kartami-750ml-4324469	Wed Jul  3 15:05:23 2024	Виски Grant's Triple Wood шотландский купажированный 40% с игральными картами, 750мл	Цена1 799,00 ₽	Grants	224.0	0.0 г	0.0 г	0.0 г	Вода питьевая подготовленная, висковой зерновой и висковой солодовый дистилляты, выдержанные не менее трех, пищевая добавка- пищевой краситель 150а. 	True	True	Sat Jul  6 00:02:07 2024
Виски Jameson ирландский купажированный 40%, 750мл	2 999,00 ₽/шт	750 мл	https://www.perekrestok.ru/cat/5/p/viski-jameson-irlandskij-kupazirovannyj-40-750ml-4320389	Wed Jul  3 15:05:23 2024	Виски Jameson ирландский купажированный 40%, 750мл	Цена1 999,00 ₽	Jameson	220.0	0.0 г	0.0 г	0.0 г	none	True	True	Sat Jul  6 00:02:08 2024
Виски The Dubliner ирландский купажированный 40%, 700мл	3 299,00 ₽/шт	700 мл	https://www.perekrestok.ru/cat/5/p/viski-the-dubliner-irlandskij-kupazirovannyj-40-700ml-4102736	Wed Jul  3 15:05:23 2024	Виски The Dubliner ирландский купажированный 40%, 700мл	Цена2 899,00 ₽	none	220.0	0.0 г	0.0 г	0.0 г	зерновой спирт, солодовый спирт, вода подготовленная, пищевая добавка: сахарный колер (Е150а) 	True	True	Sat Jul  6 00:02:09 2024
Виски Forest Cat купажированный 40%, 500мл	499,99 ₽/шт	500 мл	https://www.perekrestok.ru/cat/5/p/viski-forest-cat-kupazirovannyj-40-500ml-4291562	Wed Jul  3 15:05:23 2024	Виски Forest Cat купажированный 40%, 500мл	Цена639,99 ₽	Forest Cat	220.0	0.0 г	0.0 г	0.0 г	Висковый дистиллят выдержанный (купаж висковых зерновых выдержанных дистиллятов и висковых солодовых выдержанных дистиллятов), вода питьевая подготовленная, краситель-Е150А. 	True	True	Sat Jul  6 00:02:09 2024
Виски Royal Ranthambore купажированный 40%, 750мл	2 499,00 ₽/шт	750 мл	https://www.perekrestok.ru/cat/5/p/viski-royal-ranthambore-kupazirovannyj-40-750ml-4290027	Wed Jul  3 15:05:23 2024	Виски Royal Ranthambore купажированный 40%, 750мл	Цена3 499,00 ₽	Royal Ranthambore	220.0	0.0 г	0.0 г	0.0 г	выдержанные висковые дистилляты: зерновые и солодовые, вода питьевая подготовленная  (исправленная), краситель - сахарный колер простой 	True	True	Sat Jul  6 00:02:11 2024
Виски William Watt шотландский купажированный, 500мл	429,99 ₽/шт	500 мл	https://www.perekrestok.ru/cat/5/p/viski-william-watt-sotlandskij-kupazirovannyj-500ml-4287559	Wed Jul  3 15:05:23 2024	Виски William Watt шотландский купажированный, 500мл	Цена659,99 ₽	none	220.0	0.0 г	0.0 г	0.0 г	висковый выдержанный дистиллят, вода питьевая исправленная, краситель сахарный колер I простой (CARAMEL I-Plain) 	True	True	Sat Jul  6 00:02:12 2024
Виски Royal Hunt купажированный, 500мл	403,00 ₽/шт	500 мл	https://www.perekrestok.ru/cat/5/p/viski-royal-hunt-kupazirovannyj-500ml-4287558	Wed Jul  3 15:05:23 2024	Виски Royal Hunt купажированный, 500мл	Цена403,00 ₽	none	220.0	0.0 г	0.0 г	0.0 г	висковый купажированный выдержанный дистиллят, вода питьевая исправленная, краситель сахарный колер I простой (CARAMEL I-Plain) 	True	True	Sat Jul  6 00:02:13 2024
Виски Crazy Charley купажированный, 700мл	1 349,00 ₽/шт	700 мл	https://www.perekrestok.ru/cat/5/p/viski-crazy-charley-kupazirovannyj-700ml-4221205	Wed Jul  3 15:05:23 2024	Виски Crazy Charley купажированный, 700мл	Цена1 249,00 ₽	Crazy Charley	221.0	0.0 г	0.0 г	0.0 г	Висковые дистилляты из кукурузы, ржи, пшеницы, солодового ячменя и солодовых зерен (краситель) - сахарный колер I простой (Е150а) 	True	True	Sat Jul  6 00:02:13 2024
Виски The Whistler Double Oaked ирландский купажированный 40%, 700мл	1 649,00 ₽/шт	700 мл	https://www.perekrestok.ru/cat/5/p/viski-the-whistler-double-oaked-irlandskij-kupazirovannyj-40-700ml-4269844	Wed Jul  3 15:05:23 2024	Виски The Whistler Double Oaked ирландский купажированный 40%, 700мл	Цена2 399,00 ₽	The Whistler	220.0	0.0 г	0.0 г	0.0 г	. 	True	True	Sat Jul  6 00:02:15 2024
Виски Ben Cocky 40% шотландский купажированный, 700мл	1 399,00 ₽/шт	700 мл	https://www.perekrestok.ru/cat/5/p/viski-ben-cocky-40-sotlandskij-kupazirovannyj-700ml-4259092	Wed Jul  3 15:05:23 2024	Виски Ben Cocky 40% шотландский купажированный, 700мл	Цена1 599,00 ₽	Ben Cocky	249.0	0.0 г	0.0 г	0.0 г	Висковые выдержанные дистилляты (зерновые и солодовые), вода подготовленная (исправленная), краситель сахарный колер I простой (CARAMEL I-Plain). 	True	True	Sat Jul  6 00:02:16 2024
Виски Hawkins Спешл Резерв 8-летний 40%, 700мл	3 690,00 ₽/шт	700 мл	https://www.perekrestok.ru/cat/5/p/viski-hawkins-spesl-rezerv-8-letnij-40-700ml-4266177	Wed Jul  3 15:05:23 2024	Виски Hawkins Спешл Резерв 8-летний 40%, 700мл	Цена2 999,00 ₽	Hawkins	225.0	0.0 г	0.0 г	0.0 г	Дистиляты висковые солодовые выдержанные, дистиляты висковые зерновые выдержанные, вода подготовленная (исправленная). 	True	True	Sat Jul  6 00:02:17 2024
Виски Black Ram Bourbon Finish 3-летний 40%, 700мл	1 699,00 ₽/шт	700 мл	https://www.perekrestok.ru/cat/5/p/viski-black-ram-bourbon-finish-3-letnij-40-700ml-4263144	Wed Jul  3 15:05:23 2024	Виски Black Ram Bourbon Finish 3-летний 40%, 700мл	Цена1 299,00 ₽	Black Ram	220.0	0.0 г	0.0 г	0.0 г	Вода исправленная, купаж висковых выдержанных дистиллятов (зерновых и солодовых), краситель e150a (карамель). 	True	True	Sat Jul  6 00:02:18 2024
Виски Black Ram Bourbon Finish 3-летний 40%, 500мл	999,99 ₽/шт	500 мл	https://www.perekrestok.ru/cat/5/p/viski-black-ram-bourbon-finish-3-letnij-40-500ml-4260538	Wed Jul  3 15:05:23 2024	Виски Black Ram Bourbon Finish 3-летний 40%, 500мл	Цена1 349,00 ₽	Black Ram	220.0	0.0 г	0.0 г	0.0 г	Вода исправленная, купаж висковых выдержанных дистиллятов (зерновых и солодовых), краситель e150a (карамель). 	True	True	Sat Jul  6 00:02:18 2024
Виски Нествил купажированный 40%, 700мл	1 799,00 ₽/шт	700 мл	https://www.perekrestok.ru/cat/5/p/viski-nestvil-kupazirovannyj-40-700ml-4257234	Wed Jul  3 15:05:23 2024	Виски Нествил купажированный 40%, 700мл	Цена1 199,00 ₽	none	220.0	0.0 г	0.0 г	0.1 г	Состав: вода исправленная, солодовый и зерновой висковый выдержанный дистиллят, краситель - сахарный колер/простой. 	True	True	Sat Jul  6 00:02:19 2024
Виски Hatozaki Японский купажированный 40%, 700мл	3 999,00 ₽/шт	700 мл	https://www.perekrestok.ru/cat/5/p/viski-hatozaki-aponskij-kupazirovannyj-40-700ml-4252703	Wed Jul  3 15:05:23 2024	Виски Hatozaki Японский купажированный 40%, 700мл	Цена2 999,00 ₽	Hatozaki	225.0	0.0 г	0.0 г	0.0 г	Вода подготовленная (исправленная), дистилляты висковые зерновые выдержанные. 	True	True	Sat Jul  6 00:02:20 2024
Виски Dunmor 40%, 500мл	403,00 ₽/шт	500 мл	https://www.perekrestok.ru/cat/5/p/viski-dunmor-40-500ml-4238501	Wed Jul  3 15:05:23 2024	Виски Dunmor 40%, 500мл	Цена639,99 ₽	none	220.0	0.0 г	0.0 г	0.0 г	Дистиллят висковый, выдержанный (купаж висковых зерновых выдержанных дистиллятов и висковых солодовых выдеражнных дистиллятов), вода питьевая исправленная, пищевая добавка: краситель - сахарный колер/ простой. 	True	True	Sat Jul  6 00:02:21 2024
