name	price	size	url	time	name_	price_	brand	calories	proteins	fats	carbos	composition	get_ok	parse_ok	time_
Виски Scotch Terrier шотландский 40%, 500мл	739,99 ₽/шт	500 мл	https://www.perekrestok.ru/cat/5/p/viski-scotch-terrier-sotlandskij-40-500ml-4235889	Wed Jul  3 15:05:23 2024	Виски Scotch Terrier шотландский 40%, 500мл	Цена679,99 ₽	Scotch Terrier	220.0	0.0 г	0.0 г	0.0 г	Купаж зерновых и солодовых шотландских висковых дистиллятов, не менее 3-летней выдержки, вода питьевая исправленная, краситель - сахарный колер | простой (Caramel i-plain). 	True	True	Sat Jul  6 00:02:22 2024
Виски Gelstons Самуэль ирландский купажированный 40%, 700мл	1 649,00 ₽/шт	700 мл	https://www.perekrestok.ru/cat/5/p/viski-gelstons-samuel-irlandskij-kupazirovannyj-40-700ml-4217337	Wed Jul  3 15:05:23 2024	Виски Gelstons Самуэль ирландский купажированный 40%, 700мл	Цена1 649,00 ₽	Gelston's	220.0	0.0 г	0.0 г	0.0 г	Вода исправленная сахарный сироп натуральная карамель выдержанные зерновые дистилляты на основе ячменного солода и пшеницы натуральные ароматизаторы (корица ваниль абрикос инжир). 	True	True	Sat Jul  6 00:02:23 2024
Виски Red and Black купажированный 3-летний, 500мл	699,99 ₽/шт	500 мл	https://www.perekrestok.ru/cat/5/p/viski-red-and-black-kupazirovannyj-3-letnij-500ml-4214940	Wed Jul  3 15:05:23 2024	Виски Red and Black купажированный 3-летний, 500мл	Цена649,99 ₽	Red and Black	220.0	0.0 г	0.0 г	0.0 г	Дистиллят висковый шотландский купажированный, выдержанный не менее трех лет, дистиллят висковый шотландский зерновой, выдержанный не менее трех лет, вода питьевая исправленная, краситель - сахарный колер простой. 	True	True	Sat Jul  6 00:02:24 2024
Виски Fox&Dogs купажированный 40%, 700мл	819,99 ₽/шт	700 мл	https://www.perekrestok.ru/cat/5/p/viski-fox-dogs-kupazirovannyj-40-700ml-4087203	Wed Jul  3 15:05:23 2024	Виски Fox&Dogs купажированный 40%, 700мл	Цена999,99 ₽	Fox&Dogs	220.0	0.0 г	0.0 г	0.0 г	Вода питьевая исправленная, висковый зерновой выдержанный дистиллят из Шотландии, висковый солодовый дистиллят из Шотландии, пищевая добавка, Краситель Сахарный колер I просто E150a. 	True	True	Sat Jul  6 00:02:24 2024
Виски Fox&Dogs купажированный 40%, 250мл	379,99 ₽/шт	250 мл	https://www.perekrestok.ru/cat/5/p/viski-fox-dogs-kupazirovannyj-40-250ml-4098031	Wed Jul  3 15:05:23 2024	Виски Fox&Dogs купажированный 40%, 250мл	Цена379,99 ₽	Fox&Dogs	220.0	0.0 г	0.0 г	0.0 г	Вода питьевая исправленная, висковый зерновой выдержанный дистиллят из Шотландии, висковый солодовый дистиллят из Шотландии, пищевая добавка, Краситель Сахарный колер I просто E150a. 	True	True	Sat Jul  6 00:02:25 2024
Виски Nucky Thompson 3-летний купажированный 40%, 250мл	399,99 ₽/шт	250 мл	https://www.perekrestok.ru/cat/5/p/viski-nucky-thompson-3-letnij-kupazirovannyj-40-250ml-4050507	Wed Jul  3 15:05:23 2024	Виски Nucky Thompson 3-летний купажированный 40%, 250мл	Цена399,99 ₽	Nucky Thompson	220.0	0.0 г	0.0 г	0.0 г	Дистиллят висковый шотландский солодовый выдержанный не менее трёх лет, Вода питьевая исправленная, натуральный пищевой Краситель - Сахарный колер I простой. 	True	True	Sat Jul  6 00:02:26 2024
Виски Label 5 40%, 700мл	899,99 ₽/шт	700 мл	https://www.perekrestok.ru/cat/5/p/viski-label-5-40-700ml-3652398	Wed Jul  3 15:05:23 2024	Виски Label 5 40%, 700мл	Цена999,99 ₽	Label 5	0.0	0.0 г	0.0 г	0.0 г	none	True	True	Sat Jul  6 00:02:27 2024
Виски Grants Трипл Вуд 3-летний шотландский купажированный 40%, 700мл	1 849,00 ₽/шт	700 мл	https://www.perekrestok.ru/cat/5/p/viski-grants-tripl-vud-3-letnij-sotlandskij-kupazirovannyj-40-700ml-3927433	Wed Jul  3 15:05:23 2024	Виски Grants Трипл Вуд 3-летний шотландский купажированный 40%, 700мл	Цена1 749,00 ₽	Grants	220.0	0.0 г	0.0 г	0.0 г	Вода питьевая подготовленная, Зерновые и солодовые дистиляры, выдержанные 3 года, пищевая добавка-пищевой Краситель Е150а. 	True	True	Sat Jul  6 00:02:28 2024
Настойка Fox & Dogs Спайсд на основе виски полусладкая 35%, 700мл	1 099,00 ₽/шт	700 мл	https://www.perekrestok.ru/cat/5/p/nastojka-fox-dogs-spajsd-na-osnove-viski-polusladkaa-35-700ml-3980295	Wed Jul  3 15:05:23 2024	Настойка Fox & Dogs Спайсд на основе виски полусладкая 35%, 700мл	Цена799,99 ₽	Fox&Dogs	310.0	0.0 г	0.0 г	5.0 г	Виски купажированный ( висковый зерновой выдержанный дистиллят, висковый солодовый выдержанный дистиллят, Вода питьевая исправленная), Вода питьевая исправленная,Сахарный сироп инвертный, настой Спиртованный корицы, настой Спиртованный мускатного ореха, пищевой Ароматизатор Ваниль-Мёд, пищевые добавки, Краситель Сахарный колер I просто E150a, загумтитель глицерин Е422. 	True	True	Sat Jul  6 00:02:29 2024
Виски The Pogues Айриш ирландский купажированный 40%, 700мл	1 799,00 ₽/шт	700 мл	https://www.perekrestok.ru/cat/5/p/viski-the-pogues-ajris-irlandskij-kupazirovannyj-40-700ml-4049893	Wed Jul  3 15:05:23 2024	Виски The Pogues Айриш ирландский купажированный 40%, 700мл	Цена1 799,00 ₽	The Pogues	221.0	0.0 г	0.0 г	0.0 г	Дистилляты висковые солодовые и зерновые, выдержанные не менее 3 лет, Вода питьевая исправленная, пищевой Краситель Е 150a. 	True	True	Sat Jul  6 00:02:30 2024
Виски Nucky Thompson 3-летний купажированный 40%, 500мл	769,99 ₽/шт	500 мл	https://www.perekrestok.ru/cat/5/p/viski-nucky-thompson-3-letnij-kupazirovannyj-40-500ml-3918863	Wed Jul  3 15:05:23 2024	Виски Nucky Thompson 3-летний купажированный 40%, 500мл	Цена859,99 ₽	Nucky Thompson	220.0	0.0 г	0.0 г	0.0 г	Дистиллят висковый шотландский солодовый выдержанный не менее трёх лет, Вода питьевая исправленная, натуральный пищевой Краситель - Сахарный колер I простой. 	True	True	Sat Jul  6 00:02:31 2024
Виски Old Smuggler 40%, 700мл	1 699,00 ₽/шт	700 мл	https://www.perekrestok.ru/cat/5/p/viski-old-smuggler-40-700ml-2160754	Wed Jul  3 15:05:23 2024	Виски Old Smuggler 40%, 700мл	Цена1 749,00 ₽	Old Smuggler	221.0	0.0 г	0.0 г	0.0 г	. 	True	True	Sat Jul  6 00:02:32 2024
Виски Nucky Thompson 3-летний купажированный 40% в подарочной упаковке, 2х500мл	1 799,00 ₽/шт	1000 мл	https://www.perekrestok.ru/cat/5/p/viski-nucky-thompson-3-letnij-kupazirovannyj-40-v-podarocnoj-upakovke-2h500ml-4001635	Wed Jul  3 15:05:23 2024	Виски Nucky Thompson 3-летний купажированный 40% в подарочной упаковке, 2х500мл	Цена1 799,00 ₽	Nucky Thompson	220.0	0.0 г	0.0 г	0.0 г	Дистиллят висковый шотландский зерновой выдержанный не менее трёх лет, дистиллят висковый шотландский солодовый выдержанный не менее трёх лет, вода питьевая исправленная, натуральный пищевой краситель - сахарный колер I простой. 	True	True	Sat Jul  6 00:02:33 2024
Виски Dewar's Карибеан Смус 8-летний шотландский купажированный 40% в подарочной упаковке, 700мл	1 949,00 ₽/шт	700 мл	https://www.perekrestok.ru/cat/5/p/viski-dewars-karibean-smus-8-letnij-sotlandskij-kupazirovannyj-40-v-podarocnoj-upakovke-700ml-3986608	Wed Jul  3 15:05:23 2024	Виски Dewar's Карибеан Смус 8-летний шотландский купажированный 40% в подарочной упаковке, 700мл	Цена1 999,00 ₽	Dewars	0.0	0.0 г	0.0 г	0.0 г	Вода питьевая исправленная, Висковый зерновой выдержанный дистиллят, Висковый солодовый выдержанный дистиллят, Пищевая добавка: краситель-Е150а. 	True	True	Sat Jul  6 00:02:34 2024
Виски Tenjaku японский купажированный 40% в подарочной упаковке, 700мл	3 299,00 ₽/шт	700 мл	https://www.perekrestok.ru/cat/5/p/viski-tenjaku-aponskij-kupazirovannyj-40-v-podarocnoj-upakovke-700ml-3981221	Wed Jul  3 15:05:23 2024	Виски Tenjaku японский купажированный 40% в подарочной упаковке, 700мл	Цена3 499,00 ₽	Tenjaku	224.0	0.0 г	0.0 г	0.0 г	Смесь висковых солодовых и зерновых выдержанных (не менее 3 лет) дистиллятов, исправленная Вода, пищевой Краситель, Сахарный колер I (простой). 	True	True	Sat Jul  6 00:02:34 2024
Виски Nucky Thompson 3-летний 40%, 700мл	1 149,00 ₽/шт	700 мл	https://www.perekrestok.ru/cat/5/p/viski-nucky-thompson-3-letnij-40-700ml-3684881	Wed Jul  3 15:05:23 2024	Виски Nucky Thompson 3-летний 40%, 700мл	Цена999,99 ₽	Nucky Thompson	0.0	0.0 г	0.0 г	0.0 г	Дистиллят висковый шотландский солодовый выдержанный не менее трёх лет, Вода питьевая исправленная, натуральный пищевой Краситель - Сахарный колер I простой. 	True	True	Sat Jul  6 00:02:36 2024
Виски Bell's Original купажированный, 0.5л	409,99 ₽/шт	500 мл	https://www.perekrestok.ru/cat/5/p/viski-bells-original-kupazirovannyj-0-5l-3698328	Wed Jul  3 15:05:23 2024	Виски Bell's Original купажированный, 0.5л	Цена1 199,00 ₽	Bells	0.0	0.0 г	0.0 г	0.0 г	Дистиллят висковый выдержанный шотландский (купаж висковых зерновых выдержанных дистиллятов и висковых солодовых выдержанных дистиллятов), вода питьевая исправленная, краситель: Е150а. 	True	True	Sat Jul  6 00:02:36 2024
Виски Dewar's Вайт Лейбл 40%, 700мл	1 599,00 ₽/шт	700 мл	https://www.perekrestok.ru/cat/5/p/viski-dewars-vajt-lejbl-40-700ml-3443320	Wed Jul  3 15:05:23 2024	Виски Dewar's Вайт Лейбл 40%, 700мл	Цена1 599,00 ₽	Dewars	220.0	none	none	none	Вода питьевая исправленная, Висковый солодовый выдержанный дистиллят, Висковый зерновой выдержанный дистиллят, Пищевая добавка: краситель-Е150а. 	True	True	Sat Jul  6 00:02:38 2024
Виски Dewars 12-летний 40% в подарочной упаковке, 700мл	3 299,00 ₽/шт	700 мл	https://www.perekrestok.ru/cat/5/p/viski-dewars-12-letnij-40-v-podarocnoj-upakovke-700ml-3464385	Wed Jul  3 15:05:23 2024	Виски Dewars 12-летний 40% в подарочной упаковке, 700мл	Цена3 299,00 ₽	Dewars	220.0	0.0 г	0.0 г	0.0 г	Вода питьевая исправленная, Висковый солодовый выдержанный дистиллят, Висковый зерновой выдержанный дистиллят, Пищевая добавка: краситель-Е150а. 	True	True	Sat Jul  6 00:02:39 2024
Виски Jack Daniels Тенесси Old No.7 40%, 50мл	129,99 ₽/шт	50 мл	https://www.perekrestok.ru/cat/5/p/viski-jack-daniels-tenessi-old-no-7-40-50ml-3471594	Wed Jul  3 15:05:23 2024	Виски Jack Daniels Тенесси Old No.7 40%, 50мл	Цена169,99 ₽	Jack Daniels	0.0	0.0 г	0.0 г	0.0 г	Вода родниковая подготовленная, дистиллят на основе кукурузы, ржи и ячменного солода. 	True	True	Sat Jul  6 00:02:40 2024
Виски William Lawsons 40%, 500мл	979,99 ₽/шт	500 мл	https://www.perekrestok.ru/cat/5/p/viski-william-lawsons-40-500ml-3504071	Wed Jul  3 15:05:23 2024	Виски William Lawsons 40%, 500мл	Цена979,99 ₽	William Lawsons	220.0	none	none	none	Вода питьевая исправленная, Висковые зерновые выдержанные дистилляты, Висковые солодовые выдержанные дистилляты, Пищевая добавка: краситель Е150а. 	True	True	Sat Jul  6 00:02:41 2024
Виски Johnnie Walker Red Label купажированный в наборе с бокалом, 700мл	2 599,00 ₽/шт	700 мл	https://www.perekrestok.ru/cat/5/p/viski-johnnie-walker-red-label-kupazirovannyj-v-nabore-s-bokalom-700ml-3687940	Wed Jul  3 15:05:23 2024	Виски Johnnie Walker Red Label купажированный в наборе с бокалом, 700мл	Цена2 599,00 ₽	Johnnie Walker	0.0	0.0 г	0.0 г	0.0 г	Вода исправленная, висковые зерновые выдержанные дистилляты, висковые солодовые выдержанные дистилляты, краситель: Е150а. 	True	True	Sat Jul  6 00:02:42 2024
Виски Jim Beam Хани 35%, 700мл	999,99 ₽/шт	700 мл	https://www.perekrestok.ru/cat/5/p/viski-jim-beam-hani-35-700ml-3409473	Wed Jul  3 15:05:23 2024	Виски Jim Beam Хани 35%, 700мл	Цена1 299,00 ₽	Jim Beam	240.0	none	none	12.0 г	Висковые зерновые дистилляты из злаковых культур (кукурузы, ячменя, ржи), выдержанные 6 лет, Вода питьевая подготовленная. 	True	True	Sat Jul  6 00:02:42 2024
Виски Jameson ирландский 40%, 700мл	2 599,00 ₽/шт	700 мл	https://www.perekrestok.ru/cat/5/p/viski-jameson-irlandskij-40-700ml-32595	Wed Jul  3 15:05:23 2024	Виски Jameson ирландский 40%, 700мл	Цена1 999,00 ₽	Jameson	222.0	none	none	none	Купаж висковых зерновых выдержанных дистиллятов и висковых солодовых выдержанных дистиллятов, вода исправленная, краситель Е150а. 	True	True	Sat Jul  6 00:02:44 2024
Виски Fox&Dogs купажированный 40%, 500мл	649,99 ₽/шт	500 мл	https://www.perekrestok.ru/cat/5/p/viski-fox-dogs-kupazirovannyj-40-500ml-3646759	Wed Jul  3 15:05:23 2024	Виски Fox&Dogs купажированный 40%, 500мл	Цена799,99 ₽	Fox&Dogs	0.0	0.0 г	0.0 г	0.0 г	Вода питьевая исправленная, висковый зерновой выдержанный дистиллят из Шотландии, висковый солодовый дистиллят из Шотландии, пищевая добавка, Краситель Сахарный колер I просто E150a. 	True	True	Sat Jul  6 00:02:45 2024
Виски Dewar's Вайт Лейбл 40%, 500мл	1 199,00 ₽/шт	500 мл	https://www.perekrestok.ru/cat/5/p/viski-dewars-vajt-lejbl-40-500ml-2048005	Wed Jul  3 15:05:23 2024	Виски Dewar's Вайт Лейбл 40%, 500мл	Цена1 199,00 ₽	Dewars	220.0	none	none	none	Вода питьевая исправленная, Висковый солодовый выдержанный дистиллят, Висковый зерновой выдержанный дистиллят, Пищевая добавка: краситель-Е150а. 	True	True	Sat Jul  6 00:02:46 2024
Виски Monkey Shoulder 40%, 700мл	4 499,00 ₽/шт	700 мл	https://www.perekrestok.ru/cat/5/p/viski-monkey-shoulder-40-700ml-3406214	Wed Jul  3 15:05:23 2024	Виски Monkey Shoulder 40%, 700мл	Цена4 499,00 ₽	Monkey Shoulder	219.7	none	none	none	Вода питьевая подготовленная, солодовые дистилляры, выдержанные 3 года, пищевая добавка-пищевой Краситель Е150а. 	True	True	Sat Jul  6 00:02:47 2024
Виски Glenmorangie The Original Шотландский односолодовый 10 лет, 700мл	3 999,00 ₽/шт	700 мл	https://www.perekrestok.ru/cat/5/p/viski-glenmorangie-the-original-sotlandskij-odnosolodovyj-10-let-700ml-4319025	Wed Jul  3 15:05:23 2024	Виски Glenmorangie The Original Шотландский односолодовый 10 лет, 700мл	Цена5 599,00 ₽	Glenmorangie	221.0	0.0 г	0.0 г	0.0 г	Дистилляты висковые солодовые выдержанные, вода подготовленная (исправленная), краситель - сахарный коллер | простой (Е150А). 	True	True	Sat Jul  6 00:02:48 2024
Виски Glenfiddich 12-летний шотландский односолодовый 40% в подарочной упаковке, 700мл	4 799,00 ₽/шт	700 мл	https://www.perekrestok.ru/cat/5/p/viski-glenfiddich-12-letnij-sotlandskij-odnosolodovyj-40-v-podarocnoj-upakovke-700ml-4061118	Wed Jul  3 15:05:23 2024	Виски Glenfiddich 12-летний шотландский односолодовый 40% в подарочной упаковке, 700мл	Цена5 499,00 ₽	Glenfiddich	220.0	0.0 г	0.0 г	0.0 г	Вода питьевая подготовленная, Спирт из солода, пищевая добавка-пищевой Краситель Е150а. 	True	True	Sat Jul  6 00:02:49 2024
Напиток спиртной William Lawson's Супер Спайсд на основе виски 35%, 500мл	999,99 ₽/шт	500 мл	https://www.perekrestok.ru/cat/5/p/napitok-spirtnoj-william-lawsons-super-spajsd-na-osnove-viski-35-500ml-4069801	Wed Jul  3 15:05:23 2024	Напиток спиртной William Lawson's Супер Спайсд на основе виски 35%, 500мл	Цена979,99 ₽	William Lawsons	215.0	0.0 г	0.0 г	5.0 г	Вода питьевая исправленная, Висковые зерновые выдержанные дистилляты злаковых культур, Сахарный сироп инвертный, Ароматизатор пищевой: «Ванильный со специями», Пищевая добавка: краситель E150a. 	True	True	Sat Jul  6 00:02:50 2024
Виски Crabbie's Ярдхэд Сингл Молт шотландский односолодовый	1 549,00 ₽/шт	700 мл	https://www.perekrestok.ru/cat/5/p/viski-crabbies-ardhed-singl-molt-sotlandskij-odnosolodovyj-4266998	Wed Jul  3 15:05:23 2024	Виски Crabbie's Ярдхэд Сингл Молт шотландский односолодовый	Цена1 549,00 ₽	Crabbie's	220.0	0.0 г	0.0 г	0.0 г	Вода питьевая исправленная, висковые солодовые дистилляты на основе ячменного солода, выдержанные не менее 3 лет, пищевой краситель Е 150а. 	True	True	Sat Jul  6 00:02:51 2024
Виски West Cork Ром Каск Финишд 3-летний ирландский односолодовый 43% в подарочной упаковке, 700мл	2 599,00 ₽/шт	700 мл	https://www.perekrestok.ru/cat/5/p/viski-west-cork-rom-kask-finisd-3-letnij-irlandskij-odnosolodovyj-43-v-podarocnoj-upakovke-700ml-4253116	Wed Jul  3 15:05:23 2024	Виски West Cork Ром Каск Финишд 3-летний ирландский односолодовый 43% в подарочной упаковке, 700мл	Цена4 199,00 ₽	West Cork	301.0	0.0 г	0.0 г	0.0 г	Висковый выдержанный дистиллят из ячменного солода, вода исправленная. 	True	True	Sat Jul  6 00:02:52 2024
Виски Old Mull Highland Шотландский односолодовый 40%, 700мл	2 249,00 ₽/шт	700 мл	https://www.perekrestok.ru/cat/5/p/viski-old-mull-highland-sotlandskij-odnosolodovyj-40-700ml-4321114	Wed Jul  3 15:05:23 2024	Виски Old Mull Highland Шотландский односолодовый 40%, 700мл	Цена2 249,00 ₽	none	220.0	0.0 г	0.0 г	0.0 г	Дистилляты висковые выдержанные солодовые, вода подготовленная (исправленная), краситель сахарный колер I простой (CARAMEL I - Plain). 	True	True	Sat Jul  6 00:02:52 2024
Виски Two Stacks Smoke & Mirrors односолодовый 48%, 700мл	2 899,00 ₽/шт	700 мл	https://www.perekrestok.ru/cat/5/p/viski-two-stacks-smoke-mirrors-odnosolodovyj-48-700ml-4274221	Wed Jul  3 15:05:23 2024	Виски Two Stacks Smoke & Mirrors односолодовый 48%, 700мл	Цена2 899,00 ₽	Two Stacks	220.0	0.0 г	0.0 г	0.0 г	Висковые солодовые выдержанные дистилляты, вода исправленная 	True	True	Sat Jul  6 00:02:54 2024
Виски Bankhall Сингл Молт 40%, 700мл	1 449,00 ₽/шт	700 мл	https://www.perekrestok.ru/cat/5/p/viski-bankhall-singl-molt-40-700ml-4265669	Wed Jul  3 15:05:23 2024	Виски Bankhall Сингл Молт 40%, 700мл	Цена1 449,00 ₽	Bankhall	220.0	0.0 г	0.0 г	0.0 г	Висковые солодовые выдержанные дистилляты, вода питьевая исправленная. 	True	True	Sat Jul  6 00:02:55 2024
Виски Old Mull Speyside Шотландский односолодовый в подарочной упаковке 40%, 700мл	2 249,00 ₽/шт	700 мл	https://www.perekrestok.ru/cat/5/p/viski-old-mull-speyside-sotlandskij-odnosolodovyj-v-podarocnoj-upakovke-40-700ml-4321113	Wed Jul  3 15:05:23 2024	Виски Old Mull Speyside Шотландский односолодовый в подарочной упаковке 40%, 700мл	Цена2 249,00 ₽	none	220.0	0.0 г	0.0 г	0.0 г	Дистилляты висковые выдержанные солодовые, вода подготовленная (исправленная), краситель сахарный колер I простой (CARAMEL I - Plain). 	True	True	Sat Jul  6 00:02:56 2024
Виски ирландский односолодовый 40% O'Neills Rum Cask Finished, 700мл	2 199,00 ₽/шт	700 мл	https://www.perekrestok.ru/cat/5/p/viski-irlandskij-odnosolodovyj-40-oneills-rum-cask-finished-700ml-4261100	Wed Jul  3 15:05:23 2024	Виски ирландский односолодовый 40% O'Neills Rum Cask Finished, 700мл	Цена2 199,00 ₽	none	224.0	0.0 г	0.0 г	0.0 г	Висковый выдержанный дистиллят из ячменного солода, вода исправленная, краситель сахарный колер I простой. 	True	True	Sat Jul  6 00:02:57 2024
Виски ирландский односолодовый 40% O'Neills Sherry Cask Finished, 700мл	2 199,00 ₽/шт	700 мл	https://www.perekrestok.ru/cat/5/p/viski-irlandskij-odnosolodovyj-40-oneills-sherry-cask-finished-700ml-4261102	Wed Jul  3 15:05:23 2024	Виски ирландский односолодовый 40% O'Neills Sherry Cask Finished, 700мл	Цена2 199,00 ₽	none	224.0	0.0 г	0.0 г	0.0 г	Висковый выдержанный дистиллят из ячменного солода, вода исправленная, краситель сахарный колер I простой. 	True	True	Sat Jul  6 00:02:58 2024
