name	price	size	url	time	name_	price_	brand	calories	proteins	fats	carbos	composition	get_ok	parse_ok	time_
Грудинка копчёно-варёная Классическая из свинины категория В Маркет, 300г	329,99 ₽/шт	300 гр	https://www.perekrestok.ru/cat/136/p/grudinka-kopceno-varenaa-klassiceskaa-iz-svininy-kategoria-v-market-300g-78030214	Wed Jul  3 15:04:04 2024	none	none	none	none	none	none	none	none	none	none	none
Грудка индейки сыровяленая Экстра Зелёная Линия, 100г	329,99 ₽/шт	100 гр	https://www.perekrestok.ru/cat/136/p/grudka-indejki-syrovalenaa-ekstra-zelenaa-linia-100g-4056917	Wed Jul  3 15:04:04 2024	none	none	none	none	none	none	none	none	none	none	none
Грудинка из свинины Ремит Домашняя копчёно-варёная категория В	1 664,00 ₽/кг	none	https://www.perekrestok.ru/cat/136/p/grudinka-iz-svininy-remit-domasnaa-kopceno-varenaa-kategoria-v-78006633	Wed Jul  3 15:04:04 2024	none	none	none	none	none	none	none	none	none	none	none
Грудинка Великолукский МК Охотничья варёно-копчёная, 300г	219,99 ₽/шт	300 гр	https://www.perekrestok.ru/cat/136/p/grudinka-velikolukskij-mk-ohotnica-vareno-kopcenaa-300g-3474296	Wed Jul  3 15:04:04 2024	none	none	none	none	none	none	none	none	none	none	none
Грудинка варёно-копчёная Окраина Деревенская из свинины категория Б	1 399,00 ₽/кг	none	https://www.perekrestok.ru/cat/136/p/grudinka-vareno-kopcenaa-okraina-derevenskaa-iz-svininy-kategoria-b-4091288	Wed Jul  3 15:04:04 2024	none	none	none	none	none	none	none	none	none	none	none
Бекон Велком сырокопчёный, 200г	159,99 ₽/шт	200 гр	https://www.perekrestok.ru/cat/136/p/bekon-velkom-syrokopcenyj-200g-3443644	Wed Jul  3 15:04:04 2024	none	none	none	none	none	none	none	none	none	none	none
Бекон Дымов Венгерский сырокопчёный нарезка, 200г	289,99 ₽/шт	200 гр	https://www.perekrestok.ru/cat/136/p/bekon-dymov-vengerskij-syrokopcenyj-narezka-200g-3445554	Wed Jul  3 15:04:04 2024	none	none	none	none	none	none	none	none	none	none	none
Бекон Велком Двойное копчение сырокопчёный нарезка, 200г	159,99 ₽/шт	200 гр	https://www.perekrestok.ru/cat/136/p/bekon-velkom-dvojnoe-kopcenie-syrokopcenyj-narezka-200g-3655098	Wed Jul  3 15:04:04 2024	none	none	none	none	none	none	none	none	none	none	none
Бекон Чёрный кабан сырокопченый категории Б, 200г	134,99 ₽/шт	200 гр	https://www.perekrestok.ru/cat/136/p/bekon-cernyj-kaban-syrokopcenyj-kategorii-b-200g-4310572	Wed Jul  3 15:04:04 2024	none	none	none	none	none	none	none	none	none	none	none
Бекон из свинины копчено-запеченный категории Б Зелёная Линия, 150г	249,99 ₽/шт	150 гр	https://www.perekrestok.ru/cat/136/p/bekon-iz-svininy-kopceno-zapecennyj-kategorii-b-zelenaa-linia-150g-4191111	Wed Jul  3 15:04:04 2024	none	none	none	none	none	none	none	none	none	none	none
Бекон сырокопчёный Cortador из свинины, 180г	269,99 ₽/шт	180 гр	https://www.perekrestok.ru/cat/136/p/bekon-syrokopcenyj-cortador-iz-svininy-180g-4225967	Wed Jul  3 15:04:04 2024	none	none	none	none	none	none	none	none	none	none	none
Карбонад из свинины копчено-вареный Маркет, 100г	119,99 ₽/шт	100 гр	https://www.perekrestok.ru/cat/136/p/karbonad-iz-svininy-kopceno-varenyj-market-100g-4284223	Wed Jul  3 15:04:04 2024	none	none	none	none	none	none	none	none	none	none	none
Карбонад Великолукский МК Славянский копчёно-варёный, 300г	289,99 ₽/шт	300 гр	https://www.perekrestok.ru/cat/136/p/karbonad-velikolukskij-mk-slavanskij-kopceno-varenyj-300g-3474298	Wed Jul  3 15:04:04 2024	none	none	none	none	none	none	none	none	none	none	none
Карбонад Клинский Чёрный кабан	1 099,90 ₽/кг	none	https://www.perekrestok.ru/cat/136/p/karbonad-klinskij-cernyj-kaban-3353687	Wed Jul  3 15:04:04 2024	none	none	none	none	none	none	none	none	none	none	none
Карбонад Окраина Юбилейный копчёно-варёный	1 199,90 ₽/кг	none	https://www.perekrestok.ru/cat/136/p/karbonad-okraina-ubilejnyj-kopceno-varenyj-3658450	Wed Jul  3 15:04:04 2024	none	none	none	none	none	none	none	none	none	none	none
Карбонад свиной Мит Стар Классический копчёно-варёный категории Б	1 484,00 ₽/кг	none	https://www.perekrestok.ru/cat/136/p/karbonad-svinoj-mit-star-klassiceskij-kopceno-varenyj-kategorii-b-4215320	Wed Jul  3 15:04:04 2024	none	none	none	none	none	none	none	none	none	none	none
Карбонад Сербская Зимница Кубанский из свинины категории А	1 169,00 ₽/кг	none	https://www.perekrestok.ru/cat/136/p/karbonad-serbskaa-zimnica-kubanskij-iz-svininy-kategorii-a-4252129	Wed Jul  3 15:04:04 2024	none	none	none	none	none	none	none	none	none	none	none
Карбонад Заволжский Роскошь из свинины варено-копченый категории А	1 349,00 ₽/кг	none	https://www.perekrestok.ru/cat/136/p/karbonad-zavolzskij-roskos-iz-svininy-vareno-kopcenyj-kategorii-a-4327861	Wed Jul  3 15:04:04 2024	none	none	none	none	none	none	none	none	none	none	none
Шейка из свинины копчёно-варёная категории Б Маркет, 100г	109,99 ₽/шт	100 гр	https://www.perekrestok.ru/cat/136/p/sejka-iz-svininy-kopceno-varenaa-kategorii-b-market-100g-4331199	Wed Jul  3 15:04:04 2024	none	none	none	none	none	none	none	none	none	none	none
Шейка свиная Ремит копчёно-варёная категория Б нарезка, 150г	169,99 ₽/шт	150 мл	https://www.perekrestok.ru/cat/136/p/sejka-svinaa-remit-kopceno-varenaa-kategoria-b-narezka-150g-3499533	Wed Jul  3 15:04:04 2024	none	none	none	none	none	none	none	none	none	none	none
Шейка свиная Папа может Деликатесная копчёно-варёная категория Б	1 349,00 ₽/кг	none	https://www.perekrestok.ru/cat/136/p/sejka-svinaa-papa-mozet-delikatesnaa-kopceno-varenaa-kategoria-b-3984786	Wed Jul  3 15:04:04 2024	none	none	none	none	none	none	none	none	none	none	none
Мясное ассорти из свинины Мясная история Шейка-балык сырокопчёное категория Б-А, 100г	189,99 ₽/шт	100 гр	https://www.perekrestok.ru/cat/136/p/masnoe-assorti-iz-svininy-masnaa-istoria-sejka-balyk-syrokopcenoe-kategoria-b-a-100g-4032691	Wed Jul  3 15:04:04 2024	none	none	none	none	none	none	none	none	none	none	none
Шейка Иней сырокопчёная нарезка, 100г	219,99 ₽/шт	100 мл	https://www.perekrestok.ru/cat/136/p/sejka-inej-syrokopcenaa-narezka-100g-3658395	Wed Jul  3 15:04:04 2024	none	none	none	none	none	none	none	none	none	none	none
Шейка Окраина Подмосковная копчёно-варёная	1 499,00 ₽/кг	none	https://www.perekrestok.ru/cat/136/p/sejka-okraina-podmoskovnaa-kopceno-varenaa-3658451	Wed Jul  3 15:04:04 2024	none	none	none	none	none	none	none	none	none	none	none
Буженина из свинины Клинский МК Бужане запечённая с чёрным перцем категория Б, 270г	329,99 ₽/шт	270 гр	https://www.perekrestok.ru/cat/136/p/buzenina-iz-svininy-klinskij-mk-buzane-zapecennaa-s-cernym-percem-kategoria-b-270g-4198299	Wed Jul  3 15:04:04 2024	none	none	none	none	none	none	none	none	none	none	none
Буженина из свинины цельнокусковая запеченная Маркет,100г	179,99 ₽/шт	100 гр	https://www.perekrestok.ru/cat/136/p/buzenina-iz-svininy-celnokuskovaa-zapecennaa-market-100g-4332978	Wed Jul  3 15:04:04 2024	none	none	none	none	none	none	none	none	none	none	none
Буженина Егорьевская Боярская варёная запечённая	1 399,00 ₽/кг	none	https://www.perekrestok.ru/cat/136/p/buzenina-egorevskaa-boarskaa-varenaa-zapecennaa-3372804	Wed Jul  3 15:04:04 2024	none	none	none	none	none	none	none	none	none	none	none
Буженина Сербская Зимница Праздничная из свинины запечёная категории Б	1 249,00 ₽/кг	none	https://www.perekrestok.ru/cat/136/p/buzenina-serbskaa-zimnica-prazdnicnaa-iz-svininy-zapecenaa-kategorii-b-4252128	Wed Jul  3 15:04:04 2024	none	none	none	none	none	none	none	none	none	none	none
Сало Белорусское солёное охлаждённое Маркет	899,99 ₽/кг	none	https://www.perekrestok.ru/cat/136/p/salo-belorusskoe-solenoe-ohlazdennoe-market-4105487	Wed Jul  3 15:04:04 2024	none	none	none	none	none	none	none	none	none	none	none
Сало Белорусское солёное нарезка Зелёная Линия, 100г	149,99 ₽/шт	100 гр	https://www.perekrestok.ru/cat/136/p/salo-belorusskoe-solenoe-narezka-zelenaa-linia-100g-4104251	Wed Jul  3 15:04:04 2024	none	none	none	none	none	none	none	none	none	none	none
Сало из свиного шпика с черным перцем и чесноком Зелёная Линия, 100г	144,99 ₽/шт	100 гр	https://www.perekrestok.ru/cat/136/p/salo-iz-svinogo-spika-s-cernym-percem-i-cesnokom-zelenaa-linia-100g-4280740	Wed Jul  3 15:04:04 2024	none	none	none	none	none	none	none	none	none	none	none
Сало Запеченное с можжевельником из шпика свиного Зелёная Линия, 100г	199,99 ₽/шт	100 гр	https://www.perekrestok.ru/cat/809/p/salo-zapecennoe-s-mozzevelnikom-iz-spika-svinogo-zelenaa-linia-100g-4321978	Wed Jul  3 15:04:04 2024	none	none	none	none	none	none	none	none	none	none	none
Сало Востряково Белорусское с пряностями	1 549,00 ₽/кг	none	https://www.perekrestok.ru/cat/136/p/salo-vostrakovo-belorusskoe-s-pranostami-3154498	Wed Jul  3 15:04:04 2024	none	none	none	none	none	none	none	none	none	none	none
Окорок Папа Может Российский из свинины копчено-вареный категории Б, 300г	249,99 ₽/шт	300 гр	https://www.perekrestok.ru/cat/136/p/okorok-papa-mozet-rossijskij-iz-svininy-kopceno-varenyj-kategorii-b-300g-4295617	Wed Jul  3 15:04:04 2024	none	none	none	none	none	none	none	none	none	none	none
Окорок Клинский Черный кабан копчёно-варёный	999,90 ₽/кг	none	https://www.perekrestok.ru/cat/136/p/okorok-klinskij-cernyj-kaban-kopceno-varenyj-46296	Wed Jul  3 15:04:04 2024	none	none	none	none	none	none	none	none	none	none	none
Окорок Иней Отборный свиной копчено-вареный категории Б, 100г	169,99 ₽/шт	100 гр	https://www.perekrestok.ru/cat/136/p/okorok-inej-otbornyj-svinoj-kopceno-varenyj-kategorii-b-100g-4299226	Wed Jul  3 15:04:04 2024	none	none	none	none	none	none	none	none	none	none	none
Окорок из свинины Ремит Домашний копчёно-варёный категории А	1 149,90 ₽/кг	none	https://www.perekrestok.ru/cat/136/p/okorok-iz-svininy-remit-domasnij-kopceno-varenyj-kategorii-a-4200649	Wed Jul  3 15:04:04 2024	none	none	none	none	none	none	none	none	none	none	none
Окорок Cortador Классический из свинины копчёно-варёный, 170г	169,99 ₽/шт	170 гр	https://www.perekrestok.ru/cat/136/p/okorok-cortador-klassiceskij-iz-svininy-kopceno-varenyj-170g-4175498	Wed Jul  3 15:04:04 2024	none	none	none	none	none	none	none	none	none	none	none
Окорочок из мяса птицы Окраина варёно-копчёный	880,99 ₽/кг	none	https://www.perekrestok.ru/cat/136/p/okorocok-iz-masa-pticy-okraina-vareno-kopcenyj-3658452	Wed Jul  3 15:04:04 2024	none	none	none	none	none	none	none	none	none	none	none
Балык Дарницкий сырокопченый из свинины Маркет Collection, 100г	149,99 ₽/шт	100 гр	https://www.perekrestok.ru/cat/136/p/balyk-darnickij-syrokopcenyj-iz-svininy-market-collection-100g-4320645	Wed Jul  3 15:04:04 2024	none	none	none	none	none	none	none	none	none	none	none
Балык свиной Рублевский Ломберный сырокопчёный, 200г	459,99 ₽/шт	200 гр	https://www.perekrestok.ru/cat/136/p/balyk-svinoj-rublevskij-lombernyj-syrokopcenyj-200g-3647664	Wed Jul  3 15:04:04 2024	none	none	none	none	none	none	none	none	none	none	none
Мясное ассорти из свинины Мясная история Шейка-балык сырокопчёное категория Б-А, 100г	189,99 ₽/шт	100 гр	https://www.perekrestok.ru/cat/136/p/masnoe-assorti-iz-svininy-masnaa-istoria-sejka-balyk-syrokopcenoe-kategoria-b-a-100g-4032691	Wed Jul  3 15:04:04 2024	none	none	none	none	none	none	none	none	none	none	none
Балык Иней сырокопчёный нарезка, 100г	219,99 ₽/шт	100 гр	https://www.perekrestok.ru/cat/136/p/balyk-inej-syrokopcenyj-narezka-100g-3646854	Wed Jul  3 15:04:04 2024	none	none	none	none	none	none	none	none	none	none	none
Балык свиной Великолукский МК сырокопчёный категория А нарезка, 150г	179,99 ₽/шт	150 гр	https://www.perekrestok.ru/cat/136/p/balyk-svinoj-velikolukskij-mk-syrokopcenyj-kategoria-a-narezka-150g-4009230	Wed Jul  3 15:04:04 2024	none	none	none	none	none	none	none	none	none	none	none
Говядина сырокопчёная Егорьевская КГФ Брезаола категория А в нарезке, 80г	219,99 ₽/шт	80 гр	https://www.perekrestok.ru/cat/136/p/govadina-syrokopcenaa-egorevskaa-kgf-brezaola-kategoria-a-v-narezke-80g-3967617	Wed Jul  3 15:04:04 2024	none	none	none	none	none	none	none	none	none	none	none
Говядина Иней Отборная варёно-копчёная нарезка, 100г	219,99 ₽/шт	100 гр	https://www.perekrestok.ru/cat/136/p/govadina-inej-otbornaa-vareno-kopcenaa-narezka-100g-3658398	Wed Jul  3 15:04:04 2024	none	none	none	none	none	none	none	none	none	none	none
Говядина по-каталонски Зелёная Линия, 150г	419,99 ₽/шт	150 гр	https://www.perekrestok.ru/cat/136/p/govadina-po-katalonski-zelenaa-linia-150g-4077762	Wed Jul  3 15:04:04 2024	none	none	none	none	none	none	none	none	none	none	none
Говядина По-цыгански копчено-вареная категории А	1 499,90 ₽/кг	none	https://www.perekrestok.ru/cat/809/p/govadina-po-cyganski-kopceno-varenaa-kategorii-a-4312351	Wed Jul  3 15:04:04 2024	none	none	none	none	none	none	none	none	none	none	none
Суджук SD сыровяленый полусухое из говядины категории А, 50г	359,99 ₽/шт	50 гр	https://www.perekrestok.ru/cat/136/p/sudzuk-sd-syrovalenyj-polusuhoe-iz-govadiny-kategorii-a-50g-4323281	Wed Jul  3 15:04:04 2024	none	none	none	none	none	none	none	none	none	none	none
Карпаччо Черкизово из индейки сырокопченое, 85г	159,99 ₽/шт	85 гр	https://www.perekrestok.ru/cat/136/p/karpacco-cerkizovo-iz-indejki-syrokopcenoe-85g-4201174	Wed Jul  3 15:04:04 2024	none	none	none	none	none	none	none	none	none	none	none
Карпаччо из птицы Маркет сырокопчёное сорт Экстра, 200г	209,99 ₽/шт	200 гр	https://www.perekrestok.ru/cat/136/p/karpacco-iz-pticy-market-syrokopcenoe-sort-ekstra-200g-4256984	Wed Jul  3 15:04:04 2024	none	none	none	none	none	none	none	none	none	none	none
Карпаччо По-Домашнему из мяса индейки сырокопченое Зелёная Линия	1 899,00 ₽/кг	none	https://www.perekrestok.ru/cat/136/p/karpacco-po-domasnemu-iz-masa-indejki-syrokopcenoe-zelenaa-linia-4271776	Wed Jul  3 15:04:04 2024	none	none	none	none	none	none	none	none	none	none	none
Карпаччо из мяса птицы Рублевский сырокопчёное	1 349,00 ₽/кг	none	https://www.perekrestok.ru/cat/136/p/karpacco-iz-masa-pticy-rublevskij-syrokopcenoe-3326789	Wed Jul  3 15:04:04 2024	none	none	none	none	none	none	none	none	none	none	none
Ребра из свинины копчено-вареные категории В Маркет	499,90 ₽/кг	none	https://www.perekrestok.ru/cat/136/p/rebra-iz-svininy-kopceno-varenye-kategorii-v-market-4205815	Wed Jul  3 15:04:04 2024	none	none	none	none	none	none	none	none	none	none	none
Филе куриной грудки запеченное с прованскими травами охлажденное Зелёная Линия, 182г	239,99 ₽/шт	182 гр	https://www.perekrestok.ru/cat/136/p/file-kurinoj-grudki-zapecennoe-s-provanskimi-travami-ohlazdennoe-zelenaa-linia-182g-4063310	Wed Jul  3 15:04:04 2024	none	none	none	none	none	none	none	none	none	none	none
Филе куриной грудки гриль с черным перцем и чесноком охлажденное Зелёная Линия, 182г	239,99 ₽/шт	182 гр	https://www.perekrestok.ru/cat/136/p/file-kurinoj-grudki-gril-s-cernym-percem-i-cesnokom-ohlazdennoe-zelenaa-linia-182g-4063309	Wed Jul  3 15:04:04 2024	none	none	none	none	none	none	none	none	none	none	none
Филе Тандури куриной грудки запеченное Экстра Зелёная Линия, 180г	219,99 ₽/шт	180 гр	https://www.perekrestok.ru/cat/136/p/file-tanduri-kurinoj-grudki-zapecennoe-ekstra-zelenaa-linia-180g-4285417	Wed Jul  3 15:04:04 2024	none	none	none	none	none	none	none	none	none	none	none
Филе Сувлаки куриной грудки запеченное Экстра Зелёная Линия, 180г	219,99 ₽/шт	180 гр	https://www.perekrestok.ru/cat/136/p/file-suvlaki-kurinoj-grudki-zapecennoe-ekstra-zelenaa-linia-180g-4285416	Wed Jul  3 15:04:04 2024	none	none	none	none	none	none	none	none	none	none	none
Филе По-домашнему бедра индейки копчёно-варёное Зелёная Линия, 100г	199,99 ₽/шт	100 гр	https://www.perekrestok.ru/cat/136/p/file-po-domasnemu-bedra-indejki-kopceno-varenoe-zelenaa-linia-100g-4336443	Wed Jul  3 15:04:04 2024	none	none	none	none	none	none	none	none	none	none	none
Филе Грудки индейки с пряностями сыровяленая Зелёная Линия, 100г	379,99 ₽/шт	100 гр	https://www.perekrestok.ru/cat/136/p/file-grudki-indejki-s-pranostami-syrovalenaa-zelenaa-linia-100g-4336425	Wed Jul  3 15:04:04 2024	none	none	none	none	none	none	none	none	none	none	none
Филе индейки По-Домашнему варено-копченое Зелёная Линия	1 249,90 ₽/кг	none	https://www.perekrestok.ru/cat/136/p/file-indejki-po-domasnemu-vareno-kopcenoe-zelenaa-linia-4271774	Wed Jul  3 15:04:04 2024	none	none	none	none	none	none	none	none	none	none	none
Прошутто Prosciutto свинина сыровяленая SD, 70г	299,99 ₽/шт	70 гр	https://www.perekrestok.ru/cat/136/p/prosutto-prosciutto-svinina-syrovalenaa-sd-70g-3913882	Wed Jul  3 15:04:04 2024	none	none	none	none	none	none	none	none	none	none	none
Хамон свиной Casademont сыровяленый, 100г	579,99 ₽/шт	100 гр	https://www.perekrestok.ru/cat/136/p/hamon-svinoj-casademont-syrovalenyj-100g-3613991	Wed Jul  3 15:04:04 2024	none	none	none	none	none	none	none	none	none	none	none
Продукт мясной SD Прошутто из свинины сыровяленый категории А, 50г	399,99 ₽/шт	50 гр	https://www.perekrestok.ru/cat/136/p/produkt-masnoj-sd-prosutto-iz-svininy-syrovalenyj-kategorii-a-50g-4323279	Wed Jul  3 15:04:04 2024	none	none	none	none	none	none	none	none	none	none	none
Шинка свиная иней варёно-копчёная пряная категория Б, 150г	129,99 ₽/шт	150 гр	https://www.perekrestok.ru/cat/136/p/sinka-svinaa-inej-vareno-kopcenaa-pranaa-kategoria-b-150g-4208499	Wed Jul  3 15:04:04 2024	none	none	none	none	none	none	none	none	none	none	none
Дымовица копчено-варёная из лопатки свинины Маркет, 100г	119,99 ₽/шт	100 гр	https://www.perekrestok.ru/cat/136/p/dymovica-kopceno-varenaa-iz-lopatki-svininy-market-100g-4284224	Wed Jul  3 15:04:04 2024	none	none	none	none	none	none	none	none	none	none	none
Колбаски сырокопчёные Черкизово Premium Мясной снек Классический полусухие, 70г	169,99 ₽/шт	70 гр	https://www.perekrestok.ru/cat/136/p/kolbaski-syrokopcenye-cerkizovo-premium-masnoj-snek-klassiceskij-polusuhie-70g-4169183	Wed Jul  3 15:04:04 2024	none	none	none	none	none	none	none	none	none	none	none
Говядина сыровяленая категории Б Market Collection, 100г	279,99 ₽/шт	100 гр	https://www.perekrestok.ru/cat/136/p/govadina-syrovalenaa-kategorii-b-market-collection-100g-4181905	Wed Jul  3 15:04:04 2024	none	none	none	none	none	none	none	none	none	none	none
Пастрами из индейки Мясной дом Бородина DeliChef копчёно-варёная	1 599,90 ₽/кг	none	https://www.perekrestok.ru/cat/136/p/pastrami-iz-indejki-masnoj-dom-borodina-delichef-kopceno-varenaa-4046010	Wed Jul  3 15:04:04 2024	none	none	none	none	none	none	none	none	none	none	none
Свинина Solemici Prosciutto Crudo сыровяленая категории А нарезка, 100г	619,99 ₽/шт	100 гр	https://www.perekrestok.ru/cat/136/p/svinina-solemici-prosciutto-crudo-syrovalenaa-kategorii-a-narezka-100g-4165272	Wed Jul  3 15:04:04 2024	none	none	none	none	none	none	none	none	none	none	none
Уши свиные Марти копчёно-варёные к пиву, 100г	45,99 ₽/шт	100 гр	https://www.perekrestok.ru/cat/136/p/usi-svinye-marti-kopceno-varenye-k-pivu-100g-3441015	Wed Jul  3 15:04:04 2024	none	none	none	none	none	none	none	none	none	none	none
Голень Сербская Зимница Праздничная из мяса птицы копчёно-варёная высший сорт	1 099,00 ₽/кг	none	https://www.perekrestok.ru/cat/136/p/golen-serbskaa-zimnica-prazdnicnaa-iz-masa-pticy-kopceno-varenaa-vyssij-sort-4252120	Wed Jul  3 15:04:04 2024	none	none	none	none	none	none	none	none	none	none	none
Коппа SD сыровяленая категории А	5 399,00 ₽/кг	none	https://www.perekrestok.ru/cat/136/p/koppa-sd-syrovalenaa-kategorii-a-4323287	Wed Jul  3 15:04:04 2024	none	none	none	none	none	none	none	none	none	none	none
Язык говяжий традиционный вареный кат.Б Зелёная Линия, 100г	339,99 ₽/шт	100 гр	https://www.perekrestok.ru/cat/136/p/azyk-govazij-tradicionnyj-varenyj-kat-b-zelenaa-linia-100g-4077765	Thu Jul  4 08:48:36 2024	none	none	none	none	none	none	none	none	none	none	none
