name	url	locale	address	price	time
Пудинг молочный Ehrmann High Protein шоколад ультрапастеризованный 1.5%, 200г	https://www.perekrestok.ru/cat/658/p/puding-molocnyj-ehrmann-high-protein-sokolad-ultrapasterizovannyj-1-5-200g-4101183	msk	Москва, Большой Патриарший переулок, 5	114,99 ₽/шт	Sun Jul  7 23:20:00 2024
Пудинг молочный Ehrmann High Protein со вкусом ванили ультрапастеризованный 1.5%, 200г	https://www.perekrestok.ru/cat/658/p/puding-molocnyj-ehrmann-high-protein-so-vkusom-vanili-ultrapasterizovannyj-1-5-200g-4101182	msk	Москва, Большой Патриарший переулок, 5	114,99 ₽/шт	Sun Jul  7 23:20:00 2024
Пудинг Эрмигурт шоколад 3.2%, 100г	https://www.perekrestok.ru/cat/658/p/puding-ermigurt-sokolad-3-2-100g-3341393	msk	Москва, Большой Патриарший переулок, 5	35,99 ₽/шт	Sun Jul  7 23:20:00 2024
Пудинг молочный Grand Dessert шоколад 5.2%, 200г	https://www.perekrestok.ru/cat/658/p/puding-molocnyj-grand-dessert-sokolad-5-2-200g-3483437	msk	Москва, Большой Патриарший переулок, 5	97,99 ₽/шт	Sun Jul  7 23:20:00 2024
Пудинг Эрмигурт карамель 3%, 100г	https://www.perekrestok.ru/cat/658/p/puding-ermigurt-karamel-3-100g-3393999	msk	Москва, Большой Патриарший переулок, 5	35,99 ₽/шт	Sun Jul  7 23:20:00 2024
Пудинг Чудо шоколадный 3%, 125г	https://www.perekrestok.ru/cat/658/p/puding-cudo-sokoladnyj-3-125g-17032	msk	Москва, Большой Патриарший переулок, 5	43,99 ₽/шт	Sun Jul  7 23:20:00 2024
Пудинг молочный Село Зелёное ванильный 3%, 120г	https://www.perekrestok.ru/cat/658/p/puding-molocnyj-selo-zelenoe-vanilnyj-3-120g-3685272	msk	Москва, Большой Патриарший переулок, 5	44,99 ₽/шт	Sun Jul  7 23:20:00 2024
Пудинг молочный Grand Dessert ваниль 4.7%, 200г	https://www.perekrestok.ru/cat/658/p/puding-molocnyj-grand-dessert-vanil-4-7-200g-3483427	msk	Москва, Большой Патриарший переулок, 5	97,99 ₽/шт	Sun Jul  7 23:20:00 2024
Пудинг молочный Grand Dessert Белый шоколад с клубничным муссом 6%, 200г	https://www.perekrestok.ru/cat/658/p/puding-molocnyj-grand-dessert-belyj-sokolad-s-klubnicnym-mussom-6-200g-3666413	msk	Москва, Большой Патриарший переулок, 5	97,99 ₽/шт	Sun Jul  7 23:20:00 2024
Пудинг молочный Grand Dessert Двойной орех со сливочным муссом 4.9%, 200г	https://www.perekrestok.ru/cat/658/p/puding-molocnyj-grand-dessert-dvojnoj-oreh-so-slivocnym-mussom-4-9-200g-3483430	msk	Москва, Большой Патриарший переулок, 5	97,99 ₽/шт	Sun Jul  7 23:20:00 2024
Пудинг молочный Село Зелёное шоколадный 3%, 120г	https://www.perekrestok.ru/cat/658/p/puding-molocnyj-selo-zelenoe-sokoladnyj-3-120g-3685287	msk	Москва, Большой Патриарший переулок, 5	44,99 ₽/шт	Sun Jul  7 23:20:00 2024
Пудинг Чудо Ваниль 3%, 125г	https://www.perekrestok.ru/cat/658/p/puding-cudo-vanil-3-125g-27980	msk	Москва, Большой Патриарший переулок, 5	43,99 ₽/шт	Sun Jul  7 23:20:00 2024
Желе со вкусом вишни пастеризованное Пр!ст, 150г	https://www.perekrestok.ru/cat/658/p/zele-so-vkusom-visni-pasterizovannoe-pr-st-150g-4270407	msk	Москва, Большой Патриарший переулок, 5	29,99 ₽/шт	Sun Jul  7 23:20:00 2024
Желе со вкусом яблока пастеризованное Пр!ст, 150г	https://www.perekrestok.ru/cat/658/p/zele-so-vkusom-abloka-pasterizovannoe-pr-st-150g-4270408	msk	Москва, Большой Патриарший переулок, 5	29,99 ₽/шт	Sun Jul  7 23:20:00 2024
Желе РАЭ фруктовое с вишней, 150г	https://www.perekrestok.ru/cat/658/p/zele-rae-fruktovoe-s-visnej-150g-3625278	msk	Москва, Большой Патриарший переулок, 5	67,99 ₽/шт	Sun Jul  7 23:20:00 2024
Желе со вкусом персика пастеризованное Пр!ст, 150г	https://www.perekrestok.ru/cat/658/p/zele-so-vkusom-persika-pasterizovannoe-pr-st-150g-4270409	msk	Москва, Большой Патриарший переулок, 5	29,99 ₽/шт	Sun Jul  7 23:20:00 2024
Десерт Манго Зелёная Линия, 200г	https://www.perekrestok.ru/cat/658/p/desert-mango-zelenaa-linia-200g-4341051	msk	Москва, Большой Патриарший переулок, 5	129,99 ₽/шт	Sun Jul  7 23:20:00 2024
Десерт Манго-клубника Зелёная Линия, 200г	https://www.perekrestok.ru/cat/658/p/desert-mango-klubnika-zelenaa-linia-200g-4341050	msk	Москва, Большой Патриарший переулок, 5	139,99 ₽/шт	Sun Jul  7 23:20:00 2024
Желе New Choice Тропик ассорти, 300г	https://www.perekrestok.ru/cat/658/p/zele-new-choice-tropik-assorti-300g-4305148	msk	Москва, Большой Патриарший переулок, 5	229,99 ₽/шт	Sun Jul  7 23:20:00 2024
Десерт Ягодный микс Зелёная Линия, 200г	https://www.perekrestok.ru/cat/658/p/desert-agodnyj-miks-zelenaa-linia-200g-4341048	msk	Москва, Большой Патриарший переулок, 5	139,99 ₽/шт	Sun Jul  7 23:20:00 2024
Десерт фруктовый Tutto Фруктовый коктейль, 250г	https://www.perekrestok.ru/cat/658/p/desert-fruktovyj-tutto-fruktovyj-koktejl-250g-3656136	msk	Москва, Большой Патриарший переулок, 5	322,99 ₽/шт	Sun Jul  7 23:20:00 2024
Десерт Персик Зелёная Линия, 200г	https://www.perekrestok.ru/cat/658/p/desert-persik-zelenaa-linia-200g-4341049	msk	Москва, Большой Патриарший переулок, 5	129,99 ₽/шт	Sun Jul  7 23:20:00 2024
Десерт Tutto виноград, 250г	https://www.perekrestok.ru/cat/658/p/desert-tutto-vinograd-250g-3656135	msk	Москва, Большой Патриарший переулок, 5	322,99 ₽/шт	Sun Jul  7 23:20:00 2024
Десерт Tutto японский мандарин, 250г	https://www.perekrestok.ru/cat/658/p/desert-tutto-aponskij-mandarin-250g-3656133	msk	Москва, Большой Патриарший переулок, 5	304,99 ₽/шт	Sun Jul  7 23:20:00 2024
Десерт Аппетиссимо лесное ассорти, 500г	https://www.perekrestok.ru/cat/658/p/desert-appetissimo-lesnoe-assorti-500g-3071395	msk	Москва, Большой Патриарший переулок, 5	87,99 ₽/шт	Sun Jul  7 23:20:00 2024
Кисель Аппетиссимо чёрная смородина плодово-ягодный, 500мл	https://www.perekrestok.ru/cat/658/p/kisel-appetissimo-cernaa-smorodina-plodovo-agodnyj-500ml-3003181	msk	Москва, Большой Патриарший переулок, 5	63,99 ₽/шт	Sun Jul  7 23:20:00 2024
Кисель плодово-ягодный Аппетиссимо, 500мл	https://www.perekrestok.ru/cat/658/p/kisel-plodovo-agodnyj-appetissimo-500ml-4334578	msk	Москва, Большой Патриарший переулок, 5	63,99 ₽/шт	Sun Jul  7 23:20:00 2024
Напиток Natura Selection Latte Банан-Карамель молочный кофейный 2.4%, 220мл	https://www.perekrestok.ru/cat/658/p/napitok-natura-selection-latte-banan-karamel-molocnyj-kofejnyj-2-4-220ml-4282033	msk	Москва, Большой Патриарший переулок, 5	149,99 ₽/шт	Sun Jul  7 23:20:00 2024
Напиток Natura Selection Cappuccino Карамель молочный кофейный 2.4%, 220мл	https://www.perekrestok.ru/cat/658/p/napitok-natura-selection-cappuccino-karamel-molocnyj-kofejnyj-2-4-220ml-4282025	msk	Москва, Большой Патриарший переулок, 5	149,99 ₽/шт	Sun Jul  7 23:20:00 2024
Запеканка А.Ростагрокомплекс творожная с ванилью 16%, 100г	https://www.perekrestok.ru/cat/658/p/zapekanka-a-rostagrokompleks-tvoroznaa-s-vanilu-16-100g-4230672	msk	Москва, Большой Патриарший переулок, 5	129,99 ₽/шт	Sun Jul  7 23:20:00 2024
Запеканка А.Ростагрокомплекс Вишня творожная с фруктовым наполнителем 13%, 100г	https://www.perekrestok.ru/cat/658/p/zapekanka-a-rostagrokompleks-visna-tvoroznaa-s-fruktovym-napolnitelem-13-100g-4230671	msk	Москва, Большой Патриарший переулок, 5	129,99 ₽/шт	Sun Jul  7 23:20:00 2024
Пюре Nutrino Lab фруктовое яблоко персик клубника малина, 200г	https://www.perekrestok.ru/cat/253/p/pure-nutrino-lab-fruktovoe-abloko-persik-klubnika-malina-200g-4301926	msk	Москва, Большой Патриарший переулок, 5	229,99 ₽/шт	Sun Jul  7 23:20:00 2024
Десерт мультизлаковый Velle солёная карамель ферментированный, 130г	https://www.perekrestok.ru/cat/658/p/desert-multizlakovyj-velle-solenaa-karamel-fermentirovannyj-130g-4199050	msk	Москва, Большой Патриарший переулок, 5	69,99 ₽/шт	Sun Jul  7 23:20:00 2024
Пюре Nutrino Lab фруктовое яблоко манго папайя банан, 200г	https://www.perekrestok.ru/cat/253/p/pure-nutrino-lab-fruktovoe-abloko-mango-papaja-banan-200g-4301924	msk	Москва, Большой Патриарший переулок, 5	229,99 ₽/шт	Sun Jul  7 23:20:00 2024
Десерт творожный Grand Duet Мечта единорога ягодное мороженое 5.5%, 135г	https://www.perekrestok.ru/cat/658/p/desert-tvoroznyj-grand-duet-mecta-edinoroga-agodnoe-morozenoe-5-5-135g-4017719	msk	Москва, Большой Патриарший переулок, 5	97,99 ₽/шт	Sun Jul  7 23:20:00 2024
Десерт Ростагрокомплекс творожный клубничный Чизкейк 15%, 40г	https://www.perekrestok.ru/cat/658/p/desert-rostagrokompleks-tvoroznyj-klubnicnyj-cizkejk-15-40g-4252236	msk	Москва, Большой Патриарший переулок, 5	73,99 ₽/шт	Sun Jul  7 23:20:00 2024
Десерт творожный Grand Duet Шоко трио шоколад 7.3%, 138г	https://www.perekrestok.ru/cat/658/p/desert-tvoroznyj-grand-duet-soko-trio-sokolad-7-3-138g-4017709	msk	Москва, Большой Патриарший переулок, 5	97,99 ₽/шт	Sun Jul  7 23:20:00 2024
Десерт творожный Ностальгия Топленое Молоко глазированный 15%, 60г	https://www.perekrestok.ru/cat/658/p/desert-tvoroznyj-nostalgia-toplenoe-moloko-glazirovannyj-15-60g-3467257	msk	Москва, Большой Патриарший переулок, 5	51,99 ₽/шт	Sun Jul  7 23:20:00 2024
Пирожное Kinder Pingui шоколад, 30г	https://www.perekrestok.ru/cat/658/p/piroznoe-kinder-pingui-sokolad-30g-53713	msk	Москва, Большой Патриарший переулок, 5	69,99 ₽/шт	Sun Jul  7 23:20:00 2024
Пирожное Kinder Молочный ломтик, 5x28г	https://www.perekrestok.ru/cat/658/p/piroznoe-kinder-molocnyj-lomtik-5x28g-3492437	msk	Москва, Большой Патриарший переулок, 5	209,99 ₽/шт	Sun Jul  7 23:20:00 2024
Пирожное Kinder Maxi King орехи-карамель, 35г	https://www.perekrestok.ru/cat/658/p/piroznoe-kinder-maxi-king-orehi-karamel-35g-53715	msk	Москва, Большой Патриарший переулок, 5	97,99 ₽/шт	Sun Jul  7 23:20:00 2024
Трубочка вафельная Свитлогорье сгущённое молоко, 65г	https://www.perekrestok.ru/cat/658/p/trubocka-vafelnaa-svitlogore-sgusennoe-moloko-65g-3488298	msk	Москва, Большой Патриарший переулок, 5	49,99 ₽/шт	Sun Jul  7 23:20:00 2024
Молоко сгущённое с сахаром варёное в вафельной трубочке 8.5% Зелёная Линия, 35г	https://www.perekrestok.ru/cat/658/p/moloko-sgusennoe-s-saharom-varenoe-v-vafelnoj-trubocke-8-5-zelenaa-linia-35g-4310828	msk	Москва, Большой Патриарший переулок, 5	39,99 ₽/шт	Sun Jul  7 23:20:00 2024
Молочный крем в вафельной трубочке 11.7% Зелёная Линия, 35г	https://www.perekrestok.ru/cat/658/p/molocnyj-krem-v-vafelnoj-trubocke-11-7-zelenaa-linia-35g-4310829	msk	Москва, Большой Патриарший переулок, 5	49,99 ₽/шт	Sun Jul  7 23:20:00 2024
Десерт А.Ростагрокомплекс Чизкейк творожный с манго и семенами чиа 15%, 40г	https://www.perekrestok.ru/cat/658/p/desert-a-rostagrokompleks-cizkejk-tvoroznyj-s-mango-i-semenami-cia-15-40g-4230644	msk	Москва, Большой Патриарший переулок, 5	89,98 ₽/шт	Sun Jul  7 23:20:00 2024
Пирожное бисквитное Kinder Paradiso молоко-лимон, 29г	https://www.perekrestok.ru/cat/658/p/piroznoe-biskvitnoe-kinder-paradiso-moloko-limon-29g-3140731	msk	Москва, Большой Патриарший переулок, 5	79,99 ₽/шт	Sun Jul  7 23:20:00 2024
Пирожное Milka Шоколадный Перекус бисквитное с кремом в молочном шоколаде, 29г	https://www.perekrestok.ru/cat/658/p/piroznoe-milka-sokoladnyj-perekus-biskvitnoe-s-kremom-v-molocnom-sokolade-29g-4276522	msk	Москва, Большой Патриарший переулок, 5	77,99 ₽/шт	Sun Jul  7 23:20:00 2024
Панна-котта манго-маракуйя-апельсин 4.2% Зелёная Линия, 160г	https://www.perekrestok.ru/cat/658/p/panna-kotta-mango-marakuja-apelsin-4-2-zelenaa-linia-160g-3669116	msk	Москва, Большой Патриарший переулок, 5	144,99 ₽/шт	Sun Jul  7 23:20:00 2024
Пирожное бисквитное Kinder Pingui вишня, 30г	https://www.perekrestok.ru/cat/658/p/piroznoe-biskvitnoe-kinder-pingui-visna-30g-3979919	msk	Москва, Большой Патриарший переулок, 5	71,99 ₽/шт	Sun Jul  7 23:20:00 2024
Нуга А.Ростагрокомплекс глазированная с фундуком в молочном шоколаде, 40г	https://www.perekrestok.ru/cat/658/p/nuga-a-rostagrokompleks-glazirovannaa-s-fundukom-v-molocnom-sokolade-40g-4230659	msk	Москва, Большой Патриарший переулок, 5	79,99 ₽/шт	Sun Jul  7 23:20:00 2024
Десерт А.Ростагрокомплекс Чизкейк творожный с ванилью 15%, 40г	https://www.perekrestok.ru/cat/658/p/desert-a-rostagrokompleks-cizkejk-tvoroznyj-s-vanilu-15-40g-4230660	msk	Москва, Большой Патриарший переулок, 5	75,99 ₽/шт	Sun Jul  7 23:20:00 2024
Трубочка для молока Proпитание Баббл гам карамельное драже, 30г	https://www.perekrestok.ru/cat/658/p/trubocka-dla-moloka-propitanie-babbl-gam-karamelnoe-draze-30g-3979457	msk	Москва, Большой Патриарший переулок, 5	53,99 ₽/шт	Sun Jul  7 23:20:00 2024
Вафельная трубочка Капучино с сахаром и натуральным кофе 19% Молочный Знак, 65г	https://www.perekrestok.ru/cat/658/p/vafelnaa-trubocka-kapucino-s-saharom-i-naturalnym-kofe-19-molocnyj-znak-65g-4336941	msk	Москва, Большой Патриарший переулок, 5	45,99 ₽/шт	Sun Jul  7 23:20:00 2024
Зефир ЗГДДОП молочный с кофе в молочном бельгийском шоколаде 16%, 60г	https://www.perekrestok.ru/cat/658/p/zefir-zgddop-molocnyj-s-kofe-v-molocnom-belgijskom-sokolade-16-60g-4074289	msk	Москва, Большой Патриарший переулок, 5	119,99 ₽/шт	Sun Jul  7 23:20:00 2024
Трубочка для молока Proпитание клубника, 30г	https://www.perekrestok.ru/cat/658/p/trubocka-dla-moloka-propitanie-klubnika-30g-3432237	msk	Москва, Большой Патриарший переулок, 5	53,99 ₽/шт	Sun Jul  7 23:20:00 2024
Панна-котта Вишня 12.5% Зелёная Линия, 160г	https://www.perekrestok.ru/cat/658/p/panna-kotta-visna-12-5-zelenaa-linia-160g-4207106	msk	Москва, Большой Патриарший переулок, 5	144,99 ₽/шт	Sun Jul  7 23:20:00 2024
Трубочка для молока Proпитание шоколад, 30г	https://www.perekrestok.ru/cat/658/p/trubocka-dla-moloka-propitanie-sokolad-30g-3432239	msk	Москва, Большой Патриарший переулок, 5	53,99 ₽/шт	Sun Jul  7 23:20:00 2024
Нуга А.Ростагрокомплекс глазированная в молочном шоколаде, 40г	https://www.perekrestok.ru/cat/658/p/nuga-a-rostagrokompleks-glazirovannaa-v-molocnom-sokolade-40g-4230649	msk	Москва, Большой Патриарший переулок, 5	79,99 ₽/шт	Sun Jul  7 23:20:00 2024
Трубочка для молока Proпитание шоколад-банан, 30г	https://www.perekrestok.ru/cat/658/p/trubocka-dla-moloka-propitanie-sokolad-banan-30g-3432241	msk	Москва, Большой Патриарший переулок, 5	53,99 ₽/шт	Sun Jul  7 23:20:00 2024
Бисквит А.Ростагрокомплекс Брауни шоколадный с грецким орехом и карамелью, 40г	https://www.perekrestok.ru/cat/658/p/biskvit-a-rostagrokompleks-brauni-sokoladnyj-s-greckim-orehom-i-karamelu-40g-4230656	msk	Москва, Большой Патриарший переулок, 5	85,99 ₽/шт	Sun Jul  7 23:20:00 2024
Десерт ЗГДДОП вафельная трубочка с кремом сгущенное молоко 33.2%, 65г	https://www.perekrestok.ru/cat/658/p/desert-zgddop-vafelnaa-trubocka-s-kremom-sgusennoe-moloko-33-2-65g-4285561	msk	Москва, Большой Патриарший переулок, 5	104,99 ₽/шт	Sun Jul  7 23:20:00 2024
Десерт G-Balance кокосовый с йогуртовой закваской лесные ягоды, 170г	https://www.perekrestok.ru/cat/658/p/desert-g-balance-kokosovyj-s-jogurtovoj-zakvaskoj-lesnye-agody-170g-4336856	msk	Москва, Большой Патриарший переулок, 5	109,99 ₽/шт	Sun Jul  7 23:20:00 2024
Десерт G-Balance кокосовый с йогуртовой закваской манго-маракуйя, 170г	https://www.perekrestok.ru/cat/658/p/desert-g-balance-kokosovyj-s-jogurtovoj-zakvaskoj-mango-marakuja-170g-4336858	msk	Москва, Большой Патриарший переулок, 5	109,99 ₽/шт	Sun Jul  7 23:20:00 2024
Десерт G-Balance кокосовый с йогуртовой закваской клубника, 170г	https://www.perekrestok.ru/cat/658/p/desert-g-balance-kokosovyj-s-jogurtovoj-zakvaskoj-klubnika-170g-4336857	msk	Москва, Большой Патриарший переулок, 5	109,99 ₽/шт	Sun Jul  7 23:20:00 2024
Десерт А.Ростагрокомплекс Status глазированный Манго-семена чиа и фундуком в молочном шоколаде 26%, 45г	https://www.perekrestok.ru/cat/658/p/desert-a-rostagrokompleks-status-glazirovannyj-mango-semena-cia-i-fundukom-v-molocnom-sokolade-26-45g-4303035	msk	Москва, Большой Патриарший переулок, 5	104,99 ₽/шт	Sun Jul  7 23:20:00 2024
Пирожное Milino бисквитное с кремом с высоким содержанием белка в молочном шоколаде, 40г	https://www.perekrestok.ru/cat/65/p/piroznoe-milino-biskvitnoe-s-kremom-s-vysokim-soderzaniem-belka-v-molocnom-sokolade-40g-4338912	msk	Москва, Большой Патриарший переулок, 5	126,99 ₽/шт	Sun Jul  7 23:20:00 2024
Суфле молочное ЗГДиОП Им.В.П.Пастухова ваниль-молочный бельгийский шоколад 17%, 50г	https://www.perekrestok.ru/cat/658/p/sufle-molocnoe-zgdiop-im-v-p-pastuhova-vanil-molocnyj-belgijskij-sokolad-17-50g-4032832	msk	Москва, Большой Патриарший переулок, 5	99,99 ₽/шт	Sun Jul  7 23:20:00 2024
Суфле молочное ЗГДиОП им.В.П.Пастухова с молоком сгущённым в бельгийском шоколаде 17%, 50г	https://www.perekrestok.ru/cat/658/p/sufle-molocnoe-zgdiop-im-v-p-pastuhova-s-molokom-sgusennym-v-belgijskom-sokolade-17-50g-4032834	msk	Москва, Большой Патриарший переулок, 5	104,99 ₽/шт	Sun Jul  7 23:20:00 2024
Суфле молочное ЗГДиОП Им.В.П.Пастухова черника 17%, 50г	https://www.perekrestok.ru/cat/658/p/sufle-molocnoe-zgdiop-im-v-p-pastuhova-cernika-17-50g-4032835	msk	Москва, Большой Патриарший переулок, 5	104,99 ₽/шт	Sun Jul  7 23:20:00 2024
Десерт Mon Realle Панна-Котик Шоколад, 180г	https://www.perekrestok.ru/cat/658/p/desert-mon-realle-panna-kotik-sokolad-180g-4357960	msk	Москва, Большой Патриарший переулок, 5	229,99 ₽/шт	Sun Jul  7 23:20:00 2024
Пудинг молочный Ehrmann High Protein шоколад ультрапастеризованный 1.5%, 200г	https://www.perekrestok.ru/cat/658/p/puding-molocnyj-ehrmann-high-protein-sokolad-ultrapasterizovannyj-1-5-200g-4101183	spb	Санкт-Петербург, Биржевая площадь, 4	129,99 ₽/шт	Sun Jul  7 23:20:00 2024
Пудинг молочный Grand Dessert шоколад 5.2%, 200г	https://www.perekrestok.ru/cat/658/p/puding-molocnyj-grand-dessert-sokolad-5-2-200g-3483437	spb	Санкт-Петербург, Биржевая площадь, 4	97,99 ₽/шт	Sun Jul  7 23:20:00 2024
Пудинг молочный Grand Dessert солёная карамель 4.7%, 200г	https://www.perekrestok.ru/cat/658/p/puding-molocnyj-grand-dessert-solenaa-karamel-4-7-200g-3921666	spb	Санкт-Петербург, Биржевая площадь, 4	97,99 ₽/шт	Sun Jul  7 23:20:00 2024
Пудинг молочный Grand Dessert Белый шоколад с клубничным муссом 6%, 200г	https://www.perekrestok.ru/cat/658/p/puding-molocnyj-grand-dessert-belyj-sokolad-s-klubnicnym-mussom-6-200g-3666413	spb	Санкт-Петербург, Биржевая площадь, 4	97,99 ₽/шт	Sun Jul  7 23:20:00 2024
Пудинг молочный Grand Dessert Двойной орех со сливочным муссом 4.9%, 200г	https://www.perekrestok.ru/cat/658/p/puding-molocnyj-grand-dessert-dvojnoj-oreh-so-slivocnym-mussom-4-9-200g-3483430	spb	Санкт-Петербург, Биржевая площадь, 4	93,99 ₽/шт	Sun Jul  7 23:20:00 2024
Пудинг Эрмигурт шоколад 3.2%, 100г	https://www.perekrestok.ru/cat/658/p/puding-ermigurt-sokolad-3-2-100g-3341393	spb	Санкт-Петербург, Биржевая площадь, 4	33,99 ₽/шт	Sun Jul  7 23:20:00 2024
Пудинг молочный Село Зелёное ванильный 3%, 120г	https://www.perekrestok.ru/cat/658/p/puding-molocnyj-selo-zelenoe-vanilnyj-3-120g-3685272	spb	Санкт-Петербург, Биржевая площадь, 4	39,99 ₽/шт	Sun Jul  7 23:20:00 2024
Пудинг молочный Село Зелёное шоколадный 3%, 120г	https://www.perekrestok.ru/cat/658/p/puding-molocnyj-selo-zelenoe-sokoladnyj-3-120g-3685287	spb	Санкт-Петербург, Биржевая площадь, 4	39,99 ₽/шт	Sun Jul  7 23:20:00 2024
Пудинг Чудо шоколадный 3%, 125г	https://www.perekrestok.ru/cat/658/p/puding-cudo-sokoladnyj-3-125g-17032	spb	Санкт-Петербург, Биржевая площадь, 4	31,99 ₽/шт	Sun Jul  7 23:20:00 2024
Пудинг молочный Село Зелёное карамельный 3%, 120г	https://www.perekrestok.ru/cat/658/p/puding-molocnyj-selo-zelenoe-karamelnyj-3-120g-4126107	spb	Санкт-Петербург, Биржевая площадь, 4	39,99 ₽/шт	Sun Jul  7 23:20:00 2024
Пудинг Эрмигурт карамель 3%, 100г	https://www.perekrestok.ru/cat/658/p/puding-ermigurt-karamel-3-100g-3393999	spb	Санкт-Петербург, Биржевая площадь, 4	33,99 ₽/шт	Sun Jul  7 23:20:00 2024
Пудинг Чудо карамель 3%, 125г	https://www.perekrestok.ru/cat/658/p/puding-cudo-karamel-3-125g-54417	spb	Санкт-Петербург, Биржевая площадь, 4	43,99 ₽/шт	Sun Jul  7 23:20:00 2024
Желе РАЭ фруктовое с вишней, 150г	https://www.perekrestok.ru/cat/658/p/zele-rae-fruktovoe-s-visnej-150g-3625278	spb	Санкт-Петербург, Биржевая площадь, 4	67,99 ₽/шт	Sun Jul  7 23:20:00 2024
