name	url	locale	address	price
Вино Aristov Cuvee Alexander Blanc De Noirs белое экстра брют 11-13%, 750мл	https://www.perekrestok.ru/cat/3/p/vino-aristov-cuvee-alexander-blanc-de-noirs-beloe-ekstra-brut-11-13-750ml-4120410	pg	Пятигорск, улица Малыгина, 5	1 099,00 ₽/шт
Вино игристое De Venoge Princess Rose выдержанное розовое брют в п/у, 750мл	https://www.perekrestok.ru/cat/3/p/vino-igristoe-de-venoge-princess-rose-vyderzannoe-rozovoe-brut-v-p-u-750ml-4298671	pg	Пятигорск, улица Малыгина, 5	9 999,00 ₽/шт
Вино игристое L'Authentique Premier Cru белое брют выдержанное, 1.5л	https://www.perekrestok.ru/cat/3/p/vino-igristoe-lauthentique-premier-cru-beloe-brut-vyderzannoe-1-5l-4275519	pg	Пятигорск, улица Малыгина, 5	9 999,00 ₽/шт
Вино Cava Palau Gazo Rosado розовое брют 10.5%, 750мл	https://www.perekrestok.ru/cat/3/p/vino-cava-palau-gazo-rosado-rozovoe-brut-10-5-750ml-4282850	pg	Пятигорск, улица Малыгина, 5	1 399,00 ₽/шт
Вино игристое Valery Zaharin Кокур классика брют белое, 750мл	https://www.perekrestok.ru/cat/3/p/vino-igristoe-valery-zaharin-kokur-klassika-brut-beloe-750ml-4297678	pg	Пятигорск, улица Малыгина, 5	599,99 ₽/шт
Игристое вино Valery Zaharin Кокур и Ко брют белое, 750мл	https://www.perekrestok.ru/cat/3/p/igristoe-vino-valery-zaharin-kokur-i-ko-brut-beloe-750ml-4297674	pg	Пятигорск, улица Малыгина, 5	449,99 ₽/шт
Игристое вино Chateau Monplaisir брют белое, 750мл	https://www.perekrestok.ru/cat/3/p/igristoe-vino-chateau-monplaisir-brut-beloe-750ml-4297671	pg	Пятигорск, улица Малыгина, 5	569,99 ₽/шт
Вино игристое Altoviso Premium белое брют, 750мл	https://www.perekrestok.ru/cat/3/p/vino-igristoe-altoviso-premium-beloe-brut-750ml-4249639	pg	Пятигорск, улица Малыгина, 5	1 149,00 ₽/шт
Вино игристое Brut Dargent Pinot Noir розовое брют, 750мл	https://www.perekrestok.ru/cat/3/p/vino-igristoe-brut-dargent-pinot-noir-rozovoe-brut-750ml-4214540	pg	Пятигорск, улица Малыгина, 5	899,99 ₽/шт
Вино игристое Colligny белое брют 12.5%, 750мл	https://www.perekrestok.ru/cat/3/p/vino-igristoe-colligny-beloe-brut-12-5-750ml-4270678	pg	Пятигорск, улица Малыгина, 5	3 999,00 ₽/шт
Вино игристое Sensation Просекко белое брют 11%, 750мл	https://www.perekrestok.ru/cat/3/p/vino-igristoe-sensation-prosekko-beloe-brut-11-750ml-4266441	pg	Пятигорск, улица Малыгина, 5	1 349,00 ₽/шт
Вино игристое Zonin Famiglia Prosecco белое брют Италия, 200мл	https://www.perekrestok.ru/cat/3/p/vino-igristoe-zonin-famiglia-prosecco-beloe-brut-italia-200ml-4266682	pg	Пятигорск, улица Малыгина, 5	659,99 ₽/шт
Вино игристое Laurels Extra-dry белое брют, 750мл	https://www.perekrestok.ru/cat/3/p/vino-igristoe-laurels-extra-dry-beloe-brut-750ml-4264296	pg	Пятигорск, улица Малыгина, 5	859,99 ₽/шт
Вино игристое Zonin Famiglia Prosecco Rose розовое брют Италия, 200мл	https://www.perekrestok.ru/cat/3/p/vino-igristoe-zonin-famiglia-prosecco-rose-rozovoe-brut-italia-200ml-4262939	pg	Пятигорск, улица Малыгина, 5	779,99 ₽/шт
Вино игристое Fanagoria Блан де Нуар Белое из чёрного белое брют 11-13%, 750мл	https://www.perekrestok.ru/cat/3/p/vino-igristoe-fanagoria-blan-de-nuar-beloe-iz-cernogo-beloe-brut-11-13-750ml-4001784	pg	Пятигорск, улица Малыгина, 5	799,99 ₽/шт
Вино игристое Atelier Des Vins белое брют 11.5%, 750мл	https://www.perekrestok.ru/cat/3/p/vino-igristoe-atelier-des-vins-beloe-brut-11-5-750ml-4261594	pg	Пятигорск, улица Малыгина, 5	659,99 ₽/шт
Вино игристое Casa Coller белое брют в подарочной упаковке, 750мл	https://www.perekrestok.ru/cat/3/p/vino-igristoe-casa-coller-beloe-brut-v-podarocnoj-upakovke-750ml-4252782	pg	Пятигорск, улица Малыгина, 5	1 299,00 ₽/шт
Вино игристое Takar белое экстра брют 12%, 375мл	https://www.perekrestok.ru/cat/3/p/vino-igristoe-takar-beloe-ekstra-brut-12-375ml-4252091	pg	Пятигорск, улица Малыгина, 5	599,99 ₽/шт
Вино игристое Takar белое экстра брют, 750мл	https://www.perekrestok.ru/cat/3/p/vino-igristoe-takar-beloe-ekstra-brut-750ml-4252090	pg	Пятигорск, улица Малыгина, 5	799,99 ₽/шт
Вино игристое Наследие Мастера Левъ Голицынъ Коронационное белое брют 11.5%, 750мл	https://www.perekrestok.ru/cat/3/p/vino-igristoe-nasledie-mastera-lev-golicyn-koronacionnoe-beloe-brut-11-5-750ml-4231616	pg	Пятигорск, улица Малыгина, 5	659,99 ₽/шт
Вино игристое белое брют Cava Mare Meua, 750мл	https://www.perekrestok.ru/cat/3/p/vino-igristoe-beloe-brut-cava-mare-meua-750ml-4248611	pg	Пятигорск, улица Малыгина, 5	999,99 ₽/шт
Вино игристое Цимлянское белое брют 13.5%, 750мл	https://www.perekrestok.ru/cat/3/p/vino-igristoe-cimlanskoe-beloe-brut-13-5-750ml-4242922	pg	Пятигорск, улица Малыгина, 5	469,99 ₽/шт
Вино La Petit Perle игристое розовое брют 11.5%, 250мл	https://www.perekrestok.ru/cat/3/p/vino-la-petit-perle-igristoe-rozovoe-brut-11-5-250ml-4216266	pg	Пятигорск, улица Малыгина, 5	149,99 ₽/шт
Вино игристое Сокровища Крыма белое брют 10,5 - 12,5%, 750мл	https://www.perekrestok.ru/cat/3/p/vino-igristoe-sokrovisa-kryma-beloe-brut-10-5-12-5-750ml-4212002	pg	Пятигорск, улица Малыгина, 5	379,99 ₽/шт
Вино игристое Prosecco Ombre розовое брют 11%, 750мл	https://www.perekrestok.ru/cat/3/p/vino-igristoe-prosecco-ombre-rozovoe-brut-11-750ml-4221808	pg	Пятигорск, улица Малыгина, 5	1 299,00 ₽/шт
Вино Claroscuro Pinot Noir игристое розовое экстра брют 12.5%, 750мл	https://www.perekrestok.ru/cat/3/p/vino-claroscuro-pinot-noir-igristoe-rozovoe-ekstra-brut-12-5-750ml-4189698	pg	Пятигорск, улица Малыгина, 5	2 299,00 ₽/шт
Вино игристое Campo del Passo Prosecco Rose розовое сухое 11%, 750мл	https://www.perekrestok.ru/cat/3/p/vino-igristoe-campo-del-passo-prosecco-rose-rozovoe-suhoe-11-750ml-4125703	pg	Пятигорск, улица Малыгина, 5	1 349,00 ₽/шт
Вино игристое Tete de Cheval Blanc de Blanc белое брют, 750мл	https://www.perekrestok.ru/cat/3/p/vino-igristoe-tete-de-cheval-blanc-de-blanc-beloe-brut-750ml-4106299	pg	Пятигорск, улица Малыгина, 5	999,99 ₽/шт
Вино игристое Абрау-Дюрсо белое брют 12.5%, 200мл	https://www.perekrestok.ru/cat/3/p/vino-igristoe-abrau-durso-beloe-brut-12-5-200ml-4104389	pg	Пятигорск, улица Малыгина, 5	179,99 ₽/шт
Вино игристое Vogue белое брют 13%, 750мл	https://www.perekrestok.ru/cat/3/p/vino-igristoe-vogue-beloe-brut-13-750ml-4092024	pg	Пятигорск, улица Малыгина, 5	599,99 ₽/шт
Вино игристое Балаклава белое брют 12.5%, 750мл	https://www.perekrestok.ru/cat/3/p/vino-igristoe-balaklava-beloe-brut-12-5-750ml-3663957	pg	Пятигорск, улица Малыгина, 5	939,99 ₽/шт
Вино игристое Ahso белое брют 12%, 750мл	https://www.perekrestok.ru/cat/3/p/vino-igristoe-ahso-beloe-brut-12-750ml-4054753	pg	Пятигорск, улица Малыгина, 5	859,99 ₽/шт
Вино игристое Casa Coller Rose Spumante Brut Rose розовое брют 11.5%, 750мл	https://www.perekrestok.ru/cat/3/p/vino-igristoe-casa-coller-rose-spumante-brut-rose-rozovoe-brut-11-5-750ml-3925698	pg	Пятигорск, улица Малыгина, 5	899,99 ₽/шт
Вино игристое Crimea Classic белое брют 12.0%, 750мл	https://www.perekrestok.ru/cat/3/p/vino-igristoe-crimea-classic-beloe-brut-12-0-750ml-4011330	pg	Пятигорск, улица Малыгина, 5	559,99 ₽/шт
Вино игристое Di Caspico белое брют 12%, 750мл	https://www.perekrestok.ru/cat/3/p/vino-igristoe-di-caspico-beloe-brut-12-750ml-4019075	pg	Пятигорск, улица Малыгина, 5	469,99 ₽/шт
Вино игристое Абрау-Дюрсо Victor Dravigny розовое брют 12.5%, 750мл	https://www.perekrestok.ru/cat/3/p/vino-igristoe-abrau-durso-victor-dravigny-rozovoe-brut-12-5-750ml-3684245	pg	Пятигорск, улица Малыгина, 5	1 099,00 ₽/шт
Вино игристое Chateau Tamagne белое брют 12%, 200мл	https://www.perekrestok.ru/cat/3/p/vino-igristoe-chateau-tamagne-beloe-brut-12-200ml-3675181	pg	Пятигорск, улица Малыгина, 5	169,99 ₽/шт
Вино игристое Золотая Балка белое брют 12.0%, 750мл	https://www.perekrestok.ru/cat/3/p/vino-igristoe-zolotaa-balka-beloe-brut-12-0-750ml-3662016	pg	Пятигорск, улица Малыгина, 5	489,99 ₽/шт
Вино игристое La Gioiosa Prosecco DOC Treviso белое брют 9, 1-13%, 750мл	https://www.perekrestok.ru/cat/3/p/vino-igristoe-la-gioiosa-prosecco-doc-treviso-beloe-brut-9-1-13-750ml-3369165	pg	Пятигорск, улица Малыгина, 5	1 699,00 ₽/шт
Вино игристое Абрау-Дюрсо Imperial розовое брют 13%, 750мл	https://www.perekrestok.ru/cat/3/p/vino-igristoe-abrau-durso-imperial-rozovoe-brut-13-750ml-3355027	pg	Пятигорск, улица Малыгина, 5	1 849,00 ₽/шт
Вино игристое La Gioiosa Rosea розовое брют 11%, 750мл	https://www.perekrestok.ru/cat/3/p/vino-igristoe-la-gioiosa-rosea-rozovoe-brut-11-750ml-3456731	pg	Пятигорск, улица Малыгина, 5	1 499,00 ₽/шт
Напиток Вермут Martini Bianco белый сладкий 15%, 1л	https://www.perekrestok.ru/cat/3/p/napitok-vermut-martini-bianco-belyj-sladkij-15-1l-4075001	pg	Пятигорск, улица Малыгина, 5	1 399,00 ₽/шт
Винный напиток Martini Semi Dolce газированный белый сладкий 8, 5%, 250мл	https://www.perekrestok.ru/cat/3/p/vinnyj-napitok-martini-semi-dolce-gazirovannyj-belyj-sladkij-8-5-250ml-4125266	pg	Пятигорск, улица Малыгина, 5	399,99 ₽/шт
Вино игристое Martini Asti DOCG белое сладкое, 7, 5% 187мл	https://www.perekrestok.ru/cat/3/p/vino-igristoe-martini-asti-docg-beloe-sladkoe-7-5-187ml-4109584	pg	Пятигорск, улица Малыгина, 5	419,99 ₽/шт
Напиток Martini Fiero красный сладкий 1л, 14, 9%	https://www.perekrestok.ru/cat/3/p/napitok-martini-fiero-krasnyj-sladkij-1l-14-9-4075424	pg	Пятигорск, улица Малыгина, 5	1 399,00 ₽/шт
Вино игристое Martini Asti DOCG белое сладкое 7, 5%, 750мл	https://www.perekrestok.ru/cat/3/p/vino-igristoe-martini-asti-docg-beloe-sladkoe-7-5-750ml-4086976	pg	Пятигорск, улица Малыгина, 5	1 399,00 ₽/шт
Вино игристое Tosti Asti DOCG белое сладкое, 750мл	https://www.perekrestok.ru/cat/3/p/vino-igristoe-tosti-asti-docg-beloe-sladkoe-750ml-3301436	pg	Пятигорск, улица Малыгина, 5	849,99 ₽/шт
Напиток слабоалкогольный Santo Stefano Aperini Spritz особый газированный 8%, 750мл	https://www.perekrestok.ru/cat/3/p/napitok-slaboalkogolnyj-santo-stefano-aperini-spritz-osobyj-gazirovannyj-8-750ml-4180400	pg	Пятигорск, улица Малыгина, 5	279,99 ₽/шт
Вино игристое Cinzano Asti DOCG белое сладкое 7%, 750мл	https://www.perekrestok.ru/cat/3/p/vino-igristoe-cinzano-asti-docg-beloe-sladkoe-7-750ml-2761	pg	Пятигорск, улица Малыгина, 5	1 349,00 ₽/шт
Вино игристое Casa Coller Moscato Dolce белое сладкое 6,5%, 750мл	https://www.perekrestok.ru/cat/3/p/vino-igristoe-casa-coller-moscato-dolce-beloe-sladkoe-6-5-750ml-3959458	pg	Пятигорск, улица Малыгина, 5	1 199,00 ₽/шт
Вино игристое Mondoro Asti DOCG белое сладкое 7.5%, 750мл	https://www.perekrestok.ru/cat/3/p/vino-igristoe-mondoro-asti-docg-beloe-sladkoe-7-5-750ml-17891	pg	Пятигорск, улица Малыгина, 5	1 599,00 ₽/шт
Вино игристое Imperatore Asti DOCG белое сладкое 7.5%, 750мл	https://www.perekrestok.ru/cat/3/p/vino-igristoe-imperatore-asti-docg-beloe-sladkoe-7-5-750ml-3501353	pg	Пятигорск, улица Малыгина, 5	1 099,00 ₽/шт
Вино игристое Gaetano Lambrusco Dell Emilia жемчужное красное полусладкое, 750мл	https://www.perekrestok.ru/cat/3/p/vino-igristoe-gaetano-lambrusco-dell-emilia-zemcuznoe-krasnoe-polusladkoe-750ml-4279552	pg	Пятигорск, улица Малыгина, 5	699,99 ₽/шт
Напиток Lavetti Ванилла виноградосодержащий газированный сладкий, 250мл	https://www.perekrestok.ru/cat/3/p/napitok-lavetti-vanilla-vinogradosoderzasij-gazirovannyj-sladkij-250ml-4237461	pg	Пятигорск, улица Малыгина, 5	99,99 ₽/шт
Вино игристое Gancia Asti белое сладкое 7.5%, 200 мл	https://www.perekrestok.ru/cat/3/p/vino-igristoe-gancia-asti-beloe-sladkoe-7-5-200-ml-3506239	pg	Пятигорск, улица Малыгина, 5	449,99 ₽/шт
Вино игристое Mondoro Asti DOCG белое сладкое 7.5%, 750мл	https://www.perekrestok.ru/cat/3/p/vino-igristoe-mondoro-asti-docg-beloe-sladkoe-7-5-750ml-14632	pg	Пятигорск, улица Малыгина, 5	1 699,00 ₽/шт
Вино игристое Gancia Asti DOCG белое сладкое 7.5%, 750мл	https://www.perekrestok.ru/cat/3/p/vino-igristoe-gancia-asti-docg-beloe-sladkoe-7-5-750ml-3385436	pg	Пятигорск, улица Малыгина, 5	1 299,00 ₽/шт
Вино игристое Canti Asti DOCG белое сладкое 7%, 750мл	https://www.perekrestok.ru/cat/3/p/vino-igristoe-canti-asti-docg-beloe-sladkoe-7-750ml-2065536	pg	Пятигорск, улица Малыгина, 5	1 399,00 ₽/шт
Вино игристое Советское Шампанское белое полусладкое 10%, 750мл	https://www.perekrestok.ru/cat/3/p/vino-igristoe-sovetskoe-sampanskoe-beloe-polusladkoe-10-750ml-4006571	pg	Пятигорск, улица Малыгина, 5	249,99 ₽/шт
Вино игристое Riunite D'Oro белое полусладкое 8%, 750мл	https://www.perekrestok.ru/cat/3/p/vino-igristoe-riunite-doro-beloe-polusladkoe-8-750ml-3604201	pg	Пятигорск, улица Малыгина, 5	679,99 ₽/шт
Плодовый алкогольный напиток Pom-X газированный красный полусладкий 8%, 750мл	https://www.perekrestok.ru/cat/3/p/plodovyj-alkogolnyj-napitok-pom-x-gazirovannyj-krasnyj-polusladkij-8-750ml-4267741	pg	Пятигорск, улица Малыгина, 5	549,99 ₽/шт
Плодовый алкогольный напиток Santo Stefano Римские Каникулы газированный белый полусладкий 8%, 750мл	https://www.perekrestok.ru/cat/3/p/plodovyj-alkogolnyj-napitok-santo-stefano-rimskie-kanikuly-gazirovannyj-belyj-polusladkij-8-750ml-4142511	pg	Пятигорск, улица Малыгина, 5	289,99 ₽/шт
Вино игристое Абрау-Дюрсо Императорское белое полусладкое 12%, 750мл	https://www.perekrestok.ru/cat/3/p/vino-igristoe-abrau-durso-imperatorskoe-beloe-polusladkoe-12-750ml-4231064	pg	Пятигорск, улица Малыгина, 5	559,99 ₽/шт
Плодовый алкогольный напиток Santo Stefano Сицилийская Свадьба газированный белый полусладкий 8%, 750мл	https://www.perekrestok.ru/cat/3/p/plodovyj-alkogolnyj-napitok-santo-stefano-sicilijskaa-svadba-gazirovannyj-belyj-polusladkij-8-750ml-4142524	pg	Пятигорск, улица Малыгина, 5	279,99 ₽/шт
Вино игристое Chateau Tamagne белое полусладкое 12%, 750мл	https://www.perekrestok.ru/cat/3/p/vino-igristoe-chateau-tamagne-beloe-polusladkoe-12-750ml-3675180	pg	Пятигорск, улица Малыгина, 5	529,99 ₽/шт
Плодовый алкогольный напиток Pom-X манго газированный полусладкий 8%, 750мл	https://www.perekrestok.ru/cat/3/p/plodovyj-alkogolnyj-napitok-pom-x-mango-gazirovannyj-polusladkij-8-750ml-4283241	pg	Пятигорск, улица Малыгина, 5	549,99 ₽/шт
Вино игристое Балаклава Мускат белое полусладкое 12.5%, 750мл	https://www.perekrestok.ru/cat/3/p/vino-igristoe-balaklava-muskat-beloe-polusladkoe-12-5-750ml-3669133	pg	Пятигорск, улица Малыгина, 5	699,99 ₽/шт
Вино игристое Gaetano Lambrusco Dell Emilia жемчужное белое полусладкое, 750мл	https://www.perekrestok.ru/cat/3/p/vino-igristoe-gaetano-lambrusco-dell-emilia-zemcuznoe-beloe-polusladkoe-750ml-4279551	pg	Пятигорск, улица Малыгина, 5	659,99 ₽/шт
Плодовый алкогольный напиток Bosca Anna Federica Limited газированный белый полусладкий 7.5% 750мл	https://www.perekrestok.ru/cat/3/p/plodovyj-alkogolnyj-napitok-bosca-anna-federica-limited-gazirovannyj-belyj-polusladkij-7-5-750ml-4169076	pg	Пятигорск, улица Малыгина, 5	499,99 ₽/шт
Плодовый алкогольный напиток Santo Stefano газированный розовый полусладкий 8%, 750мл	https://www.perekrestok.ru/cat/3/p/plodovyj-alkogolnyj-napitok-santo-stefano-gazirovannyj-rozovyj-polusladkij-8-750ml-4142508	pg	Пятигорск, улица Малыгина, 5	299,99 ₽/шт
Вино игристое Абрау-Дюрсо белое полусладкое 12.5%, 750мл	https://www.perekrestok.ru/cat/3/p/vino-igristoe-abrau-durso-beloe-polusladkoe-12-5-750ml-4095504	pg	Пятигорск, улица Малыгина, 5	519,99 ₽/шт
Вино игристое ZB Wine Frizzante жемчужное красное полусладкое, 10%, 750мл	https://www.perekrestok.ru/cat/3/p/vino-igristoe-zb-wine-frizzante-zemcuznoe-krasnoe-polusladkoe-10-750ml-3944368	pg	Пятигорск, улица Малыгина, 5	599,99 ₽/шт
Вино игристое Mondoro Rose Dolce розовое полусладкое 9.5%, 750мл	https://www.perekrestok.ru/cat/3/p/vino-igristoe-mondoro-rose-dolce-rozovoe-polusladkoe-9-5-750ml-3397909	pg	Пятигорск, улица Малыгина, 5	1 599,00 ₽/шт
Вино игристое Solvino белое полусладкое 7.5%, 750мл	https://www.perekrestok.ru/cat/3/p/vino-igristoe-solvino-beloe-polusladkoe-7-5-750ml-4232544	pg	Пятигорск, улица Малыгина, 5	349,99 ₽/шт
Вино игристое Золотая Балка розовое полусладкое 12.5%, 750мл	https://www.perekrestok.ru/cat/3/p/vino-igristoe-zolotaa-balka-rozovoe-polusladkoe-12-5-750ml-3690358	pg	Пятигорск, улица Малыгина, 5	579,99 ₽/шт
Вино игристое Riunite Lambrusco Rosato розовое полусладкое 8%, 750мл	https://www.perekrestok.ru/cat/3/p/vino-igristoe-riunite-lambrusco-rosato-rozovoe-polusladkoe-8-750ml-3604207	pg	Пятигорск, улица Малыгина, 5	679,99 ₽/шт
Вино игристое Riunite Lambrusco Rosso красное полусладкое 8%, 750мл	https://www.perekrestok.ru/cat/3/p/vino-igristoe-riunite-lambrusco-rosso-krasnoe-polusladkoe-8-750ml-3604202	pg	Пятигорск, улица Малыгина, 5	679,99 ₽/шт
Вино Di Caspico Fiori di Mare игристое розовое полусладкое 11.5%, 750мл	https://www.perekrestok.ru/cat/3/p/vino-di-caspico-fiori-di-mare-igristoe-rozovoe-polusladkoe-11-5-750ml-4345289	pg	Пятигорск, улица Малыгина, 5	399,99 ₽/шт
Плодовый алкогольный напиток Pom-X ежевика газированный полусладкий 6.8%, 750мл	https://www.perekrestok.ru/cat/3/p/plodovyj-alkogolnyj-napitok-pom-x-ezevika-gazirovannyj-polusladkij-6-8-750ml-4276140	pg	Пятигорск, улица Малыгина, 5	659,99 ₽/шт
Вино игристое Абрау-Дюрсо Victor Dravigny Премиум Каберне красное полусладкое 11%, 750мл	https://www.perekrestok.ru/cat/3/p/vino-igristoe-abrau-durso-victor-dravigny-premium-kaberne-krasnoe-polusladkoe-11-750ml-4090814	pg	Пятигорск, улица Малыгина, 5	999,99 ₽/шт
Вино игристое Сокровища Крыма белое полусладкое 10,5 - 12,5%, 750мл	https://www.perekrestok.ru/cat/3/p/vino-igristoe-sokrovisa-kryma-beloe-polusladkoe-10-5-12-5-750ml-4212007	pg	Пятигорск, улица Малыгина, 5	379,99 ₽/шт
Плодовый алкогольный напиток Santo Stefano газированный белый полусладкий 8%, 750мл	https://www.perekrestok.ru/cat/3/p/plodovyj-alkogolnyj-napitok-santo-stefano-gazirovannyj-belyj-polusladkij-8-750ml-4142493	pg	Пятигорск, улица Малыгина, 5	289,99 ₽/шт
Вино игристое Наследие Мастера Левъ Голицынъ белое полусладкое 10.5%, 750мл	https://www.perekrestok.ru/cat/3/p/vino-igristoe-nasledie-mastera-lev-golicyn-beloe-polusladkoe-10-5-750ml-4088768	pg	Пятигорск, улица Малыгина, 5	419,99 ₽/шт
Вино игристое Абрау-Дюрсо красное полусладкое 12%, 750мл	https://www.perekrestok.ru/cat/3/p/vino-igristoe-abrau-durso-krasnoe-polusladkoe-12-750ml-4104391	pg	Пятигорск, улица Малыгина, 5	589,99 ₽/шт
Вино игристое Di Caspico белое полусладкое 11%, 750мл	https://www.perekrestok.ru/cat/3/p/vino-igristoe-di-caspico-beloe-polusladkoe-11-750ml-4019077	pg	Пятигорск, улица Малыгина, 5	469,99 ₽/шт
Вино Sula Sparkling Shiraz красное полусладкое 13.5%, 750мл	https://www.perekrestok.ru/cat/3/p/vino-sula-sparkling-shiraz-krasnoe-polusladkoe-13-5-750ml-4294347	pg	Пятигорск, улица Малыгина, 5	1 299,00 ₽/шт
Игристое вино Chateau Mon Plaisir полусладкое белое, 750мл	https://www.perekrestok.ru/cat/3/p/igristoe-vino-chateau-mon-plaisir-polusladkoe-beloe-750ml-4297677	pg	Пятигорск, улица Малыгина, 5	569,99 ₽/шт
Игристое вино Valery Zaharin Кокур и Ко белое полусладкое, 750мл	https://www.perekrestok.ru/cat/3/p/igristoe-vino-valery-zaharin-kokur-i-ko-beloe-polusladkoe-750ml-4297673	pg	Пятигорск, улица Малыгина, 5	449,99 ₽/шт
Вино игристое Di Caspico Фиори ди Маре жемчужное белое полусладкое 11%, 750мл	https://www.perekrestok.ru/cat/3/p/vino-igristoe-di-caspico-fiori-di-mare-zemcuznoe-beloe-polusladkoe-11-750ml-4192236	pg	Пятигорск, улица Малыгина, 5	419,99 ₽/шт
Вино игристое Lambrusco Dell'Emilia жемчужное белое полусладкое 8%, 750мл	https://www.perekrestok.ru/cat/3/p/vino-igristoe-lambrusco-dellemilia-zemcuznoe-beloe-polusladkoe-8-750ml-4255528	pg	Пятигорск, улица Малыгина, 5	859,99 ₽/шт
Вино игристое Lambrusco Dell'Emilia жемчужное красное полусладкое 8%, 750мл	https://www.perekrestok.ru/cat/3/p/vino-igristoe-lambrusco-dellemilia-zemcuznoe-krasnoe-polusladkoe-8-750ml-4255526	pg	Пятигорск, улица Малыгина, 5	779,99 ₽/шт
Вино игристое Lambrusco Dell'Emilia жемчужное розовое полусладкое 8%, 750мл	https://www.perekrestok.ru/cat/3/p/vino-igristoe-lambrusco-dellemilia-zemcuznoe-rozovoe-polusladkoe-8-750ml-4255530	pg	Пятигорск, улица Малыгина, 5	639,99 ₽/шт
Вино игристое Наследие Мастера Левъ Голицынъ Коронационное белое полусладкое 12.5%, 750мл	https://www.perekrestok.ru/cat/3/p/vino-igristoe-nasledie-mastera-lev-golicyn-koronacionnoe-beloe-polusladkoe-12-5-750ml-4231617	pg	Пятигорск, улица Малыгина, 5	679,99 ₽/шт
