name	url	locale	address	price
Вино игристое Casa Coller Spumante Brut белое брют 11%, 750мл	https://www.perekrestok.ru/cat/3/p/vino-igristoe-casa-coller-spumante-brut-beloe-brut-11-750ml-3925700	msk	Москва, Большой Патриарший переулок, 5	799,99 ₽/шт
Вино игристое Vallformosa Brut Rose Cava DO розовое сухое 11.5%, 750мл	https://www.perekrestok.ru/cat/3/p/vino-igristoe-vallformosa-brut-rose-cava-do-rozovoe-suhoe-11-5-750ml-3695833	msk	Москва, Большой Патриарший переулок, 5	699,99 ₽/шт
Вино игристое Абрау-Дюрсо белое брют 12.5%, 750мл	https://www.perekrestok.ru/cat/3/p/vino-igristoe-abrau-durso-beloe-brut-12-5-750ml-4095502	msk	Москва, Большой Патриарший переулок, 5	499,99 ₽/шт
Вино игристое Riondo Collezione Frizzante Brut Garda DOC белое брют 11%, 750мл	https://www.perekrestok.ru/cat/3/p/vino-igristoe-riondo-collezione-frizzante-brut-garda-doc-beloe-brut-11-750ml-3927486	msk	Москва, Большой Патриарший переулок, 5	699,99 ₽/шт
Вино игристое Chateau Tamagne белое брют 12%, 750мл	https://www.perekrestok.ru/cat/3/p/vino-igristoe-chateau-tamagne-beloe-brut-12-750ml-3675139	msk	Москва, Большой Патриарший переулок, 5	529,99 ₽/шт
Вино игристое Мысхако Flute Gewurztraminer белое брют 11%, 750мл	https://www.perekrestok.ru/cat/3/p/vino-igristoe-myshako-flute-gewurztraminer-beloe-brut-11-750ml-4102563	msk	Москва, Большой Патриарший переулок, 5	699,99 ₽/шт
Вино игристое Santo Stefano брют белое, 750мл	https://www.perekrestok.ru/cat/3/p/vino-igristoe-santo-stefano-brut-beloe-750ml-4312858	msk	Москва, Большой Патриарший переулок, 5	339,99 ₽/шт
Вино Chateau Tamagne Флерс Де Суд игристое белое брют, 750мл	https://www.perekrestok.ru/cat/3/p/vino-chateau-tamagne-flers-de-sud-igristoe-beloe-brut-750ml-4045467	msk	Москва, Большой Патриарший переулок, 5	399,99 ₽/шт
Вино игристое Vallformosa Classic Cava DO белое брют 11.5%, 750мл	https://www.perekrestok.ru/cat/3/p/vino-igristoe-vallformosa-classic-cava-do-beloe-brut-11-5-750ml-3201863	msk	Москва, Большой Патриарший переулок, 5	799,99 ₽/шт
Вино игристое Santo Stefano розовое брют, 750мл	https://www.perekrestok.ru/cat/3/p/vino-igristoe-santo-stefano-rozovoe-brut-750ml-4312851	msk	Москва, Большой Патриарший переулок, 5	339,99 ₽/шт
Вино игристое Эндемы Пино Нуар розовое брют 10.5%, 750мл	https://www.perekrestok.ru/cat/3/p/vino-igristoe-endemy-pino-nuar-rozovoe-brut-10-5-750ml-4262945	msk	Москва, Большой Патриарший переулок, 5	599,99 ₽/шт
Вино игристое Casa Coller Prosecco белое брют, 750мл	https://www.perekrestok.ru/cat/3/p/vino-igristoe-casa-coller-prosecco-beloe-brut-750ml-4252783	msk	Москва, Большой Патриарший переулок, 5	1 599,00 ₽/шт
Вино игристое Ombre Просекко Док белое 11%, 750мл	https://www.perekrestok.ru/cat/3/p/vino-igristoe-ombre-prosekko-dok-beloe-11-750ml-4223355	msk	Москва, Большой Патриарший переулок, 5	1 299,00 ₽/шт
Вино игристое Casa Defra Prosecco DOC белое брют 11%, 750мл	https://www.perekrestok.ru/cat/3/p/vino-igristoe-casa-defra-prosecco-doc-beloe-brut-11-750ml-3491685	msk	Москва, Большой Патриарший переулок, 5	1 219,00 ₽/шт
Вино игристое Балаклава Пино Нуар розовое брют 12.5%, 750мл	https://www.perekrestok.ru/cat/3/p/vino-igristoe-balaklava-pino-nuar-rozovoe-brut-12-5-750ml-4046418	msk	Москва, Большой Патриарший переулок, 5	739,99 ₽/шт
Вино игристое Бурлюк Алиготе белое брют 13.5%, 750мл	https://www.perekrestok.ru/cat/3/p/vino-igristoe-burluk-aligote-beloe-brut-13-5-750ml-4353011	msk	Москва, Большой Патриарший переулок, 5	719,99 ₽/шт
Вино игристое Brut Dargent Chardonnay белое брют 11.5%, 750мл	https://www.perekrestok.ru/cat/3/p/vino-igristoe-brut-dargent-chardonnay-beloe-brut-11-5-750ml-4214541	msk	Москва, Большой Патриарший переулок, 5	949,99 ₽/шт
Вино игристое Эндемы Рислинг белое брют 12.5%, 750мл	https://www.perekrestok.ru/cat/3/p/vino-igristoe-endemy-risling-beloe-brut-12-5-750ml-4233482	msk	Москва, Большой Патриарший переулок, 5	599,99 ₽/шт
Вино игристое Chateau Tamagne розовое брют 12%, 750мл	https://www.perekrestok.ru/cat/3/p/vino-igristoe-chateau-tamagne-rozovoe-brut-12-750ml-3671859	msk	Москва, Большой Патриарший переулок, 5	529,99 ₽/шт
Вино игристое Casa Coller Rose брют розовое 11%, 750мл	https://www.perekrestok.ru/cat/3/p/vino-igristoe-casa-coller-rose-brut-rozovoe-11-750ml-4252784	msk	Москва, Большой Патриарший переулок, 5	1 399,00 ₽/шт
Вино игристое Zonin Просекко белое брют 11%, 750мл	https://www.perekrestok.ru/cat/3/p/vino-igristoe-zonin-prosekko-beloe-brut-11-750ml-4266683	msk	Москва, Большой Патриарший переулок, 5	1 299,00 ₽/шт
Вино игристое Altoviso Reserva белое брют, 750мл	https://www.perekrestok.ru/cat/3/p/vino-igristoe-altoviso-reserva-beloe-brut-750ml-4249640	msk	Москва, Большой Патриарший переулок, 5	1 049,00 ₽/шт
Вино игристое ZB Wine Спуманте брют белое 12.0%, 750мл	https://www.perekrestok.ru/cat/3/p/vino-igristoe-zb-wine-spumante-brut-beloe-12-0-750ml-4225270	msk	Москва, Большой Патриарший переулок, 5	659,99 ₽/шт
Вино игристое Gancia Prosecco Brut белое брют, 200мл	https://www.perekrestok.ru/cat/3/p/vino-igristoe-gancia-prosecco-brut-beloe-brut-200ml-3505796	msk	Москва, Большой Патриарший переулок, 5	449,99 ₽/шт
Вино F. Dubois Blanc de Blancs Champagne AOC игристое белое брют в п/у 12%, 750мл	https://www.perekrestok.ru/cat/3/p/vino-f-dubois-blanc-de-blancs-champagne-aoc-igristoe-beloe-brut-v-p-u-12-750ml-4189720	msk	Москва, Большой Патриарший переулок, 5	4 999,00 ₽/шт
Вино игристое Martini Brut белое сухое 11,5%, 750мл	https://www.perekrestok.ru/cat/3/p/vino-igristoe-martini-brut-beloe-suhoe-11-5-750ml-68689	msk	Москва, Большой Патриарший переулок, 5	1 399,00 ₽/шт
Вино игристое Балаклава Шардоне белое брют 12.5%, 750мл	https://www.perekrestok.ru/cat/3/p/vino-igristoe-balaklava-sardone-beloe-brut-12-5-750ml-3663911	msk	Москва, Большой Патриарший переулок, 5	719,99 ₽/шт
Вино Мысхако Блауфранкиш.Квинтэссенция игристое брют розовое, 750мл	https://www.perekrestok.ru/cat/3/p/vino-myshako-blaufrankis-kvintessencia-igristoe-brut-rozovoe-750ml-4297322	msk	Москва, Большой Патриарший переулок, 5	699,99 ₽/шт
Вино игристое Solvino белое брют, 750мл	https://www.perekrestok.ru/cat/3/p/vino-igristoe-solvino-beloe-brut-750ml-4267565	msk	Москва, Большой Патриарший переулок, 5	349,99 ₽/шт
Вино игристое Tete De Sheval Methode Classique Резерв белое брют, 750мл	https://www.perekrestok.ru/cat/3/p/vino-igristoe-tete-de-sheval-methode-classique-rezerv-beloe-brut-750ml-4266684	msk	Москва, Большой Патриарший переулок, 5	1 799,00 ₽/шт
Вино игристое Louis Vallon Cremant de Bordeaux AOC белое брют 11.5%, 750мл	https://www.perekrestok.ru/cat/3/p/vino-igristoe-louis-vallon-cremant-de-bordeaux-aoc-beloe-brut-11-5-750ml-4116880	msk	Москва, Большой Патриарший переулок, 5	1 499,00 ₽/шт
Вино игристое Tete de Cheval белое брют, 750мл	https://www.perekrestok.ru/cat/3/p/vino-igristoe-tete-de-cheval-beloe-brut-750ml-4085626	msk	Москва, Большой Патриарший переулок, 5	999,99 ₽/шт
Вино игристое Freschello Frizzante Rosato розовое брют 10.5%, 750мл	https://www.perekrestok.ru/cat/3/p/vino-igristoe-freschello-frizzante-rosato-rozovoe-brut-10-5-750ml-3629516	msk	Москва, Большой Патриарший переулок, 5	999,99 ₽/шт
Вино Villa Loren Prosecco D.O.C. Extra Dry игристое белое брют 11%, 750мл	https://www.perekrestok.ru/cat/3/p/vino-villa-loren-prosecco-d-o-c-extra-dry-igristoe-beloe-brut-11-750ml-4348929	msk	Москва, Большой Патриарший переулок, 5	1 499,99 ₽/шт
Вино La Marca Prosecco D.O.C. Treviso Brut игристое белое брют 11%, 750мл	https://www.perekrestok.ru/cat/3/p/vino-la-marca-prosecco-d-o-c-treviso-brut-igristoe-beloe-brut-11-750ml-4329245	msk	Москва, Большой Патриарший переулок, 5	1 149,00 ₽/шт
Вино L'authentique Brut Premier Cru белое брют 12%, 375мл	https://www.perekrestok.ru/cat/3/p/vino-lauthentique-brut-premier-cru-beloe-brut-12-375ml-4275518	msk	Москва, Большой Патриарший переулок, 5	2 399,00 ₽/шт
Вино Cava In Corde белое брют 11.5%, 750мл	https://www.perekrestok.ru/cat/3/p/vino-cava-in-corde-beloe-brut-11-5-750ml-4295003	msk	Москва, Большой Патриарший переулок, 5	1 099,00 ₽/шт
Вино игристое Sula Brut белое брют, 750мл	https://www.perekrestok.ru/cat/3/p/vino-igristoe-sula-brut-beloe-brut-750ml-4294346	msk	Москва, Большой Патриарший переулок, 5	1 599,00 ₽/шт
Вино игристое Ribolla Gialla Brut белое брют белое, 750мл	https://www.perekrestok.ru/cat/3/p/vino-igristoe-ribolla-gialla-brut-beloe-brut-beloe-750ml-4305671	msk	Москва, Большой Патриарший переулок, 5	969,99 ₽/шт
Вино игристое De Venoge Princess Rose выдержанное розовое брют в п/у, 750мл	https://www.perekrestok.ru/cat/3/p/vino-igristoe-de-venoge-princess-rose-vyderzannoe-rozovoe-brut-v-p-u-750ml-4298671	msk	Москва, Большой Патриарший переулок, 5	9 999,00 ₽/шт
Вино игристое De Venoge Princes Blanc de Blancs выдержанное белое брют в п/у, 750мл	https://www.perekrestok.ru/cat/3/p/vino-igristoe-de-venoge-princes-blanc-de-blancs-vyderzannoe-beloe-brut-v-p-u-750ml-4298663	msk	Москва, Большой Патриарший переулок, 5	9 999,00 ₽/шт
Вино игристое L'Heritage Blanc de Blancs Premier Cru белое брют выдержанное, 750мл	https://www.perekrestok.ru/cat/3/p/vino-igristoe-lheritage-blanc-de-blancs-premier-cru-beloe-brut-vyderzannoe-750ml-4286679	msk	Москва, Большой Патриарший переулок, 5	5 499,00 ₽/шт
Вино игристое L'Authentique Premier Cru белое брют выдержанное, 1.5л	https://www.perekrestok.ru/cat/3/p/vino-igristoe-lauthentique-premier-cru-beloe-brut-vyderzannoe-1-5l-4275519	msk	Москва, Большой Патриарший переулок, 5	9 999,00 ₽/шт
Вино игристое Champagne De Venoge Princes Brut Tour Eiffel белое брют выдержанное, 750мл	https://www.perekrestok.ru/cat/3/p/vino-igristoe-champagne-de-venoge-princes-brut-tour-eiffel-beloe-brut-vyderzannoe-750ml-4198198	msk	Москва, Большой Патриарший переулок, 5	9 999,00 ₽/шт
Вино Cava Palau Gazo Rosado розовое брют 10.5%, 750мл	https://www.perekrestok.ru/cat/3/p/vino-cava-palau-gazo-rosado-rozovoe-brut-10-5-750ml-4282850	msk	Москва, Большой Патриарший переулок, 5	1 399,00 ₽/шт
Вино Мысхако Вионье.Квинтэссенция игристое белое брют, 750мл	https://www.perekrestok.ru/cat/3/p/vino-myshako-vione-kvintessencia-igristoe-beloe-brut-750ml-4289631	msk	Москва, Большой Патриарший переулок, 5	699,99 ₽/шт
Вино игристое Cava Naveran Brut Vintage Rose выдержанное экстра брют розовое, 750мл	https://www.perekrestok.ru/cat/3/p/vino-igristoe-cava-naveran-brut-vintage-rose-vyderzannoe-ekstra-brut-rozovoe-750ml-4286924	msk	Москва, Большой Патриарший переулок, 5	1 349,00 ₽/шт
Вино игристое Grotto Bay Sauvignon Rose Select экстра брют розовое, 750мл	https://www.perekrestok.ru/cat/3/p/vino-igristoe-grotto-bay-sauvignon-rose-select-ekstra-brut-rozovoe-750ml-4286759	msk	Москва, Большой Патриарший переулок, 5	1 299,00 ₽/шт
Вино игристое Maximilian Prosecco Rose розовое сухое 11%, 750мл	https://www.perekrestok.ru/cat/3/p/vino-igristoe-maximilian-prosecco-rose-rozovoe-suhoe-11-750ml-4286038	msk	Москва, Большой Патриарший переулок, 5	1 349,00 ₽/шт
Вино игристое Altoviso Premium белое брют, 750мл	https://www.perekrestok.ru/cat/3/p/vino-igristoe-altoviso-premium-beloe-brut-750ml-4249639	msk	Москва, Большой Патриарший переулок, 5	1 149,00 ₽/шт
Вино игристое Brut Dargent Pinot Noir розовое брют, 750мл	https://www.perekrestok.ru/cat/3/p/vino-igristoe-brut-dargent-pinot-noir-rozovoe-brut-750ml-4214540	msk	Москва, Большой Патриарший переулок, 5	899,99 ₽/шт
Вино игристое Zonin Famiglia Prosecco белое брют Италия, 200мл	https://www.perekrestok.ru/cat/3/p/vino-igristoe-zonin-famiglia-prosecco-beloe-brut-italia-200ml-4266682	msk	Москва, Большой Патриарший переулок, 5	659,99 ₽/шт
Вино игристое Laurels Extra-dry белое брют, 750мл	https://www.perekrestok.ru/cat/3/p/vino-igristoe-laurels-extra-dry-beloe-brut-750ml-4264296	msk	Москва, Большой Патриарший переулок, 5	859,99 ₽/шт
Вино игристое Zonin Famiglia Prosecco Rose розовое брют Италия, 200мл	https://www.perekrestok.ru/cat/3/p/vino-igristoe-zonin-famiglia-prosecco-rose-rozovoe-brut-italia-200ml-4262939	msk	Москва, Большой Патриарший переулок, 5	779,99 ₽/шт
Вино игристое Atelier Des Vins белое брют 11.5%, 750мл	https://www.perekrestok.ru/cat/3/p/vino-igristoe-atelier-des-vins-beloe-brut-11-5-750ml-4261594	msk	Москва, Большой Патриарший переулок, 5	649,99 ₽/шт
Вино игристое №1 белое брют, 750мл +бокал	https://www.perekrestok.ru/cat/3/p/vino-igristoe-no1-beloe-brut-750ml-bokal-4255587	msk	Москва, Большой Патриарший переулок, 5	919,99 ₽/шт
Вино игристое Рояль Розе розовое брют 12%, 750мл	https://www.perekrestok.ru/cat/3/p/vino-igristoe-roal-roze-rozovoe-brut-12-750ml-4257474	msk	Москва, Большой Патриарший переулок, 5	5 699,00 ₽/шт
Вино игристое Рояль Розе белое брют 12.5%, 750мл	https://www.perekrestok.ru/cat/3/p/vino-igristoe-roal-roze-beloe-brut-12-5-750ml-4257444	msk	Москва, Большой Патриарший переулок, 5	7 499,00 ₽/шт
Вино игристое Casa Coller белое брют в подарочной упаковке, 750мл	https://www.perekrestok.ru/cat/3/p/vino-igristoe-casa-coller-beloe-brut-v-podarocnoj-upakovke-750ml-4252782	msk	Москва, Большой Патриарший переулок, 5	1 299,00 ₽/шт
Вино игристое Takar белое экстра брют 12%, 375мл	https://www.perekrestok.ru/cat/3/p/vino-igristoe-takar-beloe-ekstra-brut-12-375ml-4252091	msk	Москва, Большой Патриарший переулок, 5	599,99 ₽/шт
Вино игристое Takar белое экстра брют, 750мл	https://www.perekrestok.ru/cat/3/p/vino-igristoe-takar-beloe-ekstra-brut-750ml-4252090	msk	Москва, Большой Патриарший переулок, 5	799,99 ₽/шт
Вино игристое Наследие Мастера Левъ Голицынъ Коронационное белое брют 11.5%, 750мл	https://www.perekrestok.ru/cat/3/p/vino-igristoe-nasledie-mastera-lev-golicyn-koronacionnoe-beloe-brut-11-5-750ml-4231616	msk	Москва, Большой Патриарший переулок, 5	679,99 ₽/шт
Вино игристое Acquesi Просекко белое брют 11%, 750мл	https://www.perekrestok.ru/cat/3/p/vino-igristoe-acquesi-prosekko-beloe-brut-11-750ml-4249087	msk	Москва, Большой Патриарший переулок, 5	959,99 ₽/шт
Вино игристое белое брют Cava Mare Meua, 750мл	https://www.perekrestok.ru/cat/3/p/vino-igristoe-beloe-brut-cava-mare-meua-750ml-4248611	msk	Москва, Большой Патриарший переулок, 5	999,99 ₽/шт
Вино игристое Prosecco Ombre розовое брют 11%, 750мл	https://www.perekrestok.ru/cat/3/p/vino-igristoe-prosecco-ombre-rozovoe-brut-11-750ml-4221808	msk	Москва, Большой Патриарший переулок, 5	1 299,00 ₽/шт
Вино игристое Мысхако Квинтэссенция Совиньон Блан белое брют 11.5%, 750мл	https://www.perekrestok.ru/cat/3/p/vino-igristoe-myshako-kvintessencia-sovinon-blan-beloe-brut-11-5-750ml-4215656	msk	Москва, Большой Патриарший переулок, 5	699,99 ₽/шт
Вино игристое Campo del Passo Prosecco Rose розовое сухое 11%, 750мл	https://www.perekrestok.ru/cat/3/p/vino-igristoe-campo-del-passo-prosecco-rose-rozovoe-suhoe-11-750ml-4125703	msk	Москва, Большой Патриарший переулок, 5	1 349,00 ₽/шт
Вино игристое Золотая Балка белое брют 12.5%, 750мл	https://www.perekrestok.ru/cat/3/p/vino-igristoe-zolotaa-balka-beloe-brut-12-5-750ml-4086007	msk	Москва, Большой Патриарший переулок, 5	649,99 ₽/шт
Вино игристое Золотая Балка розовое брют 12.5%, 750мл	https://www.perekrestok.ru/cat/3/p/vino-igristoe-zolotaa-balka-rozovoe-brut-12-5-750ml-4086006	msk	Москва, Большой Патриарший переулок, 5	649,99 ₽/шт
Вино игристое Абрау-Дюрсо белое брют 12.5%, 200мл	https://www.perekrestok.ru/cat/3/p/vino-igristoe-abrau-durso-beloe-brut-12-5-200ml-4104389	msk	Москва, Большой Патриарший переулок, 5	184,99 ₽/шт
Вино игристое Vogue белое брют 13%, 750мл	https://www.perekrestok.ru/cat/3/p/vino-igristoe-vogue-beloe-brut-13-750ml-4092024	msk	Москва, Большой Патриарший переулок, 5	599,99 ₽/шт
Вино игристое Casa Coller Rose Spumante Brut Rose розовое брют 11.5%, 750мл	https://www.perekrestok.ru/cat/3/p/vino-igristoe-casa-coller-rose-spumante-brut-rose-rozovoe-brut-11-5-750ml-3925698	msk	Москва, Большой Патриарший переулок, 5	899,99 ₽/шт
Вино игристое Di Caspico белое брют 12%, 750мл	https://www.perekrestok.ru/cat/3/p/vino-igristoe-di-caspico-beloe-brut-12-750ml-4019075	msk	Москва, Большой Патриарший переулок, 5	469,99 ₽/шт
Вино игристое Абрау-Дюрсо Victor Dravigny розовое брют 12.5%, 750мл	https://www.perekrestok.ru/cat/3/p/vino-igristoe-abrau-durso-victor-dravigny-rozovoe-brut-12-5-750ml-3684245	msk	Москва, Большой Патриарший переулок, 5	1 099,00 ₽/шт
Вино игристое Chateau Tamagne белое брют 12%, 200мл	https://www.perekrestok.ru/cat/3/p/vino-igristoe-chateau-tamagne-beloe-brut-12-200ml-3675181	msk	Москва, Большой Патриарший переулок, 5	169,99 ₽/шт
Вино игристое La Gioiosa Prosecco DOC Treviso белое брют 9, 1-13%, 750мл	https://www.perekrestok.ru/cat/3/p/vino-igristoe-la-gioiosa-prosecco-doc-treviso-beloe-brut-9-1-13-750ml-3369165	msk	Москва, Большой Патриарший переулок, 5	1 799,00 ₽/шт
Напиток Вермут Martini Bianco белый сладкий 15%, 1л	https://www.perekrestok.ru/cat/3/p/napitok-vermut-martini-bianco-belyj-sladkij-15-1l-4075001	msk	Москва, Большой Патриарший переулок, 5	1 399,00 ₽/шт
Винный напиток Martini Semi Dolce газированный белый сладкий 8, 5%, 250мл	https://www.perekrestok.ru/cat/3/p/vinnyj-napitok-martini-semi-dolce-gazirovannyj-belyj-sladkij-8-5-250ml-4125266	msk	Москва, Большой Патриарший переулок, 5	399,99 ₽/шт
Вино игристое Martini Asti DOCG белое сладкое, 7, 5% 187мл	https://www.perekrestok.ru/cat/3/p/vino-igristoe-martini-asti-docg-beloe-sladkoe-7-5-187ml-4109584	msk	Москва, Большой Патриарший переулок, 5	419,99 ₽/шт
Напиток Martini Fiero красный сладкий 1л, 14, 9%	https://www.perekrestok.ru/cat/3/p/napitok-martini-fiero-krasnyj-sladkij-1l-14-9-4075424	msk	Москва, Большой Патриарший переулок, 5	1 399,00 ₽/шт
Вино игристое Martini Asti DOCG белое сладкое 7, 5%, 750мл	https://www.perekrestok.ru/cat/3/p/vino-igristoe-martini-asti-docg-beloe-sladkoe-7-5-750ml-4086976	msk	Москва, Большой Патриарший переулок, 5	1 399,00 ₽/шт
Вино игристое Tosti Asti DOCG белое сладкое, 750мл	https://www.perekrestok.ru/cat/3/p/vino-igristoe-tosti-asti-docg-beloe-sladkoe-750ml-3301436	msk	Москва, Большой Патриарший переулок, 5	849,99 ₽/шт
Напиток слабоалкогольный Santo Stefano Aperini Spritz особый газированный 8%, 750мл	https://www.perekrestok.ru/cat/3/p/napitok-slaboalkogolnyj-santo-stefano-aperini-spritz-osobyj-gazirovannyj-8-750ml-4180400	msk	Москва, Большой Патриарший переулок, 5	279,99 ₽/шт
Вино игристое Cinzano Asti DOCG белое сладкое 7%, 750мл	https://www.perekrestok.ru/cat/3/p/vino-igristoe-cinzano-asti-docg-beloe-sladkoe-7-750ml-2761	msk	Москва, Большой Патриарший переулок, 5	1 349,00 ₽/шт
Вино игристое Mondoro Asti DOCG белое сладкое 7.5%, 750мл	https://www.perekrestok.ru/cat/3/p/vino-igristoe-mondoro-asti-docg-beloe-sladkoe-7-5-750ml-17891	msk	Москва, Большой Патриарший переулок, 5	1 599,00 ₽/шт
Вино игристое Imperatore Asti DOCG белое сладкое 7.5%, 750мл	https://www.perekrestok.ru/cat/3/p/vino-igristoe-imperatore-asti-docg-beloe-sladkoe-7-5-750ml-3501353	msk	Москва, Большой Патриарший переулок, 5	1 099,00 ₽/шт
Вино игристое Gancia Asti белое сладкое 7.5%, 200 мл	https://www.perekrestok.ru/cat/3/p/vino-igristoe-gancia-asti-beloe-sladkoe-7-5-200-ml-3506239	msk	Москва, Большой Патриарший переулок, 5	449,99 ₽/шт
Вино игристое Gancia Asti DOCG белое сладкое 7.5%, 750мл	https://www.perekrestok.ru/cat/3/p/vino-igristoe-gancia-asti-docg-beloe-sladkoe-7-5-750ml-3385436	msk	Москва, Большой Патриарший переулок, 5	1 299,00 ₽/шт
Вино игристое Советское Шампанское белое полусладкое 10%, 750мл	https://www.perekrestok.ru/cat/3/p/vino-igristoe-sovetskoe-sampanskoe-beloe-polusladkoe-10-750ml-4006571	msk	Москва, Большой Патриарший переулок, 5	249,99 ₽/шт
Вино игристое Riunite D'Oro белое полусладкое 8%, 750мл	https://www.perekrestok.ru/cat/3/p/vino-igristoe-riunite-doro-beloe-polusladkoe-8-750ml-3604201	msk	Москва, Большой Патриарший переулок, 5	719,99 ₽/шт
Плодовый алкогольный напиток Pom-X газированный красный полусладкий 8%, 750мл	https://www.perekrestok.ru/cat/3/p/plodovyj-alkogolnyj-napitok-pom-x-gazirovannyj-krasnyj-polusladkij-8-750ml-4267741	msk	Москва, Большой Патриарший переулок, 5	659,99 ₽/шт
