name	url	locale	address	price	time
Колбаса сырокопчёная Останкино Праздничная высший сорт	https://www.perekrestok.ru/cat/133/p/kolbasa-syrokopcenaa-ostankino-prazdnicnaa-vyssij-sort-3650319	pg	Пятигорск, улица Малыгина, 5	2 499,00 ₽/кг	Sun Jul  7 23:20:00 2024
Колбаса сырокопчёная Черкизово Богородская, 300г	https://www.perekrestok.ru/cat/133/p/kolbasa-syrokopcenaa-cerkizovo-bogorodskaa-300g-3270273	pg	Пятигорск, улица Малыгина, 5	359,99 ₽/шт	Sun Jul  7 23:20:00 2024
Колбаса Сальчичон сырокопчёная полусухая Маркет, 300г	https://www.perekrestok.ru/cat/133/p/kolbasa-salcicon-syrokopcenaa-polusuhaa-market-300g-4322133	pg	Пятигорск, улица Малыгина, 5	369,99 ₽/шт	Sun Jul  7 23:20:00 2024
Колбаски сырокопчёные Дымов Пиколини сметана и лук полусухие, 50г	https://www.perekrestok.ru/cat/133/p/kolbaski-syrokopcenye-dymov-pikolini-smetana-i-luk-polusuhie-50g-4063721	pg	Пятигорск, улица Малыгина, 5	77,99 ₽/шт	Sun Jul  7 23:20:00 2024
Колбаса Рублёвский Сальчичон сырокопченая полусухая категории Б	https://www.perekrestok.ru/cat/133/p/kolbasa-rublevskij-salcicon-syrokopcenaa-polusuhaa-kategorii-b-4268526	pg	Пятигорск, улица Малыгина, 5	2 299,00 ₽/кг	Sun Jul  7 23:20:00 2024
Колбаса сырокопчёная Клинский Брауншвейгская категория А	https://www.perekrestok.ru/cat/133/p/kolbasa-syrokopcenaa-klinskij-braunsvejgskaa-kategoria-a-4307	pg	Пятигорск, улица Малыгина, 5	2 699,00 ₽/кг	Sun Jul  7 23:20:00 2024
Салями сырокопчёная Черкизово Салямини полусухая, 180г	https://www.perekrestok.ru/cat/133/p/salami-syrokopcenaa-cerkizovo-salamini-polusuhaa-180g-4045574	pg	Пятигорск, улица Малыгина, 5	249,99 ₽/шт	Sun Jul  7 23:20:00 2024
Колбаса сырокопчёная Столичная полусухая категория А Зелёная Линия, 100г	https://www.perekrestok.ru/cat/133/p/kolbasa-syrokopcenaa-stolicnaa-polusuhaa-kategoria-a-zelenaa-linia-100g-4135606	pg	Пятигорск, улица Малыгина, 5	199,99 ₽/шт	Sun Jul  7 23:20:00 2024
Колбаса сырокопчёная Ремит Итальянская classic	https://www.perekrestok.ru/cat/133/p/kolbasa-syrokopcenaa-remit-italanskaa-classic-3640669	pg	Пятигорск, улица Малыгина, 5	1 349,90 ₽/кг	Sun Jul  7 23:20:00 2024
Салями сырокопчёная Ближние Горки Итальянская категория В	https://www.perekrestok.ru/cat/133/p/salami-syrokopcenaa-bliznie-gorki-italanskaa-kategoria-v-3021048	pg	Пятигорск, улица Малыгина, 5	2 099,00 ₽/кг	Sun Jul  7 23:20:00 2024
Салями сырокопчёная Ремит Княжеская трапеза	https://www.perekrestok.ru/cat/133/p/salami-syrokopcenaa-remit-knazeskaa-trapeza-3640668	pg	Пятигорск, улица Малыгина, 5	2 099,00 ₽/кг	Sun Jul  7 23:20:00 2024
Колбаса Черный Кабан Сальчичон сырокопченая полусухая	https://www.perekrestok.ru/cat/133/p/kolbasa-cernyj-kaban-salcicon-syrokopcenaa-polusuhaa-4294204	pg	Пятигорск, улица Малыгина, 5	1 699,00 ₽/кг	Sun Jul  7 23:20:00 2024
Колбаса сырокопчёная Черкизово Сальчичон	https://www.perekrestok.ru/cat/133/p/kolbasa-syrokopcenaa-cerkizovo-salcicon-3983102	pg	Пятигорск, улица Малыгина, 5	1 799,00 ₽/кг	Sun Jul  7 23:20:00 2024
Колбаса Рублевский Салями Лучеза сырокопченая полусухая категории А	https://www.perekrestok.ru/cat/133/p/kolbasa-rublevskij-salami-luceza-syrokopcenaa-polusuhaa-kategorii-a-4308230	pg	Пятигорск, улица Малыгина, 5	2 199,00 ₽/кг	Sun Jul  7 23:20:00 2024
Колбаса сырокопчёная Черкизово Сервелетти полусухая	https://www.perekrestok.ru/cat/133/p/kolbasa-syrokopcenaa-cerkizovo-serveletti-polusuhaa-4231200	pg	Пятигорск, улица Малыгина, 5	1 699,00 ₽/кг	Sun Jul  7 23:20:00 2024
Колбаса С Можжевельником и Клюквой сырокопчёная полусухая Зелёная Линия	https://www.perekrestok.ru/cat/133/p/kolbasa-s-mozzevelnikom-i-klukvoj-syrokopcenaa-polusuhaa-zelenaa-linia-4320131	pg	Пятигорск, улица Малыгина, 5	3 099,00 ₽/кг	Sun Jul  7 23:20:00 2024
Колбаса Рублёвский Еврейская сырокопченая полусухая категории А	https://www.perekrestok.ru/cat/133/p/kolbasa-rublevskij-evrejskaa-syrokopcenaa-polusuhaa-kategorii-a-4274700	pg	Пятигорск, улица Малыгина, 5	3 099,00 ₽/кг	Sun Jul  7 23:20:00 2024
Сервелат сырокопчёный Царицыно Брауншвейгский	https://www.perekrestok.ru/cat/133/p/servelat-syrokopcenyj-caricyno-braunsvejgskij-3637141	pg	Пятигорск, улица Малыгина, 5	1 599,00 ₽/кг	Sun Jul  7 23:20:00 2024
Колбаски сырокопчёные Gutendorf Чорисо полусухие, 140г	https://www.perekrestok.ru/cat/133/p/kolbaski-syrokopcenye-gutendorf-coriso-polusuhie-140g-4219665	pg	Пятигорск, улица Малыгина, 5	289,99 ₽/шт	Sun Jul  7 23:20:00 2024
Колбаса сырокопчёная Брауншвейгская полусухая категория А Зелёная Линия	https://www.perekrestok.ru/cat/133/p/kolbasa-syrokopcenaa-braunsvejgskaa-polusuhaa-kategoria-a-zelenaa-linia-4009334	pg	Пятигорск, улица Малыгина, 5	1 949,00 ₽/кг	Sun Jul  7 23:20:00 2024
Колбаса сырокопчёная Черкизово Богородская	https://www.perekrestok.ru/cat/133/p/kolbasa-syrokopcenaa-cerkizovo-bogorodskaa-3281123	pg	Пятигорск, улица Малыгина, 5	1 399,00 ₽/кг	Sun Jul  7 23:20:00 2024
Колбаса Семидаль салями миланская сырокопчёная полусухая, 200г	https://www.perekrestok.ru/cat/133/p/kolbasa-semidal-salami-milanskaa-syrokopcenaa-polusuhaa-200g-4266253	pg	Пятигорск, улица Малыгина, 5	329,99 ₽/шт	Sun Jul  7 23:20:00 2024
Салями сырокопчёная Дымов Итальянская	https://www.perekrestok.ru/cat/133/p/salami-syrokopcenaa-dymov-italanskaa-42422	pg	Пятигорск, улица Малыгина, 5	1 849,00 ₽/кг	Sun Jul  7 23:20:00 2024
Колбаса сырокопчёная Дымов Брауншвейгская полусухая высший сорт	https://www.perekrestok.ru/cat/133/p/kolbasa-syrokopcenaa-dymov-braunsvejgskaa-polusuhaa-vyssij-sort-78007056	pg	Пятигорск, улица Малыгина, 5	2 399,00 ₽/кг	Sun Jul  7 23:20:00 2024
Колбаса сырокопчёная Рублевский Зернистая полусухая категории Б	https://www.perekrestok.ru/cat/133/p/kolbasa-syrokopcenaa-rublevskij-zernistaa-polusuhaa-kategorii-b-4038642	pg	Пятигорск, улица Малыгина, 5	1 499,00 ₽/кг	Sun Jul  7 23:20:00 2024
Колбаса сырокопчёная Рублевский Пера испанская с вином полусухая	https://www.perekrestok.ru/cat/133/p/kolbasa-syrokopcenaa-rublevskij-pera-ispanskaa-s-vinom-polusuhaa-3335682	pg	Пятигорск, улица Малыгина, 5	3 399,00 ₽/кг	Sun Jul  7 23:20:00 2024
Колбаса Ремит дворянский пир куриная сырокопченая	https://www.perekrestok.ru/cat/133/p/kolbasa-remit-dvoranskij-pir-kurinaa-syrokopcenaa-4354100	pg	Пятигорск, улица Малыгина, 5	2 099,00 ₽/кг	Sun Jul  7 23:20:00 2024
Колбаса Тавр Австрийская сырокопченая полусухая	https://www.perekrestok.ru/cat/133/p/kolbasa-tavr-avstrijskaa-syrokopcenaa-polusuhaa-4117914	pg	Пятигорск, улица Малыгина, 5	1 149,00 ₽/кг	Sun Jul  7 23:20:00 2024
Колбаса Медведовские Традиции Сервелат Фирменный сырокопчёная полусухая	https://www.perekrestok.ru/cat/133/p/kolbasa-medvedovskie-tradicii-servelat-firmennyj-syrokopcenaa-polusuhaa-4305868	pg	Пятигорск, улица Малыгина, 5	1 699,00 ₽/кг	Sun Jul  7 23:20:00 2024
Колбаса Медовские Традиции Фуэт сырокопченая полусухая	https://www.perekrestok.ru/cat/133/p/kolbasa-medovskie-tradicii-fuet-syrokopcenaa-polusuhaa-4284103	pg	Пятигорск, улица Малыгина, 5	2 399,00 ₽/кг	Sun Jul  7 23:20:00 2024
Салями сырокопчёная Черкизово Фламенко полусухая	https://www.perekrestok.ru/cat/133/p/salami-syrokopcenaa-cerkizovo-flamenko-polusuhaa-4228855	pg	Пятигорск, улица Малыгина, 5	1 949,00 ₽/кг	Sun Jul  7 23:20:00 2024
Салями сырокопчёная Байсад Монреаль 1 сорт	https://www.perekrestok.ru/cat/133/p/salami-syrokopcenaa-bajsad-monreal-1-sort-78004774	pg	Пятигорск, улица Малыгина, 5	1 399,00 ₽/кг	Sun Jul  7 23:20:00 2024
Колбаса сырокопчёная Рублёвский Рублёвская 1 сорт	https://www.perekrestok.ru/cat/133/p/kolbasa-syrokopcenaa-rublevskij-rublevskaa-1-sort-4061363	pg	Пятигорск, улица Малыгина, 5	2 099,00 ₽/кг	Sun Jul  7 23:20:00 2024
Суджук сырокопчёный Тавр	https://www.perekrestok.ru/cat/133/p/sudzuk-syrokopcenyj-tavr-3652224	pg	Пятигорск, улица Малыгина, 5	1 899,00 ₽/кг	Sun Jul  7 23:20:00 2024
Колбаса полукопчёная Куриная 1 сорт Зелёная Линия, 300г	https://www.perekrestok.ru/cat/133/p/kolbasa-polukopcenaa-kurinaa-1-sort-zelenaa-linia-300g-4163885	pg	Пятигорск, улица Малыгина, 5	339,99 ₽/шт	Sun Jul  7 23:20:00 2024
Колбаса полукопчёная Идель Кавказская Особая Халяль, 400г	https://www.perekrestok.ru/cat/133/p/kolbasa-polukopcenaa-idel-kavkazskaa-osobaa-halal-400g-4251903	pg	Пятигорск, улица Малыгина, 5	289,99 ₽/шт	Sun Jul  7 23:20:00 2024
Колбаски полукопчёные Ближние Горки Охотничьи категория В	https://www.perekrestok.ru/cat/133/p/kolbaski-polukopcenye-bliznie-gorki-ohotnici-kategoria-v-3035242	pg	Пятигорск, улица Малыгина, 5	899,90 ₽/кг	Sun Jul  7 23:20:00 2024
Колбаса полукопчёная Идель Говяжья Халяль категория Г, 500г	https://www.perekrestok.ru/cat/133/p/kolbasa-polukopcenaa-idel-govaza-halal-kategoria-g-500g-4116781	pg	Пятигорск, улица Малыгина, 5	219,99 ₽/шт	Sun Jul  7 23:20:00 2024
Колбаса полукопчёная Владимирский Стандарт Кремлёвская с грудинкой категория В, 350г	https://www.perekrestok.ru/cat/133/p/kolbasa-polukopcenaa-vladimirskij-standart-kremlevskaa-s-grudinkoj-kategoria-v-350g-3920511	pg	Пятигорск, улица Малыгина, 5	199,99 ₽/шт	Sun Jul  7 23:20:00 2024
Колбаса полукопчёная Торес Балыковая по-фермерски категории Б, 330г	https://www.perekrestok.ru/cat/133/p/kolbasa-polukopcenaa-tores-balykovaa-po-fermerski-kategorii-b-330g-4204044	pg	Пятигорск, улица Малыгина, 5	449,99 ₽/шт	Sun Jul  7 23:20:00 2024
Колбаса полукопчёная Владимирский стандарт Кремлёвская с грудинкой	https://www.perekrestok.ru/cat/133/p/kolbasa-polukopcenaa-vladimirskij-standart-kremlevskaa-s-grudinkoj-78005403	pg	Пятигорск, улица Малыгина, 5	819,99 ₽/кг	Sun Jul  7 23:20:00 2024
Колбаски Сочинский охотничьи полукопчёные, 200г	https://www.perekrestok.ru/cat/133/p/kolbaski-socinskij-ohotnici-polukopcenye-200g-3673747	pg	Пятигорск, улица Малыгина, 5	144,99 ₽/шт	Sun Jul  7 23:20:00 2024
Колбаса Идель Особая полукопчёная с зирой, 400г	https://www.perekrestok.ru/cat/133/p/kolbasa-idel-osobaa-polukopcenaa-s-ziroj-400g-4263571	pg	Пятигорск, улица Малыгина, 5	209,99 ₽/шт	Sun Jul  7 23:20:00 2024
Колбаса сыровяленая Casademont Фуэт экстра, 150г	https://www.perekrestok.ru/cat/133/p/kolbasa-syrovalenaa-casademont-fuet-ekstra-150g-3437861	pg	Пятигорск, улица Малыгина, 5	259,99 ₽/шт	Sun Jul  7 23:20:00 2024
Колбаса сыровяленая Casademont Сальчичон Экстра полусухая, 70г	https://www.perekrestok.ru/cat/133/p/kolbasa-syrovalenaa-casademont-salcicon-ekstra-polusuhaa-70g-4259257	pg	Пятигорск, улица Малыгина, 5	149,99 ₽/шт	Sun Jul  7 23:20:00 2024
Колбаса сыровяленая Casademont Лонганиза сухая, 90г	https://www.perekrestok.ru/cat/133/p/kolbasa-syrovalenaa-casademont-longaniza-suhaa-90g-4052801	pg	Пятигорск, улица Малыгина, 5	339,99 ₽/шт	Sun Jul  7 23:20:00 2024
Колбаса сыровяленая Черкизово Фуэт экстра полусухая, 150г	https://www.perekrestok.ru/cat/133/p/kolbasa-syrovalenaa-cerkizovo-fuet-ekstra-polusuhaa-150g-4008105	pg	Пятигорск, улица Малыгина, 5	449,99 ₽/шт	Sun Jul  7 23:20:00 2024
Колбаса Solemici Salame Салями С Трюфелем Черный Принц сыровяленая полусухая, 110г	https://www.perekrestok.ru/cat/133/p/kolbasa-solemici-salame-salami-s-trufelem-cernyj-princ-syrovalenaa-polusuhaa-110g-4263500	pg	Пятигорск, улица Малыгина, 5	309,99 ₽/шт	Sun Jul  7 23:20:00 2024
Колбаса сыровяленая Casademont Лонганиза	https://www.perekrestok.ru/cat/133/p/kolbasa-syrovalenaa-casademont-longaniza-3688313	pg	Пятигорск, улица Малыгина, 5	3 899,00 ₽/кг	Sun Jul  7 23:20:00 2024
Колбаса сыровяленая Casademont Сальчичон экстра категория А	https://www.perekrestok.ru/cat/133/p/kolbasa-syrovalenaa-casademont-salcicon-ekstra-kategoria-a-78001772	pg	Пятигорск, улица Малыгина, 5	2 499,00 ₽/кг	Sun Jul  7 23:20:00 2024
Колбаса Casademont Фуэт Экстра сыровяленая полусухая, 200г	https://www.perekrestok.ru/cat/133/p/kolbasa-casademont-fuet-ekstra-syrovalenaa-polusuhaa-200g-4276926	pg	Пятигорск, улица Малыгина, 5	449,99 ₽/шт	Sun Jul  7 23:20:00 2024
Салями сыровяленая Solemici Al Noce с орехом полусухая, 110г	https://www.perekrestok.ru/cat/133/p/salami-syrovalenaa-solemici-al-noce-s-orehom-polusuhaa-110g-4165246	pg	Пятигорск, улица Малыгина, 5	369,99 ₽/шт	Sun Jul  7 23:20:00 2024
Колбаса сыровяленая Казылык сухая Зелёная Линия,	https://www.perekrestok.ru/cat/133/p/kolbasa-syrovalenaa-kazylyk-suhaa-zelenaa-linia-4009322	pg	Пятигорск, улица Малыгина, 5	2 799,00 ₽/кг	Sun Jul  7 23:20:00 2024
Колбаса сыровяленая Ипатов Фуэт с благородной белой плесенью полусухая, 125г	https://www.perekrestok.ru/cat/133/p/kolbasa-syrovalenaa-ipatov-fuet-s-blagorodnoj-beloj-plesenu-polusuhaa-125g-4190308	pg	Пятигорск, улица Малыгина, 5	519,99 ₽/шт	Sun Jul  7 23:20:00 2024
Колбаса сыровяленая Охотный ряд Швейцарская высший сорт	https://www.perekrestok.ru/cat/133/p/kolbasa-syrovalenaa-ohotnyj-rad-svejcarskaa-vyssij-sort-3270012	pg	Пятигорск, улица Малыгина, 5	1 899,00 ₽/кг	Sun Jul  7 23:20:00 2024
Колбаса сыровяленая Ипатов Фуэт Мини полусухая с благородной белой плесенью, 150г	https://www.perekrestok.ru/cat/133/p/kolbasa-syrovalenaa-ipatov-fuet-mini-polusuhaa-s-blagorodnoj-beloj-plesenu-150g-4187897	pg	Пятигорск, улица Малыгина, 5	619,99 ₽/шт	Sun Jul  7 23:20:00 2024
Суджук сыровяленый Огзар сухой	https://www.perekrestok.ru/cat/133/p/sudzuk-syrovalenyj-ogzar-suhoj-3692220	pg	Пятигорск, улица Малыгина, 5	2 699,00 ₽/кг	Sun Jul  7 23:20:00 2024
Колбаса Черкизово Сальчичон сырокопченая полусухая, 300г	https://www.perekrestok.ru/cat/133/p/kolbasa-cerkizovo-salcicon-syrokopcenaa-polusuhaa-300g-4268939	pg	Пятигорск, улица Малыгина, 5	399,99 ₽/шт	Sun Jul  7 23:20:00 2024
Колбаса сырокопчёная Сальчичон полусухая Маркет, 100г	https://www.perekrestok.ru/cat/133/p/kolbasa-syrokopcenaa-salcicon-polusuhaa-market-100g-4141051	rnd	Ростов-на-Дону, Будённовский проспект, 45	149,99 ₽/шт	Sun Jul  7 23:20:00 2024
Колбаса Докторская варёная категории А в натуральной оболочке синюге Маркет Collection	https://www.perekrestok.ru/cat/133/p/kolbasa-doktorskaa-varenaa-kategorii-a-v-naturalnoj-obolocke-sinuge-market-collection-4296145	rnd	Ростов-на-Дону, Будённовский проспект, 45	1 149,00 ₽/кг	Sun Jul  7 23:20:00 2024
Колбаса варёная Папа Может Мясная, 500г	https://www.perekrestok.ru/cat/133/p/kolbasa-varenaa-papa-mozet-masnaa-500g-3484605	rnd	Ростов-на-Дону, Будённовский проспект, 45	289,99 ₽/шт	Sun Jul  7 23:20:00 2024
Колбаса Вязанка Докторская вареная категория А, 370г	https://www.perekrestok.ru/cat/133/p/kolbasa-vazanka-doktorskaa-varenaa-kategoria-a-370g-4301347	rnd	Ростов-на-Дону, Будённовский проспект, 45	299,99 ₽/шт	Sun Jul  7 23:20:00 2024
Колбаса варёная Папа Может Филейная, 500г	https://www.perekrestok.ru/cat/133/p/kolbasa-varenaa-papa-mozet-filejnaa-500g-3604158	rnd	Ростов-на-Дону, Будённовский проспект, 45	289,99 ₽/шт	Sun Jul  7 23:20:00 2024
Колбаса Вязанка Филейская Классическая вареная, 450г	https://www.perekrestok.ru/cat/133/p/kolbasa-vazanka-filejskaa-klassiceskaa-varenaa-450g-4277251	rnd	Ростов-на-Дону, Будённовский проспект, 45	309,99 ₽/шт	Sun Jul  7 23:20:00 2024
Колбаса Вязанка Сливушка вареная, 375г	https://www.perekrestok.ru/cat/133/p/kolbasa-vazanka-slivuska-varenaa-375g-4258884	rnd	Ростов-на-Дону, Будённовский проспект, 45	269,99 ₽/шт	Sun Jul  7 23:20:00 2024
Колбаса варёная Рублевский Докторская категория А	https://www.perekrestok.ru/cat/133/p/kolbasa-varenaa-rublevskij-doktorskaa-kategoria-a-78001451	rnd	Ростов-на-Дону, Будённовский проспект, 45	799,99 ₽/кг	Sun Jul  7 23:20:00 2024
Колбаса Мортаделла варёная Маркет Collection, 120г	https://www.perekrestok.ru/cat/133/p/kolbasa-mortadella-varenaa-market-collection-120g-4322790	rnd	Ростов-на-Дону, Будённовский проспект, 45	219,99 ₽/шт	Sun Jul  7 23:20:00 2024
Колбаса варёная Рублевский Докторская	https://www.perekrestok.ru/cat/133/p/kolbasa-varenaa-rublevskij-doktorskaa-3387738	rnd	Ростов-на-Дону, Будённовский проспект, 45	1 449,00 ₽/кг	Sun Jul  7 23:20:00 2024
Колбаса варёная Великолукский МК Докторская, 500г	https://www.perekrestok.ru/cat/133/p/kolbasa-varenaa-velikolukskij-mk-doktorskaa-500g-3661282	rnd	Ростов-на-Дону, Будённовский проспект, 45	309,99 ₽/шт	Sun Jul  7 23:20:00 2024
Колбаса варёная Индилайт Докторская из индейки, 400г	https://www.perekrestok.ru/cat/133/p/kolbasa-varenaa-indilajt-doktorskaa-iz-indejki-400g-4131503	rnd	Ростов-на-Дону, Будённовский проспект, 45	249,99 ₽/шт	Sun Jul  7 23:20:00 2024
Колбаса варёная из мяса птицы для питания детей Зелёная Линия, 240г	https://www.perekrestok.ru/cat/133/p/kolbasa-varenaa-iz-masa-pticy-dla-pitania-detej-zelenaa-linia-240g-4300888	rnd	Ростов-на-Дону, Будённовский проспект, 45	339,99 ₽/шт	Sun Jul  7 23:20:00 2024
Колбаса варёная МД Бородина Докторская	https://www.perekrestok.ru/cat/133/p/kolbasa-varenaa-md-borodina-doktorskaa-89612	rnd	Ростов-на-Дону, Будённовский проспект, 45	1 399,00 ₽/кг	Sun Jul  7 23:20:00 2024
Колбаса ливерная Атяшево Печёночная, 250г	https://www.perekrestok.ru/cat/133/p/kolbasa-livernaa-atasevo-pecenocnaa-250g-3271672	rnd	Ростов-на-Дону, Будённовский проспект, 45	39,99 ₽/шт	Sun Jul  7 23:20:00 2024
Колбаса Вязанка Молокуша вареная	https://www.perekrestok.ru/cat/133/p/kolbasa-vazanka-molokusa-varenaa-4280559	rnd	Ростов-на-Дону, Будённовский проспект, 45	799,99 ₽/кг	Sun Jul  7 23:20:00 2024
Колбаса варёная Владимирский Стандарт Докторская	https://www.perekrestok.ru/cat/133/p/kolbasa-varenaa-vladimirskij-standart-doktorskaa-3636194	rnd	Ростов-на-Дону, Будённовский проспект, 45	899,99 ₽/кг	Sun Jul  7 23:20:00 2024
Колбаса варёная Царицыно Докторская оригинальная мясо птицы, 200г	https://www.perekrestok.ru/cat/133/p/kolbasa-varenaa-caricyno-doktorskaa-originalnaa-maso-pticy-200g-3634520	rnd	Ростов-на-Дону, Будённовский проспект, 45	209,99 ₽/шт	Sun Jul  7 23:20:00 2024
Колбаса варёная Царицыно Докторская особая Халяль, 500г	https://www.perekrestok.ru/cat/133/p/kolbasa-varenaa-caricyno-doktorskaa-osobaa-halal-500g-3016790	rnd	Ростов-на-Дону, Будённовский проспект, 45	174,99 ₽/шт	Sun Jul  7 23:20:00 2024
Колбаса варёная Дым Дымыч со сливками	https://www.perekrestok.ru/cat/133/p/kolbasa-varenaa-dym-dymyc-so-slivkami-62594	rnd	Ростов-на-Дону, Будённовский проспект, 45	499,99 ₽/кг	Sun Jul  7 23:20:00 2024
Колбаса варёная Дымов Докторская категория А, 500г	https://www.perekrestok.ru/cat/133/p/kolbasa-varenaa-dymov-doktorskaa-kategoria-a-500g-3634693	rnd	Ростов-на-Дону, Будённовский проспект, 45	489,99 ₽/шт	Sun Jul  7 23:20:00 2024
Колбаса варёная Велком Докторская высший сорт, 500г	https://www.perekrestok.ru/cat/133/p/kolbasa-varenaa-velkom-doktorskaa-vyssij-sort-500g-2120885	rnd	Ростов-на-Дону, Будённовский проспект, 45	409,99 ₽/шт	Sun Jul  7 23:20:00 2024
Колбаса варёная Русские Колбасы Докторская, 500г	https://www.perekrestok.ru/cat/133/p/kolbasa-varenaa-russkie-kolbasy-doktorskaa-500g-4210890	rnd	Ростов-на-Дону, Будённовский проспект, 45	249,99 ₽/шт	Sun Jul  7 23:20:00 2024
Колбаса варёная Великолукский МК Детям с индейкой, 500г	https://www.perekrestok.ru/cat/133/p/kolbasa-varenaa-velikolukskij-mk-detam-s-indejkoj-500g-4051411	rnd	Ростов-на-Дону, Будённовский проспект, 45	369,99 ₽/шт	Sun Jul  7 23:20:00 2024
Колбаса варёная Дымов Докторская категория А	https://www.perekrestok.ru/cat/133/p/kolbasa-varenaa-dymov-doktorskaa-kategoria-a-3634692	rnd	Ростов-на-Дону, Будённовский проспект, 45	1 149,00 ₽/кг	Sun Jul  7 23:20:00 2024
Колбаса Тавр Мортаделла варёная	https://www.perekrestok.ru/cat/133/p/kolbasa-tavr-mortadella-varenaa-4317335	rnd	Ростов-на-Дону, Будённовский проспект, 45	879,99 ₽/кг	Sun Jul  7 23:20:00 2024
Колбаса Идель Мусульманская из мяса птицы вареная	https://www.perekrestok.ru/cat/133/p/kolbasa-idel-musulmanskaa-iz-masa-pticy-varenaa-4298318	rnd	Ростов-на-Дону, Будённовский проспект, 45	259,99 ₽/кг	Sun Jul  7 23:20:00 2024
