name	url	locale	address	price	time
Колбаса Сафа Люкс Халяль сырокопченая категории А	https://www.perekrestok.ru/cat/133/p/kolbasa-safa-luks-halal-syrokopcenaa-kategorii-a-4318727	msk	Москва, Большой Патриарший переулок, 5	2 338,00 ₽/кг	Sun Jul  7 23:20:00 2024
Колбаса полукопчёная Рублевский Краковская категория Б, 350г	https://www.perekrestok.ru/cat/133/p/kolbasa-polukopcenaa-rublevskij-krakovskaa-kategoria-b-350g-3631119	msk	Москва, Большой Патриарший переулок, 5	299,99 ₽/шт	Sun Jul  7 23:20:00 2024
Сервелат Финский варёно-копчёный Маркет, 350г	https://www.perekrestok.ru/cat/133/p/servelat-finskij-vareno-kopcenyj-market-350g-4323878	msk	Москва, Большой Патриарший переулок, 5	229,99 ₽/шт	Sun Jul  7 23:20:00 2024
Колбаса полукопчёная Куриная 1 сорт Зелёная Линия, 300г	https://www.perekrestok.ru/cat/133/p/kolbasa-polukopcenaa-kurinaa-1-sort-zelenaa-linia-300g-4163885	msk	Москва, Большой Патриарший переулок, 5	279,99 ₽/шт	Sun Jul  7 23:20:00 2024
Колбаса полукопчёная Идель Кавказская Особая Халяль, 400г	https://www.perekrestok.ru/cat/133/p/kolbasa-polukopcenaa-idel-kavkazskaa-osobaa-halal-400g-4251903	msk	Москва, Большой Патриарший переулок, 5	269,99 ₽/шт	Sun Jul  7 23:20:00 2024
Колбаски полукопчёные Ближние Горки Охотничьи категория В	https://www.perekrestok.ru/cat/133/p/kolbaski-polukopcenye-bliznie-gorki-ohotnici-kategoria-v-3035242	msk	Москва, Большой Патриарший переулок, 5	899,90 ₽/кг	Sun Jul  7 23:20:00 2024
Колбаски полукопчёные МД Бородина Охотничьи, 230г	https://www.perekrestok.ru/cat/133/p/kolbaski-polukopcenye-md-borodina-ohotnici-230g-3385825	msk	Москва, Большой Патриарший переулок, 5	339,99 ₽/шт	Sun Jul  7 23:20:00 2024
Колбаса полукопчёная Идель Говяжья Халяль категория Г, 500г	https://www.perekrestok.ru/cat/133/p/kolbasa-polukopcenaa-idel-govaza-halal-kategoria-g-500g-4116781	msk	Москва, Большой Патриарший переулок, 5	194,99 ₽/шт	Sun Jul  7 23:20:00 2024
Колбаса полукопчёная МД Бородина Краковская, 400г	https://www.perekrestok.ru/cat/133/p/kolbasa-polukopcenaa-md-borodina-krakovskaa-400g-25707	msk	Москва, Большой Патриарший переулок, 5	479,99 ₽/шт	Sun Jul  7 23:20:00 2024
Колбаса полукопчёная Мираторг Чесночная категории В, 375г	https://www.perekrestok.ru/cat/133/p/kolbasa-polukopcenaa-miratorg-cesnocnaa-kategorii-v-375g-4120839	msk	Москва, Большой Патриарший переулок, 5	249,99 ₽/шт	Sun Jul  7 23:20:00 2024
Колбаса полукопчёная Рузком Мусульманская, 600г	https://www.perekrestok.ru/cat/133/p/kolbasa-polukopcenaa-ruzkom-musulmanskaa-600g-4252558	msk	Москва, Большой Патриарший переулок, 5	269,99 ₽/шт	Sun Jul  7 23:20:00 2024
Колбаса Эко Дорожная Халяль полукопченая категории В, 300г	https://www.perekrestok.ru/cat/133/p/kolbasa-eko-doroznaa-halal-polukopcenaa-kategorii-v-300g-4309416	msk	Москва, Большой Патриарший переулок, 5	147,99 ₽/шт	Sun Jul  7 23:20:00 2024
Колбаса полукопчёная Краковская категория Б Зелёная Линия	https://www.perekrestok.ru/cat/133/p/kolbasa-polukopcenaa-krakovskaa-kategoria-b-zelenaa-linia-4009326	msk	Москва, Большой Патриарший переулок, 5	1 099,00 ₽/кг	Sun Jul  7 23:20:00 2024
Колбаски полукопчёные Мясницкий Ряд Охотничьи категория В	https://www.perekrestok.ru/cat/133/p/kolbaski-polukopcenye-masnickij-rad-ohotnici-kategoria-v-78001508	msk	Москва, Большой Патриарший переулок, 5	1 099,00 ₽/кг	Sun Jul  7 23:20:00 2024
Колбаса полукопчёная МД Бородина Одесская категория Б, 400г	https://www.perekrestok.ru/cat/133/p/kolbasa-polukopcenaa-md-borodina-odesskaa-kategoria-b-400g-3919549	msk	Москва, Большой Патриарший переулок, 5	499,99 ₽/шт	Sun Jul  7 23:20:00 2024
Колбаса Эколь Баранья Халяль полукопченая категории Б, 150г	https://www.perekrestok.ru/cat/133/p/kolbasa-ekol-barana-halal-polukopcenaa-kategorii-b-150g-4276759	msk	Москва, Большой Патриарший переулок, 5	160,99 ₽/шт	Sun Jul  7 23:20:00 2024
Колбаса Идель Кавказская полукопчёная из мяса кур 2 сорт халяль, 400г	https://www.perekrestok.ru/cat/133/p/kolbasa-idel-kavkazskaa-polukopcenaa-iz-masa-kur-2-sort-halal-400g-4353591	msk	Москва, Большой Патриарший переулок, 5	269,99 ₽/шт	Sun Jul  7 23:20:00 2024
Колбаски Еремкина Т.П. Охотничьи изделие полукопченое категории В	https://www.perekrestok.ru/cat/133/p/kolbaski-eremkina-t-p-ohotnici-izdelie-polukopcenoe-kategorii-v-4283762	msk	Москва, Большой Патриарший переулок, 5	1 799,90 ₽/кг	Sun Jul  7 23:20:00 2024
Колбаса Еремкина Т.П. Краковская изделие полукопченое категории Б в натуральной оболочке	https://www.perekrestok.ru/cat/133/p/kolbasa-eremkina-t-p-krakovskaa-izdelie-polukopcenoe-kategorii-b-v-naturalnoj-obolocke-4283764	msk	Москва, Большой Патриарший переулок, 5	1 449,00 ₽/кг	Sun Jul  7 23:20:00 2024
Колбаски Баварушка Балыкбургские с сыром полукопчёные	https://www.perekrestok.ru/cat/133/p/kolbaski-bavaruska-balykburgskie-s-syrom-polukopcenye-4330185	msk	Москва, Большой Патриарший переулок, 5	1 299,00 ₽/кг	Sun Jul  7 23:20:00 2024
Колбаса сыровяленая Casademont Фуэт экстра, 150г	https://www.perekrestok.ru/cat/133/p/kolbasa-syrovalenaa-casademont-fuet-ekstra-150g-3437861	msk	Москва, Большой Патриарший переулок, 5	259,99 ₽/шт	Sun Jul  7 23:20:00 2024
Салями сыровяленая Solemici Al Chianti полусухая нарезка, 70г	https://www.perekrestok.ru/cat/133/p/salami-syrovalenaa-solemici-al-chianti-polusuhaa-narezka-70g-4165261	msk	Москва, Большой Патриарший переулок, 5	169,99 ₽/шт	Sun Jul  7 23:20:00 2024
Колбаса сыровяленая Casademont Сальчичон Экстра полусухая, 70г	https://www.perekrestok.ru/cat/133/p/kolbasa-syrovalenaa-casademont-salcicon-ekstra-polusuhaa-70g-4259257	msk	Москва, Большой Патриарший переулок, 5	149,99 ₽/шт	Sun Jul  7 23:20:00 2024
Колбаса сыровяленая Casademont Лонганиза сухая, 90г	https://www.perekrestok.ru/cat/133/p/kolbasa-syrovalenaa-casademont-longaniza-suhaa-90g-4052801	msk	Москва, Большой Патриарший переулок, 5	339,99 ₽/шт	Sun Jul  7 23:20:00 2024
Колбаса сырокопчёная Черкизово Прошутто полусухая, 100г	https://www.perekrestok.ru/cat/133/p/kolbasa-syrokopcenaa-cerkizovo-prosutto-polusuhaa-100g-3996147	msk	Москва, Большой Патриарший переулок, 5	169,99 ₽/шт	Sun Jul  7 23:20:00 2024
Колбаса сыровяленая Casademont Сальчичон монтанья экстра категория А, 250г	https://www.perekrestok.ru/cat/133/p/kolbasa-syrovalenaa-casademont-salcicon-montana-ekstra-kategoria-a-250g-3447711	msk	Москва, Большой Патриарший переулок, 5	419,99 ₽/шт	Sun Jul  7 23:20:00 2024
Колбаса сыровяленая Мясницкий Ряд Верона полусухая в нарезке, 90г	https://www.perekrestok.ru/cat/133/p/kolbasa-syrovalenaa-masnickij-rad-verona-polusuhaa-v-narezke-90g-3684835	msk	Москва, Большой Патриарший переулок, 5	169,99 ₽/шт	Sun Jul  7 23:20:00 2024
Колбаса Казылык сухая сыровяленая Зелёная Линия, 90г	https://www.perekrestok.ru/cat/133/p/kolbasa-kazylyk-suhaa-syrovalenaa-zelenaa-linia-90g-4334720	msk	Москва, Большой Патриарший переулок, 5	249,99 ₽/шт	Sun Jul  7 23:20:00 2024
Колбаса Solemici Salame Салями С Трюфелем Черный Принц сыровяленая полусухая, 110г	https://www.perekrestok.ru/cat/133/p/kolbasa-solemici-salame-salami-s-trufelem-cernyj-princ-syrovalenaa-polusuhaa-110g-4263500	msk	Москва, Большой Патриарший переулок, 5	319,99 ₽/шт	Sun Jul  7 23:20:00 2024
Колбаса Останкино Итальянское Ассорти сыровяленая полусухая, 90г	https://www.perekrestok.ru/cat/133/p/kolbasa-ostankino-italanskoe-assorti-syrovalenaa-polusuhaa-90g-4320802	msk	Москва, Большой Патриарший переулок, 5	289,99 ₽/шт	Sun Jul  7 23:20:00 2024
Колбаса сыровяленая Casademont Лонганиза	https://www.perekrestok.ru/cat/133/p/kolbasa-syrovalenaa-casademont-longaniza-3688313	msk	Москва, Большой Патриарший переулок, 5	2 799,90 ₽/кг	Sun Jul  7 23:20:00 2024
Колбаса сыровяленая Casademont Сальчичон экстра категория А	https://www.perekrestok.ru/cat/133/p/kolbasa-syrovalenaa-casademont-salcicon-ekstra-kategoria-a-78001772	msk	Москва, Большой Патриарший переулок, 5	1 399,90 ₽/кг	Sun Jul  7 23:20:00 2024
Колбаса Casademont Фуэт Экстра сыровяленая полусухая, 200г	https://www.perekrestok.ru/cat/133/p/kolbasa-casademont-fuet-ekstra-syrovalenaa-polusuhaa-200g-4276926	msk	Москва, Большой Патриарший переулок, 5	499,99 ₽/шт	Sun Jul  7 23:20:00 2024
Колбаса Solemici Strolgino Di Kulatello Салями, С Орехами, С Трюфелем Черный Принц сыровяленая полусухая, 330г	https://www.perekrestok.ru/cat/133/p/kolbasa-solemici-strolgino-di-kulatello-salami-s-orehami-s-trufelem-cernyj-princ-syrovalenaa-polusuhaa-330g-4263497	msk	Москва, Большой Патриарший переулок, 5	699,99 ₽/шт	Sun Jul  7 23:20:00 2024
Салями сыровяленая Solemici Al Noce с орехом полусухая нарезка, 70г	https://www.perekrestok.ru/cat/133/p/salami-syrovalenaa-solemici-al-noce-s-orehom-polusuhaa-narezka-70g-4165264	msk	Москва, Большой Патриарший переулок, 5	239,99 ₽/шт	Sun Jul  7 23:20:00 2024
Салями сыровяленая Solemici Al Noce с орехом полусухая, 110г	https://www.perekrestok.ru/cat/133/p/salami-syrovalenaa-solemici-al-noce-s-orehom-polusuhaa-110g-4165246	msk	Москва, Большой Патриарший переулок, 5	309,99 ₽/шт	Sun Jul  7 23:20:00 2024
Колбаса Solemici Strolghino Con Parmigiano сыровяленая полусухая, 110г	https://www.perekrestok.ru/cat/133/p/kolbasa-solemici-strolghino-con-parmigiano-syrovalenaa-polusuhaa-110g-4311279	msk	Москва, Большой Патриарший переулок, 5	369,99 ₽/шт	Sun Jul  7 23:20:00 2024
Колбаса сыровяленая Казылык сухая Зелёная Линия,	https://www.perekrestok.ru/cat/133/p/kolbasa-syrovalenaa-kazylyk-suhaa-zelenaa-linia-4009322	msk	Москва, Большой Патриарший переулок, 5	2 499,00 ₽/кг	Sun Jul  7 23:20:00 2024
Колбаса сыровяленая Мясницкий Ряд Милано полусухая в нарезке, 90г	https://www.perekrestok.ru/cat/133/p/kolbasa-syrovalenaa-masnickij-rad-milano-polusuhaa-v-narezke-90g-3682528	msk	Москва, Большой Патриарший переулок, 5	194,99 ₽/шт	Sun Jul  7 23:20:00 2024
Колбаса сыровяленая Охотный ряд Швейцарская высший сорт	https://www.perekrestok.ru/cat/133/p/kolbasa-syrovalenaa-ohotnyj-rad-svejcarskaa-vyssij-sort-3270012	msk	Москва, Большой Патриарший переулок, 5	1 499,00 ₽/кг	Sun Jul  7 23:20:00 2024
Колбаса Solemici Salame Italiano Салями Итальяно сыровяленая полусухая	https://www.perekrestok.ru/cat/133/p/kolbasa-solemici-salame-italiano-salami-italano-syrovalenaa-polusuhaa-4264677	msk	Москва, Большой Патриарший переулок, 5	2 999,00 ₽/кг	Sun Jul  7 23:20:00 2024
Колбаса Черкизово Сальчичон сырокопченая полусухая, 300г	https://www.perekrestok.ru/cat/133/p/kolbasa-cerkizovo-salcicon-syrokopcenaa-polusuhaa-300g-4268939	msk	Москва, Большой Патриарший переулок, 5	399,99 ₽/шт	Sun Jul  7 23:20:00 2024
Колбаса Клинский языковая варёная категории Б, 190г	https://www.perekrestok.ru/cat/133/p/kolbasa-klinskij-azykovaa-varenaa-kategorii-b-190g-4345579	msk	Москва, Большой Патриарший переулок, 5	229,99 ₽/шт	Sun Jul  7 23:20:00 2024
Колбаса сырокопчёная Сальчичон полусухая Маркет, 100г	https://www.perekrestok.ru/cat/133/p/kolbasa-syrokopcenaa-salcicon-polusuhaa-market-100g-4141051	spb	Санкт-Петербург, Биржевая площадь, 4	179,99 ₽/шт	Sun Jul  7 23:20:00 2024
Колбаса Докторская варёная категории А в натуральной оболочке синюге Маркет Collection	https://www.perekrestok.ru/cat/133/p/kolbasa-doktorskaa-varenaa-kategorii-a-v-naturalnoj-obolocke-sinuge-market-collection-4296145	spb	Санкт-Петербург, Биржевая площадь, 4	859,99 ₽/кг	Sun Jul  7 23:20:00 2024
Колбаса варёная Клинский Докторская категория А	https://www.perekrestok.ru/cat/133/p/kolbasa-varenaa-klinskij-doktorskaa-kategoria-a-2170372	spb	Санкт-Петербург, Биржевая площадь, 4	679,99 ₽/кг	Sun Jul  7 23:20:00 2024
Колбаса Вязанка Молокуша вареная, 450г	https://www.perekrestok.ru/cat/133/p/kolbasa-vazanka-molokusa-varenaa-450g-4277253	spb	Санкт-Петербург, Биржевая площадь, 4	169,99 ₽/шт	Sun Jul  7 23:20:00 2024
Колбаса варёная Папа Может Мясная, 500г	https://www.perekrestok.ru/cat/133/p/kolbasa-varenaa-papa-mozet-masnaa-500g-3484605	spb	Санкт-Петербург, Биржевая площадь, 4	269,99 ₽/шт	Sun Jul  7 23:20:00 2024
Колбаса варёная Папа Может Филейная, 500г	https://www.perekrestok.ru/cat/133/p/kolbasa-varenaa-papa-mozet-filejnaa-500g-3604158	spb	Санкт-Петербург, Биржевая площадь, 4	179,99 ₽/шт	Sun Jul  7 23:20:00 2024
Колбаса Вязанка Сливушка вареная, 375г	https://www.perekrestok.ru/cat/133/p/kolbasa-vazanka-slivuska-varenaa-375g-4258884	spb	Санкт-Петербург, Биржевая площадь, 4	259,99 ₽/шт	Sun Jul  7 23:20:00 2024
Колбаса варёная Окраина Докторская, 400г	https://www.perekrestok.ru/cat/133/p/kolbasa-varenaa-okraina-doktorskaa-400g-3434232	spb	Санкт-Петербург, Биржевая площадь, 4	409,99 ₽/шт	Sun Jul  7 23:20:00 2024
Колбаса варёная Иней Докторская категория А, 350г	https://www.perekrestok.ru/cat/133/p/kolbasa-varenaa-inej-doktorskaa-kategoria-a-350g-3641632	spb	Санкт-Петербург, Биржевая площадь, 4	309,99 ₽/шт	Sun Jul  7 23:20:00 2024
Колбаса варёная Окраина Докторская	https://www.perekrestok.ru/cat/133/p/kolbasa-varenaa-okraina-doktorskaa-3626340	spb	Санкт-Петербург, Биржевая площадь, 4	979,99 ₽/кг	Sun Jul  7 23:20:00 2024
Колбаса варёная МД Бородина Докторская высший сорт, 500г	https://www.perekrestok.ru/cat/133/p/kolbasa-varenaa-md-borodina-doktorskaa-vyssij-sort-500g-3347584	spb	Санкт-Петербург, Биржевая площадь, 4	229,99 ₽/шт	Sun Jul  7 23:20:00 2024
Колбаса варёная Велком Докторская кусок, 500г	https://www.perekrestok.ru/cat/133/p/kolbasa-varenaa-velkom-doktorskaa-kusok-500g-3385812	spb	Санкт-Петербург, Биржевая площадь, 4	399,99 ₽/шт	Sun Jul  7 23:20:00 2024
Колбаса вареная Стародворье Докторская Стародворская	https://www.perekrestok.ru/cat/133/p/kolbasa-varenaa-starodvore-doktorskaa-starodvorskaa-4116511	spb	Санкт-Петербург, Биржевая площадь, 4	539,99 ₽/кг	Sun Jul  7 23:20:00 2024
Колбаса варёная Клинский Докторская категория А, 400г	https://www.perekrestok.ru/cat/133/p/kolbasa-varenaa-klinskij-doktorskaa-kategoria-a-400g-4221913	spb	Санкт-Петербург, Биржевая площадь, 4	359,99 ₽/шт	Sun Jul  7 23:20:00 2024
Колбаса Велком телячья варёная высший сорт, 500г	https://www.perekrestok.ru/cat/133/p/kolbasa-velkom-telaca-varenaa-vyssij-sort-500g-3358632	spb	Санкт-Петербург, Биржевая площадь, 4	419,99 ₽/шт	Sun Jul  7 23:20:00 2024
Колбаса варёная Бахрушинъ Докторская категория А	https://www.perekrestok.ru/cat/133/p/kolbasa-varenaa-bahrusin-doktorskaa-kategoria-a-3217763	spb	Санкт-Петербург, Биржевая площадь, 4	1 249,00 ₽/кг	Sun Jul  7 23:20:00 2024
Колбаса варёная Клинский Докторская, 190г	https://www.perekrestok.ru/cat/133/p/kolbasa-varenaa-klinskij-doktorskaa-190g-3639615	spb	Санкт-Петербург, Биржевая площадь, 4	164,99 ₽/шт	Sun Jul  7 23:20:00 2024
Колбаса варёная Великолукский МК Докторская, 500г	https://www.perekrestok.ru/cat/133/p/kolbasa-varenaa-velikolukskij-mk-doktorskaa-500g-3410899	spb	Санкт-Петербург, Биржевая площадь, 4	189,99 ₽/шт	Sun Jul  7 23:20:00 2024
Колбаса варёная МД Бородина Докторская	https://www.perekrestok.ru/cat/133/p/kolbasa-varenaa-md-borodina-doktorskaa-89612	spb	Санкт-Петербург, Биржевая площадь, 4	1 049,00 ₽/кг	Sun Jul  7 23:20:00 2024
Колбаса варёная Ближние Горки Докторская категория А	https://www.perekrestok.ru/cat/133/p/kolbasa-varenaa-bliznie-gorki-doktorskaa-kategoria-a-3035251	spb	Санкт-Петербург, Биржевая площадь, 4	434,90 ₽/кг	Sun Jul  7 23:20:00 2024
Колбаса варёная Черкизово Классическая, 200г	https://www.perekrestok.ru/cat/133/p/kolbasa-varenaa-cerkizovo-klassiceskaa-200g-4180727	spb	Санкт-Петербург, Биржевая площадь, 4	184,99 ₽/шт	Sun Jul  7 23:20:00 2024
Колбаса ливерная Ладоград Классическая	https://www.perekrestok.ru/cat/133/p/kolbasa-livernaa-ladograd-klassiceskaa-3661369	spb	Санкт-Петербург, Биржевая площадь, 4	899,99 ₽/кг	Sun Jul  7 23:20:00 2024
Колбаса варёная Останкино Русская категория Б	https://www.perekrestok.ru/cat/133/p/kolbasa-varenaa-ostankino-russkaa-kategoria-b-4150236	spb	Санкт-Петербург, Биржевая площадь, 4	799,90 ₽/кг	Sun Jul  7 23:20:00 2024
Колбаса варёная Клинский Молочная нарезка, 190г	https://www.perekrestok.ru/cat/133/p/kolbasa-varenaa-klinskij-molocnaa-narezka-190g-4243028	spb	Санкт-Петербург, Биржевая площадь, 4	184,99 ₽/шт	Sun Jul  7 23:20:00 2024
Колбаса варёная Стародворье Молочная	https://www.perekrestok.ru/cat/133/p/kolbasa-varenaa-starodvore-molocnaa-3678250	spb	Санкт-Петербург, Биржевая площадь, 4	549,99 ₽/кг	Sun Jul  7 23:20:00 2024
Колбаса Мясной Дом Бородина Докторская вареная категории А, 190г	https://www.perekrestok.ru/cat/133/p/kolbasa-masnoj-dom-borodina-doktorskaa-varenaa-kategorii-a-190g-4264678	spb	Санкт-Петербург, Биржевая площадь, 4	95,99 ₽/шт	Sun Jul  7 23:20:00 2024
Колбаса Вязанка Филейская вареная	https://www.perekrestok.ru/cat/133/p/kolbasa-vazanka-filejskaa-varenaa-4280560	spb	Санкт-Петербург, Биржевая площадь, 4	529,99 ₽/кг	Sun Jul  7 23:20:00 2024
Колбаса варёная из мяса птицы для питания детей Зелёная Линия, 240г	https://www.perekrestok.ru/cat/133/p/kolbasa-varenaa-iz-masa-pticy-dla-pitania-detej-zelenaa-linia-240g-4300888	spb	Санкт-Петербург, Биржевая площадь, 4	359,99 ₽/шт	Sun Jul  7 23:20:00 2024
Колбаса Вязанка Молокуша вареная	https://www.perekrestok.ru/cat/133/p/kolbasa-vazanka-molokusa-varenaa-4280559	spb	Санкт-Петербург, Биржевая площадь, 4	249,99 ₽/кг	Sun Jul  7 23:20:00 2024
Колбаса варёная Папа Может мясная	https://www.perekrestok.ru/cat/133/p/kolbasa-varenaa-papa-mozet-masnaa-78005943	spb	Санкт-Петербург, Биржевая площадь, 4	399,90 ₽/кг	Sun Jul  7 23:20:00 2024
Колбаса варёная Мит Стар Докторская категории А	https://www.perekrestok.ru/cat/133/p/kolbasa-varenaa-mit-star-doktorskaa-kategorii-a-4176756	spb	Санкт-Петербург, Биржевая площадь, 4	1 249,00 ₽/кг	Sun Jul  7 23:20:00 2024
Колбаса варёная Черкизово Молочная по-черкизовски	https://www.perekrestok.ru/cat/133/p/kolbasa-varenaa-cerkizovo-molocnaa-po-cerkizovski-4109833	spb	Санкт-Петербург, Биржевая площадь, 4	449,90 ₽/кг	Sun Jul  7 23:20:00 2024
Колбаса варёная Мясной Дом Бородина молочная категория Б	https://www.perekrestok.ru/cat/133/p/kolbasa-varenaa-masnoj-dom-borodina-molocnaa-kategoria-b-4114051	spb	Санкт-Петербург, Биржевая площадь, 4	1 249,00 ₽/кг	Sun Jul  7 23:20:00 2024
Колбаса варёная Рублевский Любительская категория А	https://www.perekrestok.ru/cat/133/p/kolbasa-varenaa-rublevskij-lubitelskaa-kategoria-a-4235785	spb	Санкт-Петербург, Биржевая площадь, 4	839,99 ₽/кг	Sun Jul  7 23:20:00 2024
Колбаса варёная Иней Элитная категория Б	https://www.perekrestok.ru/cat/133/p/kolbasa-varenaa-inej-elitnaa-kategoria-b-4044652	spb	Санкт-Петербург, Биржевая площадь, 4	1 049,00 ₽/кг	Sun Jul  7 23:20:00 2024
Колбаса Мортаделла Cortador варёная категории А	https://www.perekrestok.ru/cat/133/p/kolbasa-mortadella-cortador-varenaa-kategorii-a-4345821	spb	Санкт-Петербург, Биржевая площадь, 4	999,90 ₽/кг	Sun Jul  7 23:20:00 2024
Колбаса варёная Gunters Мортаделла Премиум с Фисташками категории А, 120г	https://www.perekrestok.ru/cat/133/p/kolbasa-varenaa-gunters-mortadella-premium-s-fistaskami-kategorii-a-120g-4170361	spb	Санкт-Петербург, Биржевая площадь, 4	239,99 ₽/шт	Sun Jul  7 23:20:00 2024
Колбаса варёная Мит Стар Добрынинская трапеза категория Б	https://www.perekrestok.ru/cat/133/p/kolbasa-varenaa-mit-star-dobryninskaa-trapeza-kategoria-b-4208277	spb	Санкт-Петербург, Биржевая площадь, 4	639,99 ₽/кг	Sun Jul  7 23:20:00 2024
Колбаса Высший Вкус со вкусом Докторской пшеничная, 400г	https://www.perekrestok.ru/cat/133/p/kolbasa-vyssij-vkus-so-vkusom-doktorskoj-psenicnaa-400g-4260421	spb	Санкт-Петербург, Биржевая площадь, 4	489,99 ₽/шт	Sun Jul  7 23:20:00 2024
Колбаса Стародворье Стародворская варёная	https://www.perekrestok.ru/cat/133/p/kolbasa-starodvore-starodvorskaa-varenaa-4352003	spb	Санкт-Петербург, Биржевая площадь, 4	699,99 ₽/кг	Sun Jul  7 23:20:00 2024
