name	url	locale	address	price	time
Гречка ядрица пропаренная Маркет Перекрёсток, 900г	https://www.perekrestok.ru/cat/107/p/grecka-adrica-proparennaa-market-perekrestok-900g-3477255	msk	Москва, Большой Патриарший переулок, 5	109,99 ₽/шт	Sun Jul  7 23:20:00 2024
Рис длиннозёрный Маркет Перекрёсток, 900г	https://www.perekrestok.ru/cat/107/p/ris-dlinnozernyj-market-perekrestok-900g-3469126	msk	Москва, Большой Патриарший переулок, 5	154,99 ₽/шт	Sun Jul  7 23:20:00 2024
Кускус Зелёная Линия, 350г	https://www.perekrestok.ru/cat/107/p/kuskus-zelenaa-linia-350g-4151856	msk	Москва, Большой Патриарший переулок, 5	139,99 ₽/шт	Sun Jul  7 23:20:00 2024
Киноа белая Зелёная Линия, 350г	https://www.perekrestok.ru/cat/107/p/kinoa-belaa-zelenaa-linia-350g-4151854	msk	Москва, Большой Патриарший переулок, 5	239,99 ₽/шт	Sun Jul  7 23:20:00 2024
Гречка зелёная ядрица 1 сорт Зелёная Линия, 400г	https://www.perekrestok.ru/cat/107/p/grecka-zelenaa-adrica-1-sort-zelenaa-linia-400g-4151853	msk	Москва, Большой Патриарший переулок, 5	154,99 ₽/шт	Sun Jul  7 23:20:00 2024
Булгур из пшеницы Зелёная Линия, 400г	https://www.perekrestok.ru/cat/107/p/bulgur-iz-psenicy-zelenaa-linia-400g-4151852	msk	Москва, Большой Патриарший переулок, 5	119,99 ₽/шт	Sun Jul  7 23:20:00 2024
Рис Мистраль Кубань белый круглозёрный, 900г	https://www.perekrestok.ru/cat/107/p/ris-mistral-kuban-belyj-kruglozernyj-900g-3766	msk	Москва, Большой Патриарший переулок, 5	184,99 ₽/шт	Sun Jul  7 23:20:00 2024
Рис Мистраль Янтарь длиннозёрный пропаренный, 900г	https://www.perekrestok.ru/cat/107/p/ris-mistral-antar-dlinnozernyj-proparennyj-900g-57930	msk	Москва, Большой Патриарший переулок, 5	229,99 ₽/шт	Sun Jul  7 23:20:00 2024
Рис круглозернистый шлифованный, 900г	https://www.perekrestok.ru/cat/107/p/ris-kruglozernistyj-slifovannyj-900g-3231277	msk	Москва, Большой Патриарший переулок, 5	68,90 ₽/шт	Sun Jul  7 23:20:00 2024
Рис Агро-Альянс Gold Экстра элитный пропаренный, 900г	https://www.perekrestok.ru/cat/107/p/ris-agro-alans-gold-ekstra-elitnyj-proparennyj-900g-14302	msk	Москва, Большой Патриарший переулок, 5	149,99 ₽/шт	Sun Jul  7 23:20:00 2024
Рис Увелка длиннозёрный пропаренный, 5х80г	https://www.perekrestok.ru/cat/107/p/ris-uvelka-dlinnozernyj-proparennyj-5h80g-3603168	msk	Москва, Большой Патриарший переулок, 5	124,99 ₽/шт	Sun Jul  7 23:20:00 2024
Рис Мистраль Янтарь длиннозёрный пропаренный, 5х80г	https://www.perekrestok.ru/cat/107/p/ris-mistral-antar-dlinnozernyj-proparennyj-5h80g-3674166	msk	Москва, Большой Патриарший переулок, 5	109,99 ₽/шт	Sun Jul  7 23:20:00 2024
Рис Националь для плова шлифованный, 900г	https://www.perekrestok.ru/cat/107/p/ris-nacional-dla-plova-slifovannyj-900g-3413111	msk	Москва, Большой Патриарший переулок, 5	159,99 ₽/шт	Sun Jul  7 23:20:00 2024
Рис Увелка круглозёрный шлифованный, 5х80г	https://www.perekrestok.ru/cat/107/p/ris-uvelka-kruglozernyj-slifovannyj-5h80g-3603169	msk	Москва, Большой Патриарший переулок, 5	104,99 ₽/шт	Sun Jul  7 23:20:00 2024
Рис Мистраль Кубань белый круглозёрный, 5х80г	https://www.perekrestok.ru/cat/107/p/ris-mistral-kuban-belyj-kruglozernyj-5h80g-3674360	msk	Москва, Большой Патриарший переулок, 5	129,99 ₽/шт	Sun Jul  7 23:20:00 2024
Рис Националь Бальдо шлифованный, 800г	https://www.perekrestok.ru/cat/107/p/ris-nacional-baldo-slifovannyj-800g-4217255	msk	Москва, Большой Патриарший переулок, 5	139,99 ₽/шт	Sun Jul  7 23:20:00 2024
Рис Жасмин Маркет Collection, 500г	https://www.perekrestok.ru/cat/107/p/ris-zasmin-market-collection-500g-4290674	msk	Москва, Большой Патриарший переулок, 5	134,99 ₽/шт	Sun Jul  7 23:20:00 2024
Рис круглозёрный Маркет Перекрёсток, 900г	https://www.perekrestok.ru/cat/107/p/ris-kruglozernyj-market-perekrestok-900g-3469127	msk	Москва, Большой Патриарший переулок, 5	154,99 ₽/шт	Sun Jul  7 23:20:00 2024
Рис пропаренный шлифованный, 900г	https://www.perekrestok.ru/cat/107/p/ris-proparennyj-slifovannyj-900g-3608320	msk	Москва, Большой Патриарший переулок, 5	112,90 ₽/шт	Sun Jul  7 23:20:00 2024
Рис Мистраль Басмати белый ароматный, 500г	https://www.perekrestok.ru/cat/107/p/ris-mistral-basmati-belyj-aromatnyj-500g-5722	msk	Москва, Большой Патриарший переулок, 5	259,99 ₽/шт	Sun Jul  7 23:20:00 2024
Рис длиннозёрный, 900г	https://www.perekrestok.ru/cat/107/p/ris-dlinnozernyj-900g-3231230	msk	Москва, Большой Патриарший переулок, 5	86,90 ₽/шт	Sun Jul  7 23:20:00 2024
Рис Агро-Альянс Экстра для плова шлифованный, 900г	https://www.perekrestok.ru/cat/107/p/ris-agro-alans-ekstra-dla-plova-slifovannyj-900g-3422668	msk	Москва, Большой Патриарший переулок, 5	169,99 ₽/шт	Sun Jul  7 23:20:00 2024
Смесь Увелка Дружба рис круглозёрного и пшено, 5х80г	https://www.perekrestok.ru/cat/107/p/smes-uvelka-druzba-ris-kruglozernogo-i-pseno-5h80g-3424356	msk	Москва, Большой Патриарший переулок, 5	119,99 ₽/шт	Sun Jul  7 23:20:00 2024
Рис длиннозёрный Маркет Перекрёсток, 4х125г	https://www.perekrestok.ru/cat/107/p/ris-dlinnozernyj-market-perekrestok-4h125g-3469129	msk	Москва, Большой Патриарший переулок, 5	119,99 ₽/шт	Sun Jul  7 23:20:00 2024
Рис Агро-Альянс Кубанский Экстра элитный шлифованный, 900г	https://www.perekrestok.ru/cat/107/p/ris-agro-alans-kubanskij-ekstra-elitnyj-slifovannyj-900g-14304	msk	Москва, Большой Патриарший переулок, 5	159,99 ₽/шт	Sun Jul  7 23:20:00 2024
Рис Мистраль Жасмин белый ароматный длиннозёрный, 500г	https://www.perekrestok.ru/cat/107/p/ris-mistral-zasmin-belyj-aromatnyj-dlinnozernyj-500g-39747	msk	Москва, Большой Патриарший переулок, 5	189,99 ₽/шт	Sun Jul  7 23:20:00 2024
Рис Maрket Collection бурый нешлифованный, 800г	https://www.perekrestok.ru/cat/107/p/ris-market-collection-buryj-neslifovannyj-800g-4345261	msk	Москва, Большой Патриарший переулок, 5	154,99 ₽/шт	Sun Jul  7 23:20:00 2024
Рис Мистраль Италика белый круглозерный, 500г	https://www.perekrestok.ru/cat/107/p/ris-mistral-italika-belyj-kruglozernyj-500g-4332035	msk	Москва, Большой Патриарший переулок, 5	139,99 ₽/шт	Sun Jul  7 23:20:00 2024
Рис для японской кухни шлифованный Market Collection, 500г	https://www.perekrestok.ru/cat/107/p/ris-dla-aponskoj-kuhni-slifovannyj-market-collection-500g-4285358	msk	Москва, Большой Патриарший переулок, 5	114,99 ₽/шт	Sun Jul  7 23:20:00 2024
Рис Агро-Альянс Кубанский кулон экстра среднезёрный, 900г	https://www.perekrestok.ru/cat/107/p/ris-agro-alans-kubanskij-kulon-ekstra-srednezernyj-900g-2170845	msk	Москва, Большой Патриарший переулок, 5	129,99 ₽/шт	Sun Jul  7 23:20:00 2024
Рис Националь Гигант, 800г	https://www.perekrestok.ru/cat/107/p/ris-nacional-gigant-800g-3608726	msk	Москва, Большой Патриарший переулок, 5	149,99 ₽/шт	Sun Jul  7 23:20:00 2024
Рис Увелка Жасмин, 5x80г	https://www.perekrestok.ru/cat/107/p/ris-uvelka-zasmin-5x80g-3634156	msk	Москва, Большой Патриарший переулок, 5	169,99 ₽/шт	Sun Jul  7 23:20:00 2024
Рис Увелка Басмати, 5x80г	https://www.perekrestok.ru/cat/107/p/ris-uvelka-basmati-5x80g-3634155	msk	Москва, Большой Патриарший переулок, 5	174,99 ₽/шт	Sun Jul  7 23:20:00 2024
Рис шлифованный пропаренный Маркет Перекрёсток, 900г	https://www.perekrestok.ru/cat/107/p/ris-slifovannyj-proparennyj-market-perekrestok-900g-3469125	msk	Москва, Большой Патриарший переулок, 5	169,99 ₽/шт	Sun Jul  7 23:20:00 2024
Рис Sen Soy для суши, 250г	https://www.perekrestok.ru/cat/107/p/ris-sen-soy-dla-susi-250g-3143475	msk	Москва, Большой Патриарший переулок, 5	134,99 ₽/шт	Sun Jul  7 23:20:00 2024
Рис Националь Золото Таиланда, 900г	https://www.perekrestok.ru/cat/107/p/ris-nacional-zoloto-tailanda-900g-3608771	msk	Москва, Большой Патриарший переулок, 5	199,99 ₽/шт	Sun Jul  7 23:20:00 2024
Рис Мистраль Самарканд красный круглозёрный, 500г	https://www.perekrestok.ru/cat/107/p/ris-mistral-samarkand-krasnyj-kruglozernyj-500g-3467020	msk	Москва, Большой Патриарший переулок, 5	149,99 ₽/шт	Sun Jul  7 23:20:00 2024
Рис Dunar Дейли Басмати длиннозёрный шлифованный, 500г	https://www.perekrestok.ru/cat/107/p/ris-dunar-dejli-basmati-dlinnozernyj-slifovannyj-500g-3635865	msk	Москва, Большой Патриарший переулок, 5	269,99 ₽/шт	Sun Jul  7 23:20:00 2024
Рис Басмати Steam шлифованный длиннозерный Маркет Collection, 500г	https://www.perekrestok.ru/cat/107/p/ris-basmati-steam-slifovannyj-dlinnozernyj-market-collection-500g-4300775	msk	Москва, Большой Патриарший переулок, 5	239,99 ₽/шт	Sun Jul  7 23:20:00 2024
Рис Мистраль для плова традиционного, 900г	https://www.perekrestok.ru/cat/107/p/ris-mistral-dla-plova-tradicionnogo-900g-3483037	msk	Москва, Большой Патриарший переулок, 5	184,99 ₽/шт	Sun Jul  7 23:20:00 2024
Рис Legurme басмати, 250г	https://www.perekrestok.ru/cat/107/p/ris-legurme-basmati-250g-4267993	msk	Москва, Большой Патриарший переулок, 5	159,99 ₽/шт	Sun Jul  7 23:20:00 2024
Рис Арборио шлифованный Маркет Collection, 500г	https://www.perekrestok.ru/cat/107/p/ris-arborio-slifovannyj-market-collection-500g-4285414	msk	Москва, Большой Патриарший переулок, 5	299,99 ₽/шт	Sun Jul  7 23:20:00 2024
Рис Националь Испанский шлифованный, 800г	https://www.perekrestok.ru/cat/107/p/ris-nacional-ispanskij-slifovannyj-800g-4217253	msk	Москва, Большой Патриарший переулок, 5	149,99 ₽/шт	Sun Jul  7 23:20:00 2024
Рис Willette Permal длиннозёрный индийский пропаренный, 500г	https://www.perekrestok.ru/cat/107/p/ris-willette-permal-dlinnozernyj-indijskij-proparennyj-500g-4338995	msk	Москва, Большой Патриарший переулок, 5	154,99 ₽/шт	Sun Jul  7 23:20:00 2024
Рис Агро-Альянс Экстра Арборио ризотто, 500г	https://www.perekrestok.ru/cat/107/p/ris-agro-alans-ekstra-arborio-rizotto-500g-2167600	msk	Москва, Большой Патриарший переулок, 5	239,99 ₽/шт	Sun Jul  7 23:20:00 2024
Рис круглозёрный Маркет Перекрёсток, 4х125г	https://www.perekrestok.ru/cat/107/p/ris-kruglozernyj-market-perekrestok-4h125g-3469128	msk	Москва, Большой Патриарший переулок, 5	119,99 ₽/шт	Sun Jul  7 23:20:00 2024
Рис Willette Басмати Creamy Sella длиннозёрный индийский пропаренный, 500г	https://www.perekrestok.ru/cat/107/p/ris-willette-basmati-creamy-sella-dlinnozernyj-indijskij-proparennyj-500g-4338989	msk	Москва, Большой Патриарший переулок, 5	209,99 ₽/шт	Sun Jul  7 23:20:00 2024
Смесь пропаренного и красного риса Зелёная Линия, 400г	https://www.perekrestok.ru/cat/107/p/smes-proparennogo-i-krasnogo-risa-zelenaa-linia-400g-4333150	msk	Москва, Большой Патриарший переулок, 5	139,99 ₽/шт	Sun Jul  7 23:20:00 2024
Рис Мистраль Басмати Экстра белый ароматный, 5х80г	https://www.perekrestok.ru/cat/107/p/ris-mistral-basmati-ekstra-belyj-aromatnyj-5h80g-4009018	msk	Москва, Большой Патриарший переулок, 5	269,99 ₽/шт	Sun Jul  7 23:20:00 2024
Рис Legurme с овощами, 250г	https://www.perekrestok.ru/cat/107/p/ris-legurme-s-ovosami-250g-4267994	msk	Москва, Большой Патриарший переулок, 5	81,99 ₽/шт	Sun Jul  7 23:20:00 2024
Рис Мистраль Осман белый круглозёрный, 500г	https://www.perekrestok.ru/cat/107/p/ris-mistral-osman-belyj-kruglozernyj-500g-4347960	msk	Москва, Большой Патриарший переулок, 5	149,99 ₽/шт	Sun Jul  7 23:20:00 2024
Гречка ядрица, 900г	https://www.perekrestok.ru/cat/107/p/grecka-adrica-900g-3231481	msk	Москва, Большой Патриарший переулок, 5	38,94 ₽/шт	Sun Jul  7 23:20:00 2024
Гречка Увелка Экстра, 5х80г	https://www.perekrestok.ru/cat/107/p/grecka-uvelka-ekstra-5h80g-3603166	msk	Москва, Большой Патриарший переулок, 5	109,99 ₽/шт	Sun Jul  7 23:20:00 2024
Гречка Мистраль Фермерская, 900г	https://www.perekrestok.ru/cat/107/p/grecka-mistral-fermerskaa-900g-3694322	msk	Москва, Большой Патриарший переулок, 5	119,99 ₽/шт	Sun Jul  7 23:20:00 2024
Гречка Мистраль, 900г	https://www.perekrestok.ru/cat/107/p/grecka-mistral-900g-53673	msk	Москва, Большой Патриарший переулок, 5	139,99 ₽/шт	Sun Jul  7 23:20:00 2024
Гречка Националь Камолино, 800г	https://www.perekrestok.ru/cat/107/p/grecka-nacional-kamolino-800g-4204902	msk	Москва, Большой Патриарший переулок, 5	144,99 ₽/шт	Sun Jul  7 23:20:00 2024
Гречка ядрица Маркет Перекрёсток, 4х100г	https://www.perekrestok.ru/cat/107/p/grecka-adrica-market-perekrestok-4h100g-3696237	msk	Москва, Большой Патриарший переулок, 5	85,99 ₽/шт	Sun Jul  7 23:20:00 2024
Гречка Мистраль ядрица, 5х80г	https://www.perekrestok.ru/cat/107/p/grecka-mistral-adrica-5h80g-3674200	msk	Москва, Большой Патриарший переулок, 5	119,99 ₽/шт	Sun Jul  7 23:20:00 2024
Гречка Агро-Альянс Экстра элитная, 900г	https://www.perekrestok.ru/cat/107/p/grecka-agro-alans-ekstra-elitnaa-900g-14301	msk	Москва, Большой Патриарший переулок, 5	144,99 ₽/шт	Sun Jul  7 23:20:00 2024
Гречка Увелка с грибами, 2х150г	https://www.perekrestok.ru/cat/107/p/grecka-uvelka-s-gribami-2h150g-7251	msk	Москва, Большой Патриарший переулок, 5	219,99 ₽/шт	Sun Jul  7 23:20:00 2024
Гречка Raisad гарнир с овощами по-домашнему, 200г	https://www.perekrestok.ru/cat/107/p/grecka-raisad-garnir-s-ovosami-po-domasnemu-200g-3687579	msk	Москва, Большой Патриарший переулок, 5	59,99 ₽/шт	Sun Jul  7 23:20:00 2024
Пшено Мистраль Золотое шлифованное, 900г	https://www.perekrestok.ru/cat/107/p/pseno-mistral-zolotoe-slifovannoe-900g-3019675	msk	Москва, Большой Патриарший переулок, 5	109,99 ₽/шт	Sun Jul  7 23:20:00 2024
Пшено шлифованное 1 сорт, 900г	https://www.perekrestok.ru/cat/107/p/pseno-slifovannoe-1-sort-900g-3231330	msk	Москва, Большой Патриарший переулок, 5	29,90 ₽/шт	Sun Jul  7 23:20:00 2024
Крупа пшеничная Увелка, 5х80г	https://www.perekrestok.ru/cat/107/p/krupa-psenicnaa-uvelka-5h80g-3493526	msk	Москва, Большой Патриарший переулок, 5	88,99 ₽/шт	Sun Jul  7 23:20:00 2024
Крупа пшеничная Полтавская №2, 800г	https://www.perekrestok.ru/cat/107/p/krupa-psenicnaa-poltavskaa-no2-800g-3601120	msk	Москва, Большой Патриарший переулок, 5	29,90 ₽/шт	Sun Jul  7 23:20:00 2024
Пшено шлифованное Маркет Перекрёсток, 4х100г	https://www.perekrestok.ru/cat/107/p/pseno-slifovannoe-market-perekrestok-4h100g-3696238	msk	Москва, Большой Патриарший переулок, 5	59,99 ₽/шт	Sun Jul  7 23:20:00 2024
Пшено шлифованное высший сорт Маркет, 900г	https://www.perekrestok.ru/cat/107/p/pseno-slifovannoe-vyssij-sort-market-900g-4306942	msk	Москва, Большой Патриарший переулок, 5	85,99 ₽/шт	Sun Jul  7 23:20:00 2024
Пшено Мистраль Золотое, 5х80г	https://www.perekrestok.ru/cat/107/p/pseno-mistral-zolotoe-5h80g-3674169	msk	Москва, Большой Патриарший переулок, 5	89,99 ₽/шт	Sun Jul  7 23:20:00 2024
Булгур Мистраль по-турецки с вермишелью, 500г	https://www.perekrestok.ru/cat/107/p/bulgur-mistral-po-turecki-s-vermiselu-500g-4182020	msk	Москва, Большой Патриарший переулок, 5	189,99 ₽/шт	Sun Jul  7 23:20:00 2024
Манка Мистраль, 800г	https://www.perekrestok.ru/cat/107/p/manka-mistral-800g-3435928	msk	Москва, Большой Патриарший переулок, 5	79,99 ₽/шт	Sun Jul  7 23:20:00 2024
Манка Шебекинские из твердой пшеницы, 500г	https://www.perekrestok.ru/cat/107/p/manka-sebekinskie-iz-tverdoj-psenicy-500g-3637985	msk	Москва, Большой Патриарший переулок, 5	79,99 ₽/шт	Sun Jul  7 23:20:00 2024
Манка, 900г	https://www.perekrestok.ru/cat/107/p/manka-900g-2085836	msk	Москва, Большой Патриарший переулок, 5	41,90 ₽/шт	Sun Jul  7 23:20:00 2024
Крупка кукурузная Garnec Кукурузная манка, 450г	https://www.perekrestok.ru/cat/107/p/krupka-kukuruznaa-garnec-kukuruznaa-manka-450g-3663924	msk	Москва, Большой Патриарший переулок, 5	119,99 ₽/шт	Sun Jul  7 23:20:00 2024
Крупа перловая №1 Маркет, 900г	https://www.perekrestok.ru/cat/107/p/krupa-perlovaa-no1-market-900g-4306952	msk	Москва, Большой Патриарший переулок, 5	59,99 ₽/шт	Sun Jul  7 23:20:00 2024
Перловка Увелка, 5х80г	https://www.perekrestok.ru/cat/107/p/perlovka-uvelka-5h80g-2070151	msk	Москва, Большой Патриарший переулок, 5	93,99 ₽/шт	Sun Jul  7 23:20:00 2024
Перловка Мистраль, 900г	https://www.perekrestok.ru/cat/107/p/perlovka-mistral-900g-3466348	msk	Москва, Большой Патриарший переулок, 5	91,99 ₽/шт	Sun Jul  7 23:20:00 2024
Крупа перловая Алтайская Сказка Ячменная №1, 5х80г	https://www.perekrestok.ru/cat/107/p/krupa-perlovaa-altajskaa-skazka-acmennaa-no1-5h80g-3472078	msk	Москва, Большой Патриарший переулок, 5	67,99 ₽/шт	Sun Jul  7 23:20:00 2024
Суп Yelli Ирландский из перловки с тыквой, 200г	https://www.perekrestok.ru/cat/107/p/sup-yelli-irlandskij-iz-perlovki-s-tykvoj-200g-4189685	msk	Москва, Большой Патриарший переулок, 5	199,99 ₽/шт	Sun Jul  7 23:20:00 2024
Киноа Мистраль, 500г	https://www.perekrestok.ru/cat/107/p/kinoa-mistral-500g-3649025	msk	Москва, Большой Патриарший переулок, 5	489,99 ₽/шт	Sun Jul  7 23:20:00 2024
Смесь крупы булгур и киноа из пшеницы Зелёная Линия, 400г	https://www.perekrestok.ru/cat/107/p/smes-krupy-bulgur-i-kinoa-iz-psenicy-zelenaa-linia-400g-4151851	msk	Москва, Большой Патриарший переулок, 5	219,99 ₽/шт	Sun Jul  7 23:20:00 2024
Кускус Yelli с ароматными травами, 250г	https://www.perekrestok.ru/cat/107/p/kuskus-yelli-s-aromatnymi-travami-250g-3467823	msk	Москва, Большой Патриарший переулок, 5	129,99 ₽/шт	Sun Jul  7 23:20:00 2024
Кускус Мистраль, 450г	https://www.perekrestok.ru/cat/107/p/kuskus-mistral-450g-3408221	msk	Москва, Большой Патриарший переулок, 5	219,99 ₽/шт	Sun Jul  7 23:20:00 2024
Крупа пшеничная Увелка кускус, 5х80г	https://www.perekrestok.ru/cat/107/p/krupa-psenicnaa-uvelka-kuskus-5h80g-3991889	msk	Москва, Большой Патриарший переулок, 5	199,99 ₽/шт	Sun Jul  7 23:20:00 2024
Суп Yelli Чаудер с рисом и кукурузой, 190г	https://www.perekrestok.ru/cat/107/p/sup-yelli-cauder-s-risom-i-kukuruzoj-190g-3498485	msk	Москва, Большой Патриарший переулок, 5	129,99 ₽/шт	Sun Jul  7 23:20:00 2024
Суп Yelli Турецкий с булгуром, 250г	https://www.perekrestok.ru/cat/107/p/sup-yelli-tureckij-s-bulgurom-250g-3447284	msk	Москва, Большой Патриарший переулок, 5	129,99 ₽/шт	Sun Jul  7 23:20:00 2024
Суп Yelli Семь бобов, 250г	https://www.perekrestok.ru/cat/107/p/sup-yelli-sem-bobov-250g-3447287	msk	Москва, Большой Патриарший переулок, 5	129,99 ₽/шт	Sun Jul  7 23:20:00 2024
Смесь бобовых Мистраль для супов, 500г	https://www.perekrestok.ru/cat/107/p/smes-bobovyh-mistral-dla-supov-500g-3655943	msk	Москва, Большой Патриарший переулок, 5	159,99 ₽/шт	Sun Jul  7 23:20:00 2024
Суп-пюре гороховый Маркет Перекрёсток, 200г	https://www.perekrestok.ru/cat/107/p/sup-pure-gorohovyj-market-perekrestok-200g-3613665	msk	Москва, Большой Патриарший переулок, 5	119,99 ₽/шт	Sun Jul  7 23:20:00 2024
Суп факес из зеленой чечевицы Маркет Перекрёсток, 250г	https://www.perekrestok.ru/cat/107/p/sup-fakes-iz-zelenoj-cecevicy-market-perekrestok-250g-4025297	msk	Москва, Большой Патриарший переулок, 5	149,99 ₽/шт	Sun Jul  7 23:20:00 2024
Суп харчо Маркет Перекрёсток, 150г	https://www.perekrestok.ru/cat/107/p/sup-harco-market-perekrestok-150g-3613654	msk	Москва, Большой Патриарший переулок, 5	114,99 ₽/шт	Sun Jul  7 23:20:00 2024
Крем-суп Yelli лёгкий овощной с цуккини, 70г	https://www.perekrestok.ru/cat/107/p/krem-sup-yelli-legkij-ovosnoj-s-cukkini-70g-4253779	msk	Москва, Большой Патриарший переулок, 5	79,99 ₽/шт	Sun Jul  7 23:20:00 2024
Суп Yelli Мексиканский с фасолью и кукурузой, 120г	https://www.perekrestok.ru/cat/107/p/sup-yelli-meksikanskij-s-fasolu-i-kukuruzoj-120g-4034911	msk	Москва, Большой Патриарший переулок, 5	189,99 ₽/шт	Sun Jul  7 23:20:00 2024
Суп Тосканский с полбой и томатами Yelli, 200г	https://www.perekrestok.ru/cat/107/p/sup-toskanskij-s-polboj-i-tomatami-yelli-200g-4189684	msk	Москва, Большой Патриарший переулок, 5	184,99 ₽/шт	Sun Jul  7 23:20:00 2024
Суп рассольник Маркет Перекрёсток, 150г	https://www.perekrestok.ru/cat/107/p/sup-rassolnik-market-perekrestok-150g-3613664	msk	Москва, Большой Патриарший переулок, 5	114,99 ₽/шт	Sun Jul  7 23:20:00 2024
Суп Yelli Греческий с орзо и пряными травами, 250 г	https://www.perekrestok.ru/cat/107/p/sup-yelli-greceskij-s-orzo-i-pranymi-travami-250-g-4189683	msk	Москва, Большой Патриарший переулок, 5	249,99 ₽/шт	Sun Jul  7 23:20:00 2024
