name	url	locale	address	price	time
Крекер Tuc со сметаной и луком, 100г	https://www.perekrestok.ru/cat/197/p/kreker-tuc-so-smetanoj-i-lukom-100g-3400349	nn	Нижний Новгород, площадь Минина и Пожарского, 2	79,99 ₽/шт	Sun Jul  7 23:20:00 2024
Крекер Яшкино Французский хрустящий с кунжутом, 185г	https://www.perekrestok.ru/cat/197/p/kreker-askino-francuzskij-hrustasij-s-kunzutom-185g-3222305	nn	Нижний Новгород, площадь Минина и Пожарского, 2	51,99 ₽/шт	Sun Jul  7 23:20:00 2024
Крекер Яшкино Классический, 180г	https://www.perekrestok.ru/cat/197/p/kreker-askino-klassiceskij-180g-3632221	nn	Нижний Новгород, площадь Минина и Пожарского, 2	57,99 ₽/шт	Sun Jul  7 23:20:00 2024
Крекер Рыбки Пр!ст, 200г	https://www.perekrestok.ru/cat/197/p/kreker-rybki-pr-st-200g-4050547	nn	Нижний Новгород, площадь Минина и Пожарского, 2	31,99 ₽/шт	Sun Jul  7 23:20:00 2024
Крекер ржаной Зелёная Линия, 220г	https://www.perekrestok.ru/cat/197/p/kreker-rzanoj-zelenaa-linia-220g-4321923	nn	Нижний Новгород, площадь Минина и Пожарского, 2	63,99 ₽/шт	Sun Jul  7 23:20:00 2024
Крекер Tuc Original с солью, 100г	https://www.perekrestok.ru/cat/197/p/kreker-tuc-original-s-solu-100g-3329546	nn	Нижний Новгород, площадь Минина и Пожарского, 2	79,99 ₽/шт	Sun Jul  7 23:20:00 2024
Крекер Рыбки с луком Пр!ст, 200г	https://www.perekrestok.ru/cat/197/p/kreker-rybki-s-lukom-pr-st-200g-4050548	nn	Нижний Новгород, площадь Минина и Пожарского, 2	41,99 ₽/шт	Sun Jul  7 23:20:00 2024
Крекер Tuc со вкусом пиццы, 100г	https://www.perekrestok.ru/cat/197/p/kreker-tuc-so-vkusom-piccy-100g-3490862	nn	Нижний Новгород, площадь Минина и Пожарского, 2	79,99 ₽/шт	Sun Jul  7 23:20:00 2024
Крекер Любятово Янтарный с сыром, 204г	https://www.perekrestok.ru/cat/197/p/kreker-lubatovo-antarnyj-s-syrom-204g-4122153	nn	Нижний Новгород, площадь Минина и Пожарского, 2	59,99 ₽/шт	Sun Jul  7 23:20:00 2024
Крекер Любятово Янтарный с солью, 204г	https://www.perekrestok.ru/cat/197/p/kreker-lubatovo-antarnyj-s-solu-204g-4122152	nn	Нижний Новгород, площадь Минина и Пожарского, 2	59,99 ₽/шт	Sun Jul  7 23:20:00 2024
Крекер Tuc со вкусом краба, 100г	https://www.perekrestok.ru/cat/197/p/kreker-tuc-so-vkusom-kraba-100g-4024592	nn	Нижний Новгород, площадь Минина и Пожарского, 2	79,99 ₽/шт	Sun Jul  7 23:20:00 2024
Крекер Tuc копчёные колбаски, 100г	https://www.perekrestok.ru/cat/197/p/kreker-tuc-kopcenye-kolbaski-100g-3622961	nn	Нижний Новгород, площадь Минина и Пожарского, 2	79,99 ₽/шт	Sun Jul  7 23:20:00 2024
Крекер Смайл с солью Пр!ст, 200г	https://www.perekrestok.ru/cat/197/p/kreker-smajl-s-solu-pr-st-200g-4050551	nn	Нижний Новгород, площадь Минина и Пожарского, 2	41,99 ₽/шт	Sun Jul  7 23:20:00 2024
Крекер Бежицкий Бисер	https://www.perekrestok.ru/cat/197/p/kreker-bezickij-biser-3654951	nn	Нижний Новгород, площадь Минина и Пожарского, 2	179,99 ₽/кг	Sun Jul  7 23:20:00 2024
Крекер Здрава Дымка ржаной, 250г	https://www.perekrestok.ru/cat/197/p/kreker-zdrava-dymka-rzanoj-250g-3476766	nn	Нижний Новгород, площадь Минина и Пожарского, 2	71,99 ₽/шт	Sun Jul  7 23:20:00 2024
Крекер Eco Botanica пищевые волокна-картофель-зелень, 175г	https://www.perekrestok.ru/cat/197/p/kreker-eco-botanica-pisevye-volokna-kartofel-zelen-175g-3604374	nn	Нижний Новгород, площадь Минина и Пожарского, 2	124,99 ₽/шт	Sun Jul  7 23:20:00 2024
Крекер Здрава Французский, 210г	https://www.perekrestok.ru/cat/197/p/kreker-zdrava-francuzskij-210g-3601242	nn	Нижний Новгород, площадь Минина и Пожарского, 2	63,99 ₽/шт	Sun Jul  7 23:20:00 2024
Крекер Любятово Янтарный с сыром	https://www.perekrestok.ru/cat/197/p/kreker-lubatovo-antarnyj-s-syrom-78002651	nn	Нижний Новгород, площадь Минина и Пожарского, 2	249,99 ₽/кг	Sun Jul  7 23:20:00 2024
Крекер Ясная Поляна Забавные животные, 400г	https://www.perekrestok.ru/cat/197/p/kreker-asnaa-polana-zabavnye-zivotnye-400g-3238700	nn	Нижний Новгород, площадь Минина и Пожарского, 2	134,99 ₽/шт	Sun Jul  7 23:20:00 2024
Крекер Любятово Витаминный	https://www.perekrestok.ru/cat/197/p/kreker-lubatovo-vitaminnyj-78002649	nn	Нижний Новгород, площадь Минина и Пожарского, 2	249,99 ₽/кг	Sun Jul  7 23:20:00 2024
Крекер Сахарoff Фитнес на фруктозе, 200г	https://www.perekrestok.ru/cat/197/p/kreker-saharoff-fitnes-na-fruktoze-200g-4277761	nn	Нижний Новгород, площадь Минина и Пожарского, 2	129,99 ₽/шт	Sun Jul  7 23:20:00 2024
Крекер Сахарoff Классический на сорбите, 185г	https://www.perekrestok.ru/cat/197/p/kreker-saharoff-klassiceskij-na-sorbite-185g-4277783	nn	Нижний Новгород, площадь Минина и Пожарского, 2	91,99 ₽/шт	Sun Jul  7 23:20:00 2024
Крекер Вилар Грибное лукошко	https://www.perekrestok.ru/cat/197/p/kreker-vilar-gribnoe-lukosko-78002970	nn	Нижний Новгород, площадь Минина и Пожарского, 2	479,99 ₽/кг	Sun Jul  7 23:20:00 2024
Крекеры Elite Средиземноморские с кунжутом, 105г	https://www.perekrestok.ru/cat/197/p/krekery-elite-sredizemnomorskie-s-kunzutom-105g-4317785	nn	Нижний Новгород, площадь Минина и Пожарского, 2	129,99 ₽/шт	Sun Jul  7 23:20:00 2024
Крекер Сахарoff Фигурный с сыром на фруктозе, 200г	https://www.perekrestok.ru/cat/197/p/kreker-saharoff-figurnyj-s-syrom-na-fruktoze-200g-4277760	nn	Нижний Новгород, площадь Минина и Пожарского, 2	149,99 ₽/шт	Sun Jul  7 23:20:00 2024
Крекер Акконд с солью, 190г	https://www.perekrestok.ru/cat/197/p/kreker-akkond-s-solu-190g-4129086	nn	Нижний Новгород, площадь Минина и Пожарского, 2	61,99 ₽/шт	Sun Jul  7 23:20:00 2024
Крекер Любятово с семенами льна и подсолнечника, 150г	https://www.perekrestok.ru/cat/197/p/kreker-lubatovo-s-semenami-lna-i-podsolnecnika-150g-4113923	nn	Нижний Новгород, площадь Минина и Пожарского, 2	154,99 ₽/шт	Sun Jul  7 23:20:00 2024
Печенье Belvita Утреннее витаминизированное с какао, 225г	https://www.perekrestok.ru/cat/197/p/pecene-belvita-utrennee-vitaminizirovannoe-s-kakao-225g-3632860	nn	Нижний Новгород, площадь Минина и Пожарского, 2	154,99 ₽/шт	Sun Jul  7 23:20:00 2024
Печенье Orion Choco Boy с обогащающей добавкой, 45г	https://www.perekrestok.ru/cat/197/p/pecene-orion-choco-boy-s-obogasausej-dobavkoj-45g-3194287	nn	Нижний Новгород, площадь Минина и Пожарского, 2	47,99 ₽/шт	Sun Jul  7 23:20:00 2024
Печенье Kellogg's Extra гранола шоколадом и апельсином, 150г	https://www.perekrestok.ru/cat/197/p/pecene-kelloggs-extra-granola-sokoladom-i-apelsinom-150g-3687463	nn	Нижний Новгород, площадь Минина и Пожарского, 2	139,99 ₽/шт	Sun Jul  7 23:20:00 2024
Печенье Любятово шоколадное сахарное, 228г	https://www.perekrestok.ru/cat/197/p/pecene-lubatovo-sokoladnoe-saharnoe-228g-4229605	nn	Нижний Новгород, площадь Минина и Пожарского, 2	83,99 ₽/шт	Sun Jul  7 23:20:00 2024
Печенье-сэндвич Konti Супер-Контик шоколадное, 100г	https://www.perekrestok.ru/cat/197/p/pecene-sendvic-konti-super-kontik-sokoladnoe-100g-3305795	nn	Нижний Новгород, площадь Минина и Пожарского, 2	43,99 ₽/шт	Sun Jul  7 23:20:00 2024
Печенье Любятово Воздушное шоколадное, 200г	https://www.perekrestok.ru/cat/197/p/pecene-lubatovo-vozdusnoe-sokoladnoe-200g-3643999	nn	Нижний Новгород, площадь Минина и Пожарского, 2	129,99 ₽/шт	Sun Jul  7 23:20:00 2024
Печенье Orion Choco Boy с обогащающей добавкой, 100г	https://www.perekrestok.ru/cat/197/p/pecene-orion-choco-boy-s-obogasausej-dobavkoj-100g-3206107	nn	Нижний Новгород, площадь Минина и Пожарского, 2	119,99 ₽/шт	Sun Jul  7 23:20:00 2024
Печенье Orion Сhocoboy Black Currant, 45г	https://www.perekrestok.ru/cat/197/p/pecene-orion-shocoboy-black-currant-45g-4111888	nn	Нижний Новгород, площадь Минина и Пожарского, 2	55,99 ₽/шт	Sun Jul  7 23:20:00 2024
Печенье Коломенское шоколадное, 120г	https://www.perekrestok.ru/cat/197/p/pecene-kolomenskoe-sokoladnoe-120g-4238892	nn	Нижний Новгород, площадь Минина и Пожарского, 2	44,99 ₽/шт	Sun Jul  7 23:20:00 2024
Печенье Хлебный Спас Крендельки шоколадные сдобное, 320г	https://www.perekrestok.ru/cat/197/p/pecene-hlebnyj-spas-krendelki-sokoladnye-sdobnoe-320g-4316285	nn	Нижний Новгород, площадь Минина и Пожарского, 2	184,99 ₽/шт	Sun Jul  7 23:20:00 2024
Печенье Milka Biscuits покрытое молочным шоколадом, 200г	https://www.perekrestok.ru/cat/197/p/pecene-milka-biscuits-pokrytoe-molocnym-sokoladom-200g-3639098	nn	Нижний Новгород, площадь Минина и Пожарского, 2	249,99 ₽/шт	Sun Jul  7 23:20:00 2024
Печенье Milka Biscuits с кусочками молочного шоколада, 168г	https://www.perekrestok.ru/cat/197/p/pecene-milka-biscuits-s-kusockami-molocnogo-sokolada-168g-3639099	nn	Нижний Новгород, площадь Минина и Пожарского, 2	229,99 ₽/шт	Sun Jul  7 23:20:00 2024
Печенье Куки шоколадное без сахара без глютена, 105г	https://www.perekrestok.ru/cat/197/p/pecene-kuki-sokoladnoe-bez-sahara-bez-glutena-105g-4307230	nn	Нижний Новгород, площадь Минина и Пожарского, 2	229,99 ₽/шт	Sun Jul  7 23:20:00 2024
Печенье Лотте Чокопай прослоенное глазированное с ароматом банана, 336г	https://www.perekrestok.ru/cat/197/p/pecene-lotte-cokopaj-prosloennoe-glazirovannoe-s-aromatom-banana-336g-3979814	nn	Нижний Новгород, площадь Минина и Пожарского, 2	219,99 ₽/шт	Sun Jul  7 23:20:00 2024
Печенье-сэндвич Konti Супер-Контик шоколад	https://www.perekrestok.ru/cat/197/p/pecene-sendvic-konti-super-kontik-sokolad-4108472	nn	Нижний Новгород, площадь Минина и Пожарского, 2	389,90 ₽/кг	Sun Jul  7 23:20:00 2024
Маффин Rocky Muffin Двойной шоколад, 55г	https://www.perekrestok.ru/cat/197/p/maffin-rocky-muffin-dvojnoj-sokolad-55g-4107915	nn	Нижний Новгород, площадь Минина и Пожарского, 2	149,99 ₽/шт	Sun Jul  7 23:20:00 2024
Печенье Lotte Choco Pie прослоёное глазированное, 336г	https://www.perekrestok.ru/cat/197/p/pecene-lotte-choco-pie-prosloenoe-glazirovannoe-336g-3003173	nn	Нижний Новгород, площадь Минина и Пожарского, 2	144,99 ₽/шт	Sun Jul  7 23:20:00 2024
Печенье с вишней сдобное Маркет Collection, 137г	https://www.perekrestok.ru/cat/197/p/pecene-s-visnej-sdobnoe-market-collection-137g-4279728	nn	Нижний Новгород, площадь Минина и Пожарского, 2	67,99 ₽/шт	Sun Jul  7 23:20:00 2024
Печенье Апельсин сдобное Маркет Collection, 137г	https://www.perekrestok.ru/cat/197/p/pecene-apelsin-sdobnoe-market-collection-137g-4279726	nn	Нижний Новгород, площадь Минина и Пожарского, 2	67,99 ₽/шт	Sun Jul  7 23:20:00 2024
Печенье клубника сдобное Маркет Collection, 137г	https://www.perekrestok.ru/cat/197/p/pecene-klubnika-sdobnoe-market-collection-137g-4279727	nn	Нижний Новгород, площадь Минина и Пожарского, 2	71,99 ₽/шт	Sun Jul  7 23:20:00 2024
Печенье Oreo с какао и начинкой ваниль, 38г	https://www.perekrestok.ru/cat/197/p/pecene-oreo-s-kakao-i-nacinkoj-vanil-38g-3474312	nn	Нижний Новгород, площадь Минина и Пожарского, 2	52,99 ₽/шт	Sun Jul  7 23:20:00 2024
Печенье Belvita Утреннее злаки-йогуртовая начинка, 253г	https://www.perekrestok.ru/cat/197/p/pecene-belvita-utrennee-zlaki-jogurtovaa-nacinka-253g-3632839	nn	Нижний Новгород, площадь Минина и Пожарского, 2	194,99 ₽/шт	Sun Jul  7 23:20:00 2024
Печенье Кухмастер Американо сдобное с кусочками шоколада, 270г	https://www.perekrestok.ru/cat/197/p/pecene-kuhmaster-amerikano-sdobnoe-s-kusockami-sokolada-270g-3392568	nn	Нижний Новгород, площадь Минина и Пожарского, 2	154,99 ₽/шт	Sun Jul  7 23:20:00 2024
Печенье Orion Choco-Boy Caramel, 45г	https://www.perekrestok.ru/cat/197/p/pecene-orion-choco-boy-caramel-45g-3941481	nn	Нижний Новгород, площадь Минина и Пожарского, 2	63,99 ₽/шт	Sun Jul  7 23:20:00 2024
Палочки Снежка сдобные с малиновым джемом Маркет Collection, 370г	https://www.perekrestok.ru/cat/197/p/palocki-snezka-sdobnye-s-malinovym-dzemom-market-collection-370g-4331915	nn	Нижний Новгород, площадь Минина и Пожарского, 2	174,99 ₽/шт	Sun Jul  7 23:20:00 2024
Печенье Oreo с какао начинкой ваниль, 228г	https://www.perekrestok.ru/cat/197/p/pecene-oreo-s-kakao-nacinkoj-vanil-228g-3474314	nn	Нижний Новгород, площадь Минина и Пожарского, 2	229,99 ₽/шт	Sun Jul  7 23:20:00 2024
Печенье Хлебный Спас Мультизлак овсяное с начинкой из яблока с корицей, 250г	https://www.perekrestok.ru/cat/197/p/pecene-hlebnyj-spas-multizlak-ovsanoe-s-nacinkoj-iz-abloka-s-koricej-250g-4050870	nn	Нижний Новгород, площадь Минина и Пожарского, 2	129,99 ₽/шт	Sun Jul  7 23:20:00 2024
Печенье Orion Choco Boy Сафари затяжное с обогащающей добавкой, 42г	https://www.perekrestok.ru/cat/197/p/pecene-orion-choco-boy-safari-zataznoe-s-obogasausej-dobavkoj-42g-3206172	nn	Нижний Новгород, площадь Минина и Пожарского, 2	57,99 ₽/шт	Sun Jul  7 23:20:00 2024
Печенье Belvita Утреннее злаки-какао-йогуртовая начинка, 253г	https://www.perekrestok.ru/cat/197/p/pecene-belvita-utrennee-zlaki-kakao-jogurtovaa-nacinka-253g-3632899	nn	Нижний Новгород, площадь Минина и Пожарского, 2	194,99 ₽/шт	Sun Jul  7 23:20:00 2024
Десерт Полет слоёный с лимоном, 300г	https://www.perekrestok.ru/cat/197/p/desert-polet-sloenyj-s-limonom-300g-4009451	nn	Нижний Новгород, площадь Минина и Пожарского, 2	169,99 ₽/шт	Sun Jul  7 23:20:00 2024
Печенье Посиделкино сдобное творожное с клюквой, 250г	https://www.perekrestok.ru/cat/197/p/pecene-posidelkino-sdobnoe-tvoroznoe-s-klukvoj-250g-4060258	nn	Нижний Новгород, площадь Минина и Пожарского, 2	79,99 ₽/шт	Sun Jul  7 23:20:00 2024
Печенье Апельсиновый Джем сдобное Маркет Collection, 100г	https://www.perekrestok.ru/cat/197/p/pecene-apelsinovyj-dzem-sdobnoe-market-collection-100g-4318191	nn	Нижний Новгород, площадь Минина и Пожарского, 2	55,99 ₽/шт	Sun Jul  7 23:20:00 2024
Печенье Акконд Трио какао с начинкой со вкусом пломбира, 280г	https://www.perekrestok.ru/cat/197/p/pecene-akkond-trio-kakao-s-nacinkoj-so-vkusom-plombira-280g-4324464	nn	Нижний Новгород, площадь Минина и Пожарского, 2	154,99 ₽/шт	Sun Jul  7 23:20:00 2024
Печенье кокосанка сдобное Bonte Bakery, 270г	https://www.perekrestok.ru/cat/197/p/pecene-kokosanka-sdobnoe-bonte-bakery-270g-3472288	nn	Нижний Новгород, площадь Минина и Пожарского, 2	129,99 ₽/шт	Sun Jul  7 23:20:00 2024
Печенье нежное суфле Bonte Bakery, 240г	https://www.perekrestok.ru/cat/197/p/pecene-neznoe-sufle-bonte-bakery-240g-3479618	nn	Нижний Новгород, площадь Минина и Пожарского, 2	99,99 ₽/шт	Sun Jul  7 23:20:00 2024
Печенье малиновый десерт сдобное Bonte Bakery, 270г	https://www.perekrestok.ru/cat/197/p/pecene-malinovyj-desert-sdobnoe-bonte-bakery-270g-3479617	nn	Нижний Новгород, площадь Минина и Пожарского, 2	104,99 ₽/шт	Sun Jul  7 23:20:00 2024
Печенье Акульчев Купелька с брусникой, 400г	https://www.perekrestok.ru/cat/197/p/pecene-akulcev-kupelka-s-brusnikoj-400g-3650632	nn	Нижний Новгород, площадь Минина и Пожарского, 2	169,99 ₽/шт	Sun Jul  7 23:20:00 2024
Печенье Sporty Солёная карамель обогащенное белком, 40г	https://www.perekrestok.ru/cat/197/p/pecene-sporty-solenaa-karamel-obogasennoe-belkom-40g-4290389	nn	Нижний Новгород, площадь Минина и Пожарского, 2	89,99 ₽/шт	Sun Jul  7 23:20:00 2024
Печенье Oreo с какао и начинкой шоколад, 228г	https://www.perekrestok.ru/cat/197/p/pecene-oreo-s-kakao-i-nacinkoj-sokolad-228g-3640617	nn	Нижний Новгород, площадь Минина и Пожарского, 2	209,99 ₽/шт	Sun Jul  7 23:20:00 2024
Печенье Oreo Original какао-ваниль, 95г	https://www.perekrestok.ru/cat/197/p/pecene-oreo-original-kakao-vanil-95g-3474313	nn	Нижний Новгород, площадь Минина и Пожарского, 2	104,99 ₽/шт	Sun Jul  7 23:20:00 2024
Палочки Снежка сдобные с абрикосовым джемом Маркет Collection, 370г	https://www.perekrestok.ru/cat/197/p/palocki-snezka-sdobnye-s-abrikosovym-dzemom-market-collection-370g-4331935	nn	Нижний Новгород, площадь Минина и Пожарского, 2	164,99 ₽/шт	Sun Jul  7 23:20:00 2024
Печенье-сэндвич Konti Супер-Контик со сгущённым молоком, 100г	https://www.perekrestok.ru/cat/197/p/pecene-sendvic-konti-super-kontik-so-sgusennym-molokom-100g-2119068	nn	Нижний Новгород, площадь Минина и Пожарского, 2	47,99 ₽/шт	Sun Jul  7 23:20:00 2024
Печенье Ванюшкины Сладости Орешки из детства сдобное, 500г	https://www.perekrestok.ru/cat/197/p/pecene-vanuskiny-sladosti-oreski-iz-detstva-sdobnoe-500g-3650597	nn	Нижний Новгород, площадь Минина и Пожарского, 2	229,99 ₽/шт	Sun Jul  7 23:20:00 2024
Печенье Посиделкино Творожное сдобное с цельным изюмом, 250г	https://www.perekrestok.ru/cat/197/p/pecene-posidelkino-tvoroznoe-sdobnoe-s-celnym-izumom-250g-3376015	nn	Нижний Новгород, площадь Минина и Пожарского, 2	79,99 ₽/шт	Sun Jul  7 23:20:00 2024
Печенье Chikalab глазированное Малиновое суфле, 55г	https://www.perekrestok.ru/cat/197/p/pecene-chikalab-glazirovannoe-malinovoe-sufle-55g-4259646	nn	Нижний Новгород, площадь Минина и Пожарского, 2	184,99 ₽/шт	Sun Jul  7 23:20:00 2024
Печенье Пампини Чакилайфф с творожной начинкой, 700г	https://www.perekrestok.ru/cat/197/p/pecene-pampini-cakilajff-s-tvoroznoj-nacinkoj-700g-4295931	nn	Нижний Новгород, площадь Минина и Пожарского, 2	299,99 ₽/шт	Sun Jul  7 23:20:00 2024
Печенье Воздушное Морозко, 400г	https://www.perekrestok.ru/cat/197/p/pecene-vozdusnoe-morozko-400g-4266231	nn	Нижний Новгород, площадь Минина и Пожарского, 2	154,99 ₽/шт	Sun Jul  7 23:20:00 2024
Печенье Chikalab глазированное Сливочное Суфле, 55г	https://www.perekrestok.ru/cat/197/p/pecene-chikalab-glazirovannoe-slivocnoe-sufle-55g-4259645	nn	Нижний Новгород, площадь Минина и Пожарского, 2	134,99 ₽/шт	Sun Jul  7 23:20:00 2024
Печенье Яшкино с клубничным кремом затяжное, 190г	https://www.perekrestok.ru/cat/197/p/pecene-askino-s-klubnicnym-kremom-zataznoe-190g-4179532	nn	Нижний Новгород, площадь Минина и Пожарского, 2	75,99 ₽/шт	Sun Jul  7 23:20:00 2024
Печенье Бискотти с вишнёвым мармеладом, 235г	https://www.perekrestok.ru/cat/197/p/pecene-biskotti-s-visnevym-marmeladom-235g-2131829	nn	Нижний Новгород, площадь Минина и Пожарского, 2	159,99 ₽/шт	Sun Jul  7 23:20:00 2024
Печенье Oreo с какао и начинкой клубника, 228г	https://www.perekrestok.ru/cat/197/p/pecene-oreo-s-kakao-i-nacinkoj-klubnika-228g-4027700	nn	Нижний Новгород, площадь Минина и Пожарского, 2	189,99 ₽/шт	Sun Jul  7 23:20:00 2024
Десерт слоёный Полет Лимоньерки с яблоком и корицей, 500г	https://www.perekrestok.ru/cat/197/p/desert-sloenyj-polet-limonerki-s-ablokom-i-koricej-500g-4052024	nn	Нижний Новгород, площадь Минина и Пожарского, 2	249,99 ₽/шт	Sun Jul  7 23:20:00 2024
Печенье Полёт Лимоньерки с лимоном, 500г	https://www.perekrestok.ru/cat/197/p/pecene-polet-limonerki-s-limonom-500g-3630266	nn	Нижний Новгород, площадь Минина и Пожарского, 2	269,99 ₽/шт	Sun Jul  7 23:20:00 2024
Печенье Oreo с какао и начинкой шоколад, 95г	https://www.perekrestok.ru/cat/197/p/pecene-oreo-s-kakao-i-nacinkoj-sokolad-95g-3640618	nn	Нижний Новгород, площадь Минина и Пожарского, 2	95,99 ₽/шт	Sun Jul  7 23:20:00 2024
Печенье OREO с какао и начинкой со вкусом клубники, 95г	https://www.perekrestok.ru/cat/197/p/pecene-oreo-s-kakao-i-nacinkoj-so-vkusom-klubniki-95g-4032483	nn	Нижний Новгород, площадь Минина и Пожарского, 2	97,99 ₽/шт	Sun Jul  7 23:20:00 2024
Печенье Курабье любимое	https://www.perekrestok.ru/cat/196/p/pecene-kurabe-lubimoe-3035353	nn	Нижний Новгород, площадь Минина и Пожарского, 2	499,90 ₽/кг	Sun Jul  7 23:20:00 2024
Десерт Полет слоёный яблоко с корицей, 300г	https://www.perekrestok.ru/cat/197/p/desert-polet-sloenyj-abloko-s-koricej-300g-4009452	nn	Нижний Новгород, площадь Минина и Пожарского, 2	169,99 ₽/шт	Sun Jul  7 23:20:00 2024
Печенье Ванюшкины Сладости клубника	https://www.perekrestok.ru/cat/197/p/pecene-vanuskiny-sladosti-klubnika-4099953	nn	Нижний Новгород, площадь Минина и Пожарского, 2	369,99 ₽/кг	Sun Jul  7 23:20:00 2024
Печенье-сэндвич Konti Супер-Контик marshmallow сливки, 288г	https://www.perekrestok.ru/cat/197/p/pecene-sendvic-konti-super-kontik-marshmallow-slivki-288g-4102075	nn	Нижний Новгород, площадь Минина и Пожарского, 2	249,99 ₽/шт	Sun Jul  7 23:20:00 2024
