name	url	locale	address	price	time
Печенье Любятово Постное затяжное, 300г	https://www.perekrestok.ru/cat/197/p/pecene-lubatovo-postnoe-zataznoe-300g-3488053	spb	Санкт-Петербург, Биржевая площадь, 4	104,99 ₽/шт	Sun Jul  7 23:20:00 2024
Печенье Любятово Мария традиционное затяжное, 156г	https://www.perekrestok.ru/cat/197/p/pecene-lubatovo-maria-tradicionnoe-zataznoe-156g-4122161	spb	Санкт-Петербург, Биржевая площадь, 4	61,99 ₽/шт	Sun Jul  7 23:20:00 2024
Печенье Кременкульское Сливочное затяжное, 180г	https://www.perekrestok.ru/cat/197/p/pecene-kremenkulskoe-slivocnoe-zataznoe-180g-3670173	spb	Санкт-Петербург, Биржевая площадь, 4	39,99 ₽/шт	Sun Jul  7 23:20:00 2024
Печенье Belvita Утреннее витаминизированное со злаковыми хлопьями, 225г	https://www.perekrestok.ru/cat/197/p/pecene-belvita-utrennee-vitaminizirovannoe-so-zlakovymi-hlopami-225g-3632838	spb	Санкт-Петербург, Биржевая площадь, 4	139,99 ₽/шт	Sun Jul  7 23:20:00 2024
Печенье Belvita Утреннее витаминизированное фундук-мёд, 225г	https://www.perekrestok.ru/cat/197/p/pecene-belvita-utrennee-vitaminizirovannoe-funduk-med-225g-3632837	spb	Санкт-Петербург, Биржевая площадь, 4	139,99 ₽/шт	Sun Jul  7 23:20:00 2024
Печенье Любятово Мюсли злаковое с клюквой и изюмом, 120г	https://www.perekrestok.ru/cat/197/p/pecene-lubatovo-musli-zlakovoe-s-klukvoj-i-izumom-120g-3646780	spb	Санкт-Петербург, Биржевая площадь, 4	134,99 ₽/шт	Sun Jul  7 23:20:00 2024
Печенье Юбилейное витаминизированное с овсяными хлопьями, 224г	https://www.perekrestok.ru/cat/197/p/pecene-ubilejnoe-vitaminizirovannoe-s-ovsanymi-hlopami-224g-4339373	spb	Санкт-Петербург, Биржевая площадь, 4	65,99 ₽/шт	Sun Jul  7 23:20:00 2024
Печенье Сладень Ягодное, 200г	https://www.perekrestok.ru/cat/197/p/pecene-sladen-agodnoe-200g-4196905	spb	Санкт-Петербург, Биржевая площадь, 4	309,99 ₽/шт	Sun Jul  7 23:20:00 2024
Печенье Таруска Шортбред с клюквой с орехом, 175г	https://www.perekrestok.ru/cat/197/p/pecene-taruska-sortbred-s-klukvoj-s-orehom-175g-4309252	spb	Санкт-Петербург, Биржевая площадь, 4	449,99 ₽/шт	Sun Jul  7 23:20:00 2024
Печенье Missis Pickez мюсли-ореховое, 100г	https://www.perekrestok.ru/cat/197/p/pecene-missis-pickez-musli-orehovoe-100g-4345395	spb	Санкт-Петербург, Биржевая площадь, 4	154,99 ₽/шт	Sun Jul  7 23:20:00 2024
Печенье Любятово Домашнее с шоколадом сдобное, 156г	https://www.perekrestok.ru/cat/197/p/pecene-lubatovo-domasnee-s-sokoladom-sdobnoe-156g-4258739	spb	Санкт-Петербург, Биржевая площадь, 4	99,99 ₽/шт	Sun Jul  7 23:20:00 2024
Печенье Любятово Ванильные Кольца с Глазурью сдобное, 190г	https://www.perekrestok.ru/cat/197/p/pecene-lubatovo-vanilnye-kolca-s-glazuru-sdobnoe-190g-4309666	spb	Санкт-Петербург, Биржевая площадь, 4	99,99 ₽/шт	Sun Jul  7 23:20:00 2024
Печенье Курабье с яблочным повидлом сдобное Маркет, 300г	https://www.perekrestok.ru/cat/197/p/pecene-kurabe-s-ablocnym-povidlom-sdobnoe-market-300g-4286917	spb	Санкт-Петербург, Биржевая площадь, 4	124,99 ₽/шт	Sun Jul  7 23:20:00 2024
Печенье Кухмастер Золотая симфония, 230г	https://www.perekrestok.ru/cat/197/p/pecene-kuhmaster-zolotaa-simfonia-230g-3358756	spb	Санкт-Петербург, Биржевая площадь, 4	109,99 ₽/шт	Sun Jul  7 23:20:00 2024
Печенье Любятово сдобное лимон и мята, 200г	https://www.perekrestok.ru/cat/197/p/pecene-lubatovo-sdobnoe-limon-i-mata-200g-4122159	spb	Санкт-Петербург, Биржевая площадь, 4	114,99 ₽/шт	Sun Jul  7 23:20:00 2024
Печенье Диетика Чайное сдобное безглютеновое, 200г	https://www.perekrestok.ru/cat/197/p/pecene-dietika-cajnoe-sdobnoe-bezglutenovoe-200g-4017839	spb	Санкт-Петербург, Биржевая площадь, 4	199,99 ₽/шт	Sun Jul  7 23:20:00 2024
Печенье Merrybell Collection имбирное сдобное на кокосовом масле, 120г	https://www.perekrestok.ru/cat/197/p/pecene-merrybell-collection-imbirnoe-sdobnoe-na-kokosovom-masle-120g-4305910	spb	Санкт-Петербург, Биржевая площадь, 4	69,99 ₽/шт	Sun Jul  7 23:20:00 2024
Печенье Любятово Шоколадное с нежной глазурью сдобное, 197г	https://www.perekrestok.ru/cat/197/p/pecene-lubatovo-sokoladnoe-s-neznoj-glazuru-sdobnoe-197g-4287533	spb	Санкт-Петербург, Биржевая площадь, 4	99,99 ₽/шт	Sun Jul  7 23:20:00 2024
Печенье сдобное Хлебный Спас с овсяными отрубями и злаками, 240г	https://www.perekrestok.ru/cat/197/p/pecene-sdobnoe-hlebnyj-spas-s-ovsanymi-otrubami-i-zlakami-240g-4249421	spb	Санкт-Петербург, Биржевая площадь, 4	99,99 ₽/шт	Sun Jul  7 23:20:00 2024
Печенье Песочное Оригинальное Зелёная Линия, 100г	https://www.perekrestok.ru/cat/197/p/pecene-pesocnoe-originalnoe-zelenaa-linia-100g-4317447	spb	Санкт-Петербург, Биржевая площадь, 4	184,99 ₽/шт	Sun Jul  7 23:20:00 2024
Печенье Песочное с какао и арахисом Зелёная Линия, 100г	https://www.perekrestok.ru/cat/197/p/pecene-pesocnoe-s-kakao-i-arahisom-zelenaa-linia-100g-4317448	spb	Санкт-Петербург, Биржевая площадь, 4	184,99 ₽/шт	Sun Jul  7 23:20:00 2024
Печенье Lakizlaki с клюквой и курагой, 150г	https://www.perekrestok.ru/cat/197/p/pecene-lakizlaki-s-klukvoj-i-kuragoj-150g-4328536	spb	Санкт-Петербург, Биржевая площадь, 4	84,99 ₽/шт	Sun Jul  7 23:20:00 2024
Печенье Север-Метрополь Фисташковое хрустящее, 200г	https://www.perekrestok.ru/cat/197/p/pecene-sever-metropol-fistaskovoe-hrustasee-200g-4056773	spb	Санкт-Петербург, Биржевая площадь, 4	339,99 ₽/шт	Sun Jul  7 23:20:00 2024
Печенье Север-Метрополь Миндальное, 200г	https://www.perekrestok.ru/cat/197/p/pecene-sever-metropol-mindalnoe-200g-4056768	spb	Санкт-Петербург, Биржевая площадь, 4	319,99 ₽/шт	Sun Jul  7 23:20:00 2024
Печенье Таруска Звезды Утренние, 175г	https://www.perekrestok.ru/cat/197/p/pecene-taruska-zvezdy-utrennie-175g-4309253	spb	Санкт-Петербург, Биржевая площадь, 4	329,99 ₽/шт	Sun Jul  7 23:20:00 2024
Слоёное Сердечко с сахаром Маркет, 200г	https://www.perekrestok.ru/cat/197/p/sloenoe-serdecko-s-saharom-market-200g-4249428	spb	Санкт-Петербург, Биржевая площадь, 4	174,99 ₽/шт	Sun Jul  7 23:20:00 2024
Слоёное Сердечко с корицей Маркет, 200г	https://www.perekrestok.ru/cat/197/p/sloenoe-serdecko-s-koricej-market-200g-4249424	spb	Санкт-Петербург, Биржевая площадь, 4	169,99 ₽/шт	Sun Jul  7 23:20:00 2024
Палочки слоёные с семенами подсолнечника Маркет, 200г	https://www.perekrestok.ru/cat/197/p/palocki-sloenye-s-semenami-podsolnecnika-market-200g-4249425	spb	Санкт-Петербург, Биржевая площадь, 4	144,99 ₽/шт	Sun Jul  7 23:20:00 2024
Печенье Заряшки слоёное сахарные, 240г	https://www.perekrestok.ru/cat/197/p/pecene-zaraski-sloenoe-saharnye-240g-3178577	spb	Санкт-Петербург, Биржевая площадь, 4	159,99 ₽/шт	Sun Jul  7 23:20:00 2024
Вафли Plazma Коцка с кокосовой начинкой покрытые белым шоколадом и кусочками печенья, 130г	https://www.perekrestok.ru/cat/197/p/vafli-plazma-kocka-s-kokosovoj-nacinkoj-pokrytye-belym-sokoladom-i-kusockami-pecena-130g-4333146	spb	Санкт-Петербург, Биржевая площадь, 4	199,99 ₽/шт	Sun Jul  7 23:20:00 2024
Печенье Plazma Стикси покрытое молочным шоколадом и кусочками печенья, 125г	https://www.perekrestok.ru/cat/197/p/pecene-plazma-stiksi-pokrytoe-molocnym-sokoladom-i-kusockami-pecena-125g-4333147	spb	Санкт-Петербург, Биржевая площадь, 4	199,99 ₽/шт	Sun Jul  7 23:20:00 2024
Печенье Куки без сахара, 105г	https://www.perekrestok.ru/cat/197/p/pecene-kuki-bez-sahara-105g-4306873	spb	Санкт-Петербург, Биржевая площадь, 4	249,99 ₽/шт	Sun Jul  7 23:20:00 2024
Печенье Plazma с кунжутом и морской солью обогащенное витаминами, 140г	https://www.perekrestok.ru/cat/197/p/pecene-plazma-s-kunzutom-i-morskoj-solu-obogasennoe-vitaminami-140g-4333148	spb	Санкт-Петербург, Биржевая площадь, 4	129,99 ₽/шт	Sun Jul  7 23:20:00 2024
Печенье Корпорация Удачи песочное, 35г	https://www.perekrestok.ru/cat/197/p/pecene-korporacia-udaci-pesocnoe-35g-3472592	spb	Санкт-Петербург, Биржевая площадь, 4	499,99 ₽/шт	Sun Jul  7 23:20:00 2024
Вафли глазированные Ваффин из Полбы Финик в горьком шоколаде без сахара, 50г	https://www.perekrestok.ru/cat/197/p/vafli-glazirovannye-vaffin-iz-polby-finik-v-gorkom-sokolade-bez-sahara-50g-4286090	spb	Санкт-Петербург, Биржевая площадь, 4	109,99 ₽/шт	Sun Jul  7 23:20:00 2024
Вафли Вастэко Ваффин из полбы Абрикос в горьком шоколаде без сахара глазированные, 50г	https://www.perekrestok.ru/cat/197/p/vafli-vasteko-vaffin-iz-polby-abrikos-v-gorkom-sokolade-bez-sahara-glazirovannye-50g-4286088	spb	Санкт-Петербург, Биржевая площадь, 4	109,99 ₽/шт	Sun Jul  7 23:20:00 2024
Вафли Вастэко Ваффин из полбы Абрикос в молочном шоколаде без сахара глазированные, 50г	https://www.perekrestok.ru/cat/197/p/vafli-vasteko-vaffin-iz-polby-abrikos-v-molocnom-sokolade-bez-sahara-glazirovannye-50g-4286087	spb	Санкт-Петербург, Биржевая площадь, 4	109,99 ₽/шт	Sun Jul  7 23:20:00 2024
Печенье Корпорация Удачи песочное с предсказанием, 35г	https://www.perekrestok.ru/cat/197/p/pecene-korporacia-udaci-pesocnoe-s-predskazaniem-35g-4331017	spb	Санкт-Петербург, Биржевая площадь, 4	449,99 ₽/шт	Sun Jul  7 23:20:00 2024
Вафли Вастэко Ваффин из Полбы Финик в молочном шоколаде без сахара глазированный, 50г	https://www.perekrestok.ru/cat/197/p/vafli-vasteko-vaffin-iz-polby-finik-v-molocnom-sokolade-bez-sahara-glazirovannyj-50g-4286089	spb	Санкт-Петербург, Биржевая площадь, 4	109,99 ₽/шт	Sun Jul  7 23:20:00 2024
Печенье Любятово сахарное с карамелью покрытое молочным шоколадом, 50г	https://www.perekrestok.ru/cat/197/p/pecene-lubatovo-saharnoe-s-karamelu-pokrytoe-molocnym-sokoladom-50g-4347522	ekb	Екатеринбург, ул. Бориса Ельцина, 3	34,99 ₽/шт	Sun Jul  7 23:20:00 2024
Печенье Любятово сахарное с карамелью со вкусом апельсина покрытое молочным шоколадом, 50г	https://www.perekrestok.ru/cat/197/p/pecene-lubatovo-saharnoe-s-karamelu-so-vkusom-apelsina-pokrytoe-molocnym-sokoladom-50g-4347186	ekb	Екатеринбург, ул. Бориса Ельцина, 3	34,99 ₽/шт	Sun Jul  7 23:20:00 2024
Печенье Воздушные колечки заварное Зелёная Линия, 100г	https://www.perekrestok.ru/cat/197/p/pecene-vozdusnye-kolecki-zavarnoe-zelenaa-linia-100g-4113179	ekb	Екатеринбург, ул. Бориса Ельцина, 3	65,99 ₽/шт	Sun Jul  7 23:20:00 2024
Печенье Юбилейное Молочное, 112г	https://www.perekrestok.ru/cat/197/p/pecene-ubilejnoe-molocnoe-112g-3472178	ekb	Екатеринбург, ул. Бориса Ельцина, 3	34,99 ₽/шт	Sun Jul  7 23:20:00 2024
Печенье Юбилейное молочное витаминизированное с глазурью, 232г	https://www.perekrestok.ru/cat/197/p/pecene-ubilejnoe-molocnoe-vitaminizirovannoe-s-glazuru-232g-4027701	ekb	Екатеринбург, ул. Бориса Ельцина, 3	139,99 ₽/шт	Sun Jul  7 23:20:00 2024
Печенье Дарушка сахарное Зелёная Линия, 200г	https://www.perekrestok.ru/cat/197/p/pecene-daruska-saharnoe-zelenaa-linia-200g-4321922	ekb	Екатеринбург, ул. Бориса Ельцина, 3	54,99 ₽/шт	Sun Jul  7 23:20:00 2024
Савоярди La Mole Lady Fingers с яйцами, 200г	https://www.perekrestok.ru/cat/197/p/savoardi-la-mole-lady-fingers-s-ajcami-200g-4139632	ekb	Екатеринбург, ул. Бориса Ельцина, 3	174,99 ₽/шт	Sun Jul  7 23:20:00 2024
Печенье Коломенское Классическое сахарное, 240г	https://www.perekrestok.ru/cat/197/p/pecene-kolomenskoe-klassiceskoe-saharnoe-240g-4195081	ekb	Екатеринбург, ул. Бориса Ельцина, 3	109,99 ₽/шт	Sun Jul  7 23:20:00 2024
Печенье Любятово топленое молоко сахарное, 267г	https://www.perekrestok.ru/cat/197/p/pecene-lubatovo-toplenoe-moloko-saharnoe-267g-4229604	ekb	Екатеринбург, ул. Бориса Ельцина, 3	73,99 ₽/шт	Sun Jul  7 23:20:00 2024
Печенье Акульчев Вафельное сахарное рассыпчатое, 225г	https://www.perekrestok.ru/cat/197/p/pecene-akulcev-vafelnoe-saharnoe-rassypcatoe-225g-3249842	ekb	Екатеринбург, ул. Бориса Ельцина, 3	99,99 ₽/шт	Sun Jul  7 23:20:00 2024
Печенье Юбилейное Традиционное витаминизированное, 403г	https://www.perekrestok.ru/cat/197/p/pecene-ubilejnoe-tradicionnoe-vitaminizirovannoe-403g-4193898	ekb	Екатеринбург, ул. Бориса Ельцина, 3	149,99 ₽/шт	Sun Jul  7 23:20:00 2024
Печенье Хлебный Спас Крендельки маковые с сахаром сдобные, 320г	https://www.perekrestok.ru/cat/197/p/pecene-hlebnyj-spas-krendelki-makovye-s-saharom-sdobnye-320g-4296300	ekb	Екатеринбург, ул. Бориса Ельцина, 3	169,99 ₽/шт	Sun Jul  7 23:20:00 2024
Печенье Юбилейное молочное витаминизированное с глазурью, 116г	https://www.perekrestok.ru/cat/197/p/pecene-ubilejnoe-molocnoe-vitaminizirovannoe-s-glazuru-116g-3472180	ekb	Екатеринбург, ул. Бориса Ельцина, 3	77,99 ₽/шт	Sun Jul  7 23:20:00 2024
Печенье Юбилейное Традиционное витаминизированное, 268г	https://www.perekrestok.ru/cat/197/p/pecene-ubilejnoe-tradicionnoe-vitaminizirovannoe-268g-4193133	ekb	Екатеринбург, ул. Бориса Ельцина, 3	93,99 ₽/шт	Sun Jul  7 23:20:00 2024
Печенье Юбилейное витаминизированное со светлой глазурью, 121г	https://www.perekrestok.ru/cat/197/p/pecene-ubilejnoe-vitaminizirovannoe-so-svetloj-glazuru-121g-4078076	ekb	Екатеринбург, ул. Бориса Ельцина, 3	73,99 ₽/шт	Sun Jul  7 23:20:00 2024
Печенье Чайное сахарное Пр!ст, 300г	https://www.perekrestok.ru/cat/197/p/pecene-cajnoe-saharnoe-pr-st-300g-4152128	ekb	Екатеринбург, ул. Бориса Ельцина, 3	49,99 ₽/шт	Sun Jul  7 23:20:00 2024
Печенье Юбилейное витаминизированное с глазурью, 116г	https://www.perekrestok.ru/cat/197/p/pecene-ubilejnoe-vitaminizirovannoe-s-glazuru-116g-3471168	ekb	Екатеринбург, ул. Бориса Ельцина, 3	77,99 ₽/шт	Sun Jul  7 23:20:00 2024
Печенье Сладкая Слобода Деревенское к кофе сахарное детское, 355г	https://www.perekrestok.ru/cat/197/p/pecene-sladkaa-sloboda-derevenskoe-k-kofe-saharnoe-detskoe-355g-4167059	ekb	Екатеринбург, ул. Бориса Ельцина, 3	114,99 ₽/шт	Sun Jul  7 23:20:00 2024
Печенье Любятово Топлёное молоко сахарное	https://www.perekrestok.ru/cat/197/p/pecene-lubatovo-toplenoe-moloko-saharnoe-78002648	ekb	Екатеринбург, ул. Бориса Ельцина, 3	239,99 ₽/кг	Sun Jul  7 23:20:00 2024
Печенье Юбилейное витаминизированное с глазурью, 232г	https://www.perekrestok.ru/cat/197/p/pecene-ubilejnoe-vitaminizirovannoe-s-glazuru-232g-4027703	ekb	Екатеринбург, ул. Бориса Ельцина, 3	119,99 ₽/шт	Sun Jul  7 23:20:00 2024
Печенье злаковое сахарное Зелёная Линия, 280г	https://www.perekrestok.ru/cat/197/p/pecene-zlakovoe-saharnoe-zelenaa-linia-280g-4321928	ekb	Екатеринбург, ул. Бориса Ельцина, 3	99,99 ₽/шт	Sun Jul  7 23:20:00 2024
Печенье Stivado Я играю сахарное, 280г	https://www.perekrestok.ru/cat/197/p/pecene-stivado-a-igrau-saharnoe-280g-4087481	ekb	Екатеринбург, ул. Бориса Ельцина, 3	69,99 ₽/шт	Sun Jul  7 23:20:00 2024
Печенье Юбилейное ореховое витаминизированное с глазурью, 116г	https://www.perekrestok.ru/cat/197/p/pecene-ubilejnoe-orehovoe-vitaminizirovannoe-s-glazuru-116g-3471169	ekb	Екатеринбург, ул. Бориса Ельцина, 3	77,99 ₽/шт	Sun Jul  7 23:20:00 2024
Печенье St Michel Традиционное сливочное, 130г	https://www.perekrestok.ru/cat/197/p/pecene-st-michel-tradicionnoe-slivocnoe-130g-3502594	ekb	Екатеринбург, ул. Бориса Ельцина, 3	199,99 ₽/шт	Sun Jul  7 23:20:00 2024
Печенье Юбилейное Традиционное витаминизированное, 134г	https://www.perekrestok.ru/cat/197/p/pecene-ubilejnoe-tradicionnoe-vitaminizirovannoe-134g-3471174	ekb	Екатеринбург, ул. Бориса Ельцина, 3	44,99 ₽/шт	Sun Jul  7 23:20:00 2024
Печенье Юбилейное с овсяными хлопьями витаминизированное, 268г	https://www.perekrestok.ru/cat/197/p/pecene-ubilejnoe-s-ovsanymi-hlopami-vitaminizirovannoe-268g-4193136	ekb	Екатеринбург, ул. Бориса Ельцина, 3	99,99 ₽/шт	Sun Jul  7 23:20:00 2024
Печенье Kellogg's Dinosaurs сахарное в молочной глазури, 127г	https://www.perekrestok.ru/cat/197/p/pecene-kelloggs-dinosaurs-saharnoe-v-molocnoj-glazuri-127g-4047957	ekb	Екатеринбург, ул. Бориса Ельцина, 3	134,99 ₽/шт	Sun Jul  7 23:20:00 2024
Печенье Сладкая Слобода Деревенское Варёнка сахарное, 310г	https://www.perekrestok.ru/cat/197/p/pecene-sladkaa-sloboda-derevenskoe-varenka-saharnoe-310g-4039904	ekb	Екатеринбург, ул. Бориса Ельцина, 3	94,99 ₽/шт	Sun Jul  7 23:20:00 2024
Печенье Юбилейное Постное, 268г	https://www.perekrestok.ru/cat/197/p/pecene-ubilejnoe-postnoe-268g-4193140	ekb	Екатеринбург, ул. Бориса Ельцина, 3	119,99 ₽/шт	Sun Jul  7 23:20:00 2024
Печенье Kellogg's Unicorn клубника клубничное сахарное в глазури, 105г	https://www.perekrestok.ru/cat/197/p/pecene-kelloggs-unicorn-klubnika-klubnicnoe-saharnoe-v-glazuri-105g-4069074	ekb	Екатеринбург, ул. Бориса Ельцина, 3	134,99 ₽/шт	Sun Jul  7 23:20:00 2024
Печенье La Mole Amaretti, 200г	https://www.perekrestok.ru/cat/197/p/pecene-la-mole-amaretti-200g-4273378	ekb	Екатеринбург, ул. Бориса Ельцина, 3	269,99 ₽/шт	Sun Jul  7 23:20:00 2024
Печенье Русские Пряники Роб Рой сахарное, 450г	https://www.perekrestok.ru/cat/197/p/pecene-russkie-praniki-rob-roj-saharnoe-450g-4058297	ekb	Екатеринбург, ул. Бориса Ельцина, 3	229,99 ₽/шт	Sun Jul  7 23:20:00 2024
Печенье Мастер Сладостей Фестивальное сахарное, 400г	https://www.perekrestok.ru/cat/197/p/pecene-master-sladostej-festivalnoe-saharnoe-400g-4264788	ekb	Екатеринбург, ул. Бориса Ельцина, 3	119,99 ₽/шт	Sun Jul  7 23:20:00 2024
Печенье Русские Пряники Паутинка в шоколадной глазури сахарное, 370г	https://www.perekrestok.ru/cat/197/p/pecene-russkie-praniki-pautinka-v-sokoladnoj-glazuri-saharnoe-370g-4000272	ekb	Екатеринбург, ул. Бориса Ельцина, 3	159,99 ₽/шт	Sun Jul  7 23:20:00 2024
Галеты Любятово Классические, 185г	https://www.perekrestok.ru/cat/197/p/galety-lubatovo-klassiceskie-185g-2149718	ekb	Екатеринбург, ул. Бориса Ельцина, 3	71,99 ₽/шт	Sun Jul  7 23:20:00 2024
Крекер Tuc Cheezzz с сыром, 100г	https://www.perekrestok.ru/cat/197/p/kreker-tuc-cheezzz-s-syrom-100g-3329548	ekb	Екатеринбург, ул. Бориса Ельцина, 3	79,99 ₽/шт	Sun Jul  7 23:20:00 2024
Крекер Tuc со сметаной и луком, 100г	https://www.perekrestok.ru/cat/197/p/kreker-tuc-so-smetanoj-i-lukom-100g-3400349	ekb	Екатеринбург, ул. Бориса Ельцина, 3	79,99 ₽/шт	Sun Jul  7 23:20:00 2024
Крекер Яшкино Французский хрустящий с кунжутом, 185г	https://www.perekrestok.ru/cat/197/p/kreker-askino-francuzskij-hrustasij-s-kunzutom-185g-3222305	ekb	Екатеринбург, ул. Бориса Ельцина, 3	59,99 ₽/шт	Sun Jul  7 23:20:00 2024
Крекер Яшкино Классический, 180г	https://www.perekrestok.ru/cat/197/p/kreker-askino-klassiceskij-180g-3632221	ekb	Екатеринбург, ул. Бориса Ельцина, 3	57,99 ₽/шт	Sun Jul  7 23:20:00 2024
Крекер Рыбки Пр!ст, 200г	https://www.perekrestok.ru/cat/197/p/kreker-rybki-pr-st-200g-4050547	ekb	Екатеринбург, ул. Бориса Ельцина, 3	31,99 ₽/шт	Sun Jul  7 23:20:00 2024
Крекер Tuc Original с солью, 100г	https://www.perekrestok.ru/cat/197/p/kreker-tuc-original-s-solu-100g-3329546	ekb	Екатеринбург, ул. Бориса Ельцина, 3	81,99 ₽/шт	Sun Jul  7 23:20:00 2024
Крекер Рыбки с луком Пр!ст, 200г	https://www.perekrestok.ru/cat/197/p/kreker-rybki-s-lukom-pr-st-200g-4050548	ekb	Екатеринбург, ул. Бориса Ельцина, 3	39,99 ₽/шт	Sun Jul  7 23:20:00 2024
Крекер Tuc со вкусом пиццы, 100г	https://www.perekrestok.ru/cat/197/p/kreker-tuc-so-vkusom-piccy-100g-3490862	ekb	Екатеринбург, ул. Бориса Ельцина, 3	79,99 ₽/шт	Sun Jul  7 23:20:00 2024
Крекер Любятово Янтарный с сыром, 204г	https://www.perekrestok.ru/cat/197/p/kreker-lubatovo-antarnyj-s-syrom-204g-4122153	ekb	Екатеринбург, ул. Бориса Ельцина, 3	59,99 ₽/шт	Sun Jul  7 23:20:00 2024
Крекер Любятово Янтарный с солью, 204г	https://www.perekrestok.ru/cat/197/p/kreker-lubatovo-antarnyj-s-solu-204g-4122152	ekb	Екатеринбург, ул. Бориса Ельцина, 3	59,99 ₽/шт	Sun Jul  7 23:20:00 2024
Крекер Tuc со вкусом краба, 100г	https://www.perekrestok.ru/cat/197/p/kreker-tuc-so-vkusom-kraba-100g-4024592	ekb	Екатеринбург, ул. Бориса Ельцина, 3	93,99 ₽/шт	Sun Jul  7 23:20:00 2024
Крекер Tuc копчёные колбаски, 100г	https://www.perekrestok.ru/cat/197/p/kreker-tuc-kopcenye-kolbaski-100g-3622961	ekb	Екатеринбург, ул. Бориса Ельцина, 3	79,99 ₽/шт	Sun Jul  7 23:20:00 2024
Крекер Смайл с солью Пр!ст, 200г	https://www.perekrestok.ru/cat/197/p/kreker-smajl-s-solu-pr-st-200g-4050551	ekb	Екатеринбург, ул. Бориса Ельцина, 3	39,99 ₽/шт	Sun Jul  7 23:20:00 2024
