name	url	locale	address	price	time
Шпроты Вкусные Консервы в масле, 175г	https://www.perekrestok.ru/cat/812/p/sproty-vkusnye-konservy-v-masle-175g-3469704	spb	Санкт-Петербург, Биржевая площадь, 4	169,99 ₽/шт	Sun Jul  7 23:20:00 2024
Килька Барс балтийская неразделанная копчёная в томатном соусе, 250г	https://www.perekrestok.ru/cat/812/p/kilka-bars-baltijskaa-nerazdelannaa-kopcenaa-v-tomatnom-souse-250g-4047699	spb	Санкт-Петербург, Биржевая площадь, 4	104,99 ₽/шт	Sun Jul  7 23:20:00 2024
Килька балтийская Вкусные Консервы обжаренная в остром томатном соусе с халапеньо, 240г	https://www.perekrestok.ru/cat/75/p/kilka-baltijskaa-vkusnye-konservy-obzarennaa-v-ostrom-tomatnom-souse-s-halapeno-240g-4123409	spb	Санкт-Петербург, Биржевая площадь, 4	97,99 ₽/шт	Sun Jul  7 23:20:00 2024
Скумбрия Доброфлот дальневосточная натуральная в масле, 245г	https://www.perekrestok.ru/cat/812/p/skumbria-dobroflot-dalnevostocnaa-naturalnaa-v-masle-245g-3507133	spb	Санкт-Петербург, Биржевая площадь, 4	179,99 ₽/шт	Sun Jul  7 23:20:00 2024
Скумбрия Сохраним Традиции атлантическая с томатным соусом и овощным гарниром По-Болгарски, 240г	https://www.perekrestok.ru/cat/75/p/skumbria-sohranim-tradicii-atlanticeskaa-s-tomatnym-sousom-i-ovosnym-garnirom-po-bolgarski-240g-4244103	spb	Санкт-Петербург, Биржевая площадь, 4	129,99 ₽/шт	Sun Jul  7 23:20:00 2024
Скумбрия атлантическая натуральная с добавлением масла куски Маркет, 240г	https://www.perekrestok.ru/cat/75/p/skumbria-atlanticeskaa-naturalnaa-s-dobavleniem-masla-kuski-market-240g-4323677	spb	Санкт-Петербург, Биржевая площадь, 4	144,99 ₽/шт	Sun Jul  7 23:20:00 2024
Скумбрия Рыбное Меню атлантическая в томатном соусе, 250г	https://www.perekrestok.ru/cat/75/p/skumbria-rybnoe-menu-atlanticeskaa-v-tomatnom-souse-250g-4289096	spb	Санкт-Петербург, Биржевая площадь, 4	114,99 ₽/шт	Sun Jul  7 23:20:00 2024
Скумбрия атлантическая натуральная в масле Новый Океан, 240г	https://www.perekrestok.ru/cat/812/p/skumbria-atlanticeskaa-naturalnaa-v-masle-novyj-okean-240g-3477329	spb	Санкт-Петербург, Биржевая площадь, 4	119,99 ₽/шт	Sun Jul  7 23:20:00 2024
Горбуша 5 Морей натуральная, 250г	https://www.perekrestok.ru/cat/812/p/gorbusa-5-morej-naturalnaa-250g-87726	spb	Санкт-Петербург, Биржевая площадь, 4	209,99 ₽/шт	Sun Jul  7 23:20:00 2024
Горбуша Курильский Берег натуральная, 250г	https://www.perekrestok.ru/cat/812/p/gorbusa-kurilskij-bereg-naturalnaa-250g-3900135	spb	Санкт-Петербург, Биржевая площадь, 4	184,99 ₽/шт	Sun Jul  7 23:20:00 2024
Горбуша натуральная, 245г	https://www.perekrestok.ru/cat/812/p/gorbusa-naturalnaa-245g-46230	spb	Санкт-Петербург, Биржевая площадь, 4	154,99 ₽/шт	Sun Jul  7 23:20:00 2024
Горбуша натуральная Пр!ст, 250г	https://www.perekrestok.ru/cat/812/p/gorbusa-naturalnaa-pr-st-250g-3653861	spb	Санкт-Петербург, Биржевая площадь, 4	129,99 ₽/шт	Sun Jul  7 23:20:00 2024
Шпроты За Родину тушки из балтийской кильки в масле, 270г	https://www.perekrestok.ru/cat/812/p/sproty-za-rodinu-tuski-iz-baltijskoj-kilki-v-masle-270g-3962298	spb	Санкт-Петербург, Биржевая площадь, 4	189,99 ₽/шт	Sun Jul  7 23:20:00 2024
Шпроты Барс из балтийской кильки в масле, 175г	https://www.perekrestok.ru/cat/812/p/sproty-bars-iz-baltijskoj-kilki-v-masle-175g-3633223	spb	Санкт-Петербург, Биржевая площадь, 4	174,99 ₽/шт	Sun Jul  7 23:20:00 2024
Шпроты Вкусные Консервы в масле, 240г	https://www.perekrestok.ru/cat/812/p/sproty-vkusnye-konservy-v-masle-240g-3468682	spb	Санкт-Петербург, Биржевая площадь, 4	179,99 ₽/шт	Sun Jul  7 23:20:00 2024
Шпроты Вкусные Консервы в масле, 160г	https://www.perekrestok.ru/cat/812/p/sproty-vkusnye-konservy-v-masle-160g-3475329	spb	Санкт-Петербург, Биржевая площадь, 4	144,99 ₽/шт	Sun Jul  7 23:20:00 2024
Шпроты За Родину из балтийской кильки в масле, 160г	https://www.perekrestok.ru/cat/812/p/sproty-za-rodinu-iz-baltijskoj-kilki-v-masle-160g-3503292	spb	Санкт-Петербург, Биржевая площадь, 4	109,99 ₽/шт	Sun Jul  7 23:20:00 2024
Шпроты Капитан Вкусов в масле из балтийской кильки, 250г	https://www.perekrestok.ru/cat/75/p/sproty-kapitan-vkusov-v-masle-iz-baltijskoj-kilki-250g-3654699	spb	Санкт-Петербург, Биржевая площадь, 4	179,99 ₽/шт	Sun Jul  7 23:20:00 2024
Шпроты в масле из Балтийской кильки Маркет, 160г	https://www.perekrestok.ru/cat/75/p/sproty-v-masle-iz-baltijskoj-kilki-market-160g-4261613	spb	Санкт-Петербург, Биржевая площадь, 4	129,99 ₽/шт	Sun Jul  7 23:20:00 2024
Сардина Доброфлот иваси тихоокеанская натуральная, 245г	https://www.perekrestok.ru/cat/812/p/sardina-dobroflot-ivasi-tihookeanskaa-naturalnaa-245g-3613299	spb	Санкт-Петербург, Биржевая площадь, 4	139,99 ₽/шт	Sun Jul  7 23:20:00 2024
Сардина Доброфлот тихоокеанская тушка копчёная в масле, 210г	https://www.perekrestok.ru/cat/812/p/sardina-dobroflot-tihookeanskaa-tuska-kopcenaa-v-masle-210g-3932486	spb	Санкт-Петербург, Биржевая площадь, 4	159,99 ₽/шт	Sun Jul  7 23:20:00 2024
Сардины Omegin балтийские тушки бланшированной в масле с халапеньо, 175г	https://www.perekrestok.ru/cat/75/p/sardiny-omegin-baltijskie-tuski-blansirovannoj-v-masle-s-halapeno-175g-4288306	spb	Санкт-Петербург, Биржевая площадь, 4	154,99 ₽/шт	Sun Jul  7 23:20:00 2024
Сардина Рыбное Меню атлантическая в томатном соусе, 250г	https://www.perekrestok.ru/cat/75/p/sardina-rybnoe-menu-atlanticeskaa-v-tomatnom-souse-250g-4289095	spb	Санкт-Петербург, Биржевая площадь, 4	114,99 ₽/шт	Sun Jul  7 23:20:00 2024
Сайра Доброфлот натуральная, 245г	https://www.perekrestok.ru/cat/812/p/sajra-dobroflot-naturalnaa-245g-3451430	spb	Санкт-Петербург, Биржевая площадь, 4	279,99 ₽/шт	Sun Jul  7 23:20:00 2024
Сайра тихоокеанская натуральная Пр!ст, 250г	https://www.perekrestok.ru/cat/812/p/sajra-tihookeanskaa-naturalnaa-pr-st-250g-3653862	spb	Санкт-Петербург, Биржевая площадь, 4	199,99 ₽/шт	Sun Jul  7 23:20:00 2024
Тунец Fortuna кусочки натуральные, 185г	https://www.perekrestok.ru/cat/812/p/tunec-fortuna-kusocki-naturalnye-185g-72320	spb	Санкт-Петербург, Биржевая площадь, 4	219,99 ₽/шт	Sun Jul  7 23:20:00 2024
Печень трески Рыбное Меню По-Мурмански, 110г	https://www.perekrestok.ru/cat/75/p/pecen-treski-rybnoe-menu-po-murmanski-110g-4265658	spb	Санкт-Петербург, Биржевая площадь, 4	229,99 ₽/шт	Sun Jul  7 23:20:00 2024
Печень трески Б&К Морепродукт атлантической натуральная, 230г	https://www.perekrestok.ru/cat/75/p/pecen-treski-b-k-moreprodukt-atlanticeskoj-naturalnaa-230g-4249037	spb	Санкт-Петербург, Биржевая площадь, 4	549,99 ₽/шт	Sun Jul  7 23:20:00 2024
Сельдь атлантическая Сохраним Традиции в масляно-винном соусе с прованскими травами, 240г	https://www.perekrestok.ru/cat/812/p/seld-atlanticeskaa-sohranim-tradicii-v-maslano-vinnom-souse-s-provanskimi-travami-240g-4243190	spb	Санкт-Петербург, Биржевая площадь, 4	109,99 ₽/шт	Sun Jul  7 23:20:00 2024
Печень Русские Берега трески натуральная, 120г	https://www.perekrestok.ru/cat/75/p/pecen-russkie-berega-treski-naturalnaa-120g-4326947	spb	Санкт-Петербург, Биржевая площадь, 4	179,99 ₽/шт	Sun Jul  7 23:20:00 2024
Ряпушка Легенды Ямала Сибирская разделанная обжаренная в томатном соусе, 227г	https://www.perekrestok.ru/cat/75/p/rapuska-legendy-amala-sibirskaa-razdelannaa-obzarennaa-v-tomatnom-souse-227g-4332297	spb	Санкт-Петербург, Биржевая площадь, 4	174,99 ₽/шт	Sun Jul  7 23:20:00 2024
Печень трески Русские Берега натуральная, 200г	https://www.perekrestok.ru/cat/75/p/pecen-treski-russkie-berega-naturalnaa-200g-4243078	spb	Санкт-Петербург, Биржевая площадь, 4	599,99 ₽/шт	Sun Jul  7 23:20:00 2024
Бычки Соцпуть обжаренные в томатном соусе, 240г	https://www.perekrestok.ru/cat/75/p/bycki-socput-obzarennye-v-tomatnom-souse-240g-4249257	spb	Санкт-Петербург, Биржевая площадь, 4	139,99 ₽/шт	Sun Jul  7 23:20:00 2024
Налим Легенды Ямала пресноводный в томатном соусе, 227г	https://www.perekrestok.ru/cat/75/p/nalim-legendy-amala-presnovodnyj-v-tomatnom-souse-227g-4323919	spb	Санкт-Петербург, Биржевая площадь, 4	149,99 ₽/шт	Sun Jul  7 23:20:00 2024
Салат Калифорнийский с кусочками филе тунца полосатого Новый Океан, 160г	https://www.perekrestok.ru/cat/75/p/salat-kalifornijskij-s-kusockami-file-tunca-polosatogo-novyj-okean-160g-4199831	spb	Санкт-Петербург, Биржевая площадь, 4	139,99 ₽/шт	Sun Jul  7 23:20:00 2024
Язь Легенды Ямала обжаренный в томатном соусе кусок, 227г	https://www.perekrestok.ru/cat/75/p/az-legendy-amala-obzarennyj-v-tomatnom-souse-kusok-227g-4323918	spb	Санкт-Петербург, Биржевая площадь, 4	109,99 ₽/шт	Sun Jul  7 23:20:00 2024
Язь Легенды Ямала натуральный с добавлением масла кусок, 227г	https://www.perekrestok.ru/cat/75/p/az-legendy-amala-naturalnyj-s-dobavleniem-masla-kusok-227g-4323921	spb	Санкт-Петербург, Биржевая площадь, 4	109,99 ₽/шт	Sun Jul  7 23:20:00 2024
Паштет Пеккони Лососевый, 90г	https://www.perekrestok.ru/cat/75/p/pastet-pekkoni-lososevyj-90g-4340719	spb	Санкт-Петербург, Биржевая площадь, 4	69,99 ₽/шт	Sun Jul  7 23:20:00 2024
Кальмар Ультрамарин гигантский шинкованный без кожицы, 185г	https://www.perekrestok.ru/cat/75/p/kalmar-ultramarin-gigantskij-sinkovannyj-bez-kozicy-185g-4049944	spb	Санкт-Петербург, Биржевая площадь, 4	144,99 ₽/шт	Sun Jul  7 23:20:00 2024
Ряпушка Легенды Ямала сибирская в желе, 227г	https://www.perekrestok.ru/cat/75/p/rapuska-legendy-amala-sibirskaa-v-zele-227g-4345136	spb	Санкт-Петербург, Биржевая площадь, 4	139,99 ₽/шт	Sun Jul  7 23:20:00 2024
Тунец скипджек рубленый в масле Новый Океан, 185г	https://www.perekrestok.ru/cat/812/p/tunec-skipdzek-rublenyj-v-masle-novyj-okean-185g-4003716	spb	Санкт-Петербург, Биржевая площадь, 4	209,99 ₽/шт	Sun Jul  7 23:20:00 2024
Филе Thai Blue тунца желтоперого в собственном соку, 160г	https://www.perekrestok.ru/cat/75/p/file-thai-blue-tunca-zeltoperogo-v-sobstvennom-soku-160g-4276146	spb	Санкт-Петербург, Биржевая площадь, 4	199,99 ₽/шт	Sun Jul  7 23:20:00 2024
Печень тресковых рыб По-Скандинавски с молоками лососёвых тонкоизмельчённая Пр!ст, 240г	https://www.perekrestok.ru/cat/75/p/pecen-treskovyh-ryb-po-skandinavski-s-molokami-lososevyh-tonkoizmelcennaa-pr-st-240g-4183633	spb	Санкт-Петербург, Биржевая площадь, 4	134,99 ₽/шт	Sun Jul  7 23:20:00 2024
Макрель Вкусные Консервы филе в масле, 140г	https://www.perekrestok.ru/cat/75/p/makrel-vkusnye-konservy-file-v-masle-140g-4336439	spb	Санкт-Петербург, Биржевая площадь, 4	179,99 ₽/шт	Sun Jul  7 23:20:00 2024
Тунец Пеликан натуральный для салатов, 185г	https://www.perekrestok.ru/cat/812/p/tunec-pelikan-naturalnyj-dla-salatov-185g-3464758	spb	Санкт-Петербург, Биржевая площадь, 4	149,99 ₽/шт	Sun Jul  7 23:20:00 2024
Тунец скипджек филе-кусок Новый Океан, 185г	https://www.perekrestok.ru/cat/812/p/tunec-skipdzek-file-kusok-novyj-okean-185g-4003715	ekb	Екатеринбург, ул. Бориса Ельцина, 3	229,99 ₽/шт	Sun Jul  7 23:20:00 2024
Тунец скипджек рубленый Новый Океан, 185г	https://www.perekrestok.ru/cat/812/p/tunec-skipdzek-rublenyj-novyj-okean-185g-4003717	ekb	Екатеринбург, ул. Бориса Ельцина, 3	209,99 ₽/шт	Sun Jul  7 23:20:00 2024
Тунец Fortuna полосатый рубленый, 185г	https://www.perekrestok.ru/cat/812/p/tunec-fortuna-polosatyj-rublenyj-185g-72318	ekb	Екатеринбург, ул. Бориса Ельцина, 3	219,99 ₽/шт	Sun Jul  7 23:20:00 2024
Филе Thai Blue тунца желтоперого в масле, 160г	https://www.perekrestok.ru/cat/75/p/file-thai-blue-tunca-zeltoperogo-v-masle-160g-4276147	ekb	Екатеринбург, ул. Бориса Ельцина, 3	229,99 ₽/шт	Sun Jul  7 23:20:00 2024
Филе тунца Магуро в оливковом масле, 200г	https://www.perekrestok.ru/cat/812/p/file-tunca-maguro-v-olivkovom-masle-200g-3610561	ekb	Екатеринбург, ул. Бориса Ельцина, 3	279,99 ₽/шт	Sun Jul  7 23:20:00 2024
Тунец Fortuna рубленый в масле, 185г	https://www.perekrestok.ru/cat/812/p/tunec-fortuna-rublenyj-v-masle-185g-72319	ekb	Екатеринбург, ул. Бориса Ельцина, 3	239,99 ₽/шт	Sun Jul  7 23:20:00 2024
Тунец Владкон филе-кусочки с овощами в томатном соусе по-гавайски, 240г	https://www.perekrestok.ru/cat/75/p/tunec-vladkon-file-kusocki-s-ovosami-v-tomatnom-souse-po-gavajski-240g-4112728	ekb	Екатеринбург, ул. Бориса Ельцина, 3	139,99 ₽/шт	Sun Jul  7 23:20:00 2024
Тушенка Владкон из тунца желтоперого премиум, 338г	https://www.perekrestok.ru/cat/75/p/tusenka-vladkon-iz-tunca-zeltoperogo-premium-338g-4284229	ekb	Екатеринбург, ул. Бориса Ельцина, 3	229,99 ₽/шт	Sun Jul  7 23:20:00 2024
Тунец полосатый Fortuna кусочками с ароматом копчения с добавлением масла, 185г	https://www.perekrestok.ru/cat/75/p/tunec-polosatyj-fortuna-kusockami-s-aromatom-kopcenia-s-dobavleniem-masla-185g-4141770	ekb	Екатеринбург, ул. Бориса Ельцина, 3	184,99 ₽/шт	Sun Jul  7 23:20:00 2024
Тунец скипджек филе-кусок в масле Новый Океан, 185г	https://www.perekrestok.ru/cat/812/p/tunec-skipdzek-file-kusok-v-masle-novyj-okean-185g-4003714	ekb	Екатеринбург, ул. Бориса Ельцина, 3	229,99 ₽/шт	Sun Jul  7 23:20:00 2024
Тунец Fortuna по-азиатски в соусе нам джим, 185г	https://www.perekrestok.ru/cat/75/p/tunec-fortuna-po-aziatski-v-souse-nam-dzim-185g-4141767	ekb	Екатеринбург, ул. Бориса Ельцина, 3	184,99 ₽/шт	Sun Jul  7 23:20:00 2024
Филе тунца Магуро полосатый в соусе трюфель с сыром с маслом, 200г	https://www.perekrestok.ru/cat/75/p/file-tunca-maguro-polosatyj-v-souse-trufel-s-syrom-s-maslom-200g-4332354	ekb	Екатеринбург, ул. Бориса Ельцина, 3	309,99 ₽/шт	Sun Jul  7 23:20:00 2024
Филе тунца Магуро Том Ям полосатого в соусе с маслом, 200г	https://www.perekrestok.ru/cat/75/p/file-tunca-maguro-tom-am-polosatogo-v-souse-s-maslom-200g-4277012	ekb	Екатеринбург, ул. Бориса Ельцина, 3	289,99 ₽/шт	Sun Jul  7 23:20:00 2024
Набор Вкусные Консервы тунец криспи, 140г	https://www.perekrestok.ru/cat/75/p/nabor-vkusnye-konservy-tunec-krispi-140g-4342756	ekb	Екатеринбург, ул. Бориса Ельцина, 3	199,99 ₽/шт	Sun Jul  7 23:20:00 2024
Филе тунца Магуро полосатого в соусе терияки с маслом, 200г	https://www.perekrestok.ru/cat/75/p/file-tunca-maguro-polosatogo-v-souse-teriaki-s-maslom-200g-4277013	ekb	Екатеринбург, ул. Бориса Ельцина, 3	289,99 ₽/шт	Sun Jul  7 23:20:00 2024
Килька Вкусные Консервы неразделанная обжаренная в томатном соусе, 240г	https://www.perekrestok.ru/cat/812/p/kilka-vkusnye-konservy-nerazdelannaa-obzarennaa-v-tomatnom-souse-240g-3468685	ekb	Екатеринбург, ул. Бориса Ельцина, 3	114,99 ₽/шт	Sun Jul  7 23:20:00 2024
Килька 5 Морей натуральная в томатном соусе, 240г	https://www.perekrestok.ru/cat/812/p/kilka-5-morej-naturalnaa-v-tomatnom-souse-240g-39501	ekb	Екатеринбург, ул. Бориса Ельцина, 3	97,99 ₽/шт	Sun Jul  7 23:20:00 2024
Килька Барс балтийская неразделанная копчёная в томатном соусе, 250г	https://www.perekrestok.ru/cat/812/p/kilka-bars-baltijskaa-nerazdelannaa-kopcenaa-v-tomatnom-souse-250g-4047699	ekb	Екатеринбург, ул. Бориса Ельцина, 3	83,99 ₽/шт	Sun Jul  7 23:20:00 2024
Килька Вкусные Консервы черноморская неразделанная обжаренная в томатном соусе, 240г	https://www.perekrestok.ru/cat/75/p/kilka-vkusnye-konservy-cernomorskaa-nerazdelannaa-obzarennaa-v-tomatnom-souse-240g-4072472	ekb	Екатеринбург, ул. Бориса Ельцина, 3	67,99 ₽/шт	Sun Jul  7 23:20:00 2024
Шпроты Вкусные Консервы в масле, 175г	https://www.perekrestok.ru/cat/812/p/sproty-vkusnye-konservy-v-masle-175g-3469704	ekb	Екатеринбург, ул. Бориса Ельцина, 3	169,99 ₽/шт	Sun Jul  7 23:20:00 2024
Килька За Родину балтийская обжаренная в томатном соусе, 240г	https://www.perekrestok.ru/cat/812/p/kilka-za-rodinu-baltijskaa-obzarennaa-v-tomatnom-souse-240g-3495976	ekb	Екатеринбург, ул. Бориса Ельцина, 3	104,99 ₽/шт	Sun Jul  7 23:20:00 2024
Килька балтийская Вкусные Консервы обжаренная в остром томатном соусе с халапеньо, 240г	https://www.perekrestok.ru/cat/75/p/kilka-baltijskaa-vkusnye-konservy-obzarennaa-v-ostrom-tomatnom-souse-s-halapeno-240g-4123409	ekb	Екатеринбург, ул. Бориса Ельцина, 3	95,99 ₽/шт	Sun Jul  7 23:20:00 2024
Килька балтийская За Родину По-венгерски обжаренная с овощами в томатном соусе, 240г	https://www.perekrestok.ru/cat/75/p/kilka-baltijskaa-za-rodinu-po-vengerski-obzarennaa-s-ovosami-v-tomatnom-souse-240g-4243080	ekb	Екатеринбург, ул. Бориса Ельцина, 3	104,99 ₽/шт	Sun Jul  7 23:20:00 2024
Килька черноморская неразделанная в томатном соусе Пр!ст, 240г	https://www.perekrestok.ru/cat/812/p/kilka-cernomorskaa-nerazdelannaa-v-tomatnom-souse-pr-st-240g-4088784	ekb	Екатеринбург, ул. Бориса Ельцина, 3	35,99 ₽/шт	Sun Jul  7 23:20:00 2024
Килька Знак Качества неразделанная обжаренная в томатном соусе, 240г	https://www.perekrestok.ru/cat/812/p/kilka-znak-kacestva-nerazdelannaa-obzarennaa-v-tomatnom-souse-240g-3604633	ekb	Екатеринбург, ул. Бориса Ельцина, 3	63,99 ₽/шт	Sun Jul  7 23:20:00 2024
Скумбрия атлантическая натуральная с добавлением масла куски Маркет, 240г	https://www.perekrestok.ru/cat/75/p/skumbria-atlanticeskaa-naturalnaa-s-dobavleniem-masla-kuski-market-240g-4323677	ekb	Екатеринбург, ул. Бориса Ельцина, 3	124,99 ₽/шт	Sun Jul  7 23:20:00 2024
Скумбрия Доброфлот дальневосточная натуральная в масле, 245г	https://www.perekrestok.ru/cat/812/p/skumbria-dobroflot-dalnevostocnaa-naturalnaa-v-masle-245g-3507133	ekb	Екатеринбург, ул. Бориса Ельцина, 3	154,99 ₽/шт	Sun Jul  7 23:20:00 2024
Скумбрия Рыбное Меню атлантическая в томатном соусе, 250г	https://www.perekrestok.ru/cat/75/p/skumbria-rybnoe-menu-atlanticeskaa-v-tomatnom-souse-250g-4289096	ekb	Екатеринбург, ул. Бориса Ельцина, 3	114,99 ₽/шт	Sun Jul  7 23:20:00 2024
Скумбрия Барс в томатном соусе, 250г	https://www.perekrestok.ru/cat/812/p/skumbria-bars-v-tomatnom-souse-250g-2050134	ekb	Екатеринбург, ул. Бориса Ельцина, 3	129,99 ₽/шт	Sun Jul  7 23:20:00 2024
Скумбрия Сохраним Традиции атлантическая с томатным соусом и овощным гарниром По-Болгарски, 240г	https://www.perekrestok.ru/cat/75/p/skumbria-sohranim-tradicii-atlanticeskaa-s-tomatnym-sousom-i-ovosnym-garnirom-po-bolgarski-240g-4244103	ekb	Екатеринбург, ул. Бориса Ельцина, 3	129,99 ₽/шт	Sun Jul  7 23:20:00 2024
Скумбрия Рыбное Меню атлантическая с добавлением масла, 250г	https://www.perekrestok.ru/cat/75/p/skumbria-rybnoe-menu-atlanticeskaa-s-dobavleniem-masla-250g-3631524	ekb	Екатеринбург, ул. Бориса Ельцина, 3	129,99 ₽/шт	Sun Jul  7 23:20:00 2024
Скумбрия атлантическая Сохраним Традиции в масляно-горчичной заливке с семенами горчицы, 240г	https://www.perekrestok.ru/cat/75/p/skumbria-atlanticeskaa-sohranim-tradicii-v-maslano-gorcicnoj-zalivke-s-semenami-gorcicy-240g-4243188	ekb	Екатеринбург, ул. Бориса Ельцина, 3	139,99 ₽/шт	Sun Jul  7 23:20:00 2024
Горбуша натуральная, 245г	https://www.perekrestok.ru/cat/812/p/gorbusa-naturalnaa-245g-46230	ekb	Екатеринбург, ул. Бориса Ельцина, 3	129,99 ₽/шт	Sun Jul  7 23:20:00 2024
Горбуша 5 Морей натуральная, 250г	https://www.perekrestok.ru/cat/812/p/gorbusa-5-morej-naturalnaa-250g-87726	ekb	Екатеринбург, ул. Бориса Ельцина, 3	169,99 ₽/шт	Sun Jul  7 23:20:00 2024
Горбуша Курильский Берег натуральная, 250г	https://www.perekrestok.ru/cat/812/p/gorbusa-kurilskij-bereg-naturalnaa-250g-3900135	ekb	Екатеринбург, ул. Бориса Ельцина, 3	149,99 ₽/шт	Sun Jul  7 23:20:00 2024
Горбуша натуральная Пр!ст, 250г	https://www.perekrestok.ru/cat/812/p/gorbusa-naturalnaa-pr-st-250g-3653861	ekb	Екатеринбург, ул. Бориса Ельцина, 3	104,99 ₽/шт	Sun Jul  7 23:20:00 2024
Горбуша Ультрамарин натуральная, 240г	https://www.perekrestok.ru/cat/812/p/gorbusa-ultramarin-naturalnaa-240g-3679993	ekb	Екатеринбург, ул. Бориса Ельцина, 3	159,99 ₽/шт	Sun Jul  7 23:20:00 2024
Лосось Владкон атлантический с овощами в томатном соусе по-итальянски филе-кусочки, 240г	https://www.perekrestok.ru/cat/75/p/losos-vladkon-atlanticeskij-s-ovosami-v-tomatnom-souse-po-italanski-file-kusocki-240g-4212266	ekb	Екатеринбург, ул. Бориса Ельцина, 3	129,99 ₽/шт	Sun Jul  7 23:20:00 2024
