name	url	locale	address	price	time
Горбуша Капитан Вкусов в масле со вкусом Сладкий Чили, 200г	https://www.perekrestok.ru/cat/75/p/gorbusa-kapitan-vkusov-v-masle-so-vkusom-sladkij-cili-200g-4332353	ekb	Екатеринбург, ул. Бориса Ельцина, 3	179,99 ₽/шт	Sun Jul  7 23:20:00 2024
Горбуша Капитан Вкусов куски в масле со вкусом Кимчи, 200г	https://www.perekrestok.ru/cat/75/p/gorbusa-kapitan-vkusov-kuski-v-masle-so-vkusom-kimci-200g-4332356	ekb	Екатеринбург, ул. Бориса Ельцина, 3	179,99 ₽/шт	Sun Jul  7 23:20:00 2024
Шпроты Вкусные Консервы крупные в масле, 240г	https://www.perekrestok.ru/cat/812/p/sproty-vkusnye-konservy-krupnye-v-masle-240g-3468684	ekb	Екатеринбург, ул. Бориса Ельцина, 3	139,99 ₽/шт	Sun Jul  7 23:20:00 2024
Шпроты За Родину тушки из балтийской кильки в масле, 270г	https://www.perekrestok.ru/cat/812/p/sproty-za-rodinu-tuski-iz-baltijskoj-kilki-v-masle-270g-3962298	ekb	Екатеринбург, ул. Бориса Ельцина, 3	199,99 ₽/шт	Sun Jul  7 23:20:00 2024
Шпроты в масле из Балтийской кильки Маркет, 160г	https://www.perekrestok.ru/cat/75/p/sproty-v-masle-iz-baltijskoj-kilki-market-160g-4261613	ekb	Екатеринбург, ул. Бориса Ельцина, 3	124,99 ₽/шт	Sun Jul  7 23:20:00 2024
Шпроты Вкусные Консервы в масле, 240г	https://www.perekrestok.ru/cat/812/p/sproty-vkusnye-konservy-v-masle-240g-3468682	ekb	Екатеринбург, ул. Бориса Ельцина, 3	189,99 ₽/шт	Sun Jul  7 23:20:00 2024
Шпроты Вкусные Консервы в масле, 160г	https://www.perekrestok.ru/cat/812/p/sproty-vkusnye-konservy-v-masle-160g-3475329	ekb	Екатеринбург, ул. Бориса Ельцина, 3	144,99 ₽/шт	Sun Jul  7 23:20:00 2024
Шпроты За Родину из балтийской кильки в масле, 160г	https://www.perekrestok.ru/cat/812/p/sproty-za-rodinu-iz-baltijskoj-kilki-v-masle-160g-3503292	ekb	Екатеринбург, ул. Бориса Ельцина, 3	109,99 ₽/шт	Sun Jul  7 23:20:00 2024
Шпроты Барс из балтийской кильки в масле, 175г	https://www.perekrestok.ru/cat/812/p/sproty-bars-iz-baltijskoj-kilki-v-masle-175g-3633223	ekb	Екатеринбург, ул. Бориса Ельцина, 3	144,99 ₽/шт	Sun Jul  7 23:20:00 2024
Шпроты Капитан Вкусов в масле из балтийской кильки, 250г	https://www.perekrestok.ru/cat/75/p/sproty-kapitan-vkusov-v-masle-iz-baltijskoj-kilki-250g-3654699	ekb	Екатеринбург, ул. Бориса Ельцина, 3	179,99 ₽/шт	Sun Jul  7 23:20:00 2024
Шпроты Барс из балтийской кильки в масле, 160г	https://www.perekrestok.ru/cat/812/p/sproty-bars-iz-baltijskoj-kilki-v-masle-160g-3504456	ekb	Екатеринбург, ул. Бориса Ельцина, 3	129,99 ₽/шт	Sun Jul  7 23:20:00 2024
Сардина Доброфлот иваси тихоокеанская натуральная, 245г	https://www.perekrestok.ru/cat/812/p/sardina-dobroflot-ivasi-tihookeanskaa-naturalnaa-245g-3613299	ekb	Екатеринбург, ул. Бориса Ельцина, 3	144,99 ₽/шт	Sun Jul  7 23:20:00 2024
Сардины Omegin балтийские тушки бланшированной в масле с халапеньо, 175г	https://www.perekrestok.ru/cat/75/p/sardiny-omegin-baltijskie-tuski-blansirovannoj-v-masle-s-halapeno-175g-4288306	ekb	Екатеринбург, ул. Бориса Ельцина, 3	119,99 ₽/шт	Sun Jul  7 23:20:00 2024
Сардина Доброфлот тихоокеанская тушка копчёная в масле, 210г	https://www.perekrestok.ru/cat/812/p/sardina-dobroflot-tihookeanskaa-tuska-kopcenaa-v-masle-210g-3932486	ekb	Екатеринбург, ул. Бориса Ельцина, 3	129,99 ₽/шт	Sun Jul  7 23:20:00 2024
Сардина Рыбное Меню атлантическая в томатном соусе, 250г	https://www.perekrestok.ru/cat/75/p/sardina-rybnoe-menu-atlanticeskaa-v-tomatnom-souse-250g-4289095	ekb	Екатеринбург, ул. Бориса Ельцина, 3	114,99 ₽/шт	Sun Jul  7 23:20:00 2024
Сардина тихоокеанская Курильский Берег иваси натуральная куски, 250г	https://www.perekrestok.ru/cat/75/p/sardina-tihookeanskaa-kurilskij-bereg-ivasi-naturalnaa-kuski-250g-4179345	ekb	Екатеринбург, ул. Бориса Ельцина, 3	104,99 ₽/шт	Sun Jul  7 23:20:00 2024
Сардина Сохраним Традиции атлантическая в масляно-горчичной заливке с семенами горчицы, 240г	https://www.perekrestok.ru/cat/75/p/sardina-sohranim-tradicii-atlanticeskaa-v-maslano-gorcicnoj-zalivke-s-semenami-gorcicy-240g-4276597	ekb	Екатеринбург, ул. Бориса Ельцина, 3	129,99 ₽/шт	Sun Jul  7 23:20:00 2024
Сардина Рыбное Меню атлантическая с добавлением масла, 250г	https://www.perekrestok.ru/cat/75/p/sardina-rybnoe-menu-atlanticeskaa-s-dobavleniem-masla-250g-3630003	ekb	Екатеринбург, ул. Бориса Ельцина, 3	77,99 ₽/шт	Sun Jul  7 23:20:00 2024
Сайра Доброфлот натуральная, 245г	https://www.perekrestok.ru/cat/812/p/sajra-dobroflot-naturalnaa-245g-3451430	ekb	Екатеринбург, ул. Бориса Ельцина, 3	259,99 ₽/шт	Sun Jul  7 23:20:00 2024
Сайра тихоокеанская натуральная Пр!ст, 250г	https://www.perekrestok.ru/cat/812/p/sajra-tihookeanskaa-naturalnaa-pr-st-250g-3653862	ekb	Екатеринбург, ул. Бориса Ельцина, 3	159,99 ₽/шт	Sun Jul  7 23:20:00 2024
Тунец Fortuna кусочки натуральные, 185г	https://www.perekrestok.ru/cat/812/p/tunec-fortuna-kusocki-naturalnye-185g-72320	ekb	Екатеринбург, ул. Бориса Ельцина, 3	219,99 ₽/шт	Sun Jul  7 23:20:00 2024
Печень трески Рыбное Меню По-Мурмански, 110г	https://www.perekrestok.ru/cat/75/p/pecen-treski-rybnoe-menu-po-murmanski-110g-4265658	ekb	Екатеринбург, ул. Бориса Ельцина, 3	209,99 ₽/шт	Sun Jul  7 23:20:00 2024
Печень трески Б&К-Морепродукт атлантической натуральная, 115г	https://www.perekrestok.ru/cat/75/p/pecen-treski-b-k-moreprodukt-atlanticeskoj-naturalnaa-115g-4249036	ekb	Екатеринбург, ул. Бориса Ельцина, 3	309,99 ₽/шт	Sun Jul  7 23:20:00 2024
Печень трески Б&К Морепродукт атлантической натуральная, 230г	https://www.perekrestok.ru/cat/75/p/pecen-treski-b-k-moreprodukt-atlanticeskoj-naturalnaa-230g-4249037	ekb	Екатеринбург, ул. Бориса Ельцина, 3	449,99 ₽/шт	Sun Jul  7 23:20:00 2024
Треска Владкон атлантическая с овощами в сливочном соусе по-норвежски филе-кусочки, 240г	https://www.perekrestok.ru/cat/75/p/treska-vladkon-atlanticeskaa-s-ovosami-v-slivocnom-souse-po-norvezski-file-kusocki-240g-4212267	ekb	Екатеринбург, ул. Бориса Ельцина, 3	89,99 ₽/шт	Sun Jul  7 23:20:00 2024
Сельдь атлантическая Сохраним Традиции в масляно-винном соусе с прованскими травами, 240г	https://www.perekrestok.ru/cat/812/p/seld-atlanticeskaa-sohranim-tradicii-v-maslano-vinnom-souse-s-provanskimi-travami-240g-4243190	ekb	Екатеринбург, ул. Бориса Ельцина, 3	109,99 ₽/шт	Sun Jul  7 23:20:00 2024
Горбуша Жемчужина Сахалина натуральная куски, 245г	https://www.perekrestok.ru/cat/75/p/gorbusa-zemcuzina-sahalina-naturalnaa-kuski-245g-4307462	ekb	Екатеринбург, ул. Бориса Ельцина, 3	149,99 ₽/шт	Sun Jul  7 23:20:00 2024
Печень Русские Берега трески натуральная, 120г	https://www.perekrestok.ru/cat/75/p/pecen-russkie-berega-treski-naturalnaa-120g-4326947	ekb	Екатеринбург, ул. Бориса Ельцина, 3	179,99 ₽/шт	Sun Jul  7 23:20:00 2024
Бычки Соцпуть обжаренные в томатном соусе, 240г	https://www.perekrestok.ru/cat/75/p/bycki-socput-obzarennye-v-tomatnom-souse-240g-4249257	ekb	Екатеринбург, ул. Бориса Ельцина, 3	139,99 ₽/шт	Sun Jul  7 23:20:00 2024
Ряпушка Легенды Ямала сибирская в желе, 227г	https://www.perekrestok.ru/cat/75/p/rapuska-legendy-amala-sibirskaa-v-zele-227g-4345136	ekb	Екатеринбург, ул. Бориса Ельцина, 3	139,99 ₽/шт	Sun Jul  7 23:20:00 2024
Кальмар Ультрамарин гигантский шинкованный без кожицы, 185г	https://www.perekrestok.ru/cat/75/p/kalmar-ultramarin-gigantskij-sinkovannyj-bez-kozicy-185g-4049944	ekb	Екатеринбург, ул. Бориса Ельцина, 3	149,99 ₽/шт	Sun Jul  7 23:20:00 2024
Печень трески Русские Берега натуральная, 200г	https://www.perekrestok.ru/cat/75/p/pecen-treski-russkie-berega-naturalnaa-200g-4243078	ekb	Екатеринбург, ул. Бориса Ельцина, 3	599,99 ₽/шт	Sun Jul  7 23:20:00 2024
Паштет Пеккони Лососевый, 90г	https://www.perekrestok.ru/cat/75/p/pastet-pekkoni-lososevyj-90g-4340719	ekb	Екатеринбург, ул. Бориса Ельцина, 3	69,99 ₽/шт	Sun Jul  7 23:20:00 2024
Паштет Пеккони Форелевый копченый, 90г	https://www.perekrestok.ru/cat/75/p/pastet-pekkoni-forelevyj-kopcenyj-90g-4340721	ekb	Екатеринбург, ул. Бориса Ельцина, 3	69,99 ₽/шт	Sun Jul  7 23:20:00 2024
Язь Легенды Ямала натуральный с добавлением масла кусок, 227г	https://www.perekrestok.ru/cat/75/p/az-legendy-amala-naturalnyj-s-dobavleniem-masla-kusok-227g-4323921	ekb	Екатеринбург, ул. Бориса Ельцина, 3	109,99 ₽/шт	Sun Jul  7 23:20:00 2024
Кальмар Владкон Перуанско-Чилийский Гигантский тушка без кожицы, 185г	https://www.perekrestok.ru/cat/75/p/kalmar-vladkon-peruansko-cilijskij-gigantskij-tuska-bez-kozicy-185g-4307744	ekb	Екатеринбург, ул. Бориса Ельцина, 3	134,99 ₽/шт	Sun Jul  7 23:20:00 2024
Ряпушка Легенды Ямала Сибирская разделанная обжаренная в томатном соусе, 227г	https://www.perekrestok.ru/cat/75/p/rapuska-legendy-amala-sibirskaa-razdelannaa-obzarennaa-v-tomatnom-souse-227g-4332297	ekb	Екатеринбург, ул. Бориса Ельцина, 3	144,99 ₽/шт	Sun Jul  7 23:20:00 2024
Налим Легенда Ямала пресноводный обжаренный в томатном соусе, 240г	https://www.perekrestok.ru/cat/812/p/nalim-legenda-amala-presnovodnyj-obzarennyj-v-tomatnom-souse-240g-3681641	ekb	Екатеринбург, ул. Бориса Ельцина, 3	124,99 ₽/шт	Sun Jul  7 23:20:00 2024
Салат Калифорнийский с кусочками филе тунца полосатого Новый Океан, 160г	https://www.perekrestok.ru/cat/75/p/salat-kalifornijskij-s-kusockami-file-tunca-polosatogo-novyj-okean-160g-4199831	ekb	Екатеринбург, ул. Бориса Ельцина, 3	139,99 ₽/шт	Sun Jul  7 23:20:00 2024
Нерка Жемчужина Сахалина натуральная куски, 227г	https://www.perekrestok.ru/cat/75/p/nerka-zemcuzina-sahalina-naturalnaa-kuski-227g-4323483	ekb	Екатеринбург, ул. Бориса Ельцина, 3	229,99 ₽/шт	Sun Jul  7 23:20:00 2024
Налим филе натуральный с добавлением масла, 240г	https://www.perekrestok.ru/cat/75/p/nalim-file-naturalnyj-s-dobavleniem-masla-240g-4249079	ekb	Екатеринбург, ул. Бориса Ельцина, 3	134,99 ₽/шт	Sun Jul  7 23:20:00 2024
Налим Легенды Ямала пресноводный в томатном соусе, 227г	https://www.perekrestok.ru/cat/75/p/nalim-legendy-amala-presnovodnyj-v-tomatnom-souse-227g-4323919	ekb	Екатеринбург, ул. Бориса Ельцина, 3	119,99 ₽/шт	Sun Jul  7 23:20:00 2024
Язь Легенда Ямала с добавлением масла, 240г	https://www.perekrestok.ru/cat/75/p/az-legenda-amala-s-dobavleniem-masla-240g-3635106	ekb	Екатеринбург, ул. Бориса Ельцина, 3	124,99 ₽/шт	Sun Jul  7 23:20:00 2024
Филе Thai Blue тунца желтоперого в собственном соку, 160г	https://www.perekrestok.ru/cat/75/p/file-thai-blue-tunca-zeltoperogo-v-sobstvennom-soku-160g-4276146	ekb	Екатеринбург, ул. Бориса Ельцина, 3	199,99 ₽/шт	Sun Jul  7 23:20:00 2024
Тунец скипджек рубленый в масле Новый Океан, 185г	https://www.perekrestok.ru/cat/812/p/tunec-skipdzek-rublenyj-v-masle-novyj-okean-185g-4003716	ekb	Екатеринбург, ул. Бориса Ельцина, 3	209,99 ₽/шт	Sun Jul  7 23:20:00 2024
Сельдь Доброфлот тихоокеанская натуральная в масле, 245г	https://www.perekrestok.ru/cat/812/p/seld-dobroflot-tihookeanskaa-naturalnaa-v-masle-245g-3451441	ekb	Екатеринбург, ул. Бориса Ельцина, 3	114,99 ₽/шт	Sun Jul  7 23:20:00 2024
Печень тресковых рыб По-Скандинавски с молоками лососёвых тонкоизмельчённая Пр!ст, 240г	https://www.perekrestok.ru/cat/75/p/pecen-treskovyh-ryb-po-skandinavski-s-molokami-lososevyh-tonkoizmelcennaa-pr-st-240g-4183633	ekb	Екатеринбург, ул. Бориса Ельцина, 3	89,99 ₽/шт	Sun Jul  7 23:20:00 2024
Печень По-приморски минтая, 185г	https://www.perekrestok.ru/cat/75/p/pecen-po-primorski-mintaa-185g-4304758	ekb	Екатеринбург, ул. Бориса Ельцина, 3	179,99 ₽/шт	Sun Jul  7 23:20:00 2024
Макрель Вкусные Консервы филе в масле, 140г	https://www.perekrestok.ru/cat/75/p/makrel-vkusnye-konservy-file-v-masle-140g-4336439	ekb	Екатеринбург, ул. Бориса Ельцина, 3	184,99 ₽/шт	Sun Jul  7 23:20:00 2024
Уха EcoFood По-царски из осётра, 530г	https://www.perekrestok.ru/cat/812/p/uha-ecofood-po-carski-iz-osetra-530g-3500060	ekb	Екатеринбург, ул. Бориса Ельцина, 3	699,99 ₽/шт	Sun Jul  7 23:20:00 2024
Уха Ararat Рыбный суп из форели, 530г	https://www.perekrestok.ru/cat/75/p/uha-ararat-rybnyj-sup-iz-foreli-530g-4223600	ekb	Екатеринбург, ул. Бориса Ельцина, 3	239,99 ₽/шт	Sun Jul  7 23:20:00 2024
Бычки Соцпуть обжаренные с фасолью в остром томатном соусе, 240г	https://www.perekrestok.ru/cat/75/p/bycki-socput-obzarennye-s-fasolu-v-ostrom-tomatnom-souse-240g-4249269	ekb	Екатеринбург, ул. Бориса Ельцина, 3	129,99 ₽/шт	Sun Jul  7 23:20:00 2024
Килька Laatsa балтийская с овощным гарниром в томатном соусе, 240г	https://www.perekrestok.ru/cat/812/p/kilka-laatsa-baltijskaa-s-ovosnym-garnirom-v-tomatnom-souse-240g-3900131	ekb	Екатеринбург, ул. Бориса Ельцина, 3	119,99 ₽/шт	Sun Jul  7 23:20:00 2024
Сельдь Барс атлантическая филе копчёное в масле, 175г	https://www.perekrestok.ru/cat/812/p/seld-bars-atlanticeskaa-file-kopcenoe-v-masle-175g-3993912	ekb	Екатеринбург, ул. Бориса Ельцина, 3	149,99 ₽/шт	Sun Jul  7 23:20:00 2024
Тунец скипджек филе-кусок Новый Океан, 185г	https://www.perekrestok.ru/cat/812/p/tunec-skipdzek-file-kusok-novyj-okean-185g-4003715	nn	Нижний Новгород, площадь Минина и Пожарского, 2	229,99 ₽/шт	Sun Jul  7 23:20:00 2024
Тунец скипджек рубленый Новый Океан, 185г	https://www.perekrestok.ru/cat/812/p/tunec-skipdzek-rublenyj-novyj-okean-185g-4003717	nn	Нижний Новгород, площадь Минина и Пожарского, 2	209,99 ₽/шт	Sun Jul  7 23:20:00 2024
Тунец Fortuna полосатый рубленый, 185г	https://www.perekrestok.ru/cat/812/p/tunec-fortuna-polosatyj-rublenyj-185g-72318	nn	Нижний Новгород, площадь Минина и Пожарского, 2	239,99 ₽/шт	Sun Jul  7 23:20:00 2024
Филе Thai Blue тунца желтоперого в масле, 160г	https://www.perekrestok.ru/cat/75/p/file-thai-blue-tunca-zeltoperogo-v-masle-160g-4276147	nn	Нижний Новгород, площадь Минина и Пожарского, 2	229,99 ₽/шт	Sun Jul  7 23:20:00 2024
Филе тунца Магуро в оливковом масле, 200г	https://www.perekrestok.ru/cat/812/p/file-tunca-maguro-v-olivkovom-masle-200g-3610561	nn	Нижний Новгород, площадь Минина и Пожарского, 2	279,99 ₽/шт	Sun Jul  7 23:20:00 2024
Тунец Fortuna рубленый в масле, 185г	https://www.perekrestok.ru/cat/812/p/tunec-fortuna-rublenyj-v-masle-185g-72319	nn	Нижний Новгород, площадь Минина и Пожарского, 2	239,99 ₽/шт	Sun Jul  7 23:20:00 2024
Тунец Владкон филе-кусочки с овощами в томатном соусе по-гавайски, 240г	https://www.perekrestok.ru/cat/75/p/tunec-vladkon-file-kusocki-s-ovosami-v-tomatnom-souse-po-gavajski-240g-4112728	nn	Нижний Новгород, площадь Минина и Пожарского, 2	139,99 ₽/шт	Sun Jul  7 23:20:00 2024
Тушенка Владкон из тунца желтоперого премиум, 338г	https://www.perekrestok.ru/cat/75/p/tusenka-vladkon-iz-tunca-zeltoperogo-premium-338g-4284229	nn	Нижний Новгород, площадь Минина и Пожарского, 2	249,99 ₽/шт	Sun Jul  7 23:20:00 2024
Тунец полосатый Fortuna кусочками с ароматом копчения с добавлением масла, 185г	https://www.perekrestok.ru/cat/75/p/tunec-polosatyj-fortuna-kusockami-s-aromatom-kopcenia-s-dobavleniem-masla-185g-4141770	nn	Нижний Новгород, площадь Минина и Пожарского, 2	184,99 ₽/шт	Sun Jul  7 23:20:00 2024
Тунец скипджек филе-кусок в масле Новый Океан, 185г	https://www.perekrestok.ru/cat/812/p/tunec-skipdzek-file-kusok-v-masle-novyj-okean-185g-4003714	nn	Нижний Новгород, площадь Минина и Пожарского, 2	229,99 ₽/шт	Sun Jul  7 23:20:00 2024
Тунец Fortuna по-азиатски в соусе нам джим, 185г	https://www.perekrestok.ru/cat/75/p/tunec-fortuna-po-aziatski-v-souse-nam-dzim-185g-4141767	nn	Нижний Новгород, площадь Минина и Пожарского, 2	184,99 ₽/шт	Sun Jul  7 23:20:00 2024
Филе тунца Магуро полосатый в соусе трюфель с сыром с маслом, 200г	https://www.perekrestok.ru/cat/75/p/file-tunca-maguro-polosatyj-v-souse-trufel-s-syrom-s-maslom-200g-4332354	nn	Нижний Новгород, площадь Минина и Пожарского, 2	319,99 ₽/шт	Sun Jul  7 23:20:00 2024
Филе тунца Магуро Том Ям полосатого в соусе с маслом, 200г	https://www.perekrestok.ru/cat/75/p/file-tunca-maguro-tom-am-polosatogo-v-souse-s-maslom-200g-4277012	nn	Нижний Новгород, площадь Минина и Пожарского, 2	319,99 ₽/шт	Sun Jul  7 23:20:00 2024
Набор Вкусные Консервы тунец криспи, 140г	https://www.perekrestok.ru/cat/75/p/nabor-vkusnye-konservy-tunec-krispi-140g-4342756	nn	Нижний Новгород, площадь Минина и Пожарского, 2	199,99 ₽/шт	Sun Jul  7 23:20:00 2024
Филе тунца Магуро полосатого в соусе оливки-орегано в масле, 200г	https://www.perekrestok.ru/cat/75/p/file-tunca-maguro-polosatogo-v-souse-olivki-oregano-v-masle-200g-4332355	nn	Нижний Новгород, площадь Минина и Пожарского, 2	309,99 ₽/шт	Sun Jul  7 23:20:00 2024
Килька Вкусные Консервы неразделанная обжаренная в томатном соусе, 240г	https://www.perekrestok.ru/cat/812/p/kilka-vkusnye-konservy-nerazdelannaa-obzarennaa-v-tomatnom-souse-240g-3468685	nn	Нижний Новгород, площадь Минина и Пожарского, 2	114,99 ₽/шт	Sun Jul  7 23:20:00 2024
Килька 5 Морей натуральная в томатном соусе, 240г	https://www.perekrestok.ru/cat/812/p/kilka-5-morej-naturalnaa-v-tomatnom-souse-240g-39501	nn	Нижний Новгород, площадь Минина и Пожарского, 2	104,99 ₽/шт	Sun Jul  7 23:20:00 2024
Килька Барс балтийская неразделанная копчёная в томатном соусе, 250г	https://www.perekrestok.ru/cat/812/p/kilka-bars-baltijskaa-nerazdelannaa-kopcenaa-v-tomatnom-souse-250g-4047699	nn	Нижний Новгород, площадь Минина и Пожарского, 2	87,99 ₽/шт	Sun Jul  7 23:20:00 2024
Шпроты Вкусные Консервы в масле, 175г	https://www.perekrestok.ru/cat/812/p/sproty-vkusnye-konservy-v-masle-175g-3469704	nn	Нижний Новгород, площадь Минина и Пожарского, 2	169,99 ₽/шт	Sun Jul  7 23:20:00 2024
Килька За Родину балтийская неразделанная обжаренная в томатном соусе, 270г	https://www.perekrestok.ru/cat/812/p/kilka-za-rodinu-baltijskaa-nerazdelannaa-obzarennaa-v-tomatnom-souse-270g-4047829	nn	Нижний Новгород, площадь Минина и Пожарского, 2	134,99 ₽/шт	Sun Jul  7 23:20:00 2024
Скумбрия атлантическая натуральная с добавлением масла куски Маркет, 240г	https://www.perekrestok.ru/cat/75/p/skumbria-atlanticeskaa-naturalnaa-s-dobavleniem-masla-kuski-market-240g-4323677	nn	Нижний Новгород, площадь Минина и Пожарского, 2	119,99 ₽/шт	Sun Jul  7 23:20:00 2024
Скумбрия Доброфлот дальневосточная натуральная в масле, 245г	https://www.perekrestok.ru/cat/812/p/skumbria-dobroflot-dalnevostocnaa-naturalnaa-v-masle-245g-3507133	nn	Нижний Новгород, площадь Минина и Пожарского, 2	154,99 ₽/шт	Sun Jul  7 23:20:00 2024
Скумбрия Рыбное Меню атлантическая в томатном соусе, 250г	https://www.perekrestok.ru/cat/75/p/skumbria-rybnoe-menu-atlanticeskaa-v-tomatnom-souse-250g-4289096	nn	Нижний Новгород, площадь Минина и Пожарского, 2	114,99 ₽/шт	Sun Jul  7 23:20:00 2024
Скумбрия Сохраним Традиции атлантическая с томатным соусом и овощным гарниром По-Болгарски, 240г	https://www.perekrestok.ru/cat/75/p/skumbria-sohranim-tradicii-atlanticeskaa-s-tomatnym-sousom-i-ovosnym-garnirom-po-bolgarski-240g-4244103	nn	Нижний Новгород, площадь Минина и Пожарского, 2	129,99 ₽/шт	Sun Jul  7 23:20:00 2024
Скумбрия Рыбное Меню атлантическая с добавлением масла, 250г	https://www.perekrestok.ru/cat/75/p/skumbria-rybnoe-menu-atlanticeskaa-s-dobavleniem-masla-250g-3631524	nn	Нижний Новгород, площадь Минина и Пожарского, 2	129,99 ₽/шт	Sun Jul  7 23:20:00 2024
Скумбрия атлантическая Сохраним Традиции в масляно-горчичной заливке с семенами горчицы, 240г	https://www.perekrestok.ru/cat/75/p/skumbria-atlanticeskaa-sohranim-tradicii-v-maslano-gorcicnoj-zalivke-s-semenami-gorcicy-240g-4243188	nn	Нижний Новгород, площадь Минина и Пожарского, 2	139,99 ₽/шт	Sun Jul  7 23:20:00 2024
Горбуша натуральная, 245г	https://www.perekrestok.ru/cat/812/p/gorbusa-naturalnaa-245g-46230	nn	Нижний Новгород, площадь Минина и Пожарского, 2	139,99 ₽/шт	Sun Jul  7 23:20:00 2024
Горбуша 5 Морей натуральная, 250г	https://www.perekrestok.ru/cat/812/p/gorbusa-5-morej-naturalnaa-250g-87726	nn	Нижний Новгород, площадь Минина и Пожарского, 2	159,99 ₽/шт	Sun Jul  7 23:20:00 2024
