name	url	locale	address	price	time
Вино Chateau l'Eclair Merlot красное полусладкое 10%, 750мл	https://www.perekrestok.ru/cat/2/p/vino-chateau-leclair-merlot-krasnoe-polusladkoe-10-750ml-4181690	nn	Нижний Новгород, площадь Минина и Пожарского, 2	249,99 ₽/шт	Sun Jul  7 23:20:00 2024
Вино Solvinо Tamagne Merlot красное сухое 10-12%, 750мл	https://www.perekrestok.ru/cat/2/p/vino-solvino-tamagne-merlot-krasnoe-suhoe-10-12-750ml-4323380	nn	Нижний Новгород, площадь Минина и Пожарского, 2	229,99 ₽/шт	Sun Jul  7 23:20:00 2024
Плодовый алкогольный напиток Pom-X гранатовый полусладкий 12%, 750мл	https://www.perekrestok.ru/cat/2/p/plodovyj-alkogolnyj-napitok-pom-x-granatovyj-polusladkij-12-750ml-4275179	nn	Нижний Новгород, площадь Минина и Пожарского, 2	659,99 ₽/шт	Sun Jul  7 23:20:00 2024
Вино Mayrik красное сухое 13%, 750мл	https://www.perekrestok.ru/cat/2/p/vino-mayrik-krasnoe-suhoe-13-750ml-4195678	nn	Нижний Новгород, площадь Минина и Пожарского, 2	469,99 ₽/шт	Sun Jul  7 23:20:00 2024
Вино красное сухое 21 Wine Street Pinot Noir, 750мл	https://www.perekrestok.ru/cat/2/p/vino-krasnoe-suhoe-21-wine-street-pinot-noir-750ml-4270441	nn	Нижний Новгород, площадь Минина и Пожарского, 2	899,99 ₽/шт	Sun Jul  7 23:20:00 2024
Вино Prado Molar Tempranillo VDT красное полусладкое, 750мл	https://www.perekrestok.ru/cat/2/p/vino-prado-molar-tempranillo-vdt-krasnoe-polusladkoe-750ml-4247048	nn	Нижний Новгород, площадь Минина и Пожарского, 2	799,99 ₽/шт	Sun Jul  7 23:20:00 2024
Вино Сокровища Крыма Мускат Чёрный красное сладкое 9-11%, 1,5л	https://www.perekrestok.ru/cat/2/p/vino-sokrovisa-kryma-muskat-cernyj-krasnoe-sladkoe-9-11-1-5l-4123276	nn	Нижний Новгород, площадь Минина и Пожарского, 2	619,99 ₽/шт	Sun Jul  7 23:20:00 2024
Вино Les Blousons Noirs сортовое ординарное красное сухое, 750мл	https://www.perekrestok.ru/cat/2/p/vino-les-blousons-noirs-sortovoe-ordinarnoe-krasnoe-suhoe-750ml-4227066	nn	Нижний Новгород, площадь Минина и Пожарского, 2	799,00 ₽/шт	Sun Jul  7 23:20:00 2024
Вино Aspeti Гранат красное полусладкое 12%, 750мл	https://www.perekrestok.ru/cat/2/p/vino-aspeti-granat-krasnoe-polusladkoe-12-750ml-4180158	nn	Нижний Новгород, площадь Минина и Пожарского, 2	399,99 ₽/шт	Sun Jul  7 23:20:00 2024
Вино Pirovano Montepulciano D'Abruzzo DOC красное сухое 13%, 750мл	https://www.perekrestok.ru/cat/2/p/vino-pirovano-montepulciano-dabruzzo-doc-krasnoe-suhoe-13-750ml-3611087	nn	Нижний Новгород, площадь Минина и Пожарского, 2	659,99 ₽/шт	Sun Jul  7 23:20:00 2024
Вино Tini Montepulciano d'Abruzzo DOC красное сухое 12.5%, 750мл	https://www.perekrestok.ru/cat/2/p/vino-tini-montepulciano-dabruzzo-doc-krasnoe-suhoe-12-5-750ml-3373794	nn	Нижний Новгород, площадь Минина и Пожарского, 2	769,99 ₽/шт	Sun Jul  7 23:20:00 2024
Вино Mucho Mas Ред Бленд красное полусухое 14%, 750мл	https://www.perekrestok.ru/cat/2/p/vino-mucho-mas-red-blend-krasnoe-polusuhoe-14-750ml-4211302	nn	Нижний Новгород, площадь Минина и Пожарского, 2	979,99 ₽/шт	Sun Jul  7 23:20:00 2024
Вино сортовое ординарное Mayrik красное полусладкое, 750мл	https://www.perekrestok.ru/cat/2/p/vino-sortovoe-ordinarnoe-mayrik-krasnoe-polusladkoe-750ml-4261595	nn	Нижний Новгород, площадь Минина и Пожарского, 2	469,99 ₽/шт	Sun Jul  7 23:20:00 2024
Вино Chateau Vartely Индивидо фетяска неагра красное сухое 14%, 750мл	https://www.perekrestok.ru/cat/2/p/vino-chateau-vartely-individo-fetaska-neagra-krasnoe-suhoe-14-750ml-4219856	nn	Нижний Новгород, площадь Минина и Пожарского, 2	859,99 ₽/шт	Sun Jul  7 23:20:00 2024
Вино Vina Tomar Темпранильо Сира красное полусухое, 750мл	https://www.perekrestok.ru/cat/2/p/vino-vina-tomar-tempranilo-sira-krasnoe-polusuhoe-750ml-4203044	nn	Нижний Новгород, площадь Минина и Пожарского, 2	759,99 ₽/шт	Sun Jul  7 23:20:00 2024
Вино Babalu Tropical Wine красное сладкое, 10%, 750мл	https://www.perekrestok.ru/cat/2/p/vino-babalu-tropical-wine-krasnoe-sladkoe-10-750ml-4195442	nn	Нижний Новгород, площадь Минина и Пожарского, 2	549,99 ₽/шт	Sun Jul  7 23:20:00 2024
Вино Camden Park Shiraz красное полусухое 13%, 750мл	https://www.perekrestok.ru/cat/2/p/vino-camden-park-shiraz-krasnoe-polusuhoe-13-750ml-4132884	nn	Нижний Новгород, площадь Минина и Пожарского, 2	1 099,00 ₽/шт	Sun Jul  7 23:20:00 2024
Вино Фанагория Номерной Резерв Каберне красное сухое 14%, 750мл	https://www.perekrestok.ru/cat/2/p/vino-fanagoria-nomernoj-rezerv-kaberne-krasnoe-suhoe-14-750ml-3195826	nn	Нижний Новгород, площадь Минина и Пожарского, 2	389,99 ₽/шт	Sun Jul  7 23:20:00 2024
Вино Апсны красное полусладкое, 10%, 750мл	https://www.perekrestok.ru/cat/2/p/vino-apsny-krasnoe-polusladkoe-10-750ml-75230	nn	Нижний Новгород, площадь Минина и Пожарского, 2	499,99 ₽/шт	Sun Jul  7 23:20:00 2024
Вино Don Simon красное сухое 11%, 1л	https://www.perekrestok.ru/cat/2/p/vino-don-simon-krasnoe-suhoe-11-1l-66777	nn	Нижний Новгород, площадь Минина и Пожарского, 2	679,99 ₽/шт	Sun Jul  7 23:20:00 2024
Вино Алазанская Долина красное полусладкое, 750мл	https://www.perekrestok.ru/cat/2/p/vino-alazanskaa-dolina-krasnoe-polusladkoe-750ml-4231763	nn	Нижний Новгород, площадь Минина и Пожарского, 2	349,99 ₽/шт	Sun Jul  7 23:20:00 2024
Вино Chateau Pinot Гравитация Пино Нуар/Саперави красное сухое 13%, 750мл	https://www.perekrestok.ru/cat/2/p/vino-chateau-pinot-gravitacia-pino-nuar-saperavi-krasnoe-suhoe-13-750ml-4213964	nn	Нижний Новгород, площадь Минина и Пожарского, 2	699,99 ₽/шт	Sun Jul  7 23:20:00 2024
Вино Santa Julia Malbec красное сухое 13%, 750мл	https://www.perekrestok.ru/cat/2/p/vino-santa-julia-malbec-krasnoe-suhoe-13-750ml-4133194	nn	Нижний Новгород, площадь Минина и Пожарского, 2	599,99 ₽/шт	Sun Jul  7 23:20:00 2024
Вино Solvino Каберне красное полусладкое 12%, 750мл	https://www.perekrestok.ru/cat/2/p/vino-solvino-kaberne-krasnoe-polusladkoe-12-750ml-4132863	nn	Нижний Новгород, площадь Минина и Пожарского, 2	229,99 ₽/шт	Sun Jul  7 23:20:00 2024
Вино Резерв Винодела Мерло красное сухое 12%, 700мл	https://www.perekrestok.ru/cat/2/p/vino-rezerv-vinodela-merlo-krasnoe-suhoe-12-700ml-4124932	nn	Нижний Новгород, площадь Минина и Пожарского, 2	299,99 ₽/шт	Sun Jul  7 23:20:00 2024
Вино Bouchard Aine&Fils Grand Conseiller Pinot Noir красное сухое 12%, 750мл	https://www.perekrestok.ru/cat/2/p/vino-bouchard-aine-fils-grand-conseiller-pinot-noir-krasnoe-suhoe-12-750ml-3963636	nn	Нижний Новгород, площадь Минина и Пожарского, 2	899,99 ₽/шт	Sun Jul  7 23:20:00 2024
Вино Rauli Syrah красное сухое 13%, 750мл	https://www.perekrestok.ru/cat/2/p/vino-rauli-syrah-krasnoe-suhoe-13-750ml-3445602	nn	Нижний Новгород, площадь Минина и Пожарского, 2	569,99 ₽/шт	Sun Jul  7 23:20:00 2024
Вино выдержанное красное полусухое Q.S.S. Rare Reserva, 750мл	https://www.perekrestok.ru/cat/2/p/vino-vyderzannoe-krasnoe-polusuhoe-q-s-s-rare-reserva-750ml-4286676	nn	Нижний Новгород, площадь Минина и Пожарского, 2	939,99 ₽/шт	Sun Jul  7 23:20:00 2024
Вино Amaranta Pinotage красное сухое 14%, 750мл	https://www.perekrestok.ru/cat/2/p/vino-amaranta-pinotage-krasnoe-suhoe-14-750ml-3995312	nn	Нижний Новгород, площадь Минина и Пожарского, 2	599,99 ₽/шт	Sun Jul  7 23:20:00 2024
Вино Loggia Del Sole Chianti DOCG красное сухое 12.5%, 750мл	https://www.perekrestok.ru/cat/2/p/vino-loggia-del-sole-chianti-docg-krasnoe-suhoe-12-5-750ml-4096020	nn	Нижний Новгород, площадь Минина и Пожарского, 2	999,99 ₽/шт	Sun Jul  7 23:20:00 2024
Вино Поместье Голубицкое Каберне-Совиньон красное сухое 750мл	https://www.perekrestok.ru/cat/2/p/vino-pomeste-golubickoe-kaberne-sovinon-krasnoe-suhoe-750ml-3985014	nn	Нижний Новгород, площадь Минина и Пожарского, 2	879,99 ₽/шт	Sun Jul  7 23:20:00 2024
Вино Rauli Merlot красное сухое 13.5%, 750мл	https://www.perekrestok.ru/cat/2/p/vino-rauli-merlot-krasnoe-suhoe-13-5-750ml-3445601	nn	Нижний Новгород, площадь Минина и Пожарского, 2	569,99 ₽/шт	Sun Jul  7 23:20:00 2024
Вино Matsu El Picaro Toro DO красное сухое 14.5%, 750мл	https://www.perekrestok.ru/cat/2/p/vino-matsu-el-picaro-toro-do-krasnoe-suhoe-14-5-750ml-3691849	nn	Нижний Новгород, площадь Минина и Пожарского, 2	2 199,00 ₽/шт	Sun Jul  7 23:20:00 2024
Вино Фанагория Авторское вино Каберне-Мерло красное сухое 13%, 750мл	https://www.perekrestok.ru/cat/2/p/vino-fanagoria-avtorskoe-vino-kaberne-merlo-krasnoe-suhoe-13-750ml-3505291	nn	Нижний Новгород, площадь Минина и Пожарского, 2	449,99 ₽/шт	Sun Jul  7 23:20:00 2024
Вино Finca El Encinal Roble Ribera del Duero DO красное сухое 14.5%, 750мл	https://www.perekrestok.ru/cat/2/p/vino-finca-el-encinal-roble-ribera-del-duero-do-krasnoe-suhoe-14-5-750ml-3657106	nn	Нижний Новгород, площадь Минина и Пожарского, 2	2 299,00 ₽/шт	Sun Jul  7 23:20:00 2024
Вино Sauvignon Blanc Whakaata Rock сортовое белое сухое, 750мл	https://www.perekrestok.ru/cat/2/p/vino-sauvignon-blanc-whakaata-rock-sortovoe-beloe-suhoe-750ml-4293958	nn	Нижний Новгород, площадь Минина и Пожарского, 2	1 499,00 ₽/шт	Sun Jul  7 23:20:00 2024
Вино Zinfandel Long Barn красное полусухое 13, 9%, 750мл	https://www.perekrestok.ru/cat/2/p/vino-zinfandel-long-barn-krasnoe-polusuhoe-13-9-750ml-4300213	nn	Нижний Новгород, площадь Минина и Пожарского, 2	1 949,00 ₽/шт	Sun Jul  7 23:20:00 2024
Портвейн Monge Porto Fine Ruby марочный красный крепкий, 750мл	https://www.perekrestok.ru/cat/2/p/portvejn-monge-porto-fine-ruby-marocnyj-krasnyj-krepkij-750ml-4268329	nn	Нижний Новгород, площадь Минина и Пожарского, 2	1 199,00 ₽/шт	Sun Jul  7 23:20:00 2024
Вино выдержанное Pinta Negra Reserva красное сухое, 750мл	https://www.perekrestok.ru/cat/2/p/vino-vyderzannoe-pinta-negra-reserva-krasnoe-suhoe-750ml-4217190	nn	Нижний Новгород, площадь Минина и Пожарского, 2	899,99 ₽/шт	Sun Jul  7 23:20:00 2024
Вино Le Chant du Cot a la Negrette красное сухое, 750мл	https://www.perekrestok.ru/cat/2/p/vino-le-chant-du-cot-a-la-negrette-krasnoe-suhoe-750ml-4227065	nn	Нижний Новгород, площадь Минина и Пожарского, 2	999,99 ₽/шт	Sun Jul  7 23:20:00 2024
Вино B-Liv Каберне-Совиньон-Карменер-Сира красное сухое, 750мл	https://www.perekrestok.ru/cat/2/p/vino-b-liv-kaberne-sovinon-karmener-sira-krasnoe-suhoe-750ml-4216001	nn	Нижний Новгород, площадь Минина и Пожарского, 2	999,99 ₽/шт	Sun Jul  7 23:20:00 2024
Вино Paladin Syrah красное полусладкое 13.5%, 750мл	https://www.perekrestok.ru/cat/2/p/vino-paladin-syrah-krasnoe-polusladkoe-13-5-750ml-4097710	nn	Нижний Новгород, площадь Минина и Пожарского, 2	839,99 ₽/шт	Sun Jul  7 23:20:00 2024
Вино Inspirado Carmenere красное сухое 12%, 750мл	https://www.perekrestok.ru/cat/2/p/vino-inspirado-carmenere-krasnoe-suhoe-12-750ml-4057355	nn	Нижний Новгород, площадь Минина и Пожарского, 2	499,99 ₽/шт	Sun Jul  7 23:20:00 2024
Вино Cape Art Pinotage красное сухое 13.5%, 750мл	https://www.perekrestok.ru/cat/2/p/vino-cape-art-pinotage-krasnoe-suhoe-13-5-750ml-3608101	nn	Нижний Новгород, площадь Минина и Пожарского, 2	499,99 ₽/шт	Sun Jul  7 23:20:00 2024
Вино Киндзмараули красное полусладкое 12%, 750мл	https://www.perekrestok.ru/cat/2/p/vino-kindzmarauli-krasnoe-polusladkoe-12-750ml-3694712	nn	Нижний Новгород, площадь Минина и Пожарского, 2	1 499,00 ₽/шт	Sun Jul  7 23:20:00 2024
Вино Wine Guide Бастардо красное полусладкое 12%, 750мл	https://www.perekrestok.ru/cat/2/p/vino-wine-guide-bastardo-krasnoe-polusladkoe-12-750ml-3493844	nn	Нижний Новгород, площадь Минина и Пожарского, 2	299,99 ₽/шт	Sun Jul  7 23:20:00 2024
Вино Лыхны красное полусладкое, 10%, 750мл	https://www.perekrestok.ru/cat/2/p/vino-lyhny-krasnoe-polusladkoe-10-750ml-69435	nn	Нижний Новгород, площадь Минина и Пожарского, 2	499,99 ₽/шт	Sun Jul  7 23:20:00 2024
Вино Papik Malbec красное сухое 13.5%, 750мл	https://www.perekrestok.ru/cat/2/p/vino-papik-malbec-krasnoe-suhoe-13-5-750ml-4333106	nn	Нижний Новгород, площадь Минина и Пожарского, 2	599,99 ₽/шт	Sun Jul  7 23:20:00 2024
Вино Boardwalk California Zinfandel красное полусухое 13.5%, 750мл	https://www.perekrestok.ru/cat/2/p/vino-boardwalk-california-zinfandel-krasnoe-polusuhoe-13-5-750ml-4270444	nn	Нижний Новгород, площадь Минина и Пожарского, 2	1 099,00 ₽/шт	Sun Jul  7 23:20:00 2024
Вино Aristov Anima Pinot Nero Sangiovese красное сухое 11.5%, 750мл	https://www.perekrestok.ru/cat/2/p/vino-aristov-anima-pinot-nero-sangiovese-krasnoe-suhoe-11-5-750ml-4311092	nn	Нижний Новгород, площадь Минина и Пожарского, 2	459,99 ₽/шт	Sun Jul  7 23:20:00 2024
Вино Sellata Primitivo сортовое красное полусухое 13% 750мл	https://www.perekrestok.ru/cat/2/p/vino-sellata-primitivo-sortovoe-krasnoe-polusuhoe-13-750ml-4322425	nn	Нижний Новгород, площадь Минина и Пожарского, 2	919,99 ₽/шт	Sun Jul  7 23:20:00 2024
Вино Aristov Cabernet-Saperavi красное сухое 12.5%, 375мл	https://www.perekrestok.ru/cat/2/p/vino-aristov-cabernet-saperavi-krasnoe-suhoe-12-5-375ml-4318929	nn	Нижний Новгород, площадь Минина и Пожарского, 2	269,99 ₽/шт	Sun Jul  7 23:20:00 2024
Вино The Freaky Wines Tempranillo красное сухое, 750мл	https://www.perekrestok.ru/cat/2/p/vino-the-freaky-wines-tempranillo-krasnoe-suhoe-750ml-4278810	nn	Нижний Новгород, площадь Минина и Пожарского, 2	679,99 ₽/шт	Sun Jul  7 23:20:00 2024
Вино Wine Guide Каберне Совиньон сортовое сухое красное, 750мл	https://www.perekrestok.ru/cat/2/p/vino-wine-guide-kaberne-sovinon-sortovoe-suhoe-krasnoe-750ml-4287199	nn	Нижний Новгород, площадь Минина и Пожарского, 2	399,99 ₽/шт	Sun Jul  7 23:20:00 2024
Вино Златни Брег красное сухое 12%, 750мл	https://www.perekrestok.ru/cat/2/p/vino-zlatni-breg-krasnoe-suhoe-12-750ml-4274800	nn	Нижний Новгород, площадь Минина и Пожарского, 2	699,99 ₽/шт	Sun Jul  7 23:20:00 2024
Вино ординарное Reino de Altuzarra красное сухое 13%, 750мл	https://www.perekrestok.ru/cat/2/p/vino-ordinarnoe-reino-de-altuzarra-krasnoe-suhoe-13-750ml-4255392	nn	Нижний Новгород, площадь Минина и Пожарского, 2	549,00 ₽/шт	Sun Jul  7 23:20:00 2024
Вино Sottocielo Blaufrankisch Selection красное сухое, 750мл	https://www.perekrestok.ru/cat/2/p/vino-sottocielo-blaufrankisch-selection-krasnoe-suhoe-750ml-4214438	nn	Нижний Новгород, площадь Минина и Пожарского, 2	959,99 ₽/шт	Sun Jul  7 23:20:00 2024
Вино Pearly Bay Dry Red красное сухое 13.5%, 3л	https://www.perekrestok.ru/cat/2/p/vino-pearly-bay-dry-red-krasnoe-suhoe-13-5-3l-4260569	nn	Нижний Новгород, площадь Минина и Пожарского, 2	1 399,00 ₽/шт	Sun Jul  7 23:20:00 2024
Вино Chateau Pinot Кубань Классика Каберне Совиньон 2019 сухое красное 13%, 750мл	https://www.perekrestok.ru/cat/2/p/vino-chateau-pinot-kuban-klassika-kaberne-sovinon-2019-suhoe-krasnoe-13-750ml-4220057	nn	Нижний Новгород, площадь Минина и Пожарского, 2	1 099,00 ₽/шт	Sun Jul  7 23:20:00 2024
Вино JP. Chenet Origonal Cabernet Syrah красное полусухое, 750мл	https://www.perekrestok.ru/cat/2/p/vino-jp-chenet-origonal-cabernet-syrah-krasnoe-polusuhoe-750ml-4252542	nn	Нижний Новгород, площадь Минина и Пожарского, 2	999,99 ₽/шт	Sun Jul  7 23:20:00 2024
Вино Chateau Vartely Изабелла красное полусладкое, 750мл	https://www.perekrestok.ru/cat/2/p/vino-chateau-vartely-izabella-krasnoe-polusladkoe-750ml-4219854	nn	Нижний Новгород, площадь Минина и Пожарского, 2	599,99 ₽/шт	Sun Jul  7 23:20:00 2024
Вино Maradi Киндзмараули красное полусладкое 11%, 750мл	https://www.perekrestok.ru/cat/2/p/vino-maradi-kindzmarauli-krasnoe-polusladkoe-11-750ml-4200941	nn	Нижний Новгород, площадь Минина и Пожарского, 2	859,99 ₽/шт	Sun Jul  7 23:20:00 2024
Вино Sobreiro de Pegoes Premium красное сухое 12.5%, 750мл	https://www.perekrestok.ru/cat/2/p/vino-sobreiro-de-pegoes-premium-krasnoe-suhoe-12-5-750ml-4174049	nn	Нижний Новгород, площадь Минина и Пожарского, 2	749,99 ₽/шт	Sun Jul  7 23:20:00 2024
Вино Torneo The Tournament Malbec красное полусухое 13.5%, 750мл	https://www.perekrestok.ru/cat/2/p/vino-torneo-the-tournament-malbec-krasnoe-polusuhoe-13-5-750ml-4120201	nn	Нижний Новгород, площадь Минина и Пожарского, 2	869,99 ₽/шт	Sun Jul  7 23:20:00 2024
Вино Aristov Cabernet Sauvignon красное сухое 12.5%, 750мл	https://www.perekrestok.ru/cat/2/p/vino-aristov-cabernet-sauvignon-krasnoe-suhoe-12-5-750ml-4154539	nn	Нижний Новгород, площадь Минина и Пожарского, 2	599,99 ₽/шт	Sun Jul  7 23:20:00 2024
Вино Мысхако Quintessence Cabernet Sauvignon красное сухое 14.8%, 750мл	https://www.perekrestok.ru/cat/2/p/vino-myshako-quintessence-cabernet-sauvignon-krasnoe-suhoe-14-8-750ml-4116469	nn	Нижний Новгород, площадь Минина и Пожарского, 2	859,99 ₽/шт	Sun Jul  7 23:20:00 2024
Вино Chateau Pinot Pinot Noir красное сухое 14%, 750мл	https://www.perekrestok.ru/cat/2/p/vino-chateau-pinot-pinot-noir-krasnoe-suhoe-14-750ml-4104146	nn	Нижний Новгород, площадь Минина и Пожарского, 2	1 099,00 ₽/шт	Sun Jul  7 23:20:00 2024
Вино Chateau Pinot Shiraz красное сухое 14%, 750мл	https://www.perekrestok.ru/cat/2/p/vino-chateau-pinot-shiraz-krasnoe-suhoe-14-750ml-4086037	nn	Нижний Новгород, площадь Минина и Пожарского, 2	1 049,00 ₽/шт	Sun Jul  7 23:20:00 2024
Вино ликерное Солнечная Долина Черный Доктор Солнечной Долины красное сладкое 16%, 750мл	https://www.perekrestok.ru/cat/2/p/vino-likernoe-solnecnaa-dolina-cernyj-doktor-solnecnoj-doliny-krasnoe-sladkoe-16-750ml-3684042	nn	Нижний Новгород, площадь Минина и Пожарского, 2	1 649,00 ₽/шт	Sun Jul  7 23:20:00 2024
Вино Destination Rouge Bordeaux AOC красное сухое 12.5%, 750мл	https://www.perekrestok.ru/cat/2/p/vino-destination-rouge-bordeaux-aoc-krasnoe-suhoe-12-5-750ml-3951501	nn	Нижний Новгород, площадь Минина и Пожарского, 2	849,99 ₽/шт	Sun Jul  7 23:20:00 2024
Вино Vinogor Изабелла красное полусладкое 12%, 1л	https://www.perekrestok.ru/cat/2/p/vino-vinogor-izabella-krasnoe-polusladkoe-12-1l-3369482	nn	Нижний Новгород, площадь Минина и Пожарского, 2	164,99 ₽/шт	Sun Jul  7 23:20:00 2024
Вино Molom Tinto красное сухое 12%, 750мл	https://www.perekrestok.ru/cat/2/p/vino-molom-tinto-krasnoe-suhoe-12-750ml-3660059	nn	Нижний Новгород, площадь Минина и Пожарского, 2	999,99 ₽/шт	Sun Jul  7 23:20:00 2024
Вино Cape Art Shiraz красное сухое 14%, 750мл	https://www.perekrestok.ru/cat/2/p/vino-cape-art-shiraz-krasnoe-suhoe-14-750ml-3608100	nn	Нижний Новгород, площадь Минина и Пожарского, 2	449,99 ₽/шт	Sun Jul  7 23:20:00 2024
Вино Ca'Del Poggio Montepulciano d'Abruzzo DOC красное сухое 12.5%, 750мл	https://www.perekrestok.ru/cat/2/p/vino-cadel-poggio-montepulciano-dabruzzo-doc-krasnoe-suhoe-12-5-750ml-3473820	nn	Нижний Новгород, площадь Минина и Пожарского, 2	599,99 ₽/шт	Sun Jul  7 23:20:00 2024
Вино Elegido Tinto красное полусладкое 12%, 1л	https://www.perekrestok.ru/cat/2/p/vino-elegido-tinto-krasnoe-polusladkoe-12-1l-3456670	nn	Нижний Новгород, площадь Минина и Пожарского, 2	799,99 ₽/шт	Sun Jul  7 23:20:00 2024
Вино Vivanco Crianza красное сухое 13.5%, 750мл	https://www.perekrestok.ru/cat/2/p/vino-vivanco-crianza-krasnoe-suhoe-13-5-750ml-3506247	nn	Нижний Новгород, площадь Минина и Пожарского, 2	979,99 ₽/шт	Sun Jul  7 23:20:00 2024
Вино Papik Cabernet Franc красное сухое 13.5%, 750мл	https://www.perekrestok.ru/cat/2/p/vino-papik-cabernet-franc-krasnoe-suhoe-13-5-750ml-4333107	nn	Нижний Новгород, площадь Минина и Пожарского, 2	599,99 ₽/шт	Sun Jul  7 23:20:00 2024
Вино Sellata Appassimento Puglia IGP красное полусухое 14%, 750мл	https://www.perekrestok.ru/cat/2/p/vino-sellata-appassimento-puglia-igp-krasnoe-polusuhoe-14-750ml-4322424	nn	Нижний Новгород, площадь Минина и Пожарского, 2	919,99 ₽/шт	Sun Jul  7 23:20:00 2024
Вино Bodega El Angosto La Tribuna красное сухое 13.5%, 750мл	https://www.perekrestok.ru/cat/2/p/vino-bodega-el-angosto-la-tribuna-krasnoe-suhoe-13-5-750ml-4326587	nn	Нижний Новгород, площадь Минина и Пожарского, 2	1 399,00 ₽/шт	Sun Jul  7 23:20:00 2024
Вино Ziari Creek красное сухое 12%, 750мл	https://www.perekrestok.ru/cat/2/p/vino-ziari-creek-krasnoe-suhoe-12-750ml-4320439	nn	Нижний Новгород, площадь Минина и Пожарского, 2	699,99 ₽/шт	Sun Jul  7 23:20:00 2024
Вино Ranina Саперави красное сухое 12%, 750мл	https://www.perekrestok.ru/cat/2/p/vino-ranina-saperavi-krasnoe-suhoe-12-750ml-4308074	nn	Нижний Новгород, площадь Минина и Пожарского, 2	599,99 ₽/шт	Sun Jul  7 23:20:00 2024
Вино Inkerman Пино Нуар красное сухое 11-13%, 750мл	https://www.perekrestok.ru/cat/2/p/vino-inkerman-pino-nuar-krasnoe-suhoe-11-13-750ml-4326700	nn	Нижний Новгород, площадь Минина и Пожарского, 2	449,99 ₽/шт	Sun Jul  7 23:20:00 2024
