name	url	locale	address	price	time
Вино Sottocielo Неро Д'Авола красное сухое, 750мл	https://www.perekrestok.ru/cat/2/p/vino-sottocielo-nero-davola-krasnoe-suhoe-750ml-4215286	msk	Москва, Большой Патриарший переулок, 5	799,99 ₽/шт	Sun Jul  7 23:20:00 2024
Вино Lemi Киндзмараули красное полусладкое, 750мл	https://www.perekrestok.ru/cat/2/p/vino-lemi-kindzmarauli-krasnoe-polusladkoe-750ml-4231764	msk	Москва, Большой Патриарший переулок, 5	449,99 ₽/шт	Sun Jul  7 23:20:00 2024
Вино Highway to Hell красное сухое 13%, 750мл	https://www.perekrestok.ru/cat/2/p/vino-highway-to-hell-krasnoe-suhoe-13-750ml-4169130	msk	Москва, Большой Патриарший переулок, 5	749,99 ₽/шт	Sun Jul  7 23:20:00 2024
Вино Chateau l'Eclair Cabernet красное сухое 10%, 750мл	https://www.perekrestok.ru/cat/2/p/vino-chateau-leclair-cabernet-krasnoe-suhoe-10-750ml-4181689	msk	Москва, Большой Патриарший переулок, 5	249,99 ₽/шт	Sun Jul  7 23:20:00 2024
Вино Chateau l'Eclair Merlot красное полусладкое 10%, 750мл	https://www.perekrestok.ru/cat/2/p/vino-chateau-leclair-merlot-krasnoe-polusladkoe-10-750ml-4181690	msk	Москва, Большой Патриарший переулок, 5	249,99 ₽/шт	Sun Jul  7 23:20:00 2024
Плодовый алкогольный напиток Pom-X гранатовый полусладкий 12%, 750мл	https://www.perekrestok.ru/cat/2/p/plodovyj-alkogolnyj-napitok-pom-x-granatovyj-polusladkij-12-750ml-4275179	msk	Москва, Большой Патриарший переулок, 5	449,99 ₽/шт	Sun Jul  7 23:20:00 2024
Вино Castillo Santa Barbara Вьехо красное сухое, 187мл	https://www.perekrestok.ru/cat/2/p/vino-castillo-santa-barbara-veho-krasnoe-suhoe-187ml-4258812	msk	Москва, Большой Патриарший переулок, 5	429,99 ₽/шт	Sun Jul  7 23:20:00 2024
Вино Mayrik красное сухое 13%, 750мл	https://www.perekrestok.ru/cat/2/p/vino-mayrik-krasnoe-suhoe-13-750ml-4195678	msk	Москва, Большой Патриарший переулок, 5	469,99 ₽/шт	Sun Jul  7 23:20:00 2024
Портвейн Manuel D. Pocas Junior Руби красный марочный 16%, 750мл	https://www.perekrestok.ru/cat/2/p/portvejn-manuel-d-pocas-junior-rubi-krasnyj-marocnyj-16-750ml-4215390	msk	Москва, Большой Патриарший переулок, 5	1 399,00 ₽/шт	Sun Jul  7 23:20:00 2024
Вино красное сухое 21 Wine Street Pinot Noir, 750мл	https://www.perekrestok.ru/cat/2/p/vino-krasnoe-suhoe-21-wine-street-pinot-noir-750ml-4270441	msk	Москва, Большой Патриарший переулок, 5	899,99 ₽/шт	Sun Jul  7 23:20:00 2024
Вино Prado Molar Tempranillo VDT красное полусладкое, 750мл	https://www.perekrestok.ru/cat/2/p/vino-prado-molar-tempranillo-vdt-krasnoe-polusladkoe-750ml-4247048	msk	Москва, Большой Патриарший переулок, 5	799,99 ₽/шт	Sun Jul  7 23:20:00 2024
Вино Les Blousons Noirs сортовое ординарное красное сухое, 750мл	https://www.perekrestok.ru/cat/2/p/vino-les-blousons-noirs-sortovoe-ordinarnoe-krasnoe-suhoe-750ml-4227066	msk	Москва, Большой Патриарший переулок, 5	999,99 ₽/шт	Sun Jul  7 23:20:00 2024
Вино Aspeti Гранат красное полусладкое 12%, 750мл	https://www.perekrestok.ru/cat/2/p/vino-aspeti-granat-krasnoe-polusladkoe-12-750ml-4180158	msk	Москва, Большой Патриарший переулок, 5	399,99 ₽/шт	Sun Jul  7 23:20:00 2024
Вино Pirovano Montepulciano D'Abruzzo DOC красное сухое 13%, 750мл	https://www.perekrestok.ru/cat/2/p/vino-pirovano-montepulciano-dabruzzo-doc-krasnoe-suhoe-13-750ml-3611087	msk	Москва, Большой Патриарший переулок, 5	659,99 ₽/шт	Sun Jul  7 23:20:00 2024
Вино Tini Montepulciano d'Abruzzo DOC красное сухое 12.5%, 750мл	https://www.perekrestok.ru/cat/2/p/vino-tini-montepulciano-dabruzzo-doc-krasnoe-suhoe-12-5-750ml-3373794	msk	Москва, Большой Патриарший переулок, 5	769,99 ₽/шт	Sun Jul  7 23:20:00 2024
Вино Mucho Mas Ред Бленд красное полусухое 14%, 750мл	https://www.perekrestok.ru/cat/2/p/vino-mucho-mas-red-blend-krasnoe-polusuhoe-14-750ml-4211302	msk	Москва, Большой Патриарший переулок, 5	1 199,00 ₽/шт	Sun Jul  7 23:20:00 2024
Вино сортовое ординарное Mayrik красное полусладкое, 750мл	https://www.perekrestok.ru/cat/2/p/vino-sortovoe-ordinarnoe-mayrik-krasnoe-polusladkoe-750ml-4261595	msk	Москва, Большой Патриарший переулок, 5	469,99 ₽/шт	Sun Jul  7 23:20:00 2024
Вино Chateau Vartely Индивидо фетяска неагра красное сухое 14%, 750мл	https://www.perekrestok.ru/cat/2/p/vino-chateau-vartely-individo-fetaska-neagra-krasnoe-suhoe-14-750ml-4219856	msk	Москва, Большой Патриарший переулок, 5	859,99 ₽/шт	Sun Jul  7 23:20:00 2024
Вино Vina Tomar Темпранильо Сира красное полусухое, 750мл	https://www.perekrestok.ru/cat/2/p/vino-vina-tomar-tempranilo-sira-krasnoe-polusuhoe-750ml-4203044	msk	Москва, Большой Патриарший переулок, 5	479,99 ₽/шт	Sun Jul  7 23:20:00 2024
Вино Camden Park Shiraz красное полусухое 13%, 750мл	https://www.perekrestok.ru/cat/2/p/vino-camden-park-shiraz-krasnoe-polusuhoe-13-750ml-4132884	msk	Москва, Большой Патриарший переулок, 5	1 099,00 ₽/шт	Sun Jul  7 23:20:00 2024
Вино Фанагория Номерной Резерв Каберне красное сухое 14%, 750мл	https://www.perekrestok.ru/cat/2/p/vino-fanagoria-nomernoj-rezerv-kaberne-krasnoe-suhoe-14-750ml-3195826	msk	Москва, Большой Патриарший переулок, 5	429,99 ₽/шт	Sun Jul  7 23:20:00 2024
Вино Апсны красное полусладкое, 10%, 750мл	https://www.perekrestok.ru/cat/2/p/vino-apsny-krasnoe-polusladkoe-10-750ml-75230	msk	Москва, Большой Патриарший переулок, 5	529,99 ₽/шт	Sun Jul  7 23:20:00 2024
Вино Don Simon красное сухое 11%, 1л	https://www.perekrestok.ru/cat/2/p/vino-don-simon-krasnoe-suhoe-11-1l-66777	msk	Москва, Большой Патриарший переулок, 5	659,99 ₽/шт	Sun Jul  7 23:20:00 2024
Вино Muga Reserva Rioja DOC красное сухое 13.5%, 750мл	https://www.perekrestok.ru/cat/2/p/vino-muga-reserva-rioja-doc-krasnoe-suhoe-13-5-750ml-3337783	msk	Москва, Большой Патриарший переулок, 5	3 899,00 ₽/шт	Sun Jul  7 23:20:00 2024
Вино Gai-Kodzor Merlot красное сухое 14%, 750мл	https://www.perekrestok.ru/cat/2/p/vino-gai-kodzor-merlot-krasnoe-suhoe-14-750ml-4324867	msk	Москва, Большой Патриарший переулок, 5	699,99 ₽/шт	Sun Jul  7 23:20:00 2024
Вино Алазанская Долина красное полусладкое, 750мл	https://www.perekrestok.ru/cat/2/p/vino-alazanskaa-dolina-krasnoe-polusladkoe-750ml-4231763	msk	Москва, Большой Патриарший переулок, 5	349,99 ₽/шт	Sun Jul  7 23:20:00 2024
Вино Chateau Pinot Гравитация Пино Нуар/Саперави красное сухое 13%, 750мл	https://www.perekrestok.ru/cat/2/p/vino-chateau-pinot-gravitacia-pino-nuar-saperavi-krasnoe-suhoe-13-750ml-4213964	msk	Москва, Большой Патриарший переулок, 5	699,99 ₽/шт	Sun Jul  7 23:20:00 2024
Вино Santa Julia Malbec красное сухое 13%, 750мл	https://www.perekrestok.ru/cat/2/p/vino-santa-julia-malbec-krasnoe-suhoe-13-750ml-4133194	msk	Москва, Большой Патриарший переулок, 5	599,99 ₽/шт	Sun Jul  7 23:20:00 2024
Вино Резерв Винодела Мерло красное сухое 12%, 700мл	https://www.perekrestok.ru/cat/2/p/vino-rezerv-vinodela-merlo-krasnoe-suhoe-12-700ml-4124932	msk	Москва, Большой Патриарший переулок, 5	299,99 ₽/шт	Sun Jul  7 23:20:00 2024
Вино Bouchard Aine&Fils Grand Conseiller Pinot Noir красное сухое 12%, 750мл	https://www.perekrestok.ru/cat/2/p/vino-bouchard-aine-fils-grand-conseiller-pinot-noir-krasnoe-suhoe-12-750ml-3963636	msk	Москва, Большой Патриарший переулок, 5	899,99 ₽/шт	Sun Jul  7 23:20:00 2024
Вино выдержанное красное полусухое Q.S.S. Rare Reserva, 750мл	https://www.perekrestok.ru/cat/2/p/vino-vyderzannoe-krasnoe-polusuhoe-q-s-s-rare-reserva-750ml-4286676	msk	Москва, Большой Патриарший переулок, 5	999,99 ₽/шт	Sun Jul  7 23:20:00 2024
Вино Amaranta Pinotage красное сухое 14%, 750мл	https://www.perekrestok.ru/cat/2/p/vino-amaranta-pinotage-krasnoe-suhoe-14-750ml-3995312	msk	Москва, Большой Патриарший переулок, 5	569,99 ₽/шт	Sun Jul  7 23:20:00 2024
Вино Loggia Del Sole Chianti DOCG красное сухое 12.5%, 750мл	https://www.perekrestok.ru/cat/2/p/vino-loggia-del-sole-chianti-docg-krasnoe-suhoe-12-5-750ml-4096020	msk	Москва, Большой Патриарший переулок, 5	999,99 ₽/шт	Sun Jul  7 23:20:00 2024
Вино Rauli Merlot красное сухое 13.5%, 750мл	https://www.perekrestok.ru/cat/2/p/vino-rauli-merlot-krasnoe-suhoe-13-5-750ml-3445601	msk	Москва, Большой Патриарший переулок, 5	569,99 ₽/шт	Sun Jul  7 23:20:00 2024
Вино Matsu El Picaro Toro DO красное сухое 14.5%, 750мл	https://www.perekrestok.ru/cat/2/p/vino-matsu-el-picaro-toro-do-krasnoe-suhoe-14-5-750ml-3691849	msk	Москва, Большой Патриарший переулок, 5	1 749,00 ₽/шт	Sun Jul  7 23:20:00 2024
Вино Фанагория Авторское вино Каберне-Мерло красное сухое 13%, 750мл	https://www.perekrestok.ru/cat/2/p/vino-fanagoria-avtorskoe-vino-kaberne-merlo-krasnoe-suhoe-13-750ml-3505291	msk	Москва, Большой Патриарший переулок, 5	479,99 ₽/шт	Sun Jul  7 23:20:00 2024
Вино Sauvignon Blanc Whakaata Rock сортовое белое сухое, 750мл	https://www.perekrestok.ru/cat/2/p/vino-sauvignon-blanc-whakaata-rock-sortovoe-beloe-suhoe-750ml-4293958	msk	Москва, Большой Патриарший переулок, 5	1 499,00 ₽/шт	Sun Jul  7 23:20:00 2024
Вино Zinfandel Long Barn красное полусухое 13, 9%, 750мл	https://www.perekrestok.ru/cat/2/p/vino-zinfandel-long-barn-krasnoe-polusuhoe-13-9-750ml-4300213	msk	Москва, Большой Патриарший переулок, 5	1 749,00 ₽/шт	Sun Jul  7 23:20:00 2024
Портвейн Monge Porto Fine Ruby марочный красный крепкий, 750мл	https://www.perekrestok.ru/cat/2/p/portvejn-monge-porto-fine-ruby-marocnyj-krasnyj-krepkij-750ml-4268329	msk	Москва, Большой Патриарший переулок, 5	1 199,00 ₽/шт	Sun Jul  7 23:20:00 2024
Вино выдержанное Pinta Negra Reserva красное сухое, 750мл	https://www.perekrestok.ru/cat/2/p/vino-vyderzannoe-pinta-negra-reserva-krasnoe-suhoe-750ml-4217190	msk	Москва, Большой Патриарший переулок, 5	999,99 ₽/шт	Sun Jul  7 23:20:00 2024
Вино Le Chant du Cot a la Negrette красное сухое, 750мл	https://www.perekrestok.ru/cat/2/p/vino-le-chant-du-cot-a-la-negrette-krasnoe-suhoe-750ml-4227065	msk	Москва, Большой Патриарший переулок, 5	1 149,00 ₽/шт	Sun Jul  7 23:20:00 2024
Вино B-Liv Каберне-Совиньон-Карменер-Сира красное сухое, 750мл	https://www.perekrestok.ru/cat/2/p/vino-b-liv-kaberne-sovinon-karmener-sira-krasnoe-suhoe-750ml-4216001	msk	Москва, Большой Патриарший переулок, 5	999,99 ₽/шт	Sun Jul  7 23:20:00 2024
Вино Paladin Syrah красное полусладкое 13.5%, 750мл	https://www.perekrestok.ru/cat/2/p/vino-paladin-syrah-krasnoe-polusladkoe-13-5-750ml-4097710	msk	Москва, Большой Патриарший переулок, 5	1 199,00 ₽/шт	Sun Jul  7 23:20:00 2024
Вино Inspirado Carmenere красное сухое 12%, 750мл	https://www.perekrestok.ru/cat/2/p/vino-inspirado-carmenere-krasnoe-suhoe-12-750ml-4057355	msk	Москва, Большой Патриарший переулок, 5	499,99 ₽/шт	Sun Jul  7 23:20:00 2024
Вино Cape Art Pinotage красное сухое 13.5%, 750мл	https://www.perekrestok.ru/cat/2/p/vino-cape-art-pinotage-krasnoe-suhoe-13-5-750ml-3608101	msk	Москва, Большой Патриарший переулок, 5	449,99 ₽/шт	Sun Jul  7 23:20:00 2024
Вино Киндзмараули красное полусладкое 12%, 750мл	https://www.perekrestok.ru/cat/2/p/vino-kindzmarauli-krasnoe-polusladkoe-12-750ml-3694712	msk	Москва, Большой Патриарший переулок, 5	1 499,00 ₽/шт	Sun Jul  7 23:20:00 2024
Вино Matsu El Viejo Toro DO красное сухое 15%, 750мл	https://www.perekrestok.ru/cat/2/p/vino-matsu-el-viejo-toro-do-krasnoe-suhoe-15-750ml-3691847	msk	Москва, Большой Патриарший переулок, 5	7 399,00 ₽/шт	Sun Jul  7 23:20:00 2024
Вино Wine Guide Бастардо красное полусладкое 12%, 750мл	https://www.perekrestok.ru/cat/2/p/vino-wine-guide-bastardo-krasnoe-polusladkoe-12-750ml-3493844	msk	Москва, Большой Патриарший переулок, 5	299,99 ₽/шт	Sun Jul  7 23:20:00 2024
Вино Лыхны красное полусладкое, 10%, 750мл	https://www.perekrestok.ru/cat/2/p/vino-lyhny-krasnoe-polusladkoe-10-750ml-69435	msk	Москва, Большой Патриарший переулок, 5	519,99 ₽/шт	Sun Jul  7 23:20:00 2024
Вино Papik Malbec красное сухое 13.5%, 750мл	https://www.perekrestok.ru/cat/2/p/vino-papik-malbec-krasnoe-suhoe-13-5-750ml-4333106	msk	Москва, Большой Патриарший переулок, 5	599,99 ₽/шт	Sun Jul  7 23:20:00 2024
Вино Boardwalk California Zinfandel красное полусухое 13.5%, 750мл	https://www.perekrestok.ru/cat/2/p/vino-boardwalk-california-zinfandel-krasnoe-polusuhoe-13-5-750ml-4270444	msk	Москва, Большой Патриарший переулок, 5	1 099,00 ₽/шт	Sun Jul  7 23:20:00 2024
Вино Aristov Anima Pinot Nero Sangiovese красное сухое 11.5%, 750мл	https://www.perekrestok.ru/cat/2/p/vino-aristov-anima-pinot-nero-sangiovese-krasnoe-suhoe-11-5-750ml-4311092	msk	Москва, Большой Патриарший переулок, 5	459,99 ₽/шт	Sun Jul  7 23:20:00 2024
Вино Sellata Primitivo сортовое красное полусухое 13% 750мл	https://www.perekrestok.ru/cat/2/p/vino-sellata-primitivo-sortovoe-krasnoe-polusuhoe-13-750ml-4322425	msk	Москва, Большой Патриарший переулок, 5	919,99 ₽/шт	Sun Jul  7 23:20:00 2024
Вино The Freaky Wines Tempranillo красное сухое, 750мл	https://www.perekrestok.ru/cat/2/p/vino-the-freaky-wines-tempranillo-krasnoe-suhoe-750ml-4278810	msk	Москва, Большой Патриарший переулок, 5	799,99 ₽/шт	Sun Jul  7 23:20:00 2024
Вино Златни Брег красное сухое 12%, 750мл	https://www.perekrestok.ru/cat/2/p/vino-zlatni-breg-krasnoe-suhoe-12-750ml-4274800	msk	Москва, Большой Патриарший переулок, 5	699,99 ₽/шт	Sun Jul  7 23:20:00 2024
Вино ординарное Reino de Altuzarra красное сухое 13%, 750мл	https://www.perekrestok.ru/cat/2/p/vino-ordinarnoe-reino-de-altuzarra-krasnoe-suhoe-13-750ml-4255392	msk	Москва, Большой Патриарший переулок, 5	899,99 ₽/шт	Sun Jul  7 23:20:00 2024
Вино Sottocielo Blaufrankisch Selection красное сухое, 750мл	https://www.perekrestok.ru/cat/2/p/vino-sottocielo-blaufrankisch-selection-krasnoe-suhoe-750ml-4214438	msk	Москва, Большой Патриарший переулок, 5	959,99 ₽/шт	Sun Jul  7 23:20:00 2024
Вино Pearly Bay Dry Red красное сухое 13.5%, 3л	https://www.perekrestok.ru/cat/2/p/vino-pearly-bay-dry-red-krasnoe-suhoe-13-5-3l-4260569	msk	Москва, Большой Патриарший переулок, 5	1 399,00 ₽/шт	Sun Jul  7 23:20:00 2024
Вино Chateau Pinot Кубань Классика Каберне Совиньон 2019 сухое красное 13%, 750мл	https://www.perekrestok.ru/cat/2/p/vino-chateau-pinot-kuban-klassika-kaberne-sovinon-2019-suhoe-krasnoe-13-750ml-4220057	msk	Москва, Большой Патриарший переулок, 5	1 099,00 ₽/шт	Sun Jul  7 23:20:00 2024
Вино JP. Chenet Origonal Cabernet Syrah красное полусухое, 750мл	https://www.perekrestok.ru/cat/2/p/vino-jp-chenet-origonal-cabernet-syrah-krasnoe-polusuhoe-750ml-4252542	msk	Москва, Большой Патриарший переулок, 5	999,99 ₽/шт	Sun Jul  7 23:20:00 2024
Вино Chateau Vartely Изабелла красное полусладкое, 750мл	https://www.perekrestok.ru/cat/2/p/vino-chateau-vartely-izabella-krasnoe-polusladkoe-750ml-4219854	msk	Москва, Большой Патриарший переулок, 5	599,99 ₽/шт	Sun Jul  7 23:20:00 2024
Вино Maradi Киндзмараули красное полусладкое 11%, 750мл	https://www.perekrestok.ru/cat/2/p/vino-maradi-kindzmarauli-krasnoe-polusladkoe-11-750ml-4200941	msk	Москва, Большой Патриарший переулок, 5	859,99 ₽/шт	Sun Jul  7 23:20:00 2024
Вино Sobreiro de Pegoes Premium красное сухое 12.5%, 750мл	https://www.perekrestok.ru/cat/2/p/vino-sobreiro-de-pegoes-premium-krasnoe-suhoe-12-5-750ml-4174049	msk	Москва, Большой Патриарший переулок, 5	749,99 ₽/шт	Sun Jul  7 23:20:00 2024
Вино Torneo The Tournament Malbec красное полусухое 13.5%, 750мл	https://www.perekrestok.ru/cat/2/p/vino-torneo-the-tournament-malbec-krasnoe-polusuhoe-13-5-750ml-4120201	msk	Москва, Большой Патриарший переулок, 5	869,99 ₽/шт	Sun Jul  7 23:20:00 2024
Вино Aristov Cabernet Sauvignon красное сухое 12.5%, 750мл	https://www.perekrestok.ru/cat/2/p/vino-aristov-cabernet-sauvignon-krasnoe-suhoe-12-5-750ml-4154539	msk	Москва, Большой Патриарший переулок, 5	599,99 ₽/шт	Sun Jul  7 23:20:00 2024
Вино Мысхако Quintessence Cabernet Sauvignon красное сухое 14.8%, 750мл	https://www.perekrestok.ru/cat/2/p/vino-myshako-quintessence-cabernet-sauvignon-krasnoe-suhoe-14-8-750ml-4116469	msk	Москва, Большой Патриарший переулок, 5	859,99 ₽/шт	Sun Jul  7 23:20:00 2024
Вино Chateau Pinot Pinot Noir красное сухое 14%, 750мл	https://www.perekrestok.ru/cat/2/p/vino-chateau-pinot-pinot-noir-krasnoe-suhoe-14-750ml-4104146	msk	Москва, Большой Патриарший переулок, 5	1 099,00 ₽/шт	Sun Jul  7 23:20:00 2024
Вино Chateau Pinot Shiraz красное сухое 14%, 750мл	https://www.perekrestok.ru/cat/2/p/vino-chateau-pinot-shiraz-krasnoe-suhoe-14-750ml-4086037	msk	Москва, Большой Патриарший переулок, 5	999,99 ₽/шт	Sun Jul  7 23:20:00 2024
Вино ликерное Солнечная Долина Черный Доктор Солнечной Долины красное сладкое 16%, 750мл	https://www.perekrestok.ru/cat/2/p/vino-likernoe-solnecnaa-dolina-cernyj-doktor-solnecnoj-doliny-krasnoe-sladkoe-16-750ml-3684042	msk	Москва, Большой Патриарший переулок, 5	1 649,00 ₽/шт	Sun Jul  7 23:20:00 2024
Вино Destination Rouge Bordeaux AOC красное сухое 12.5%, 750мл	https://www.perekrestok.ru/cat/2/p/vino-destination-rouge-bordeaux-aoc-krasnoe-suhoe-12-5-750ml-3951501	msk	Москва, Большой Патриарший переулок, 5	849,99 ₽/шт	Sun Jul  7 23:20:00 2024
Вино Vinogor Изабелла красное полусладкое 12%, 1л	https://www.perekrestok.ru/cat/2/p/vino-vinogor-izabella-krasnoe-polusladkoe-12-1l-3369482	msk	Москва, Большой Патриарший переулок, 5	289,99 ₽/шт	Sun Jul  7 23:20:00 2024
Вино Molom Tinto красное сухое 12%, 750мл	https://www.perekrestok.ru/cat/2/p/vino-molom-tinto-krasnoe-suhoe-12-750ml-3660059	msk	Москва, Большой Патриарший переулок, 5	999,99 ₽/шт	Sun Jul  7 23:20:00 2024
Вино Cape Art Shiraz красное сухое 14%, 750мл	https://www.perekrestok.ru/cat/2/p/vino-cape-art-shiraz-krasnoe-suhoe-14-750ml-3608100	msk	Москва, Большой Патриарший переулок, 5	449,99 ₽/шт	Sun Jul  7 23:20:00 2024
Вино Тайна Колхиды Киндзмараули красное полусладкое 11-13%, 750мл	https://www.perekrestok.ru/cat/2/p/vino-tajna-kolhidy-kindzmarauli-krasnoe-polusladkoe-11-13-750ml-3494659	msk	Москва, Большой Патриарший переулок, 5	899,99 ₽/шт	Sun Jul  7 23:20:00 2024
Вино Ca'Del Poggio Montepulciano d'Abruzzo DOC красное сухое 12.5%, 750мл	https://www.perekrestok.ru/cat/2/p/vino-cadel-poggio-montepulciano-dabruzzo-doc-krasnoe-suhoe-12-5-750ml-3473820	msk	Москва, Большой Патриарший переулок, 5	599,99 ₽/шт	Sun Jul  7 23:20:00 2024
Вино Elegido Tinto красное полусладкое 12%, 1л	https://www.perekrestok.ru/cat/2/p/vino-elegido-tinto-krasnoe-polusladkoe-12-1l-3456670	msk	Москва, Большой Патриарший переулок, 5	799,99 ₽/шт	Sun Jul  7 23:20:00 2024
Вино Vivanco Crianza красное сухое 13.5%, 750мл	https://www.perekrestok.ru/cat/2/p/vino-vivanco-crianza-krasnoe-suhoe-13-5-750ml-3506247	msk	Москва, Большой Патриарший переулок, 5	1 249,00 ₽/шт	Sun Jul  7 23:20:00 2024
Вино Papik Cabernet Franc красное сухое 13.5%, 750мл	https://www.perekrestok.ru/cat/2/p/vino-papik-cabernet-franc-krasnoe-suhoe-13-5-750ml-4333107	msk	Москва, Большой Патриарший переулок, 5	599,99 ₽/шт	Sun Jul  7 23:20:00 2024
Вино Резерв Винодела Красностоп красное сухое, 750мл	https://www.perekrestok.ru/cat/2/p/vino-rezerv-vinodela-krasnostop-krasnoe-suhoe-750ml-4330034	msk	Москва, Большой Патриарший переулок, 5	299,99 ₽/шт	Sun Jul  7 23:20:00 2024
Вино Sellata Appassimento Puglia IGP красное полусухое 14%, 750мл	https://www.perekrestok.ru/cat/2/p/vino-sellata-appassimento-puglia-igp-krasnoe-polusuhoe-14-750ml-4322424	msk	Москва, Большой Патриарший переулок, 5	919,99 ₽/шт	Sun Jul  7 23:20:00 2024
Вино Bodega El Angosto La Tribuna красное сухое 13.5%, 750мл	https://www.perekrestok.ru/cat/2/p/vino-bodega-el-angosto-la-tribuna-krasnoe-suhoe-13-5-750ml-4326587	msk	Москва, Большой Патриарший переулок, 5	1 449,00 ₽/шт	Sun Jul  7 23:20:00 2024
Вино Ziari Creek красное сухое 12%, 750мл	https://www.perekrestok.ru/cat/2/p/vino-ziari-creek-krasnoe-suhoe-12-750ml-4320439	msk	Москва, Большой Патриарший переулок, 5	699,99 ₽/шт	Sun Jul  7 23:20:00 2024
Вино Ranina Саперави красное сухое 12%, 750мл	https://www.perekrestok.ru/cat/2/p/vino-ranina-saperavi-krasnoe-suhoe-12-750ml-4308074	msk	Москва, Большой Патриарший переулок, 5	599,99 ₽/шт	Sun Jul  7 23:20:00 2024
Вино Inkerman Пино Нуар красное сухое 11-13%, 750мл	https://www.perekrestok.ru/cat/2/p/vino-inkerman-pino-nuar-krasnoe-suhoe-11-13-750ml-4326700	msk	Москва, Большой Патриарший переулок, 5	449,99 ₽/шт	Sun Jul  7 23:20:00 2024
Вино Qimerioni Киндзмараули красное полусладкое 12%, 750мл	https://www.perekrestok.ru/cat/2/p/vino-qimerioni-kindzmarauli-krasnoe-polusladkoe-12-750ml-4317953	msk	Москва, Большой Патриарший переулок, 5	799,99 ₽/шт	Sun Jul  7 23:20:00 2024
Вино Sellata Nero di Troia красное полусухое 13%, 750мл	https://www.perekrestok.ru/cat/2/p/vino-sellata-nero-di-troia-krasnoe-polusuhoe-13-750ml-4322426	msk	Москва, Большой Патриарший переулок, 5	919,99 ₽/шт	Sun Jul  7 23:20:00 2024
Вино Chabiant красное сухое 13.5%, 750мл	https://www.perekrestok.ru/cat/2/p/vino-chabiant-krasnoe-suhoe-13-5-750ml-4275522	msk	Москва, Большой Патриарший переулок, 5	799,99 ₽/шт	Sun Jul  7 23:20:00 2024
